title,authors,number_of_pages,publisher,publication_date,price_in_euros,discount_in_euros,rating,number_of_votes_goodreads,number_of_votes_one_star,number_of_votes_two_stars,number_of_votes_three_stars,number_of_votes_four_stars,number_of_votes_five_stars,bestsellers_rank,isbn13,language,category
The Need for Words : Voice  and the Text,Patsy Rodenburg,272,Bloomsbury Publishing PLC,2018-02-22,28.80,0.70,4.27,30,1,0,4,10,15,564362,9781474273558,English,"Art, Photography"
The Jungle Book,"Stuart Paterson, Rudyard Kipling",64,NICK HERN BOOKS,2008-01-01,7.79,9.71,3.91,115979,1808,6695,29675,39558,38243,851910,9781854599681,English,"Art, Photography"
Shomin Sample: I Was Abducted by an Elite All-Girls School as a Sample Commoner Vol. 15,Nanatsuki Takafumi,180,"Seven Seas Entertainment, LLC",2021-06-01,9.69,5.31,4,2,0,0,0,2,0,462137,9781645059974,English,"Art, Photography"
The Violin And Viola,Sheila M. Nelson,304,Dover Publications Inc.,2003-06-20,16.99,1.01,4.14,7,0,1,1,1,4,500208,9780486428536,English,"Art, Photography"
On the Rooftop : A Reese's Book Club Pick,Margaret Wilkerson Sexton,304,Oneworld Publications,2022-10-06,20.00,1.00,3.27,3494,82,464,1661,995,292,266635,9780861546275,English,"Art, Photography"
The book of the Mazda MX-5 Miata : The 'Mk1' NA-series  1988 to 1997,Brian Long,144,Veloce Publishing Ltd,2021-12-14,20.64,13.86,4,2,0,0,0,2,0,28880,9781787117778,English,"Art, Photography"
"Movie Hereos for Students, Book 1 : Piano",Tom Gerou,24,"Alfred Publishing Co Inc.,U.S.",2012-02-01,10.85,3.10,4,1,0,0,0,1,0,684977,9780739080290,English,"Art, Photography"
The Jungle Book,"Stuart Paterson, Rudyard Kipling",64,NICK HERN BOOKS,2008-01-01,7.79,9.71,3.91,115979,1808,6695,29675,39558,38243,851910,9781854599681,English,"Art, Photography"
Successful Television Writing,"Lee Goldberg, William Rabkin",224,Turner Publishing Company,2003-07-22,18.91,1.09,3.92,112,0,6,29,45,32,491874,9780471431688,English,"Art, Photography"
The Book of Exodus : The Making and Meaning of Bob Marley and the Wailers' Album of the Century,Vivien Goldman,336,Crown Publishing Group (NY),2006-05-01,16.92,1.08,4.16,91,2,1,12,41,35,840467,9781400052868,English,"Art, Photography"
Headhunted to Another World: From Salaryman to Big Four! Vol. 1,"Muramitsu, Benigashira",186,"Seven Seas Entertainment, LLC",2021-10-05,11.76,2.24,4.25,81,0,4,11,27,39,494475,9781648276026,English,"Art, Photography"
Guitar Chords for Beginners : A Beginners Guitar Chord Book with Open Chords and More,Gareth Evans,32,Intuition Publications,2014-01-27,7.51,0.29,4.38,26,0,0,2,12,12,219530,9780957650664,English,"Art, Photography"
Jim Henson's The Dark Crystal: Creation Myths Vol. 3,"Jim Henson, Matthew Dow Smith, Brian Froud, Alan Sheikman",96,Archaia Studios Press,2015-10-27,23.93,2.07,4.07,542,1,17,107,236,181,565590,9781608864355,English,"Art, Photography"
Girl Genius: Agatha Heterodyne and the Clockwork Princess v. 5,"Kaja Foglio, Phil Foglio",112,STUDIO FOGLIO,2013-12-03,24.98,1.02,4.39,1925,4,23,215,651,1032,555932,9781890856397,English,"Art, Photography"
"Little Mozarts Go to Hollywood, Pop Bk 1 & 2 : 10 Favorites from Tv, Movies and Radio","Christine H Barden, Gayle Kowalchyk, E L Lancaster",24,"Alfred Publishing Co Inc.,U.S.",2008-02-01,8.34,1.66,5,2,0,0,0,0,2,562221,9780739050132,English,"Art, Photography"
Princeless: Raven The Pirate Princess Book 9: The Black Fort and the Golden Queen,"Jeremy Whitley, Xenia Pamfil, Telenia Albuquerque, Nicole D'Andria",128,"Action Lab Entertainment, Inc.",2020-12-15,14.68,0.82,3.96,51,0,2,11,25,13,750028,9781632295118,English,"Art, Photography"
"Alfred's Basic Music Writing Book : Wide Lines, 32 Pages",Alfred Music,32,"Alfred Publishing Co Inc.,U.S.",1993-09-01,3.74,1.76,5,1,0,0,0,0,1,659140,9780739021958,English,"Art, Photography"
Headhunted to Another World: From Salaryman to Big Four! Vol. 1,"Muramitsu, Benigashira",186,"Seven Seas Entertainment, LLC",2021-10-05,11.76,2.24,4.25,81,0,4,11,27,39,494475,9781648276026,English,"Art, Photography"
Serious Jazz Practice Book,Barry Finnerty,162,"Sher Music Co ,U.S.",2006-01-01,32.39,4.11,4.04,24,1,0,6,7,10,753457,9781883217426,English,"Art, Photography"
Images,Jamie Keddie,152,Oxford University Press,2010-04-12,31.59,10.41,5,6,0,0,0,0,6,473479,9780194425797,English,"Art, Photography"
"Creative Composition Toolbox, Book 6 : A Step-by-Step Guide for Learning to Compose",Wynn-Anne Rossi,24,"Alfred Publishing Co Inc.,U.S.",2012-05-01,7.07,2.93,5,1,0,0,0,0,1,669693,9780739089071,English,"Art, Photography"
Jim Henson's The Dark Crystal: Creation Myths Vol. 3,"Jim Henson, Matthew Dow Smith, Brian Froud, Alan Sheikman",96,Archaia Studios Press,2015-10-27,23.93,2.07,4.07,542,1,17,107,236,181,565590,9781608864355,English,"Art, Photography"
Girl Genius: Agatha Heterodyne and the Clockwork Princess v. 5,"Kaja Foglio, Phil Foglio",112,STUDIO FOGLIO,2013-12-03,24.98,1.02,4.39,1925,4,23,215,651,1032,555932,9781890856397,English,"Art, Photography"
Sorry For My Familiar Vol. 2,Tekka Yaguraba,180,"Seven Seas Entertainment, LLC",2018-07-10,11.51,0.99,3.91,127,2,3,38,46,38,693222,9781626928398,English,"Art, Photography"
"Movie Hereos for Students, Book 1 : Piano",Tom Gerou,24,"Alfred Publishing Co Inc.,U.S.",2012-02-01,10.85,3.10,4,1,0,0,0,1,0,684977,9780739080290,English,"Art, Photography"
My Deer Friend Nokotan Vol. 2,Oshioshio,128,"Seven Seas Entertainment, LLC",2022-07-12,9.98,4.02,3.83,6,0,0,3,1,2,555922,9781638583189,English,"Art, Photography"
Star Wars: The Poster Collection (Mini Book),Insight Editions,304,Insight Editions,2020-10-06,11.02,1.98,4,8,0,0,2,4,2,576374,9781683839590,English,"Art, Photography"
Images,Jamie Keddie,152,Oxford University Press,2010-04-12,31.59,10.41,5,6,0,0,0,0,6,473479,9780194425797,English,"Art, Photography"
Female Nude,Flaminio Gualdoni,96,Skira,2008-10-07,7.34,2.66,3.6,10,2,0,2,2,4,480958,9788861305397,English,"Art, Photography"
The Colouring Book of Glasgow,Eilidh Muldoon,48,Birlinn General,2019-09-11,13.22,1.78,5,1,0,0,0,0,1,731828,9781780276144,English,"Art, Photography"
"Yowamushi Pedal, Vol. 18",Wataru Watanabe,402,"Little, Brown & Company",2021-10-05,22.01,1.49,3.93,15,0,1,4,5,5,754918,9781975310660,English,"Art, Photography"
Images,Jamie Keddie,152,Oxford University Press,2010-04-12,31.59,10.41,5,6,0,0,0,0,6,473479,9780194425797,English,"Art, Photography"
"The Honor Student at Magic High School, Vol. 11","Tsutomu Satou, Yu Mori",146,"Little, Brown & Company",2021-06-29,10.78,2.72,4.03,29,1,0,6,12,10,647460,9781975325268,English,"Art, Photography"
My Deer Friend Nokotan Vol. 2,Oshioshio,128,"Seven Seas Entertainment, LLC",2022-07-12,9.98,4.02,3.83,6,0,0,3,1,2,555922,9781638583189,English,"Art, Photography"
Star Wars: The Poster Collection (Mini Book),Insight Editions,304,Insight Editions,2020-10-06,11.02,1.98,4,8,0,0,2,4,2,576374,9781683839590,English,"Art, Photography"
Rainbow and Black Vol. 1,Eri Takenashi,180,"Seven Seas Entertainment, LLC",2020-11-10,11.63,3.37,3.92,275,3,13,70,106,83,694668,9781645058403,English,"Art, Photography"
"Yowamushi Pedal, Vol. 18",Wataru Watanabe,402,"Little, Brown & Company",2021-10-05,22.01,1.49,3.93,15,0,1,4,5,5,754918,9781975310660,English,"Art, Photography"
Jumpin' Jim's Ukulele Masters : Lyle Ritz Solos,Lyle Ritz,64,Hal Leonard Corporation,2008-07-27,21.64,3.36,3.67,9,0,0,5,2,2,383357,9780634046582,English,"Art, Photography"
Precarious Woman Executive Miss Black General Vol. 6,Jin,180,"Seven Seas Entertainment, LLC",2021-03-30,12.23,1.77,4.12,16,1,0,2,6,7,515567,9781645057895,English,"Art, Photography"
Jumpin' Jim's Ukulele Masters : Lyle Ritz Solos,Lyle Ritz,64,Hal Leonard Corporation,2008-07-27,21.64,3.36,3.67,9,0,0,5,2,2,383357,9780634046582,English,"Art, Photography"
Precarious Woman Executive Miss Black General Vol. 6,Jin,180,"Seven Seas Entertainment, LLC",2021-03-30,12.23,1.77,4.12,16,1,0,2,6,7,515567,9781645057895,English,"Art, Photography"
Alfred's Essentials of Music Theory : Book 1,"Surmani, Hanus",40,"Alfred Publishing Co Inc.,U.S.",1998-01-01,9.13,0.37,3.29,31,5,4,8,5,9,259172,9780882848945,English,"Art, Photography"
Female Nude,Flaminio Gualdoni,96,Skira,2008-10-07,7.34,2.66,3.6,10,2,0,2,2,4,480958,9788861305397,English,"Art, Photography"
The Grove Book of Operas,"Stanley Sadie, Laura Macy",784,Oxford University Press Inc,2006-11-30,41.97,1.53,4.22,18,0,0,4,6,8,691368,9780195309072,English,"Art, Photography"
Five Graphic Music Analyses,Heinrich Schenker,66,Dover Publications Inc.,2012-05-17,15.59,0.41,4.23,31,0,1,6,9,15,458948,9780486222943,English,"Art, Photography"
Groucho Marx and Other Short Stories and Tall Tales : Selected Writings of Groucho MarxTHAn,Robert S. Bader,310,Hal Leonard Corporation,2011-11-15,20.42,0.18,3.65,166,4,11,61,53,37,531255,9781557837912,English,"Art, Photography"
The Music Tree - Part 2A : Student'S Book,"Frances Clark, Louise Goss, Sam Holland",64,"Alfred Publishing Co Inc.,U.S.",2000-05-01,11.76,1.19,4,1,0,0,0,1,0,256728,9780874876871,English,"Art, Photography"
"English, Welsh, Scottish And Irish Fiddle Tunes (Book and CD)",Robin Williamson,96,AMSCO MUSIC,1992-01-01,23.86,3.14,4.31,13,0,1,1,4,7,513008,9780825601651,English,"Art, Photography"
Arifureta: From Commonplace to World's Strongest ZERO (Manga) Vol. 5,"Ryo Shirakome, Ataru Kamichi",178,"Seven Seas Entertainment, LLC",2021-12-21,11.36,2.64,3.67,6,0,0,3,2,1,629934,9781648273803,English,"Art, Photography"
The Ancient Magus' Bride: Jack Flash and the Faerie Case Files Vol. 3,"Yu Godai, Kore Yamazaki, Mako Oikawa",180,"Seven Seas Entertainment, LLC",2021-07-20,11.51,2.49,3.99,69,0,2,18,28,21,479931,9781648272738,English,"Art, Photography"
She Professed Herself Pupil of the Wise Man (Manga) Vol. 3,"Ryusen Hirotsugu, Dicca*Suemitsu, Fuzichoco",160,"Seven Seas Entertainment, LLC",2021-12-14,11.82,2.18,4.36,22,0,0,3,8,11,479932,9781648274619,English,"Art, Photography"
"English, Welsh, Scottish And Irish Fiddle Tunes (Book and CD)",Robin Williamson,96,AMSCO MUSIC,1992-01-01,23.86,3.14,4.31,13,0,1,1,4,7,513008,9780825601651,English,"Art, Photography"
Arifureta: From Commonplace to World's Strongest ZERO (Manga) Vol. 5,"Ryo Shirakome, Ataru Kamichi",178,"Seven Seas Entertainment, LLC",2021-12-21,11.36,2.64,3.67,6,0,0,3,2,1,629934,9781648273803,English,"Art, Photography"
The Ancient Magus' Bride: Jack Flash and the Faerie Case Files Vol. 3,"Yu Godai, Kore Yamazaki, Mako Oikawa",180,"Seven Seas Entertainment, LLC",2021-07-20,11.51,2.49,3.99,69,0,2,18,28,21,479931,9781648272738,English,"Art, Photography"
Cengage Advantage Books: This is PR : The Realities of Public Relations,"Doug Newsom, Judy Turk, Dean Kruckeberg",384,"Cengage Learning, Inc",2012-01-06,73.36,72.14,3.52,27,1,3,8,11,4,1704335,9781111836832,English,"Art, Photography"
Alfred's Piano 101 Pop Book 2,Carol Matz,32,"Alfred Publishing Co Inc.,U.S.",2008-03-01,10.41,0.59,3,1,0,0,1,0,0,609493,9780739051474,English,"Art, Photography"
Movie Movements : Films That Changed the World of Cinema,James Clarke,160,Oldcastle Books Ltd,2011-03-01,7.13,16.87,3.5,10,0,2,2,5,1,27701,9781842433058,English,"Art, Photography"
Groucho Marx and Other Short Stories and Tall Tales : Selected Writings of Groucho MarxTHAn,Robert S. Bader,310,Hal Leonard Corporation,2011-11-15,20.42,0.18,3.65,166,4,11,61,53,37,531255,9781557837912,English,"Art, Photography"
The Real Book - Volume 1 : Book/Usb Flash Drive Pack,Hal Leonard Publishing Corporation,462,Hal Leonard Corporation,2013-02-01,83.70,1.30,3.5,2,0,1,0,0,1,729479,9781476877266,English,"Art, Photography"
Precarious Woman Executive Miss Black General Vol. 6,Jin,180,"Seven Seas Entertainment, LLC",2021-03-30,12.23,1.77,4.12,16,1,0,2,6,7,515567,9781645057895,English,"Art, Photography"
Nine Inch Nails : Bobcat Books Presents the Story of,Tommy Udo,268,Omnibus Press,2008-03-01,19.02,1.58,3,86,6,19,37,17,7,686335,9780825673481,English,"Art, Photography"
The Complete Book of Classic Ford Tractors : Every Model 1917-1996,"Robert N. Pripps, Andrew Morland",192,Motorbooks International,2021-11-02,44.93,0.57,4.4,5,0,0,1,1,3,668739,9780760370643,English,"Art, Photography"
"The Imaginary Museum : A Personal Tour of Contemporary Art Featuring Ghosts, Nudity and Disagreements",Ben Eastham,144,HarperCollins Publishers,2020-10-27,10.29,3.71,4.02,81,0,5,18,28,30,536460,9780008375423,English,"Art, Photography"
"Not Just Another Jazz Book, Book 1 : 10 Original Piano Solos with Optional CD Accompaniments",Mike Springer,24,"Alfred Publishing Co Inc.,U.S.",2014-08-20,8.54,4.41,5,1,0,0,0,0,1,762358,9780739093696,English,"Art, Photography"
Movie Movements : Films That Changed the World of Cinema,James Clarke,160,Oldcastle Books Ltd,2011-03-01,7.13,16.87,3.5,10,0,2,2,5,1,27701,9781842433058,English,"Art, Photography"
Saint Young Men Omnibus 9 (Vol. 17-18),Hikaru Nakamura,264,"Kodansha America, Inc",2022-06-21,23.25,2.25,4.27,15,0,1,0,8,6,497995,9781646512812,English,"Art, Photography"
"Klezmer Book, Avrahm Galper Clarinet Series : 42 Klezmer Favorites for Clarinet and B-Flat Instruments",Avrahm Galper,44,"Mel Bay Publications,U.S.",2004-07-09,14.98,1.02,5,1,0,0,0,0,1,611123,9780786659630,English,"Art, Photography"
Kristy's Winter Cutting Garden: A Watercoloring Book,Kristy Rice,60,Schiffer Publishing Ltd,2017-09-28,20.84,0.16,4,3,0,0,1,1,1,597247,9780764353802,English,"Art, Photography"
The Spitz Master - A Parisian Book of Hours,. Clark,90,Getty Trust Publications,2006-03-31,18.60,2.40,3,2,0,0,2,0,0,612027,9780892367122,English,"Art, Photography"
Unpacking My Library : Artists and Their Books,"Jo Steffens, Matthias Neumann, Marcel Proust",184,Yale University Press,2017-11-07,17.36,4.64,3.72,53,1,3,17,21,11,717996,9780300216981,English,"Art, Photography"
"Basic Classical Guitar Method, Book 1",Scott Tennant,48,"Alfred Publishing Co Inc.,U.S.",2003-01-01,14.43,3.57,3.33,3,1,0,0,1,1,610148,9780739019832,English,"Art, Photography"
Disney Frozen Postcard Box,Disney,100,CHRONICLE BOOKS,2019-10-15,22.75,1.75,5,1,0,0,0,0,1,446782,9781452176871,English,"Art, Photography"
Working Shakespeare Library,Cicely Berry,157,Hal Leonard Corporation,2004-12-01,90.12,40.88,5,1,0,0,0,0,1,518878,9781557835383,English,"Art, Photography"
Let's Buy the Land and Cultivate It in a Different World (Manga) Vol. 2,"Rokujuuyon Okazawa, Jun Sasameyuki, Yuichi Murakami",160,"Seven Seas Entertainment, LLC",2023-01-24,12.73,3.27,3.5,6,0,0,3,3,0,32653,9781685793425,English,"Art, Photography"
Raise the Bar Violin Book 3 Grades 6-8,Anna Dryer-Beers,112,Trinity College London Press,2017-01-12,23.54,0.96,5,1,0,0,0,0,1,510710,9780857365392,English,"Art, Photography"
"Suzuki Guitar School Guitar Acc., Vol. 1 (Revised)","Frank Longay, William Kossler, Seth Himmelhoch, Louis Brown",28,"Alfred Publishing Co Inc.,U.S.",2011-06-10,8.54,4.41,4.33,15,1,0,0,6,8,520440,9780874873894,English,"Art, Photography"
"Accent On Achievement, Book 2 (Tenor Saxophone)","Professor John O'Reilly, Mark Williams",48,"Alfred Publishing Co Inc.,U.S.",1998-07-01,10.52,0.48,4,16,1,2,1,4,8,640569,9780739004623,English,"Art, Photography"
"Accent On Achievement, Book 2 (Baritone BC)","Professor John O'Reilly, Mark Williams",48,"Alfred Publishing Co Inc.,U.S.",1998-05-01,10.52,0.48,4,16,1,2,1,4,8,574984,9780739004647,English,"Art, Photography"
The Little Black Book of Classic Songs for Ukulele,,192,Hal Leonard Europe Limited,2013-03-12,15.12,2.38,4,4,0,1,0,1,2,578206,9781783050925,English,"Art, Photography"
Drawing Support: Murals of War and Peace Bk. 2,Bill Rolston,60,Bill Rolston,1995-11-30,14.46,4.02,3.64,14,1,1,3,6,3,526585,9780951422977,English,"Art, Photography"
Shomin Sample: I Was Abducted by an Elite All-Girls School as a Sample Commoner Vol. 11,Nanatsuki Takafumi,180,"Seven Seas Entertainment, LLC",2019-11-19,9.07,3.43,3.75,4,0,0,1,3,0,408337,9781642757316,English,"Art, Photography"
Easiest Drum Set Book,James Morton,28,"Mel Bay Publications,U.S.",1990-08-20,10.99,0.01,5,1,0,0,0,0,1,711393,9781562220273,English,"Art, Photography"
"Accent On Achievement, Book 3 (Trombone)","Professor John O'Reilly, Mark Williams",40,"Alfred Publishing Co Inc.,U.S.",1999-05-01,8.87,0.13,5,2,0,0,0,0,2,518905,9780739006337,English,"Art, Photography"
"Accent on Achievement, Book 1 (Percussion)","Professor John O'Reilly, Mark Williams",48,"Alfred Publishing Co Inc.,U.S.",2014-08-22,10.52,3.43,3.79,48,4,5,9,9,21,645055,9780739005156,English,"Art, Photography"
The Invincible Shovel (Manga) Vol. 3,"Yasohachi Tsuchise, Renji Fukuhara, Hagure Yuuki",172,"Seven Seas Entertainment, LLC",2022-03-01,9.69,4.31,3.5,2,0,0,1,1,0,659387,9781638581345,English,"Art, Photography"
An English Medieval And Renaissance Songs Book,Noah Greenberg,224,Dover Publications Inc.,2000-09-08,13.29,0.61,4.17,12,0,1,2,3,6,653789,9780486413747,English,"Art, Photography"
"Two at One Piano, Book 1",Jon George,16,"Alfred Publishing Co Inc.,U.S.",1995-10-01,6.38,2.57,4.5,4,0,0,1,0,3,654292,9780874871418,English,"Art, Photography"
Easiest Drum Set Book,James Morton,28,"Mel Bay Publications,U.S.",1990-08-20,10.99,0.01,5,1,0,0,0,0,1,711393,9781562220273,English,"Art, Photography"
"Guitar Works of Agustin Barrios Mangore, Vol. IV","Agustin Barrios Mangore, Richard Stover",64,"Warner Bros. Publications Inc.,U.S.",2018-03-23,12.85,7.10,5,2,0,0,0,0,2,753369,9780769212920,English,"Art, Photography"
Let's Buy the Land and Cultivate It in a Different World (Manga) Vol. 2,"Rokujuuyon Okazawa, Jun Sasameyuki, Yuichi Murakami",160,"Seven Seas Entertainment, LLC",2023-01-24,12.73,3.27,3.5,6,0,0,3,3,0,32653,9781685793425,English,"Art, Photography"
Raise the Bar Violin Book 3 Grades 6-8,Anna Dryer-Beers,112,Trinity College London Press,2017-01-12,23.54,0.96,5,1,0,0,0,0,1,510710,9780857365392,English,"Art, Photography"
"Suzuki Guitar School Guitar Acc., Vol. 1 (Revised)","Frank Longay, William Kossler, Seth Himmelhoch, Louis Brown",28,"Alfred Publishing Co Inc.,U.S.",2011-06-10,8.54,4.41,4.33,15,1,0,0,6,8,520440,9780874873894,English,"Art, Photography"
The Ancient Magus' Bride: Jack Flash and the Faerie Case Files Vol. 4,"Yu Godai, Kore Yamazaki, Mako Oikawa",178,"Seven Seas Entertainment, LLC",2022-03-29,9.86,4.14,3.92,52,0,3,11,25,13,504222,9781638581703,English,"Art, Photography"
Disney Frozen Postcard Box,Disney,100,CHRONICLE BOOKS,2019-10-15,22.75,1.75,5,1,0,0,0,0,1,446782,9781452176871,English,"Art, Photography"
A Book of Rather Strange Animals : Highlighting the Wonders of Evolution and the Extraordinary Diversity of Life,Caleb Compton,136,Austin Macauley Publishers,2019-01-31,13.43,1.56,4.1,42,2,0,6,18,16,47206,9781788785327,English,"Art, Photography"
Saint Young Men Omnibus 9 (Vol. 17-18),Hikaru Nakamura,264,"Kodansha America, Inc",2022-06-21,23.25,2.25,4.27,15,0,1,0,8,6,497995,9781646512812,English,"Art, Photography"
Color Friendship Coloring Book,Suzy Toronto,64,Design Originals,2016-05-03,5.94,0.06,4,1,0,0,0,1,0,708514,9781497201590,English,"Art, Photography"
Fractals : On the Edge of Chaos,Oliver Linton,64,Bloomsbury Publishing,2021-02-23,12.63,1.87,3.75,24,0,3,4,13,4,513950,9781635575088,English,"Art, Photography"
Recorder From The Beginning : Pupil'S Book 3 & CD,John Pitts,48,Hal Leonard Europe Limited,2005-08-01,11.18,3.82,5,3,0,0,0,0,3,237677,9781844495207,English,"Art, Photography"
Shomin Sample: I Was Abducted by an Elite All-Girls School as a Sample Commoner Vol. 11,Nanatsuki Takafumi,180,"Seven Seas Entertainment, LLC",2019-11-19,9.07,3.43,3.75,4,0,0,1,3,0,408337,9781642757316,English,"Art, Photography"
Beautifully Made! : Celebrating Womanhood (Book 2),Julie   Hiramine,72,GENERATIONS OF VIRTUE,2003-05-25,5.79,2.21,4.38,8,0,0,1,3,4,63446,9780976614319,English,"Art, Photography"
Didn't I Say to Make My Abilities Average in the Next Life?! (Manga) Vol. 4,Funa,180,"Seven Seas Entertainment, LLC",2020-10-20,12.12,1.88,3.79,29,0,1,8,16,4,12203,9781642757507,English,"Art, Photography"
Persian Designs and Motifs CD-ROM and Book,Ali Dowlatshahi,48,Dover Publications Inc.,2007-11-02,13.76,2.24,4.5,4,0,0,0,2,2,583362,9780486998756,English,"Art, Photography"
Irish Castles : Ireland'S Most Dramatic Castles and Strongholds,"Orna Mulcahy, Collins Books",224,HarperCollins Publishers,2020-05-01,8.91,0.09,4,1,0,0,0,1,0,498283,9780008348229,English,"Art, Photography"
"Alfred's Basic Adult Piano Course -- Popular Hits, Bk 1",Tom Gerou,40,ALFRED MUSIC,2018-03-01,9.88,1.12,4,1,0,0,0,1,0,448990,9781470627331,English,"Art, Photography"
The Disney Villains Postcard Box : 100 Collectible Postcards,Disney,100,Chronicle Books,2020-11-17,23.37,1.13,5,1,0,0,0,0,1,402893,9781797200897,English,"Art, Photography"
Didn't I Say to Make My Abilities Average in the Next Life?! (Manga) Vol. 4,Funa,180,"Seven Seas Entertainment, LLC",2020-10-20,12.12,1.88,3.79,29,0,1,8,16,4,12203,9781642757507,English,"Art, Photography"
ROLL OVER AND DIE: I Will Fight for an Ordinary Life with My Love and Cursed Sword! (Manga) Vol. 2,"Kiki, Sunao Minakata",160,"Seven Seas Entertainment, LLC",2021-12-14,9.69,4.31,3.91,22,0,2,5,8,7,422120,9781648279270,English,"Art, Photography"
Hanne Darboven : Cultural History 1880-1983,Dan Adler,112,Afterall Publishing,2009-04-30,19.26,2.74,4,3,0,0,0,3,0,441676,9781846380501,English,"Art, Photography"
The Modern Tailor Outfitter And Clothier - Vol I,A S Bridgland,298,Read Books,2010-05-07,32.73,16.17,5,5,0,0,0,0,5,587519,9781445505633,English,"Art, Photography"
Accordion Course - Polka Book,"Willard A Palmer, Bill Hughes",52,"Alfred Publishing Co Inc.,U.S.",1963-06-01,10.52,2.43,4,2,0,0,1,0,1,835350,9780739013557,English,"Art, Photography"
Access Accents: London (Cockney) : An accent training resource for actors,"Gwyneth Strong, Penny Dyer",1,Bloomsbury Publishing PLC,2008-08-01,23.98,6.51,3,1,0,0,1,0,0,698022,9780713685183,English,"Art, Photography"
Our Gods Wear Spandex : The Secret History of Comic Book Heros,"Christopher Knowles, Joseph Micheal Linsner",256,Red Wheel/Weiser,2007-11-30,20.30,0.20,3.41,239,11,36,79,71,42,338741,9781578634064,English,"Art, Photography"
Essential Elements Ukulele Method - Book 2,Marty Gross,48,Hal Leonard Corporation,2015-12-01,14.06,0.94,4,1,0,0,0,1,0,816943,9781480395985,English,"Art, Photography"
Our Gods Wear Spandex : The Secret History of Comic Book Heros,"Christopher Knowles, Joseph Micheal Linsner",256,Red Wheel/Weiser,2007-11-30,20.30,0.20,3.41,239,11,36,79,71,42,338741,9781578634064,English,"Art, Photography"
Greek Astronomy,Thomas Heath,256,Dover Publications Inc.,2011-11-02,15.85,0.15,3.81,16,0,2,5,3,6,683537,9780486266206,English,"Art, Photography"
Beverly Buchanan,Amelia Groom,96,Afterall Publishing,2021-02-02,16.25,5.75,4.08,12,1,0,3,1,7,27332,9781846382185,English,"Art, Photography"
Sittin' in with the Big Band - Vol. 2,Alfred Music,36,"Alfred Publishing Co Inc.,U.S.",2008-10-01,12.85,3.15,4,1,0,0,0,1,0,965668,9780739056998,English,"Art, Photography"
Picturing Algeria,"Pierre Bourdieu, Craig Calhoun, Franz Schultheis, Christine Frisinghelli",248,Columbia University Press,2012-05-22,67.07,18.33,4.23,22,0,0,5,7,10,504094,9780231148429,English,"Art, Photography"
Joe Brainard - The Nancy Book,"Joe Brainard, Ron Padgett, Ann Lauterbach, Ted Berrigan, Frank O'Hara",144,Siglio Press,2008-04-30,37.73,3.27,4.38,78,1,3,7,21,46,1062461,9780979956201,English,"Art, Photography"
A Very Special 90210 Book : 100 Absolutely Essential Episodes from TV's Most Notorious Zip Code,"Tara Ariano, Sarah Bunting, Julie Kane",272,Abrams,2020-09-22,23.57,2.43,4.44,119,1,1,10,40,67,1015253,9781419747465,English,"Art, Photography"
"The Basic Guide to How to Read Music : Even If You Have Never Read a Note of Music Before, This Book Will Teach You How - Quickly and Easily",Helen Cooper,80,Penguin Putnam Inc,1985-05-13,11.23,2.27,3.51,39,2,6,13,6,12,249164,9780399511226,English,"Art, Photography"
The BBC Puzzle Book,"Ian Haydn Smith, Dr. Gareth Moore",240,Frances Lincoln Publishers Ltd,2022-10-25,19.31,3.69,3,1,0,0,1,0,0,54055,9780711277663,English,"Art, Photography"
Welcome To Zamrock! Vol. 2,Eothen Alapatt,104,"Gingko Press, Inc",2017-06-01,23.19,1.31,4,2,0,0,0,2,0,1917154,9781584236597,English,"Art, Photography"
Sittin' in with the Big Band - Vol. 2,Alfred Music,36,"Alfred Publishing Co Inc.,U.S.",2008-10-01,12.85,3.15,4,1,0,0,0,1,0,965668,9780739056998,English,"Art, Photography"
Beverly Buchanan,Amelia Groom,96,Afterall Publishing,2021-02-02,16.25,5.75,4.08,12,1,0,3,1,7,27332,9781846382185,English,"Art, Photography"
Greek Astronomy,Thomas Heath,256,Dover Publications Inc.,2011-11-02,15.85,0.15,3.81,16,0,2,5,3,6,683537,9780486266206,English,"Art, Photography"
Magician's Magic,Paul Curry,288,Dover Publications Inc.,2003-09-06,15.76,3.24,3.45,11,0,1,5,4,1,701126,9780486431765,English,"Art, Photography"
"Strictly Strings, Book 2","Jacquelyn Dillon, James Kjelland, Professor John O'Reilly",40,"Alfred Publishing Co Inc.,U.S.",1993-05-01,8.21,0.79,4,3,0,0,1,1,1,936284,9780882845371,English,"Art, Photography"
Exploring the Book of Kells,"George Otto Simms, David Rooney, Eoin O'Brien",80,O'Brien Press Ltd,2015-09-01,10.11,1.39,3.45,62,2,6,25,20,9,1205672,9781847177964,English,"Art, Photography"
Spawn Coloring Book,Todd McFarlane,96,Image Comics,2016-04-19,18.86,1.24,4.5,4,0,0,1,0,3,1027700,9781632157850,English,"Art, Photography"
"The Unofficial Bridgerton Coloring Book : From the Gardens to the Ballrooms, Color Your Way Through Grosvenor Square",Sara Richard,96,Adams Media Corporation,2021-09-16,12.50,3.50,3.8,5,1,0,1,0,3,1931278,9781507216798,English,"Art, Photography"
The Little Book of New York : Celebrating the City that Never Sleeps,Orange Hippo!,192,Welbeck Publishing Group,2021-10-12,9.57,0.43,5,4,0,0,0,0,4,824595,9781800690240,English,"Art, Photography"
"Accent on Achievement, Book 1 (Mallet Percussion)","Professor John O'Reilly, Mark Williams",48,"Alfred Publishing Co Inc.,U.S.",2014-08-22,11.19,2.76,3.79,48,4,5,9,9,21,854857,9780739005132,English,"Art, Photography"
