title,authors,number_of_pages,publisher,publication_date,price_in_euros,discount_in_euros,rating,number_of_votes_goodreads,number_of_votes_one_star,number_of_votes_two_stars,number_of_votes_three_stars,number_of_votes_four_stars,number_of_votes_five_stars,bestsellers_rank,isbn13,language,category
Piano Time Jazz Book 2,Pauline Hall,32,Oxford University Press,2000-02-17,13.85,0.15,1,1,1,0,0,0,0,61860,9780193727342,English,"Art, Photography"
Paws for a Cause: A Branches Book (Diary of a Pug #3) : Volume 3,Kyla May,80,Scholastic US,2020-07-07,6.73,0.27,4.25,278,4,4,52,77,141,14220,9781338530094,English,"Art, Photography"
"Sonic The Hedgehog, Vol. 10: Test Run!","Evan Stanley, Adam Bryce Thomas",96,Idea & Design Works,2022-03-08,14.79,2.21,4.23,101,1,2,19,30,49,113886,9781684058518,English,"Art, Photography"
"The 100 Girlfriends Who Really, Really, Really, Really, Really Love You Vol. 4","Rikito Nakamura, Nozawa Yukiko",210,"Seven Seas Entertainment, LLC",2022-11-22,11.42,3.08,4.18,17,1,0,2,6,8,68886,9781638588054,English,"Art, Photography"
Disney: The Little Mermaid (Tiny Book),Brooke Vitale,192,Insight Editions,2020-03-17,7.81,3.19,4.3,27,0,0,6,7,14,133333,9781683838678,English,"Art, Photography"
Failed Princesses Vol. 6,Ajiichi,193,"Seven Seas Entertainment, LLC",2022-11-15,10.64,2.86,4.59,49,0,0,3,14,32,34247,9781638586029,English,"Art, Photography"
Yuuna and the Haunted Hot Springs Vol. 22,Tadahiro Miura,194,"Seven Seas Entertainment, LLC",2022-12-27,10.55,2.95,3.15,13,1,4,2,4,2,34235,9781638586845,English,"Art, Photography"
Drawing Dragons : Learn How to Create Fantastic Fire-Breathing Dragons,Sandra Staple,144,Ulysses Press,2008-06-12,17.73,2.87,4.23,159,1,4,25,56,73,17711,9781569756416,English,"Art, Photography"
Alfred's Basic Piano Library Notespeller Book 1B,"Gayle Kowalchyk, E L Lancaster",32,"Alfred Publishing Co Inc.,U.S.",1991-07-01,8.07,0.93,4.8,5,0,0,0,1,4,117895,9780739016008,English,"Art, Photography"
Drawing Dragons : Learn How to Create Fantastic Fire-Breathing Dragons,Sandra Staple,144,Ulysses Press,2008-06-12,17.73,2.87,4.23,159,1,4,25,56,73,17711,9781569756416,English,"Art, Photography"
Alfred's Basic Piano Library Notespeller Book 1B,"Gayle Kowalchyk, E L Lancaster",32,"Alfred Publishing Co Inc.,U.S.",1991-07-01,8.07,0.93,4.8,5,0,0,0,1,4,117895,9780739016008,English,"Art, Photography"
"Animal Crossing: New Horizons, Vol. 3 : Deserted Island Diary",Kokonasu Rumba,128,"Viz Media, Subs. of Shogakukan Inc",2022-10-13,8.42,2.58,3.76,94,1,8,30,29,26,8931,9781974729074,English,"Art, Photography"
BERKLEE MUSIC THEORY BOOK 2 - 2ND EDITION,"Paul Schmeling, Susan Gedutis Lindsay",69,Berklee Press Publications,2011-05-01,24.63,0.37,3.92,37,1,3,11,5,17,48735,9780876391112,English,"Art, Photography"
Benny Greb - The Language of Drumming Book : A System for Musical Expression. Includes Online Audio & 2-Hour Video,"Benny Greb, Joe Bergamini, Rick Gratton",96,Hal Leonard Corporation,2017-03-01,26.93,3.07,4.68,25,0,0,2,4,19,43581,9781495072116,English,"Art, Photography"
Disney Cinderella (Tiny Book),Brooke Vitale,192,Insight Editions,2019-08-27,9.18,3.32,4.21,19,0,0,5,5,9,35456,9781683836988,English,"Art, Photography"
My Music Practice Book,Wise Publications,112,Hal Leonard Europe Limited,2010-03-01,4.63,1.37,4.25,4,0,0,1,1,2,130510,9781849383431,English,"Art, Photography"
The Drawing Ideas Book,Frances Stanfield,176,Octopus Publishing Group,2019-08-20,12.00,0.50,4,7,0,0,3,1,3,31550,9781781576885,English,"Art, Photography"
The Case Files of Jeweler Richard (Manga) Vol. 3,"Nanako Tsujimura, Mika Akatsuki, Utako Yukihiro",170,"Seven Seas Entertainment, LLC",2022-09-27,10.31,3.69,4.09,46,1,0,10,18,17,97702,9781638586173,English,"Art, Photography"
The Little World of Liz Climo Postcard Book,Liz Climo,30,CHRONICLE BOOKS,2020-08-24,10.18,1.32,4.75,4,0,0,0,1,3,115192,9781797202136,English,"Art, Photography"
BERKLEE MUSIC THEORY BOOK 2 - 2ND EDITION,"Paul Schmeling, Susan Gedutis Lindsay",69,Berklee Press Publications,2011-05-01,24.63,0.37,3.92,37,1,3,11,5,17,48735,9780876391112,English,"Art, Photography"
Piano Adventures for the Older Beginner Perf. Bk 1 : Performance Book 1,"Nancy Faber, Randall Faber",40,Faber Piano Adventures,2000-01-01,7.93,2.07,4.54,13,0,0,0,6,7,106101,9781616772079,English,"Art, Photography"
Syrup: A Yuri Anthology Vol. 1,Milk Morinaga,180,"Seven Seas Entertainment, LLC",2020-08-11,14.33,0.67,3.36,480,22,73,182,117,86,11151,9781645055334,English,"Art, Photography"
The Digital Photography Book : The Step-by-Step Secrets for how to Make Your Photos Look Like the Pros,Scott Kelby,272,Rocky Nook,2020-09-22,24.70,6.80,4.5,32,0,1,2,9,20,142362,9781681986715,English,"Art, Photography"
The Measure Of A Man : A Memoir,Sidney Poitier,272,Simon & Schuster,2007-03-01,11.28,0.53,3.74,12380,413,1072,3272,4217,3406,76730,9780743403863,English,"Art, Photography"
Color Love Coloring Book : Perfectly Portable Pages,Thaneeya Mcardle,64,Design Originals,2015-09-01,5.97,0.03,4.34,29,1,1,2,8,17,139195,9781497200357,English,"Art, Photography"
"Accent On Achievement, Book 2 (Trumpet)","Professor John O'Reilly, Mark Williams",48,"Alfred Publishing Co Inc.,U.S.",1998-05-01,10.52,0.48,4,16,1,2,1,4,8,125338,9780739004630,English,"Art, Photography"
"A Tropical Fish Yearns for Snow, Vol. 9",Makoto Hagino,186,"Viz Media, Subs. of Shogakukan Inc",2022-09-01,9.33,1.67,3.83,168,3,12,45,59,49,38246,9781974730117,English,"Art, Photography"
Little Book of Valentino : The story of the iconic fashion house,Karen Homer,160,Welbeck Publishing Group,2022-04-19,16.22,0.28,3.86,21,0,1,6,9,5,10358,9781802790146,English,"Art, Photography"
"Whatever You Are, Be a Good One",Lisa Congdon,108,CHRONICLE BOOKS,2014-04-01,15.27,0.73,4.01,651,15,33,136,212,255,60187,9781452124834,English,"Art, Photography"
"Studying Early Printed Books, 1450-1800 - A Practical Guide",S Werner,216,John Wiley and Sons Ltd,2019-03-01,22.14,0.86,4.37,62,0,1,7,22,32,342043,9781119049968,English,"Art, Photography"
Birds by Charley Harper Book of Postcards,Pomegranate,30,"Pomegranate Communications Inc,US",2010-08-27,12.44,1.56,4.7,23,0,0,0,7,16,118762,9780764953729,English,"Art, Photography"
Homer Vol. II. Iliad (Books XIII-XXIV),"D. B. Monro, T. W. Allen",320,Oxford University Press,1963-03-26,24.91,35.09,4.53,947,6,17,83,203,638,398761,9780198145295,English,"Art, Photography"
The Typography Idea Book : Inspiration from 50 Masters,"Steven Heller, Gail Anderson",128,Laurence King Publishing,2016-08-23,13.94,4.56,3.58,76,1,6,31,24,14,137762,9781780678498,English,"Art, Photography"
The Allen Vizzutti Trumpet Method Book 1 : Technical Studies,Allen Vizzutti,128,"Alfred Publishing Co Inc.,U.S.",1991-02-01,20.12,9.83,3.9,10,1,0,2,3,4,54223,9780739019412,English,"Art, Photography"
Yuuna and the Haunted Hot Springs Vol. 3,Tadahiro Miura,193,"Seven Seas Entertainment, LLC",2018-08-07,11.93,3.57,3.92,129,3,10,26,45,45,108495,9781947804142,English,"Art, Photography"
Uzaki-chan Wants to Hang Out! Vol. 2,Take,176,"Seven Seas Entertainment, LLC",2020-01-14,10.18,4.82,4.06,226,4,11,46,72,93,106910,9781645051930,English,"Art, Photography"
Kemono Jihen Vol. 1,Sho Aimoto,192,"Seven Seas Entertainment, LLC",2022-08-09,11.26,3.24,4.06,468,3,17,93,191,164,128354,9781638585398,English,"Art, Photography"
"A Tropical Fish Yearns for Snow, Vol. 9",Makoto Hagino,186,"Viz Media, Subs. of Shogakukan Inc",2022-09-01,9.33,1.67,3.83,168,3,12,45,59,49,38246,9781974730117,English,"Art, Photography"
"Splatoon, Vol. 13",Sankichi Hinodeya,168,"Viz Media, Subs. of Shogakukan Inc",2021-11-11,8.94,2.06,4.59,39,0,1,3,7,28,126308,9781974724581,English,"Art, Photography"
NTR - Netsuzou Trap Vol. 1,Kodama Naoko,180,"Seven Seas Entertainment, LLC",2016-09-20,12.12,0.38,3.3,510,49,85,145,124,107,120926,9781626923355,English,"Art, Photography"
Lumberjanes Vol. 10 : Parents' Day,"Kat Leyh, Maarta Laiho, Shannon Watters, Nd Stevenson, Grace Ellis, Gus Allen, Ayme Sotuyo",112,Boom! Studios,2019-01-24,12.95,1.55,4.15,3005,6,59,531,1304,1105,134628,9781684152780,English,"Art, Photography"
Little Book of Balenciaga : The Story of the Iconic Fashion House,Emmanuelle Dirix,160,Welbeck Publishing Group,2022-04-19,16.98,0.52,4.07,14,0,0,3,7,4,28785,9781787398306,English,"Art, Photography"
Preacher Book 3,Garth Ennis,352,DC Comics,2010-12-21,28.16,16.84,4.36,4816,11,54,567,1742,2442,131667,9781401230166,English,"Art, Photography"
Color this Book: New York City,Abbi Jacobson,32,CHRONICLE BOOKS,2013-05-01,10.17,0.83,4.58,33,0,0,2,10,21,120267,9781452117331,English,"Art, Photography"
Bowie's Books : The Hundred Literary Heroes Who Changed His Life,John O'Connell,288,Bloomsbury Publishing PLC,2021-09-03,11.91,1.59,3.73,1240,14,74,392,512,248,64055,9781526605818,English,"Art, Photography"
The Young Violinist's Repertoire Book 1,Paul De Keyser,40,Faber Music Ltd,2014-11-15,11.12,0.38,5,1,0,0,0,0,1,57724,9780571506187,English,"Art, Photography"
"Solos for Young Violinists , Vol. 4 : Selections from the Student Repertoire",Barbara Barber,72,"Alfred Publishing Co Inc.,U.S.",1999-07-01,13.84,5.11,4.75,8,0,0,0,2,6,115041,9780874879919,English,"Art, Photography"
Yuuna and the Haunted Hot Springs Vol. 21,Tadahiro Miura,202,"Seven Seas Entertainment, LLC",2022-11-01,12.37,1.63,3.44,16,2,2,2,7,3,11267,9781638582984,English,"Art, Photography"
"The ABRSM Songbook, Book 4 : Selected pieces and traditional songs in five volumes",ABRSM,80,Associated Board of the Royal Schools of Music,2008-09-04,25.36,0.64,4,2,0,0,1,0,1,127755,9781860966002,English,"Art, Photography"
Invader Zim Vol. 2,"Jhonen Vasquez, Eric Trueheart, Dave Crosland",136,"Oni Press,US",2016-08-09,17.76,3.24,3.95,456,5,24,118,149,160,121453,9781620103364,English,"Art, Photography"
The Art of Harry Potter : Mini Book of Graphic Design,Insight Editions,304,Insight Editions,2018-10-23,10.97,3.53,4.3,70,1,1,9,24,35,62758,9781683834526,English,"Art, Photography"
The Medieval Mind of C. S. Lewis - How Great Books Shaped a Great Mind,Jason M. Baxter,176,IVP Academic,2022-03-15,19.69,5.01,4.57,347,0,3,13,113,218,39637,9781514001646,English,"Art, Photography"
"The ABRSM Songbook, Book 4 : Selected pieces and traditional songs in five volumes",ABRSM,80,Associated Board of the Royal Schools of Music,2008-09-04,25.36,0.64,4,2,0,0,1,0,1,127755,9781860966002,English,"Art, Photography"
"Ramble Book : Musings on Childhood, Friendship, Family and 80s Pop Culture",Adam Buxton,368,HarperCollins Publishers,2021-09-07,13.40,5.60,4.15,3866,8,82,632,1734,1410,156773,9780008293338,English,"Art, Photography"
Metal Rhythm Guitar Vol. 1,Troy Stetina,64,Hal Leonard Corporation,1992-03-01,20.69,2.31,4.15,41,2,0,6,15,18,111384,9780793509584,English,"Art, Photography"
Little Book of Balenciaga : The Story of the Iconic Fashion House,Emmanuelle Dirix,160,Welbeck Publishing Group,2022-04-19,16.98,0.52,4.07,14,0,0,3,7,4,28785,9781787398306,English,"Art, Photography"
The Case Files of Jeweler Richard (Manga) Vol. 4,"Nanako Tsujimura, Mika Akatsuki, Utako Yukihiro",242,"Seven Seas Entertainment, LLC",2022-12-06,11.14,2.86,4.48,27,0,0,2,10,15,11050,9781638588429,English,"Art, Photography"
Music for Children Vol. 1 : Pentatonic,"Margaret Murray, Carl Orff, Gunild Keetman",144,Schott Musik International GmbH & Co KG,2012-09-28,24.79,2.21,4.78,9,0,0,1,0,8,23399,9783795795016,English,"Art, Photography"
I Can't Believe I Slept With You! Vol. 3,Miyako Miyahara,186,"Seven Seas Entertainment, LLC",2022-11-08,11.26,3.24,4.42,127,0,0,18,38,71,34214,9781638587767,English,"Art, Photography"
The Future of Architecture in 100 Buildings,Marc Kushner,176,Simon & Schuster/ Ted,2015-03-10,20.65,2.35,3.76,537,10,35,169,184,139,81997,9781476784922,English,"Art, Photography"
"Boruto: Naruto Next Generations, Vol. 12","Ukyo Kodachi, Masashi Kishimoto, Mikio Ikemoto",176,"Viz Media, Subs. of Shogakukan Inc",2021-11-11,9.33,0.67,4.1,491,7,22,95,157,210,101620,9781974722778,English,"Art, Photography"
"Skip*Beat!, Vol. 45",Yoshiki Nakamura,168,"Viz Media, Subs. of Shogakukan Inc",2021-04-15,9.63,1.37,4.62,650,3,1,35,165,446,119174,9781974721108,English,"Art, Photography"
The Materials and Techniques of Medieval Painting,Daniel V. Thompson,256,Dover Publications Inc.,2003-03-28,12.65,2.35,4.13,62,0,2,13,22,25,58256,9780486203270,English,"Art, Photography"
The Book of Illusions,Paul Auster,336,Faber & Faber,2011-05-05,9.47,0.53,3.9,22815,309,1213,5325,9610,6358,144630,9780571276530,English,"Art, Photography"
Music For Little Mozarts : Music Lesson Book 3,"Christine H Barden, Gayle Kowalchyk, E L Lancaster",48,"Alfred Publishing Co Inc.,U.S.",2000-02-01,9.52,3.43,4,1,0,0,0,1,0,52517,9780739006443,English,"Art, Photography"
Pepperbox Jazz: Bk. 2 : (piano),Elissa Milne,32,Faber Music Ltd,2006-12-01,10.48,2.02,5,7,0,0,0,0,7,121745,9780571523726,English,"Art, Photography"
Pepperbox Jazz: Bk. 2 : (piano),Elissa Milne,32,Faber Music Ltd,2006-12-01,10.48,2.02,5,7,0,0,0,0,7,121745,9780571523726,English,"Art, Photography"
"Magi: The Labyrinth of Magic, Vol. 36",Shinobu Ohtaka,192,"Viz Media, Subs. of Shogakukan Inc",2019-06-27,8.83,0.17,3.83,296,9,27,72,84,104,110578,9781974703036,English,"Art, Photography"
The Irish Fiddle Book (CD Edition),Matt Cranitch,190,Ossian Publications Ltd,2006-01-25,28.01,7.99,4.4,25,0,0,2,11,12,107021,9781900428675,English,"Art, Photography"
"Solos for Young Violinists , Vol. 3 : Selections from the Student Repertoire",Barbara Barber,72,"Alfred Publishing Co Inc.,U.S.",1999-07-01,13.84,5.11,4.83,6,0,0,0,1,5,111805,9780874879902,English,"Art, Photography"
My Senpai is Annoying Vol. 9,Shiromanta,136,"Seven Seas Entertainment, LLC",2023-01-03,13.44,2.06,4.25,24,1,0,3,8,12,11049,9781638588566,English,"Art, Photography"
101 Music Games for Children : Fun and Learning with Rhythms and Songs,G. Storms,160,"Hunter House Inc.,U.S.",1999-11-10,18.64,2.36,4.04,26,0,2,5,9,10,63576,9780897931649,English,"Art, Photography"
"A Tropical Fish Yearns for Snow, Vol. 3",Makoto Hagino,168,"Viz Media, Subs. of Shogakukan Inc",2020-06-11,9.33,1.17,4.03,532,1,15,119,227,170,24652,9781974710607,English,"Art, Photography"
The Education Of A Gardener,"Russell Page, Robin Lane Fox",448,"The New York Review of Books, Inc",2007-07-03,25.59,0.41,3.72,135,3,13,34,54,31,54415,9781590172315,English,"Art, Photography"
Harry Potter: Hogwarts School of Witchcraft and Wizardry,Jody Revenson,192,Insight Editions,2020-03-17,7.65,3.35,4.2,40,1,1,8,9,21,33539,9781683834588,English,"Art, Photography"
"Celtic Hand Stroke by Stroke (Irish Half-Uncial from ""The Book of Kells"") : An Arthur Baker Calligraphy Manual",Arthur Baker,48,Dover Publications Inc.,2000-01-02,7.91,0.59,3.92,26,1,0,9,6,10,73196,9780486243368,English,"Art, Photography"
You Will be Able to Draw Faces by the End of This Book,Jake Spicer,160,Octopus Publishing Group,2018-08-07,18.93,0.57,4.15,33,0,2,5,12,14,30624,9781781575260,English,"Art, Photography"
"Magi: The Labyrinth of Magic, Vol. 37",Shinobu Ohtaka,192,"Viz Media, Subs. of Shogakukan Inc",2019-08-22,8.94,0.06,3.83,309,14,25,71,87,112,104680,9781974703043,English,"Art, Photography"
Christmas Coloring Book,Thaneeya Mcardle,80,Design Originals,2015-11-01,10.05,0.95,4.05,19,0,2,5,2,10,116830,9781497200807,English,"Art, Photography"
Sushi,PIE Books,208,PIE Books,2014-02-28,20.80,3.70,4.41,22,0,0,3,7,12,344168,9784756241344,English,"Art, Photography"
Archidoodle : An Architect's Activity Book,Steve Bowkett,160,Laurence King Publishing,2013-11-05,18.15,5.35,4.33,61,1,2,5,21,32,10681,9781780673219,English,"Art, Photography"
You Will be Able to Draw Faces by the End of This Book,Jake Spicer,160,Octopus Publishing Group,2018-08-07,18.93,0.57,4.15,33,0,2,5,12,14,30624,9781781575260,English,"Art, Photography"
Alfred's Basic Piano Library Theory Book 2-3 : Complete,"Willard A Palmer, Morton Manus, Amanda Vick Lethco",48,"Alfred Publishing Co Inc.,U.S.",1992-10-01,8.87,1.13,4.67,3,0,0,0,1,2,76979,9780739008669,English,"Art, Photography"
"Konosuba: God's Blessing on This Wonderful World!, Vol. 14","Natsume Akatsuki, Masahito Watari",162,"Little, Brown & Company",2022-12-13,11.45,2.05,4.25,8,0,0,1,4,3,22705,9781975348205,English,"Art, Photography"
Sushi,PIE Books,208,PIE Books,2014-02-28,20.80,3.70,4.41,22,0,0,3,7,12,344168,9784756241344,English,"Art, Photography"
Cats in Art: A Pop-Up Book,"Corina Fletcher, Susan Herbert",6,Thames & Hudson Ltd,2020-10-06,16.38,2.12,4.65,17,0,0,1,4,12,101011,9780500023594,English,"Art, Photography"
The Book of the Raven : Corvids in Art and Legend,"Angus Hyland, Caroline Roberts",160,Orion Publishing Co,2021-10-19,16.06,1.94,4.43,150,0,3,13,51,83,158658,9781786277015,English,"Art, Photography"
Toradora! (Manga) Vol. 10,"Yuyuko Takemiya, Zekkyo",162,"Seven Seas Entertainment, LLC",2022-12-27,10.23,3.27,4.5,4,0,0,0,2,2,6141,9781648275555,English,"Art, Photography"
"The Complete Guitar Player : Books 1, 2, & 3",Russ Shipton,128,AMSCO Music,2002-06-01,34.25,2.75,4.33,3,0,0,0,2,1,126729,9780825619366,English,"Art, Photography"
Superstudies Violin Book 2,Mary Cohen,16,Faber Music Ltd,2014-11-15,9.02,0.48,4,3,0,0,1,1,1,57717,9780571514502,English,"Art, Photography"
The Country Diary of an Edwardian Lady Colouring Book,Edith Holden,96,Penguin Books Ltd,2017-02-21,15.88,0.12,4.71,7,0,0,0,2,5,91845,9780718185428,English,"Art, Photography"
"Accent On Achievement, Book 1 (Trombone)","Professor John O'Reilly, Mark Williams",48,"Alfred Publishing Co Inc.,U.S.",2014-08-22,12.03,1.92,3.79,48,4,5,9,9,21,108759,9780739005187,English,"Art, Photography"
"Animal Crossing: New Horizons, Vol. 1 : Deserted Island Diary",Kokonasu Rumba,128,"Viz Media, Subs. of Shogakukan Inc",2021-11-11,9.12,1.88,3.4,952,39,137,353,252,171,22085,9781974725922,English,"Art, Photography"
"Accent On Achievement, Book 1 (Clarinet)","John O'Reilly, Mark Williams",48,"Alfred Publishing Co Inc.,U.S.",2014-08-22,10.52,3.43,3.79,48,4,5,9,9,21,99884,9780739004852,English,"Art, Photography"
"A Tropical Fish Yearns for Snow, Vol. 3",Makoto Hagino,168,"Viz Media, Subs. of Shogakukan Inc",2020-06-11,9.33,1.17,4.03,532,1,15,119,227,170,24652,9781974710607,English,"Art, Photography"
The Book of Mac : Remembering Mac Miller,Donna-claire Chesman,288,Permuted Press,2022-01-20,24.96,4.04,3.53,379,27,55,99,87,111,122863,9781637580684,English,"Art, Photography"
The Book of Mac : Remembering Mac Miller,Donna-claire Chesman,288,Permuted Press,2022-01-20,24.96,4.04,3.53,379,27,55,99,87,111,122863,9781637580684,English,"Art, Photography"
Confess : The year's most touching and revelatory rock autobiography' Telegraph's Best Music Books of 2020,Rob Halford,384,Headline Publishing Group,2021-09-28,11.67,1.83,4.39,2405,7,23,250,860,1265,12474,9781472269324,English,"Art, Photography"
The Industrial Design Reference & Specification Book : Everything Industrial Designers Need to Know Every Day,"Dan Cuffaro, Isaac Zaksenberg",272,Rockport Publishers Inc.,2013-09-15,28.03,0.47,4.11,36,0,1,9,11,15,102751,9781592538478,English,"Art, Photography"
Classroom of the Elite (Manga) Vol. 1,"Syougo Kinugasa, Ichino, Tomoseshunsaku",180,"Seven Seas Entertainment, LLC",2022-03-01,13.54,0.96,3.98,91,2,6,19,29,35,12091,9781638581307,English,"Art, Photography"
Harry Potter: The Dark Arts Tiny Book,Insight Editions,192,Insight Editions,2020-10-08,7.65,1.35,3.96,28,0,1,8,10,9,87404,9781683834595,English,"Art, Photography"
The Listening Book : Discovering Your Own Music,W. A. Mathieu,192,Shambhala Publications Inc,2011-11-15,15.89,4.61,4.04,222,3,10,44,84,81,149949,9781590308318,English,"Art, Photography"
I'm in Love with the Villainess (Light Novel) Vol. 5,"Inori, Hanagata",386,"Seven Seas Entertainment, LLC",2022-10-11,15.67,2.33,4.32,79,0,3,9,27,40,6466,9781638586463,English,"Art, Photography"
Piano Lessons Book 1 & Audio : Hal Leonard Student Piano Library,Hal Leonard Student Piano Library,64,Hal Leonard Corporation,2003-01-01,14.34,1.16,3.67,3,0,1,0,1,1,53859,9780634055546,English,"Art, Photography"
"Skip*Beat!, Vol. 43",Yoshiki Nakamura,192,"Viz Media, Subs. of Shogakukan Inc",2019-12-10,10.30,0.70,4.46,813,4,7,85,236,481,113578,9781974710416,English,"Art, Photography"
After Hours Book 1,Pam Wedgwood,32,Faber Music Ltd,2003-01-01,11.74,0.76,4.5,2,0,0,0,1,1,113274,9780571521104,English,"Art, Photography"
Kase-san and Yamada Vol. 2,Hiromi Takashima,178,"Seven Seas Entertainment, LLC",2022-02-15,13.79,1.21,4.23,163,0,3,27,63,70,33969,9781648279379,English,"Art, Photography"
Miss Kobayashi's Dragon Maid Vol. 11,Coolkyousinnjya,148,"Seven Seas Entertainment, LLC",2021-12-14,9.62,4.38,4.19,88,1,3,16,26,42,35944,9781648274633,English,"Art, Photography"
Piano Adventures Performance Book Level 5,"Nancy Faber, Randall Faber",32,Faber Piano Adventures,1997-01-01,7.40,0.60,4.67,3,0,0,0,1,2,3983,9781616770952,English,"Art, Photography"
My First Piano Adventure - Christmas (Book C - Skips On The Staff),"Nancy Faber, Randall Faber",19,Faber Piano Adventures,2010-09-01,6.99,0.01,5,3,0,0,0,0,3,63574,9781616776275,English,"Art, Photography"
Principles of Violin Playing and Teaching (Dover Books on Music),Ivan Galamian,118,Echo Point Books & Media,2017-12-27,18.78,0.12,4.62,56,1,1,2,10,42,343156,9781626545076,English,"Art, Photography"
Color Christmas Coloring Book : Perfectly Portable Pages,Thaneeya Mcardle,64,Design Originals,2015-11-01,5.22,0.78,4.4,20,0,1,2,5,12,110917,9781497200814,English,"Art, Photography"
Accordion Course Book 3,"Willard A Palmer, Bill Hughes",48,"Alfred Publishing Co Inc.,U.S.",2016-11-22,10.12,3.83,4.67,12,0,0,1,2,9,105770,9780739012215,English,"Art, Photography"
"The First Book of Scales, Chords, Arpeggios : & Cadences","Willard A Palmer, Morton Manus, Amanda Vick Lethco",32,"Alfred Publishing Co Inc.,U.S.",1994-12-01,8.54,1.46,3.89,9,1,0,2,2,4,52500,9780739012970,English,"Art, Photography"
The Very Pointless Quiz Book : Prove your Pointless Credentials,"Alexander Armstrong, Richard Osman",336,HODDER & STOUGHTON,2015-06-04,10.71,3.29,3.76,95,2,7,30,29,27,114724,9781444782745,English,"Art, Photography"
Lumberjanes Vol. 9,"Kat Leyh, Carolyn Nowak, Maarta Laiho, Shannon Watters, ND Stevenson, Grace Ellis, Gus Allen",112,Boom! Studios,2018-09-20,13.59,0.41,4.07,3334,14,80,674,1460,1106,36501,9781608869572,English,"Art, Photography"
The Backstagers Vol. 1,"James Tynion IV, Rian Sygh",112,Boom! Studios,2017-08-24,13.02,0.98,3.93,5553,66,283,1293,2227,1684,36988,9781608869930,English,"Art, Photography"
Homer Vol. IV. Odyssey (Books XIII-XXIV),"D. B. Monro, T. W. Allen",240,Oxford University Press,2010-03-26,24.91,31.09,4.48,568,8,10,58,117,375,404586,9780198145325,English,"Art, Photography"
Tales from the Witch's Cottage : Coloring Book,Hanna Karlzon,64,Gibbs M. Smith Inc,2022-07-05,16.67,0.83,5,3,0,0,0,0,3,6440,9781423661658,English,"Art, Photography"
Himouto! Umaru-chan Vol. 1,Sankakuhead,180,"Seven Seas Entertainment, LLC",2018-05-22,9.16,5.84,4.14,729,27,32,113,195,362,47262,9781626928817,English,"Art, Photography"
This Book Is Literally Just Pictures of Cute Animals That Will Make You Feel Better,Smith Street Books,96,SMITH STREET BOOKS,2019-10-08,14.37,3.13,4.3,70,0,1,16,14,39,243963,9781925811186,English,"Art, Photography"
Berklee Music Theory Book 1 - 2nd Edition,"Paul Schmeling, Susan Gedutis Lindsay",110,Berklee Press Publications,2011-03-01,25.24,2.76,4.02,99,2,3,23,34,37,50756,9780876391105,English,"Art, Photography"
Citrus Plus Vol. 2,Saburouta,180,"Seven Seas Entertainment, LLC",2020-11-24,13.64,1.36,4.14,200,2,4,41,69,84,107290,9781645057338,English,"Art, Photography"
SUPER HXEROS Vol. 3,Ryoma Kitada,180,"Seven Seas Entertainment, LLC",2021-07-06,12.21,2.79,3.54,24,3,2,5,7,7,293204,9781648275500,English,"Art, Photography"
The Designing for Growth Field Book : A Step-by-Step Project Guide,"Jeanne Liedtka, Tim Ogilvie",152,Columbia University Press,2019-04-30,20.77,0.23,4.57,7,0,0,0,3,4,16126,9780231187893,English,"Art, Photography"
The Broadway Musical Quiz Book,Laura Frankos,288,Hal Leonard Corporation,2010-08-01,19.82,0.13,3.63,30,3,2,8,7,10,266943,9781423492757,English,"Art, Photography"
Bowie's Bookshelf : The Hundred Books That Changed David Bowie's Life,John O'Connell,320,GALLERY BOOKS,2019-11-12,18.41,0.59,3.73,1255,14,74,398,518,251,215208,9781982112547,English,"Art, Photography"
"101 Stories of the Great Ballets : The scene-by-scene stories of the most popular ballets, old and new","George Balanchine, Francis Mason",560,Bantam Doubleday Dell Publishing Group Inc,1989-04-01,18.77,2.23,4.03,216,4,11,45,71,85,16276,9780385033985,English,"Art, Photography"
"Suzuki Violin School, Vol 8 : Violin Part",Alfred Music,24,Suzuki Method International,1995-05-01,7.08,2.87,4.86,7,0,0,0,1,6,280133,9780874871586,English,"Art, Photography"
"Star Wars Lost Stars, Vol. 3 (Manga)","Claudia Gray, Yusaku Komiyama",200,Yen Press,2019-11-12,12.91,0.99,4.28,406,0,8,57,155,186,22370,9781975358679,English,"Art, Photography"
The Mammoth Book of Slasher Movies,Peter Normanton,528,"Little, Brown Book Group",2012-12-11,14.76,1.24,3.59,135,4,13,41,53,24,335112,9781780330365,English,"Art, Photography"
The Mime Book,Claude Kipnis,202,Christian Publishers LLC,1988-11-01,19.89,1.11,4.38,34,0,1,4,10,19,379943,9780916260552,English,"Art, Photography"
Connecting Chords With Linear Harmony : Jazz Book,Bert Ligon,152,Hal Leonard Corporation,1996-05-01,29.90,6.10,4.3,77,1,3,9,23,41,57363,9780793561933,English,"Art, Photography"
Jazz Improvisation for Guitar,Garrison Fewell,109,Berklee Press Publications,2010-11-01,29.21,0.79,4.33,6,0,1,0,1,4,214296,9780876391044,English,"Art, Photography"
Wonder Cat Kyuu-chan Vol. 4,Sasami Nitori,128,"Seven Seas Entertainment, LLC",2022-01-25,15.37,0.13,4.52,202,1,2,16,55,128,34423,9781648274763,English,"Art, Photography"
