title,authors,number_of_pages,publisher,publication_date,price_in_euros,discount_in_euros,rating,number_of_votes_goodreads,number_of_votes_one_star,number_of_votes_two_stars,number_of_votes_three_stars,number_of_votes_four_stars,number_of_votes_five_stars,bestsellers_rank,isbn13,language,category
Cutting Edge 3rd Edition Intermediate Students' Book and DVD Pack,"Sarah Cunningham, Peter Moor, Jonathan Bygrave",96,Pearson Education Limited,2016-10-05,36.41,4.24,4,2,0,0,1,0,1,66529,9781447936879,English,"Children, Books"
Cutting Edge 3rd Edition Intermediate Students' Book and DVD Pack,"Sarah Cunningham, Peter Moor, Jonathan Bygrave",96,Pearson Education Limited,2016-10-05,36.41,4.24,4,2,0,0,1,0,1,66529,9781447936879,English,"Children, Books"
"The Little Artists' Big Book of Activities : 60 Fun and Creative Projects to Explore Color, Patterns, Shapes, Art History and More",Shannon Wong-Nizic,168,Page Street Publishing Co.,2022-07-12,19.51,3.49,4,3,0,1,0,0,2,73829,9781645675808,English,"Children, Books"
When I Care About Others,Cornelia Spelman,24,Albert Whitman & Company,2004-03-01,8.69,0.31,4.01,126,2,5,32,38,49,51093,9780807588987,English,"Children, Books"
"The Eye of Minds (The Mortality Doctrine, Book One)",James Dashner,352,Random House USA Inc,2015-02-20,11.39,2.11,3.85,39718,1089,3066,9291,13586,12686,83352,9780385741408,English,"Children, Books"
The Berenstain Bears Trick or Treat,"Stan Berenstain, Jan Berenstain",32,Random House USA Inc,1989-08-12,5.99,0.01,4.26,7708,65,211,1471,1904,4057,57073,9780679800910,English,"Children, Books"
"The Case of the Missing Moonstone (The Wollstonecraft Detective Agency, Book 1)","Jordan Stratford, Kelly Murphy",240,Random House USA Inc,2016-01-26,8.85,0.15,3.86,2522,29,121,671,1062,639,65703,9780385754439,English,"Children, Books"
Skating Shoes,Noel Streatfeild,224,Random House USA Inc,2009-10-13,7.69,0.31,4.09,3657,33,110,753,1346,1415,70817,9780440477310,English,"Children, Books"
The Times Cryptic Crossword Book 19 : 80 World-Famous Crossword Puzzles,"The Times Mind Games, Richard Browne",192,HarperCollins Publishers,2015-04-01,9.25,0.75,2,2,1,0,1,0,0,94274,9780007580781,English,"Children, Books"
"Laid-Back Camp, Vol. 7",Afro,160,"Little, Brown & Company",2019-10-01,11.71,0.79,4.37,276,1,2,34,97,142,93879,9781975358129,English,"Children, Books"
The Berenstain Bears Trick or Treat,"Stan Berenstain, Jan Berenstain",32,Random House USA Inc,1989-08-12,5.99,0.01,4.26,7708,65,211,1471,1904,4057,57073,9780679800910,English,"Children, Books"
"How To Heal Your Chakras With Fairy Rainbow (Children's book about a Fairy, Chakra Healing and Meditation, Picture Books, Kindergarten Books, Toddler Books, Kids Book, 3-8, Kids Story, Books for Kids)",Nerissa Marie,30,Childrens Books Kids Books,2017-04-29,8.50,0.50,5,1,0,0,0,0,1,367910,9781925647525,English,"Children, Books"
I'm a Ballerina!,"Sue Fliess, Joey Chou",24,Random House USA Inc,2015-07-14,6.82,0.18,4.21,146,0,4,31,41,70,58954,9780553497588,English,"Children, Books"
"Konosuba: An Explosion on This Wonderful World!, Vol. 1 (light novel)","Natsume Akatsuki, Kurone Mishima",182,"Little, Brown & Company",2019-12-24,12.53,2.47,4.07,196,1,6,41,78,70,67386,9781975359607,English,"Children, Books"
"Project X Origins: Gold Book Band, Oxford Level 9: Communication: Message in an X-bot",Tony Bradman,24,Oxford University Press,2014-01-09,6.82,3.68,3,1,0,0,1,0,0,47103,9780198302032,English,"Children, Books"
"Rokka: Braves of the Six Flowers, Vol. 2 (light novel)","Ishio Yamagata, Miyagi",224,"Little, Brown & Company",2017-08-22,13.33,1.67,4.23,325,1,9,49,122,144,67871,9780316556194,English,"Children, Books"
When I Care About Others,Cornelia Spelman,24,Albert Whitman & Company,2004-03-01,8.69,0.31,4.01,126,2,5,32,38,49,51093,9780807588987,English,"Children, Books"
My First Horse and Pony Book,"Kingfisher (individual), Judith Draper",48,Pan Macmillan,2005-07-04,10.62,1.88,3.54,26,2,2,9,6,7,51440,9780753458785,English,"Children, Books"
Himouto! Umaru-chan Vol. 1,Sankakuhead,180,"Seven Seas Entertainment, LLC",2018-05-22,9.16,5.84,4.14,729,27,32,113,195,362,47262,9781626928817,English,"Children, Books"
Harry Potter: The Monster Book of Monsters : It Roams and Chomps!,Donald Lemke,48,"Running Press,U.S.",2020-12-17,13.45,2.05,4,2,0,0,0,2,0,53106,9780762497171,English,"Children, Books"
Gobbolino the Witch's Cat,Ursula Williams,240,Penguin Random House Children's UK,2014-08-26,9.33,0.67,4.15,1386,10,43,264,480,589,66547,9780141354897,English,"Children, Books"
Beast Quest: Arachnid the King of Spiders : Series 2 Book 5,Adam Blade,144,Hachette Children's Group,2015-06-04,5.93,0.57,4.07,729,17,66,128,159,359,30321,9781846169922,English,"Children, Books"
"Konosuba: An Explosion on This Wonderful World!, Vol. 1 (light novel)","Natsume Akatsuki, Kurone Mishima",182,"Little, Brown & Company",2019-12-24,12.53,2.47,4.07,196,1,6,41,78,70,67386,9781975359607,English,"Children, Books"
Secret Kingdom: Unicorn Valley : Book 2,Rosie Banks,128,Hachette Children's Group,2012-07-05,6.02,1.48,4.3,444,7,23,55,105,254,24864,9781408323656,English,"Children, Books"
"My Milk Will Go, Our Love Will Grow : A Book for Weaning","Jessica Elder, Sheila Fein",40,Heart Words Press,2020-01-28,13.37,2.13,4.77,26,0,0,3,0,23,2093,9781733417716,English,"Children, Books"
"The Naughtiest Girl: Well Done, The Naughtiest Girl : Book 8",Anne Digby,192,Hachette Children's Group,2008-02-07,5.73,0.77,4.16,1422,12,57,281,413,659,23550,9780340917763,English,"Children, Books"
A Kiss for Little Bear,"Else Holmelund Minarik, Maurice Sendak",32,HarperCollins Publishers Inc,2011-08-31,4.52,0.98,4.32,13151,102,320,2107,3418,7204,40952,9780064440509,English,"Children, Books"
Tales from the Witch's Cottage : Coloring Book,Hanna Karlzon,64,Gibbs M. Smith Inc,2022-07-05,16.67,0.83,5,3,0,0,0,0,3,6440,9781423661658,English,"Children, Books"
Famous Five: Five On A Hike Together : Book 10,Enid Blyton,208,Hachette Children's Group,1997-03-19,7.13,2.17,4.02,8833,64,291,2196,3114,3168,23682,9780340681152,English,"Children, Books"
"Splatoon, Vol. 12",Sankichi Hinodeya,160,"Viz Media, Subs. of Shogakukan Inc",2021-06-24,8.97,2.03,4.51,55,0,1,3,18,33,21240,9781974722396,English,"Children, Books"
"Wait, What?: A Comic Book Guide to Relationships, Bodies, and Growing Up","Heather Corinna, Isabella Rotman",72,"Oni Press,US",2019-09-03,12.69,1.81,4.34,370,3,8,39,132,188,35218,9781620106594,English,"Children, Books"
Skip and Loafer Vol. 6,Misaki Takamatsu,184,"Seven Seas Entertainment, LLC",2022-11-29,10.55,2.95,4.6,210,1,0,11,57,141,6221,9781638587897,English,"Children, Books"
No Flying in the House,"Betty Brock, Wallace Tripp",144,Harpercollins Publishers Inc,2020-05-05,6.92,1.08,4.19,3021,43,126,497,902,1453,63617,9780064401302,English,"Children, Books"
Adult Puzzle Book : 100 Assorted Puzzles,How2become,150,How2become Ltd,2017-08-20,9.27,3.93,3.25,8,1,2,1,2,2,101202,9781911259886,English,"Children, Books"
"Story of the World, Vol. 2 Audiobook : History for the Classical Child: The Middle Ages","Jim Weiss, Susan Wise Bauer",9,Peace Hill Press,2007-09-25,38.93,12.77,4.33,2514,23,41,290,882,1278,91335,9781933339122,English,"Children, Books"
"Laid-Back Camp, Vol. 9",Afro,160,"Little, Brown & Company",2020-08-25,10.63,3.37,4.42,198,1,2,21,62,112,95784,9781975315375,English,"Children, Books"
"Splatoon, Vol. 12",Sankichi Hinodeya,160,"Viz Media, Subs. of Shogakukan Inc",2021-06-24,8.97,2.03,4.51,55,0,1,3,18,33,21240,9781974722396,English,"Children, Books"
Rainbow Magic Beginner Reader: The Rainbow Fairies : Book 1,"Daisy Meadows, Georgie Ripper",32,Hachette Children's Group,2014-10-02,5.79,1.71,4.23,31,1,2,3,8,17,46165,9781408333747,English,"Children, Books"
"Log Horizon, Vol. 6 (light novel) : Lost Child of the Dawn",Mamare Touno,240,"Little, Brown & Company",2016-11-15,13.15,0.75,4.14,305,3,10,53,115,124,79226,9780316263870,English,"Children, Books"
A Kiss for Little Bear,"Else Holmelund Minarik, Maurice Sendak",32,HarperCollins Publishers Inc,2011-08-31,4.52,0.98,4.32,13151,102,320,2107,3418,7204,40952,9780064440509,English,"Children, Books"
Rock Star : Book 19,"Francesca Simon, Tony Ross",144,Hachette Children's Group,2010-09-02,5.92,1.58,4.12,550,15,39,90,128,278,26863,9781842551349,English,"Children, Books"
Famous Five: Five On A Hike Together : Book 10,Enid Blyton,208,Hachette Children's Group,1997-03-19,7.13,2.17,4.02,8833,64,291,2196,3114,3168,23682,9780340681152,English,"Children, Books"
"Story of the World, Vol. 2 Audiobook : History for the Classical Child: The Middle Ages","Jim Weiss, Susan Wise Bauer",9,Peace Hill Press,2007-09-25,38.93,12.77,4.33,2514,23,41,290,882,1278,91335,9781933339122,English,"Children, Books"
50 Football Skills,Various,104,Usborne Publishing Ltd,2014-05-01,8.72,0.28,3.17,6,1,2,0,1,2,60187,9781409583097,English,"Children, Books"
My First Horse and Pony Book,"Kingfisher (individual), Judith Draper",48,Pan Macmillan,2005-07-04,10.62,1.88,3.54,26,2,2,9,6,7,51440,9780753458785,English,"Children, Books"
"Project X Origins: Turquoise Book Band, Oxford Level 7: Discovery: Tiger's Discovery",Michaela Morgan,24,Oxford University Press,2014-01-09,6.58,3.42,5,3,0,0,0,0,3,44891,9780198301554,English,"Children, Books"
Famous Five: Five On A Hike Together : Book 10,Enid Blyton,208,Hachette Children's Group,1997-03-19,7.13,2.17,4.02,8833,64,291,2196,3114,3168,23682,9780340681152,English,"Children, Books"
Sparkly Fairies Sticker Book,"Kirsteen Robson, Lauren Ellis, Stella Baggott",32,Usborne Publishing Ltd,2019-05-02,8.29,0.71,3.33,3,1,0,0,1,1,104073,9781474960359,English,"Children, Books"
The Table Where Rich People Sit,"Byrd Baylor, Peter Parnall",32,Aladdin Paperbacks,1998-07-01,9.45,0.55,4.39,522,6,12,54,153,297,53342,9780689820083,English,"Children, Books"
"Story of the World, Vol. 2 Audiobook : History for the Classical Child: The Middle Ages","Jim Weiss, Susan Wise Bauer",9,Peace Hill Press,2007-09-25,38.93,12.77,4.33,2514,23,41,290,882,1278,91335,9781933339122,English,"Children, Books"
Complete Swedish Beginner to Intermediate Course : (Book and audio support),Anneli Beronius Haake,368,John Murray Press,2018-06-26,34.67,7.83,3.79,53,2,4,13,18,16,6630,9781444195101,English,"Children, Books"
Bluecoats Vol. 7: The Blues in the Mud,Raoul Cauvin,48,Cinebook Ltd,2014-04-07,9.14,3.86,3.87,108,0,7,28,45,28,93611,9781849181839,English,"Children, Books"
Bloom Into You (Light Novel): Regarding Saeki Sayaka Vol. 3,Hitoma Iruma,228,"Seven Seas Entertainment, LLC",2020-12-22,13.39,1.61,4.49,368,2,5,27,112,222,34867,9781645057277,English,"Children, Books"
How Do Planes Fly? How Airplanes Work - Children's Aviation Books,Professor Gusto,40,Professor Gusto,2016-05-25,11.82,3.38,5,2,0,0,0,0,2,272783,9781683219729,English,"Children, Books"
"Goblin Slayer, Vol. 8 (light novel)","Kumo Kagyu, Noboru Kannatuki",208,"Little, Brown & Company",2019-10-01,13.70,1.30,4.38,247,0,5,27,83,132,77753,9781975331788,English,"Children, Books"
"My Youth Romantic Comedy is Wrong, As I Expected, Vol. 7 (light novel)",Wataru Watari,192,"Little, Brown & Company",2019-02-19,13.67,1.33,4.32,496,4,7,57,188,240,44720,9781975384128,English,"Children, Books"
Cutting Edge 3rd Edition Pre-Intermediate Students' Book and DVD Pack,"Sarah Cunningham, Peter Moor, Araminta Crace",176,Pearson Education Limited,2016-10-12,38.73,1.92,4.43,7,0,0,0,4,3,64160,9781447936909,English,"Children, Books"
"I've Been Killing Slimes for 300 Years and Maxed Out My Level, Vol.1","Kisetsu Morita, Bensio",208,Yen on,2018-04-24,12.60,2.40,3.93,1309,45,89,283,386,506,59066,9780316448277,English,"Children, Books"
The Magical Unicorn Society Official Colouring Book,"Oana Befort, Ciara Ni Dhuinn, Harry and Zanna Goldhawk (Papio Goldhawk (Papio Press)",64,Michael O'Mara Books Ltd,2018-10-18,8.28,0.72,5,3,0,0,0,0,3,30063,9781789290561,English,"Children, Books"
"Death March to the Parallel World Rhapsody, Vol. 2 (light novel)",Hiro Ainana,208,"Little, Brown & Company",2017-05-23,13.20,1.80,4.3,942,12,20,122,312,476,62672,9780316507974,English,"Children, Books"
The Oxford Nursery Rhyme Book,"Iona Opie, Joan Hassall",240,Oxford University Press,1964-12-31,19.71,2.29,4.14,50,0,0,7,29,14,122316,9780198691129,English,"Children, Books"
The Book of Ivy,Amy Engel,304,HODDER & STOUGHTON,2015-10-08,9.12,2.38,4.14,22404,303,824,3642,8333,9302,44262,9781473629301,English,"Children, Books"
Giant Days Vol. 7,"John Allison, Liz Fleming, Max Sarin",112,Boom! Studios,2018-05-31,12.96,3.04,4.24,4578,10,35,574,2181,1778,100241,9781684151318,English,"Children, Books"
Julie of the Wolves,"Jean Craighead George, John Schoenherr",170,HarperCollins Publishers Inc,2019-07-02,7.99,1.01,3.83,58128,1428,3965,15184,20306,17245,65994,9780064400589,English,"Children, Books"
Why Do Farts Smell Like Rotten Eggs?,Mitchell Symons,352,Penguin Random House Children's UK,2010-05-27,9.99,0.01,4.16,56,2,1,11,14,28,64205,9781862307490,English,"Children, Books"
My Advent Calendar Christmas Book,"Antonia Jackson, Krisztina Kallai Nagy",32,SPCK Publishing,2014-08-01,7.58,3.92,4,3,0,0,0,3,0,97998,9780745963921,English,"Children, Books"
Flap Your Wings,P.D. Eastman,48,Random House USA Inc,2000-01-25,10.49,0.51,4.24,1666,26,56,266,456,862,83496,9780375802430,English,"Children, Books"
"My Youth Romantic Comedy is Wrong, As I Expected @ comic, Vol. 8 (light novel)",Wataru Watari,192,"Little, Brown & Company",2019-11-05,13.79,1.21,4.45,445,2,1,38,158,246,22019,9781975384135,English,"Children, Books"
Grammar and Vocabulary for First and First for Schools Book with Answers and Audio,"Barbara Thomas, Louise Hashemi, Laura Matthews",256,Cambridge University Press,2015-06-05,32.58,1.73,3.9,10,1,0,2,3,4,73085,9781107481060,English,"Children, Books"
"Social Success Workbook For Teens: Skill-Building Activities for Teens with Nonverbal Learning Disorder, Asperger's Disorder, and Other Social-Skill Problems",Barbara Cooper,130,New Harbinger Publications,2008-08-13,15.38,3.62,3.94,65,2,1,18,22,22,49218,9781572246140,English,"Children, Books"
Chronicles of Ancient Darkness: Ghost Hunter : Book 6 from the bestselling author of Wolf Brother,Michelle Paver,256,Hachette Children's Group,2011-04-07,8.97,1.03,4.4,8663,42,131,928,2739,4823,20902,9781842551172,English,"Children, Books"
"Pokemon Adventures, Vol. 15","Hidenori Kusaka, Mato",144,VIZ Media,2013-03-05,9.53,1.47,4.31,721,7,24,96,206,388,118393,9781421535494,English,"Children, Books"
"The LEGO Games Book : 50 fun brainteasers, games, challenges, and puzzles!",Tori Kosara,80,Dorling Kindersley Ltd,2020-10-08,19.18,0.42,4,13,1,0,1,7,4,118734,9780241409466,English,"Children, Books"
"My Youth Romantic Comedy is Wrong, As I Expected @ comic, Vol. 7.5 (light novel)",Wataru Watari,192,"Little, Brown & Company",2019-06-18,12.48,2.52,3.82,303,5,18,96,91,93,56501,9781975384159,English,"Children, Books"
"Log Horizon, Vol. 9 (light novel)","Mamare Touno, Kazuhiro Hara",272,"Little, Brown & Company",2017-10-31,13.93,1.07,4.04,106,1,5,21,41,38,95468,9780316470971,English,"Children, Books"
Usagi Yojimbo: Book 2,Stan Sakai,144,Fantagraphics,2005-09-01,17.49,0.01,4.34,1826,9,23,195,719,880,134438,9780930193881,English,"Children, Books"
Christmas Coloring Book,Thaneeya Mcardle,80,Design Originals,2015-11-01,10.05,0.95,4.05,19,0,2,5,2,10,116830,9781497200807,English,"Children, Books"
Stopping The Pain: A Workbook for Teens Who Cut and Self-Injure,Lawrence E. Shapiro,168,New Harbinger Publications,2008-05-29,15.87,4.63,3.98,129,3,7,23,53,43,50035,9781572246027,English,"Children, Books"
I Am A Bunny,"Ole Risom, Richard Scarry",24,Random House USA Inc,2015-01-06,5.99,0.01,4.34,7578,65,235,1135,1795,4348,46622,9780385384759,English,"Children, Books"
Bletchley Park Brainteasers : The biggest selling quiz book of 2017,Sinclair McKay,288,Headline Publishing Group,2018-11-13,14.84,4.66,3.78,112,3,8,30,41,30,23288,9781472252609,English,"Children, Books"
"The Answer Book for Kids, Volume 1 : 22 Questions from Kids on Creation and the Fall",Ken Ham,48,Master Books,2008-07-01,8.83,0.17,4.19,108,6,6,7,32,57,111159,9780890515266,English,"Children, Books"
Usagi Yojimbo: Book 2,Stan Sakai,144,Fantagraphics,2005-09-01,17.49,0.01,4.34,1826,9,23,195,719,880,134438,9780930193881,English,"Children, Books"
CHERUB: New Guard : Book 17,Robert Muchamore,320,Hachette Children's Group,2017-08-08,8.84,1.96,4.43,2135,12,33,247,569,1274,50521,9781444914146,English,"Children, Books"
Rainbow Magic: Lacey the Little Mermaid Fairy : The Fairytale Fairies Book 4,"Daisy Meadows, Georgie Ripper",80,Hachette Children's Group,2021-06-01,5.44,2.06,4.25,364,15,17,49,64,219,6702,9781408336786,English,"Children, Books"
"A Certain Magical Index, Vol. 6 (light novel)",Kazuma Kamachi,224,"Little, Brown & Company",2016-02-23,14.21,0.29,3.78,381,5,34,108,127,107,96658,9780316340601,English,"Children, Books"
Skip and Loafer Vol. 5,Misaki Takamatsu,184,"Seven Seas Entertainment, LLC",2022-07-26,10.39,3.11,4.62,307,1,0,15,82,209,34930,9781638583714,English,"Children, Books"
"I Cannot Reach You, Vol. 5",Mika,196,"Little, Brown & Company",2022-12-13,13.49,0.01,4.22,130,1,3,18,53,55,91652,9781975351564,English,"Children, Books"
Rainbow Magic: Lauren The Puppy Fairy : The Pet Keeper Fairies Book 4,"Daisy Meadows, Georgie Ripper",80,Hachette Children's Group,2021-09-21,5.41,2.09,3.94,1424,67,119,302,284,652,29064,9781846161698,English,"Children, Books"
"A Certain Magical Index, Vol. 6 (light novel)",Kazuma Kamachi,224,"Little, Brown & Company",2016-02-23,14.21,0.29,3.78,381,5,34,108,127,107,96658,9780316340601,English,"Children, Books"
Doughnuts Under a Crescent Moon Vol. 1,Shio Usui,180,"Seven Seas Entertainment, LLC",2021-02-23,13.27,1.73,4.4,1201,2,16,113,437,633,28839,9781648270741,English,"Children, Books"
Michael Rosen's Book of Very Silly Poems,"Michael Rosen, Shoo Rayner",64,Penguin Random House Children's UK,2018-10-04,6.66,2.34,4.03,74,3,4,14,20,33,68761,9780241354575,English,"Children, Books"
A Little Book of Coincidence : In the Solar System,John Martineau,64,WALKER & CO,2002-04-01,13.74,0.76,4.03,287,5,19,57,87,119,121801,9780802713889,English,"Children, Books"
Little Scholastic: Little Piggy Hand-Puppet Board Book,"Jill Ackerman, Michelle Berg",6,Scholastic US,2007-07-01,12.42,1.08,4.21,24,1,1,4,4,14,73920,9780545030380,English,"Children, Books"
The Times Quick Cryptic Crossword Book 2 : 100 World-Famous Crossword Puzzles,"The Times Mind Games, Richard Rogan",240,HarperCollins Publishers,2017-04-01,9.83,0.17,4.44,9,1,0,0,1,7,67556,9780008173876,English,"Children, Books"
Behaviour Matters: Lion's in a Flap - A book about feeling worried,"Sue Graves, Trevor Dunton",32,Hachette Children's Group,2016-10-13,7.47,1.53,3.62,32,0,3,12,11,6,42609,9781445142487,English,"Children, Books"
"The Great Pet Plan: Juliet, Nearly a Vet (Book 1)",Rebecca Johnson,96,Penguin Random House Australia,2013-04-01,7.98,2.02,4.27,64,1,2,10,17,34,74078,9780143307044,English,"Children, Books"
The Last Wild Trilogy: The Dark Wild : Book 2,"Piers Torday, Oliver Hembrough",368,Hachette Children's Group,2014-09-08,9.24,0.76,4.18,932,11,32,154,320,415,27263,9781848663787,English,"Children, Books"
A Little Book of Coincidence : In the Solar System,John Martineau,64,WALKER & CO,2002-04-01,13.74,0.76,4.03,287,5,19,57,87,119,121801,9780802713889,English,"Children, Books"
Angelfall : Penryn and the End of Days Book One,Susan Ee,336,Hodder & Stoughton,2013-06-01,9.53,1.97,4.11,184745,5107,8887,28467,59502,82782,44321,9781444778519,English,"Children, Books"
Where Does Maisy Live? : A Maisy Lift-the-Flap Book,Lucy Cousins,12,"Candlewick Press,U.S.",2010-06-08,7.88,0.12,3.81,129,1,7,45,38,38,54107,9780763646684,English,"Children, Books"
Lucky Luke Vol. 77: A Cowboy In High Cotton,"Jul, Achdé",48,CINEBOOK LTD,2021-04-19,10.42,2.08,3.81,346,8,21,82,153,82,91560,9781849185950,English,"Children, Books"
The Storm Book,"Charlotte Zolotow, Margaret Bloy Graham",29,HarperCollins Publishers Inc,1989-01-15,7.36,1.64,3.85,688,9,53,190,214,222,132207,9780064431941,English,"Children, Books"
"Social Success Workbook For Teens: Skill-Building Activities for Teens with Nonverbal Learning Disorder, Asperger's Disorder, and Other Social-Skill Problems",Barbara Cooper,130,New Harbinger Publications,2008-08-13,15.38,3.62,3.94,65,2,1,18,22,22,49218,9781572246140,English,"Children, Books"
"I Cannot Reach You, Vol. 5",Mika,196,"Little, Brown & Company",2022-12-13,13.49,0.01,4.22,130,1,3,18,53,55,91652,9781975351564,English,"Children, Books"
A Certain Scientific Railgun Vol. 11,Kazuma Kamachi,180,"Seven Seas Entertainment, LLC",2016-06-28,13.13,0.37,4.03,115,2,4,25,42,42,105936,9781626922167,English,"Children, Books"
Peter's Chair,Ezra Jack Keats,40,Penguin Random House Australia,1998-08-01,8.75,0.25,4.21,4077,32,135,700,1274,1936,83836,9780140564419,English,"Children, Books"
Toradora! (Manga) Vol. 10,"Yuyuko Takemiya, Zekkyo",162,"Seven Seas Entertainment, LLC",2022-12-27,10.23,3.27,4.5,4,0,0,0,2,2,6141,9781648275555,English,"Children, Books"
Old MacDonald Had a Farm,"Golden Books, Anne Kennedy",24,Random House USA Inc,2013-01-08,6.82,0.18,4.21,95,1,2,21,23,48,98540,9780307979643,English,"Children, Books"
"My Happy Marriage, Vol. 2 (light novel)","Akumi Agitogi, Tsukiho Tsukioka",180,"Little, Brown & Company",2022-07-12,13.40,2.60,4.04,247,0,10,59,90,88,22177,9781975335021,English,"Children, Books"
Peter's Chair,Ezra Jack Keats,40,Penguin Random House Australia,1998-08-01,8.75,0.25,4.21,4077,32,135,700,1274,1936,83836,9780140564419,English,"Children, Books"
Junie B. Jones Complete Kindergarten Collection : Books 1-17,"Barbara Park, Denise Brunkus",96,Random House USA Inc,2014-07-22,79.22,11.78,4.39,71,3,2,6,13,47,115947,9780385376945,English,"Children, Books"
The Last Wild Trilogy: The Dark Wild : Book 2,"Piers Torday, Oliver Hembrough",368,Hachette Children's Group,2014-09-08,9.24,0.76,4.18,932,11,32,154,320,415,27263,9781848663787,English,"Children, Books"
Classroom of the Elite (Manga) Vol. 1,"Syougo Kinugasa, Ichino, Tomoseshunsaku",180,"Seven Seas Entertainment, LLC",2022-03-01,13.54,0.96,3.98,91,2,6,19,29,35,12091,9781638581307,English,"Children, Books"
Nuevo Espanol en Marcha 1 : Exercises Book + CD : Level A1,"Pilar Díaz Ballesteros, Ignacio ... [et al.] Rodero, Francisca Castro Viudez, Carmen Sardinero Francos",64,Sociedad General Espanola de Libreria,2014-02-25,20.28,2.69,5,1,0,0,0,0,1,74120,9788497783743,Spanish,"Children, Books"
Doughnuts Under a Crescent Moon Vol. 1,Shio Usui,180,"Seven Seas Entertainment, LLC",2021-02-23,13.27,1.73,4.4,1201,2,16,113,437,633,28839,9781648270741,English,"Children, Books"
The House that Jack Built,"Golden Books, J. P. Miller",24,Random House USA Inc,2008-02-26,5.99,0.01,3.99,215,5,8,56,62,84,92183,9780375835308,English,"Children, Books"
"Log Horizon, Vol. 7 (light novel) : The Gold of the Kunie",Mamare Touno,272,"Little, Brown & Company",2017-03-21,13.58,0.42,4.29,226,1,2,32,87,104,92453,9780316263887,English,"Children, Books"
"Play It Cool, Guys, Vol. 2",Kokone Nata,196,"Little, Brown & Company",2021-06-29,14.74,1.26,4.28,430,1,10,60,154,205,8497,9781975324087,English,"Children, Books"
"Play It Cool, Guys, Vol. 2",Kokone Nata,196,"Little, Brown & Company",2021-06-29,14.74,1.26,4.28,430,1,10,60,154,205,8497,9781975324087,English,"Children, Books"
Junie B. Jones Complete Kindergarten Collection : Books 1-17,"Barbara Park, Denise Brunkus",96,Random House USA Inc,2014-07-22,79.22,11.78,4.39,71,3,2,6,13,47,115947,9780385376945,English,"Children, Books"
Where's the Unicorn Now? : A Magical Search and Find Book,"Sophie Schrey, Paul Moran",48,Michael O'Mara Books Ltd,2018-09-20,8.90,0.10,3.95,37,3,1,9,6,18,34382,9781782439950,English,"Children, Books"
Beast Quest: Narga the Sea Monster : Series 3 Book 3,Adam Blade,144,Hachette Children's Group,2015-06-04,6.31,1.19,4.11,599,21,37,101,135,305,25679,9781408300008,English,"Children, Books"
Wheels on the Bus,"Grosset & Dunlap, Jerry Smath",18,Penguin Putnam Inc,1991-05-02,5.69,0.31,4.16,233,2,7,54,59,111,63528,9780448401249,English,"Children, Books"
"Goblin Slayer, Vol. 9 (light novel)","Kumo Kagyu, Noboru Kannatuki",208,"Little, Brown & Company",2020-01-28,13.00,2.00,4.4,213,1,1,24,73,114,23943,9781975331801,English,"Children, Books"
The Case Files of Jeweler Richard (Light Novel) Vol. 1,"Nanako Tsujimura, Utako Yukihiro",264,"Seven Seas Entertainment, LLC",2022-10-11,13.51,4.49,4.24,124,1,3,14,53,53,4395,9781638585770,English,"Children, Books"
Bo's Magical New Friend: A Branches Book (Unicorn Diaries #1) : Volume 1,Rebecca Elliott,80,Scholastic US,2019-12-26,5.97,0.03,4.26,998,12,34,162,264,526,69757,9781338323320,English,"Children, Books"
Five Little Ducks,Penny Ives,16,Child's Play International Ltd,2007-10-01,7.85,0.15,3.9,206,1,16,54,66,69,50593,9781846431371,English,"Children, Books"
"Torture Princess: Fremd Torturchen, Vol. 1 (light novel)","Keishi Ayasato, Saki Ukai",192,"Little, Brown & Company",2019-05-21,14.47,0.53,3.82,252,6,23,60,84,79,22905,9781975304690,English,"Children, Books"
"Play It Cool, Guys, Vol. 4",Kokone Nata,144,"Little, Brown & Company",2022-09-27,13.71,2.29,4.33,94,1,0,11,37,45,22712,9781975346683,English,"Children, Books"
World After : Penryn and the End of Days Book Two,Susan Ee,448,Hodder & Stoughton,2013-11-21,11.30,0.20,4.16,100225,1377,3667,16055,35957,43169,44320,9781444778533,English,"Children, Books"
Archidoodle : An Architect's Activity Book,Steve Bowkett,160,Laurence King Publishing,2013-11-05,18.15,5.35,4.33,61,1,2,5,21,32,10681,9781780673219,English,"Children, Books"
Cambridge English: Proficiency (CPE) Masterclass: Student's Book with Online Skills and Language Practice Pack : Master an exceptional level of English with confidence,"Kathy Gude, Michael Duckworth",189,Oxford University Press,2012-12-01,55.86,10.64,4.48,21,0,0,2,7,12,53462,9780194705240,English,"Children, Books"
