title,authors,number_of_pages,publisher,publication_date,price_in_euros,discount_in_euros,rating,number_of_votes_goodreads,number_of_votes_one_star,number_of_votes_two_stars,number_of_votes_three_stars,number_of_votes_four_stars,number_of_votes_five_stars,bestsellers_rank,isbn13,language,category
"Is It Wrong to Try to Pick Up Girls in a Dungeon?, Vol. 3 (manga)",Fujino Omori,176,"Little, Brown & Company",2015-11-17,12.15,0.35,4.31,434,3,6,57,154,214,16890,9780316352079,English,"Children, Books"
The Last Olympian: The Graphic Novel (Percy Jackson Book 5),Rick Riordan,128,Penguin Random House Children's UK,2020-02-24,15.34,0.66,4.44,3128,11,65,346,810,1896,67552,9780241342909,English,"Children, Books"
"The Irregular at Magic High School, Vol. 7 (light novel)","Tsutomu Satou, Kana Ishida",272,"Little, Brown & Company",2018-03-27,12.92,2.08,4.42,906,9,15,93,260,529,86112,9781975300074,English,"Children, Books"
Cat Massage Therapy Vol. 1,Haru Hisakawa,128,"Seven Seas Entertainment, LLC",2021-12-21,14.47,1.03,4.48,1162,1,21,131,277,732,134640,9781648276569,English,"Children, Books"
"A to Z Mysteries Boxed Set Collection #1 (Books A, B, C, & D)","Ron Roy, John Steven Gurney",384,Random House USA Inc,2020-10-13,20.53,3.97,4.5,2,0,0,0,1,1,345438,9780593378120,English,"Children, Books"
Beyond The Blues : A Workbook to Help Teens Overcome Depression,Lisa M. Schab,160,New Harbinger Publications,2008-08-13,17.13,0.37,3.92,92,2,7,17,36,30,62442,9781572246119,English,"Children, Books"
We're Going on a Bear Hunt: Christmas Activity Book,Walker Productions Ltd,32,Walker Books Ltd,2018-11-01,8.79,0.21,3.88,8,1,0,2,1,4,92074,9781406384512,English,"Children, Books"
The Lion King Read-Along Storybook,"Disney Books, Disney Storybook Art Team",32,Disney Press,2019-06-04,7.87,0.13,4.54,13,0,0,1,4,8,123057,9781368041560,English,"Children, Books"
Chronicles of Ancient Darkness: Spirit Walker : Book 2 from the bestselling author of Wolf Brother,Michelle Paver,304,Hachette Children's Group,2011-04-07,8.95,1.05,4.28,15266,76,325,2127,5418,7320,27693,9781842551134,English,"Children, Books"
"Ready, Set, Grow! : A What's Happening to My Body? Book for Younger Girls","Lynda Madaras, Linda Davick",128,HarperCollins Publishers Inc,2007-12-13,13.82,3.18,4.12,170,8,5,27,48,82,23285,9781557045652,English,"Children, Books"
"Little Witch Academia, Vol. 3 (manga)","Yoh Yoshinari, TRIGGER, Keisuke Sato",192,"Little, Brown & Company",2019-05-21,10.07,1.43,3.87,546,5,36,152,186,167,105211,9781975357429,English,"Children, Books"
Beast Quest: Carnivora the Winged Scavenger : Series 7 Book 6,Adam Blade,144,Hachette Children's Group,2016-02-11,6.23,1.27,4.16,160,3,11,26,38,82,28672,9781408307342,English,"Children, Books"
Operation Ouch: Medical Milestones and Crazy Cures : Book 2,"Dr Chris van Tulleken, Dr Xand van Tulleken",224,Hachette Children's Group,2014-09-04,7.67,1.33,4.52,31,0,0,6,3,22,45027,9781405529815,English,"Children, Books"
"From Mild to Wild, Dinosaurs for Kids - Dinosaur Book for 6-Year-Old Children's Dinosaur Books",Baby Professor,64,Baby Professor,2017-12-01,14.03,6.17,4,1,0,0,0,1,0,38349,9781541916364,English,"Children, Books"
The Quiet Book,"Deborah Underwood, Renata Liwska",32,HOUGHTON MIFFLIN,2016-09-07,6.91,1.09,4.06,5158,63,249,1057,1742,2047,53770,9780544809048,English,"Children, Books"
School Zone Girls Vol. 4,Ningiyau,240,"Seven Seas Entertainment, LLC",2022-12-20,13.31,1.19,4.3,20,0,0,3,8,9,36216,9781638582137,English,"Children, Books"
Giant Days Vol. 12,"John Allison, Max Sarin",112,Boom! Studios,2020-04-30,15.49,0.51,4.13,2366,2,30,403,1146,785,33797,9781684154845,English,"Children, Books"
"Barakamon, Vol. 14",Satsuki Yoshino,224,"Little, Brown & Company",2017-09-19,14.51,0.49,4.25,323,1,2,56,119,145,58549,9780316511216,English,"Children, Books"
"My Weird School Christmas 3-Book Box Set : Miss Holly Is Too Jolly!, Dr. Carbles Is Losing His Marbles!, Deck the Halls, We're Off the Walls! A Christmas Holiday Book for Kids","Dan Gutman, Jim Paillot",368,HarperCollins Publishers Inc,2015-11-05,15.46,1.04,4.38,26,0,3,1,5,17,83325,9780062424365,English,"Children, Books"
Dragon's Halloween: An Acorn Book (Dragon #4) : Volume 4,Dav Pilkey,64,Scholastic US,2020-07-07,5.54,0.46,4.14,644,6,18,137,200,283,47590,9781338347487,English,"Children, Books"
Trapped in a Dating Sim: The World of Otome Games is Tough for Mobs (Light Novel) Vol. 1,Yomu Mishima,320,"Seven Seas Entertainment, LLC",2021-02-16,15.09,0.41,4.31,594,11,13,65,198,307,11809,9781645059509,English,"Children, Books"
Home for a Bunny,"Margaret Wise Brown, Garth Williams",24,Random House USA Inc,2012-01-10,5.99,0.01,4.24,3018,25,112,548,756,1577,62748,9780307930095,English,"Children, Books"
Horrid Henry Early Reader: Horrid Henry's Homework : Book 23,"Francesca Simon, Tony Ross",80,Hachette Children's Group,2013-07-18,6.27,1.23,4.17,76,5,3,11,12,45,12779,9781444001228,English,"Children, Books"
Alphonse Mucha (Art Colouring Book) : Make Your Own Art Masterpiece,"Daisy Seal, David Jones",96,Flame Tree Publishing,2016-09-25,16.77,1.23,4.75,4,0,0,0,1,3,28809,9781786640468,English,"Children, Books"
United As One : Lorien Legacies Book 7,Pittacus Lore,352,Penguin Books Ltd,2017-06-01,11.19,0.21,4.3,29076,190,682,3890,9731,14583,32210,9780718184896,English,"Children, Books"
When I Feel Worried,Cornelia Spelman,24,Albert Whitman & Company,2014-09-01,7.62,0.38,3.88,126,1,9,31,48,37,77103,9780807588956,English,"Children, Books"
A Universe of Wishes: A We Need Diverse Books Anthology,"V.E. Schwab, Zoraida Cordova, Libba Bray, Nic Stone, Tessa Gratton, Rebecca Roanhorse, Samira Ahmed, Natalie C. Parker, Anna-Marie McLemore, Dhonielle Clayton",400,Titan Books Ltd,2021-07-06,11.26,0.24,3.75,2071,21,117,616,921,396,28480,9781789098006,English,"Children, Books"
Awesome Paper Doll Cut Outs Activity Book - Activities Books For Kids,Activibooks For Kids,78,Activibooks for Kids,2016-01-20,15.08,4.62,5,1,0,0,0,0,1,347460,9781683210528,English,"Children, Books"
"Sonic The Hedgehog, Vol. 10: Test Run!","Evan Stanley, Adam Bryce Thomas",96,Idea & Design Works,2022-03-08,14.79,2.21,4.23,101,1,2,19,30,49,113886,9781684058518,English,"Children, Books"
Swim with Little Fish!: Bath Book,Lucy Cousins,8,Walker Books Ltd,2019-04-04,7.49,2.51,4.2,5,0,0,1,2,2,138239,9781406383508,English,"Children, Books"
Hug Me Little Bunny: Finger Puppet Book,Chronicle Books,10,CHRONICLE BOOKS,2019-02-19,9.30,1.70,4.6,5,0,0,0,2,3,379826,9781452175225,English,"Children, Books"
Curious George Grows A Garden (2 Books In 1),"Erica Zappy, Marcy Goldberg Sacks",48,Houghton Mifflin Harcourt Publishing Company,2012-03-07,6.52,0.48,3.24,17,1,4,6,2,4,428666,9780547643045,English,"Children, Books"
Behaviour Matters: Cheetah Learns to Play Nicely - A book about being a good sport,"Sue Graves, Trevor Dunton",32,Hachette Children's Group,2019-04-11,7.52,1.48,4.18,11,0,1,2,2,6,43562,9781445158723,English,"Children, Books"
"Paradise : A BBC Radio 4 Book at Bedtime, by the winner of the Nobel Prize in Literature 2021",Abdulrazak Gurnah,256,Bloomsbury Publishing PLC,2004-11-15,11.12,1.38,3.6,6364,110,529,2155,2566,1004,4310,9780747573999,English,"Children, Books"
The Best Ever Baking Book : How to Bake Delicious Things to Eat,Jane Bull,64,Dorling Kindersley Ltd,2017-10-05,11.10,1.40,4.17,6,0,0,1,3,2,122359,9780241318164,English,"Children, Books"
"Pokemon X*Y, Vol. 1","Hidenori Kusaka, Satoshi Yamamoto",96,"Viz Media, Subs. of Shogakukan Inc",2015-01-15,5.32,0.18,4.09,263,8,12,44,84,115,122040,9781421579801,English,"Children, Books"
"Barakamon, Vol. 14",Satsuki Yoshino,224,"Little, Brown & Company",2017-09-19,14.51,0.49,4.25,323,1,2,56,119,145,58549,9780316511216,English,"Children, Books"
"Little Witch Academia, Vol. 3 (manga)","Yoh Yoshinari, TRIGGER, Keisuke Sato",192,"Little, Brown & Company",2019-05-21,10.07,1.43,3.87,546,5,36,152,186,167,105211,9781975357429,English,"Children, Books"
"Thank You, Amelia Bedelia : I Can Read","Peggy Parish, Barbara Siebel Thomas",64,HarperCollins Publishers (Australia) Pty Ltd,1995-08-01,5.79,0.21,4.18,4988,65,181,975,1359,2408,45928,9780064441711,English,"Children, Books"
Amelia Bedelia CD Audio Collection,"Peggy Parish, Suzanne Toren",1,Greenwillow Books,2004-09-01,12.84,5.16,4.07,107,1,7,19,36,44,55617,9780060740542,English,"Children, Books"
"From Mild to Wild, Dinosaurs for Kids - Dinosaur Book for 6-Year-Old Children's Dinosaur Books",Baby Professor,64,Baby Professor,2017-12-01,14.03,6.17,4,1,0,0,0,1,0,38349,9781541916364,English,"Children, Books"
Chronicles of Ancient Darkness: Spirit Walker : Book 2 from the bestselling author of Wolf Brother,Michelle Paver,304,Hachette Children's Group,2011-04-07,8.95,1.05,4.28,15266,76,325,2127,5418,7320,27693,9781842551134,English,"Children, Books"
"The Irregular at Magic High School, Vol. 7 (light novel)","Tsutomu Satou, Kana Ishida",272,"Little, Brown & Company",2018-03-27,12.92,2.08,4.42,906,9,15,93,260,529,86112,9781975300074,English,"Children, Books"
God Is Listening When You Pray - Children's Christian Prayer Books,Baby Professor,42,Baby Professor,2017-02-15,12.68,4.02,5,1,0,0,0,0,1,373232,9781541903203,English,"Children, Books"
Rainbow Magic: Katie The Kitten Fairy : The Pet Keeper Fairies Book 1,"Daisy Meadows, Georgie Ripper",80,Hachette Children's Group,2021-09-21,5.44,2.06,3.97,2619,129,227,518,462,1283,27695,9781846161667,English,"Children, Books"
Where is Baby?,Sally Rippin,12,Allen & Unwin,2009-11-01,5.69,3.81,3.74,23,0,2,9,5,7,75436,9781741753868,English,"Children, Books"
Out of the Blue,"Barefoot Books, Alison Jay",32,Barefoot Books Ltd,2014-06-30,17.03,0.97,3.94,244,0,12,60,102,70,114610,9781782850427,English,"Children, Books"
Invader Zim Vol. 2,"Jhonen Vasquez, Eric Trueheart, Dave Crosland",136,"Oni Press,US",2016-08-09,17.76,3.24,3.96,459,5,24,118,148,164,121453,9781620103364,English,"Children, Books"
The Underwear Book,Todd Parr,32,"Little, Brown & Company",2012-08-07,9.71,0.29,3.74,117,3,8,38,36,32,145392,9780316188319,English,"Children, Books"
Everybody Cooks Rice,"Norah Dooley, Peter J. Thornton",32,Lerner Publishing Group,1992-11-01,6.87,1.13,3.79,474,11,30,152,136,145,67347,9780876145913,English,"Children, Books"
"Death March to the Parallel World Rhapsody, Vol. 17 (light novel)",Hiro Ainana,192,"Little, Brown & Company",2022-07-26,14.71,1.29,4.55,267,1,4,22,61,179,92716,9781975320867,English,"Children, Books"
"Practical Magic : A Beginner's Guide to Crystals, Horoscopes, Psychics, and Spells",Nikki van de Car,176,"Running Press,U.S.",2017-09-28,17.81,1.19,4.01,1202,19,58,235,471,419,53890,9780762463077,English,"Children, Books"
Rainbow Magic: Saffron the Yellow Fairy : The Rainbow Fairies Book 3,"Daisy Meadows, Georgie Ripper",80,Hachette Children's Group,2021-09-07,5.41,2.09,3.87,3215,124,293,794,673,1331,31941,9781843620181,English,"Children, Books"
"Toriko, Vol. 6",Mitsutoshi Shimabukuro,192,"Viz Media, Subs. of Shogakukan Inc",2011-09-15,10.30,0.70,4.25,272,1,7,53,72,139,132915,9781421536941,English,"Children, Books"
"Twin Star Exorcists, Vol. 3 : Onmyoji",Yoshiaki Sukeno,200,"Viz Media, Subs. of Shogakukan Inc",2016-01-28,9.99,1.51,4.24,373,2,9,51,148,163,37959,9781421582177,English,"Children, Books"
A Birthday for Frances,"Russell Hoban, Lillian Hoban",32,HARPERCOLLINS,1994-10-26,8.78,0.22,4.23,2646,29,74,477,758,1308,84169,9780064430074,English,"Children, Books"
Richard Scarry's The Gingerbread Man,"Nancy Nolte, Richard Scarry",24,Random House USA Inc,2015-07-14,5.99,0.01,4.26,5251,66,194,948,1161,2882,57632,9780385376198,English,"Children, Books"
The Underwear Book,Todd Parr,32,"Little, Brown & Company",2012-08-07,9.71,0.29,3.74,117,3,8,38,36,32,145392,9780316188319,English,"Children, Books"
Rainbow Magic: Saffron the Yellow Fairy : The Rainbow Fairies Book 3,"Daisy Meadows, Georgie Ripper",80,Hachette Children's Group,2021-09-07,5.41,2.09,3.87,3215,124,293,794,673,1331,31941,9781843620181,English,"Children, Books"
William's Doll,Charlotte Zolotow,32,HarperCollins Publishers,1993-01-22,7.59,1.41,4.08,1100,20,52,209,357,462,71953,9780064430678,English,"Children, Books"
Dragon Gets By: An Acorn Book (Dragon #3) : Volume 3,Dav Pilkey,64,Scholastic US,2019-12-26,5.85,0.15,4.23,752,9,26,124,216,377,13514,9781338347500,English,"Children, Books"
"Tegami Bachi, Vol. 7",Hiroyuki Asada,184,"Viz Media, Subs. of Shogakukan Inc",2011-11-10,10.23,0.77,4.21,463,1,11,82,165,204,66408,9781421536040,English,"Children, Books"
The Art of Harry Potter : Mini Book of Graphic Design,Insight Editions,304,Insight Editions,2018-10-23,10.96,3.54,4.31,74,1,1,9,26,37,62713,9781683834526,English,"Children, Books"
"Pokemon Adventures, Vol. 15","Hidenori Kusaka, Mato",144,VIZ Media,2013-03-05,9.53,1.47,4.31,721,7,24,96,206,388,118393,9781421535494,English,"Children, Books"
Will Shortz Presents the Monster Book of Sudoku for Kids,Will Shortz,186,Griffin Publishing,2007-02-01,10.16,0.84,4.33,24,0,0,6,4,14,99178,9780312368425,English,"Children, Books"
First Test : Book 1 of the Protector of the Small Quartet,Tamora Pierce,240,Random House USA Inc,2004-08-24,10.76,0.24,4.24,58941,726,1652,8836,19555,28172,58825,9780375829055,English,"Children, Books"
Richard Scarry's The Gingerbread Man,"Nancy Nolte, Richard Scarry",24,Random House USA Inc,2015-07-14,5.99,0.01,4.26,5251,66,194,948,1161,2882,57632,9780385376198,English,"Children, Books"
A Birthday for Frances,"Russell Hoban, Lillian Hoban",32,HARPERCOLLINS,1994-10-26,8.78,0.22,4.23,2646,29,74,477,758,1308,84169,9780064430074,English,"Children, Books"
The Art of Harry Potter : Mini Book of Graphic Design,Insight Editions,304,Insight Editions,2018-10-23,10.96,3.54,4.31,74,1,1,9,26,37,62713,9781683834526,English,"Children, Books"
Toto the Ninja Cat and the Incredible Cheese Heist : Book 2,"Dermot O'Leary, Nick East",192,Hachette Children's Group,2018-09-20,7.41,1.59,4.32,202,0,5,29,64,104,30480,9781444939477,English,"Children, Books"
The Strangeworlds Travel Agency : Book 1,L.D. Lapinski,384,Hachette Children's Group,2020-05-11,9.53,0.47,4.07,2216,19,59,436,935,767,28796,9781510105942,English,"Children, Books"
Matthew's Dream,Leo Lionni,32,Random House USA Inc,1995-04-01,8.69,1.31,3.9,470,2,27,132,163,146,72664,9780679873181,English,"Children, Books"
Madame Doubtfire,Anne Fine,256,Penguin Random House Children's UK,2015-07-04,9.49,0.51,3.62,3391,116,330,1082,1055,808,62313,9780141359755,English,"Children, Books"
The Ember Stone: A Branches Book (the Last Firehawk #1) : Volume 1,"Katrina Charman, Jeremy Norton",96,Scholastic US,2017-09-26,6.99,0.01,4.29,1205,8,30,201,336,630,20530,9781338122138,English,"Children, Books"
The Year of the Book,"Andrea Cheng, Abigail Halpin",160,Clarion Books,2013-07-01,7.23,0.77,3.91,3360,67,175,830,1198,1090,135245,9780544022638,English,"Children, Books"
The Silly Book of Side-Splitting Stuff,"Andy Seed, Scott Garrett",160,Bloomsbury Publishing Plc,2014-05-08,8.93,0.07,4,41,2,2,11,5,21,102308,9781408850794,English,"Children, Books"
Gallagher Girls: Don't Judge A Girl By Her Cover : Book 3,Ally Carter,320,Hachette Children's Group,2015-02-05,8.65,1.35,4.21,69435,654,2059,11701,22909,32112,30780,9781408309537,English,"Children, Books"
The Silliest Joke Book Ever,,128,Penguin Random House Children's UK,2003-09-04,6.73,0.77,3.37,19,2,3,4,6,4,127215,9780141315768,English,"Children, Books"
Girl Who Hated Books,Manjusha Pawagi,24,Second Story Press,2010-09-01,9.68,0.82,3.97,279,5,18,56,101,99,471902,9781896764092,English,"Children, Books"
"Thomas Discovers The Purpose Of Life (Kids book about Self-Esteem for Kids, Picture Book, Kids Books, Bedtime Stories for Kids, Picture Books, Baby Books, Kids Books, Bedtime Story, Books for Kids)",Nerissa Marie,30,Childrens Books Kids Books,2017-01-03,8.50,0.50,4.25,8,1,0,1,0,6,419907,9780994608925,English,"Children, Books"
Warm Hearts Day: A Branches Book (Owl Diaries #5) : Volume 5,Rebecca Elliott,80,Scholastic US,2016-10-25,6.57,0.43,4.41,1194,13,32,134,292,723,45772,9781338042801,English,"Children, Books"
Abe Lincoln: The Boy who Loved Books,Nancy Carpenter,40,SIMON & SCHUSTER,2006-01-10,9.61,0.39,4.05,566,0,17,119,248,182,359283,9781416912682,English,"Children, Books"
The Search for the Missing Bones,"Eva Moore, Joanna Cole, Ted Enik",74,Scholastic Australia,2016-06-07,5.12,0.88,4.42,4286,50,104,579,801,2752,82557,9780439107990,English,"Children, Books"
Cornelius,Leo Lionni,32,Random House USA Inc,1994-03-22,7.69,2.81,3.76,414,4,22,142,149,97,83186,9780679860402,English,"Children, Books"
Horrid Henry Early Reader: Horrid Henry Tricks the Tooth Fairy : Book 22,"Francesca Simon, Tony Ross",80,Hachette Children's Group,2013-05-09,6.24,1.26,4.11,46,1,2,6,19,18,30084,9781444001150,English,"Children, Books"
My First London Bus Cloth Book,Marion Billet,8,Pan Macmillan,2018-07-01,7.11,6.39,4.33,3,0,0,0,2,1,93015,9781509881932,English,"Children, Books"
Stopping The Pain: A Workbook for Teens Who Cut and Self-Injure,Lawrence E. Shapiro,168,New Harbinger Publications,2008-05-29,15.87,4.63,3.98,129,3,7,23,53,43,50035,9781572246027,English,"Children, Books"
Winnie-the-Pooh's Little Book Of Wisdom,"A. A. Milne, E. H. Shepard",64,HarperCollins Publishers,2020-03-05,8.90,0.10,4.32,99,0,3,11,36,49,6579,9781405297592,English,"Children, Books"
"My Youth Romantic Comedy Is Wrong, As I Expected, Vol. 13 (light novel)",Wataru Watari,192,"Little, Brown & Company",2022-03-15,12.31,2.69,4.14,111,0,3,19,48,41,59243,9781975325008,English,"Children, Books"
The Book of Ivy,Amy Engel,304,HODDER & STOUGHTON,2015-10-08,9.12,2.38,4.14,22404,303,824,3642,8333,9302,44262,9781473629301,English,"Children, Books"
"Log Horizon, Vol. 9 (light novel)","Mamare Touno, Kazuhiro Hara",272,"Little, Brown & Company",2017-10-31,13.93,1.07,4.04,106,1,5,21,41,38,95468,9780316470971,English,"Children, Books"
Lucky Luke Vol. 80: The Alibi,"Claude Guylouis, Morris",48,Cinebook Ltd,2022-02-21,9.52,3.98,3.48,216,11,18,80,70,37,10390,9781800440388,English,"Children, Books"
Hop On Pop,Dr. Seuss,64,HarperCollins Publishers,2018-04-19,7.53,1.47,4.02,54490,1040,3171,12777,14396,23106,17062,9780008203900,English,"Children, Books"
"Barakamon, Vol. 5",Satsuki Yoshino,208,"Little, Brown & Company",2015-06-23,14.51,0.49,4.34,579,1,8,67,221,282,122976,9780316340311,English,"Children, Books"
Secret Kingdom: Enchanted Palace : Book 1,Rosie Banks,128,Hachette Children's Group,2012-07-05,5.98,1.52,4.26,675,18,24,108,142,383,31421,9781408323649,English,"Children, Books"
The Times Codeword : 150 Cracking Logic Puzzles,The Times Mind Games,192,HarperCollins Publishers,2009-11-01,9.54,0.76,4,2,0,0,1,0,1,72295,9780007313969,English,"Children, Books"
"Gin Tama, Vol. 13",Hideaki Sorachi,200,Viz Media,2009-07-07,10.65,0.35,4.35,260,2,7,38,65,148,140206,9781421523972,English,"Children, Books"
"Combatants Will be Dispatched!, Vol. 2 (light novel)","Natsume Akatsuki, Kakao Lanthanum",224,"Little, Brown & Company",2019-12-31,13.45,2.55,4.18,80,0,1,18,27,34,166009,9781975331528,English,"Children, Books"
"Yu-Gi-Oh! GX, Vol. 7","Naoyuki Kageyama, Kazuki Takahashi",200,"Viz Media, Subs. of Shogakukan Inc",2011-08-18,10.77,0.23,4.16,191,3,12,30,52,94,60908,9781421539256,English,"Children, Books"
The World's Greatest Paper Airplane and Toy Book,Keith Laux,120,McGraw-Hill Education - Europe,1988-01-01,17.88,0.62,3.91,33,0,3,11,5,14,166471,9780830628469,English,"Children, Books"
Secret Kingdom: Glitter Beach : Book 6,Rosie Banks,128,Hachette Children's Group,2012-07-05,6.02,1.48,4.41,283,3,7,41,51,181,57869,9781408323694,English,"Children, Books"
Buggin' Out!: An Early Chapter Book,Derek Laufman,80,Disney Book Publishing Inc.,2018-06-05,5.69,0.31,4.05,65,1,1,16,23,24,215530,9781368008570,English,"Children, Books"
Pegasus and the Flame : Book 1,Kate O'Hearn,352,Hachette Children's Group,2011-02-03,9.95,0.05,4.25,12385,204,484,1778,3419,6500,62295,9780340997406,English,"Children, Books"
The Downstairs Girl : the must-read Reese Witherspoon Book Club Pick,Stacey Lee,384,"Little, Brown Book Group",2019-08-13,10.95,0.55,3.99,28024,183,906,5986,12819,8130,15967,9780349423609,English,"Children, Books"
Accomplishments of the Duke's Daughter (Light Novel) Vol. 1,"Reia, Haduki Futaba",320,"Seven Seas Entertainment, LLC",2021-07-06,15.55,0.45,4.23,628,8,13,93,228,286,181209,9781648274213,English,"Children, Books"
The Great Kiwi 123 Book,Donovan Bixley,32,Upstart Press Ltd,2018-09-01,10.88,2.62,4.67,3,0,0,0,1,2,211896,9781988516073,English,"Children, Books"
The Science Fair Is Freaky! a Branches Book (Eerie Elementary #4) : Volume 4,"Jack Chabert, Sam Ricks",96,Scholastic US,2016-06-28,6.57,0.43,4.32,581,5,15,84,160,317,140336,9780545873680,English,"Children, Books"
Thorgal Vol. 14: Giants,"Jean van Hamme, Grzegorz Rosinski",48,Cinebook Ltd,2013-08-07,7.78,1.22,3.81,630,7,37,184,244,158,247440,9781849181563,English,"Children, Books"
"The Complete Children's Liturgy Book : Liturgies of the Word for Years A, B, C",Kate Thompson,352,Twenty-Third Publications,2004-01-16,42.10,2.40,3.88,16,0,2,4,4,6,222470,9780896226951,English,"Children, Books"
"Is It Wrong to Try to Pick Up Girls in a Dungeon? Sword Oratoria, Vol. 6 (light novel)","Fujino Omori, Kiyotaka Haimura",192,Yen on,2018-06-26,13.31,1.69,4.31,192,3,1,27,63,98,15697,9780316442527,English,"Children, Books"
Yoko Tsuno Vol. 6: The Morning Of The World,Roger Leloup,48,Cinebook Ltd,2011-10-16,9.78,0.22,3.87,321,2,15,90,129,85,186379,9781849180825,English,"Children, Books"
Sylvia's Super-Awesome Project Book : Super-Simple Arduino (Volume 2),Sylvia Super-Awesome Todd,46,Constructing Modern Knowledge Press,2014-11-20,18.34,7.86,4.26,19,0,0,4,6,9,207645,9780989151160,English,"Children, Books"
The Saint's Magic Power is Omnipotent (Manga) Vol. 2,Yuka Tachibana,180,"Seven Seas Entertainment, LLC",2021-03-09,11.98,1.52,4.33,367,3,6,48,121,189,163621,9781645059837,English,"Children, Books"
Football School: The Ultimate Puzzle Book : 100 Brilliant Brain-teasers,"Alex Bellos, Ben Lyttleton, Spike Gerrell",144,Walker Books Ltd,2020-05-07,8.14,0.86,5,2,0,0,0,0,2,221957,9781406386646,English,"Children, Books"
My First Book of Christian Values,Carine MacKenzie,64,Christian Focus Publications Ltd,2008-05-20,3.40,2.10,5,1,0,0,0,0,1,13263,9781845502621,English,"Children, Books"
Gal Gohan Vol. 10,Marii Taiyou,160,"Seven Seas Entertainment, LLC",2022-01-25,10.61,3.39,4.54,26,0,0,3,6,17,34008,9781648273797,English,"Children, Books"
Skeleton Knight in Another World (Light Novel) Vol. 1,Ennki Hakari,240,"Seven Seas Entertainment, LLC",2019-06-11,14.21,0.29,4.14,706,15,22,133,212,324,107390,9781642750645,English,"Children, Books"
I Am Never Bored: The Best Ever Craft and Activity Book for Kids : 100 Great Ideas for Kids to Do When There is Nothing to Do,"Ms. Sarah Devos, Ms. Emma Thyssen",144,Quarry Books,2018-05-10,14.73,0.27,4.75,4,0,0,0,1,3,135376,9781631594687,English,"Children, Books"
Pug's Got Talent: A Branches Book (Diary of a Pug #4) : Volume 4,Kyla May,80,Scholastic US,2021-02-02,6.82,0.18,4.32,214,2,3,32,65,112,162024,9781338530124,English,"Children, Books"
Thorgal Vol. 14: Giants,"Jean van Hamme, Grzegorz Rosinski",48,Cinebook Ltd,2013-08-07,7.78,1.22,3.81,630,7,37,184,244,158,247440,9781849181563,English,"Children, Books"
My First Bilingual Book-Feelings (English-Chinese),Milet Publishing,16,Milet Publishing Ltd,2016-01-28,8.40,1.60,4,16,0,0,6,4,6,167024,9781785080715,English,"Children, Books"
Silly Sally Big Book,Wood,32,Cengage Learning EMEA,2007-04-01,26.96,1.04,4.12,9515,140,520,1847,2565,4443,219498,9780152000721,English,"Children, Books"
Mushoku Tensei: Jobless Reincarnation (Manga) Vol. 13,"Rifujin Na Magonote, Fujikawa Yuka",180,"Seven Seas Entertainment, LLC",2021-07-06,11.58,1.92,4.33,104,0,3,14,33,54,34442,9781648272837,English,"Children, Books"
"The Complete Children's Liturgy Book : Liturgies of the Word for Years A, B, C",Kate Thompson,352,Twenty-Third Publications,2004-01-16,42.10,2.40,3.88,16,0,2,4,4,6,222470,9780896226951,English,"Children, Books"
The Elements Of Pop-up : A Pop-Up Book for Aspiring Paper Engineers,David A. Carter,18,Simon & Schuster,2011-03-03,36.84,6.66,4.52,169,1,0,15,47,106,58238,9780689822247,English,"Children, Books"
Are You a Ladybug?,"Judy Allen, Tudor Humphries",31,KINGFISHER,2003-05-16,8.66,0.34,3.99,170,2,9,32,72,55,155113,9780753456033,English,"Children, Books"
All Paws on Deck: A Branches Book (Haggis and Tank Unleashed #1) : Volume 1,"Jessica Young, James Burks",80,Scholastic US,2016-01-05,6.73,0.27,4.11,526,8,13,112,175,218,141226,9780545818865,English,"Children, Books"
The Falcon Chronicles: Tiger Wars : Book 1,Steve Backshall,272,Hachette Children's Group,2014-07-17,8.33,0.67,4,249,5,15,49,86,94,65420,9781444014488,English,"Children, Books"
"Grand Guignol Orchestra, Vol. 5",Kaori Yuki,208,"Viz Media, Subs. of Shogakukan Inc",2012-01-05,10.61,0.39,4.07,253,5,5,54,93,96,199022,9781421539607,English,"Children, Books"
Sleeping Beauty (Disney Animated Classics) : A deluxe gift book of the classic film - collect them all!,Lily Murray,64,Bonnier Books Ltd,2018-12-06,16.15,1.35,4.67,155,0,0,8,35,112,29655,9781787414174,English,"Children, Books"
Secret Kingdom: Fancy Dress Party : Book 17,Rosie Banks,128,Hachette Children's Group,2013-11-12,6.04,1.46,4.41,101,3,4,7,22,65,50337,9781408323427,English,"Children, Books"
My Status as an Assassin Obviously Exceeds the Hero's (Manga) Vol. 1,Matsuri Akai,180,"Seven Seas Entertainment, LLC",2020-03-10,9.86,3.64,4.14,637,12,25,108,206,286,34426,9781645052890,English,"Children, Books"
Goldilocks and the Three Bears,James Marshall,32,Penguin Putnam Inc,1998-01-01,9.06,0.94,4.07,10720,135,541,2479,2859,4706,129269,9780140563665,English,"Children, Books"
"Durarara!!, Vol. 10 (light novel)","Ryohgo Narita, Suzuhito Yasuda",240,Yen on,2018-07-17,12.35,2.65,4.1,168,0,4,41,58,65,208927,9780316474344,English,"Children, Books"
