title,authors,number_of_pages,publisher,publication_date,price_in_euros,discount_in_euros,rating,number_of_votes_goodreads,number_of_votes_one_star,number_of_votes_two_stars,number_of_votes_three_stars,number_of_votes_four_stars,number_of_votes_five_stars,bestsellers_rank,isbn13,language,category
Charlotte's Web : 70th Anniversary Edition,"E. B. White, Garth Williams",272,Penguin Random House Children's UK,2014-07-31,9.64,0.36,4.19,1696754,33241,62186,272152,509483,819692,3306,9780141354828,English,"Children, Books"
The Times Quick Cryptic Crossword Book 1 : 80 World-Famous Crossword Puzzles,"The Times Mind Games, Richard Rogan",192,HarperCollins Publishers,2016-08-01,9.10,0.90,4.38,16,0,0,3,4,9,36322,9780008139810,English,"Children, Books"
Bookscape Board Books : Christmas Cheer,Ingela P. Arrhenius,10,CHRONICLE BOOKS,2020-10-16,8.13,1.87,4,4,0,0,1,2,1,218033,9781452174914,English,"Children, Books"
"Konosuba: God's Blessing on This Wonderful World!, Vol. 9 (light novel)","Natsume Akatsuki, Kurone Mishima",192,"Little, Brown & Company",2019-08-27,12.73,2.27,4.37,465,0,11,52,157,245,32021,9781975385033,English,"Children, Books"
"Yoga Games for Children : Fun and Fitness with Postures, Movements and Breath","Danielle Bersma, Marjoke Visscher",160,"Hunter House Inc.,U.S.",2003-06-12,20.00,2.50,3.75,76,0,6,31,15,24,22759,9780897933896,English,"Children, Books"
Wolf by Wolf: A BBC Radio 2 Book Club Choice : Book 1,Ryan Graudin,320,Hachette Children's Group,2016-05-05,10.70,0.80,4.2,21113,290,601,2713,8401,9108,11116,9781780622033,English,"Children, Books"
The Book of Lost Things Illustrated Edition,John Connolly,496,Hodder & Stoughton,2020-09-21,11.74,0.76,3.95,75166,1712,4316,15292,28189,25657,46229,9781473659148,English,"Children, Books"
"The Worry (Less) Book : Feel Strong, Find Calm and Tame Your Anxiety",Rachel Brian,64,Hachette Children's Group,2020-09-03,9.26,0.74,4.56,243,1,6,14,56,166,39691,9781526362780,English,"Children, Books"
"Pokemon Adventures (Red and Blue), Vol. 7","Hidenori Kusaka, Mato",224,"Viz Media, Subs. of Shogakukan Inc",2013-10-10,9.96,0.04,4.5,2099,14,42,174,523,1346,36582,9781421530604,English,"Children, Books"
"Bleach, Vol. 48",Tite Kubo,216,"Viz Media, Subs. of Shogakukan Inc",2012-10-25,10.39,0.61,4.36,3300,35,82,450,837,1896,13088,9781421543017,English,"Children, Books"
"The Girl From the Other Side: Siuil, a Run Vol. 7",Nagabe,180,"Seven Seas Entertainment, LLC",2019-08-27,9.16,4.34,4.29,2945,4,31,393,1196,1321,6465,9781642751161,English,"Children, Books"
"The Mortal Instruments: The Graphic Novel, Vol. 1","Cassandra Clare, Cassandra Jean",192,"Little, Brown & Company",2017-11-07,12.92,0.58,4.1,7875,248,304,1270,2657,3396,12844,9780316465816,English,"Children, Books"
Famous Five: Five On A Treasure Island : Book 1,Enid Blyton,192,Hachette Children's Group,2012-05-03,7.21,1.59,4.11,30397,388,1023,5929,10645,12412,42420,9781444908657,English,"Children, Books"
"One Piece: Ace's Story, Vol. 1 : Formation of the Spade Pirates","Sho Hinata, Stephen Paul, Eiichiro Oda",144,"Viz Media, Subs. of Shogakukan Inc",2020-06-11,8.78,1.22,4.08,700,10,27,135,250,278,8767,9781974713301,English,"Children, Books"
"Naruto, Vol. 7",Masashi Kishimoto,192,"Viz Media, Subs. of Shogakukan Inc",2007-11-05,9.35,0.65,4.46,14386,80,281,1652,3348,9025,17303,9781591168751,English,"Children, Books"
Quiet Book,"Deborah Underwood, Renata Liwska",32,Houghton Mifflin Harcourt Publishing Company,2010-04-12,14.40,1.60,4.06,5163,63,249,1061,1744,2046,20962,9780547215679,English,"Children, Books"
My World : A Companion to Goodnight Moon,"Margaret Wise Brown, Clement Hurd",36,HarperCollins Publishers Inc,2007-09-19,9.15,1.85,3.45,1055,71,162,313,236,273,13362,9780694008629,English,"Children, Books"
"That Time I Got Reincarnated as a Slime, Vol. 1","Fuse, Mitz Vah",224,"Little, Brown & Company",2017-12-19,14.53,0.47,4.35,2903,54,71,315,814,1649,7431,9780316414203,English,"Children, Books"
Classmates Vol. 1: Dou kyu sei,Asumiko Nakamura,180,"Seven Seas Entertainment, LLC",2019-06-04,9.25,4.25,4.38,4569,36,108,526,1296,2603,3621,9781642750669,English,"Children, Books"
Where's the Unicorn? : A Magical Search and Find Book,"Sophie Schrey, Jonny Marx, Paul Moran",48,Michael O'Mara Books Ltd,2017-10-19,8.91,0.09,4.01,191,12,13,29,45,92,4085,9781782439073,English,"Children, Books"
"Yotsuba&!, Vol. 4",Kiyohiko Azuma,192,"Little, Brown & Company",2009-09-15,12.57,0.43,4.55,4336,7,36,315,1193,2785,17475,9780316073912,English,"Children, Books"
Waldorf Alphabet Book,"William Ward, Famke Zonneveld",64,Anthroposophic Press Inc,2005-06-01,15.26,0.74,4.25,55,2,2,8,11,32,18171,9780880105590,English,"Children, Books"
Do Not Open This Book Again,"Andy Lee, Heath McKenzie",28,Bonnier Books Ltd,2019-02-07,8.84,0.16,3.98,169,5,12,32,53,67,32707,9781787414709,English,"Children, Books"
Moomin Book Three : The Complete Tove Jansson Comic Strip,Tove Jansson,104,Drawn and Quarterly,2008-10-08,22.49,3.01,4.38,1253,4,13,141,446,649,44518,9781897299555,English,"Children, Books"
The 100 : Book One,Kass Morgan,336,Hodder & Stoughton,2013-08-29,9.45,2.05,3.57,67909,2568,7418,21163,22028,14732,50650,9781444766882,English,"Children, Books"
The Jungle Book: A Pop Up Adventure,Reinhart,12,SIMON & SCHUSTER,2006-10-24,41.03,3.97,4.49,101,0,1,11,27,62,44925,9781416918240,English,"Children, Books"
Famous Five: Five Go Off In A Caravan : Book 5,Enid Blyton,224,Hachette Children's Group,1997-03-19,7.76,1.24,4.02,13170,81,510,3195,4665,4719,86108,9780340681107,English,"Children, Books"
Bookscape Board Books: Wild Animals,Ingela P. Arrhenius,10,Chronicle Books,2022-06-09,7.75,1.25,3.75,4,0,0,2,1,1,171645,9781797215570,English,"Children, Books"
Noisy Nora,Rosemary Wells,32,Penguin Putnam Inc,2000-07-01,8.50,0.50,3.91,1456,44,99,349,414,550,63139,9780140567281,English,"Children, Books"
We'll Always Have Summer : Book 3 in the Summer I Turned Pretty Series,Jenny Han,304,Penguin Random House Children's UK,2012-05-03,10.59,0.91,3.91,247708,6257,18738,54675,78894,89144,16187,9780141330563,English,"Children, Books"
"Pokemon Adventures (Red and Blue), Vol. 5","Hidenori Kusaka, Mato",216,"Viz Media, Subs. of Shogakukan Inc",2013-09-12,9.47,1.03,4.39,2559,27,49,314,671,1498,64563,9781421530581,English,"Children, Books"
Darth Vader and Friends,"Jeffrey Brown, Sang An",64,CHRONICLE BOOKS,2015-07-29,13.09,2.41,3.9,1902,22,112,522,621,625,17650,9781452138107,English,"Children, Books"
Are You My Mother?,P.D. Eastman,24,Random House USA Inc,1998-09-08,6.79,0.21,4.2,234386,5535,10334,38344,57685,122488,310,9780679890478,English,"Children, Books"
"Bob Books - Set 1: Beginning Readers Box Set Phonics, Ages 4 and Up, Kindergarten (Stage 1: Starting to Read)","John R Maslen, Bobby Lynn Maslen",12,Scholastic US,2006-05-01,18.62,0.38,4.41,1589,38,54,155,307,1035,15735,9780439845007,English,"Children, Books"
Ultimate Sticker Book: Frozen : More Than 60 Reusable Full-Color Stickers,Dk,16,DK,2013-10-01,7.94,0.06,4.1,177,17,6,20,33,101,844,9781465414052,English,"Children, Books"
Bookscape Board Books: Wild Animals,Ingela P. Arrhenius,10,Chronicle Books,2022-06-09,7.75,1.25,3.75,4,0,0,2,1,1,171645,9781797215570,English,"Children, Books"
The Dinosaur's Diary,Julia Donaldson,112,Penguin Random House Children's UK,2002-03-28,8.10,1.90,4.04,216,7,10,45,59,95,982,9780141313825,English,"Children, Books"
Where's Wally? The Wonder Book,Martin Handford,32,Walker Books Ltd,2011-07-04,7.09,0.41,4.21,1326,18,50,240,346,672,13012,9781406313239,English,"Children, Books"
Rainbow Fish Board Book,Marcus Pfister,14,North-South Books (Nord-Sud Verlag AG),2005-09-15,9.50,1.50,4.2,141734,3402,6867,23187,33146,75132,5962,9781558585362,English,"Children, Books"
"Is It Wrong to Try to Pick Up Girls in a Dungeon?, Vol. 4 (light novel)","Fujino Omori, Suzuhito Yasuda",240,"Little, Brown & Company",2015-12-15,13.08,1.92,4.34,1354,10,18,174,446,706,21461,9780316340168,English,"Children, Books"
"Splatoon, Vol. 3",Sankichi Hinodeya,160,"Viz Media, Subs. of Shogakukan Inc",2018-07-12,9.20,1.80,4.34,335,3,10,54,70,198,45060,9781421598574,English,"Children, Books"
In Too Deep: Vol. 6,Jude Watson,208,Scholastic US,2010-09-22,14.98,0.02,4.03,43740,881,2008,9716,13281,17854,37986,9780545060462,English,"Children, Books"
Old Possum's Book of Practical Cats,"T. S. Eliot, Edward Gorey",64,Ecco Press,1982-08-30,15.18,1.82,4.07,26284,431,1177,5058,9016,10602,32042,9780151686568,English,"Children, Books"
The Ha Ha Bonk Book,Janet Ahlberg,96,Penguin Random House Children's UK,1999-06-01,7.17,1.83,4.27,179,2,5,31,45,96,36162,9780140314120,English,"Children, Books"
The Tomorrow Series: The Dead of the Night : Book 2,John Marsden,288,Hachette Children's Group,2012-01-05,8.48,1.52,4.12,22395,149,568,3998,9498,8182,50533,9780857388735,English,"Children, Books"
"Indestructibles: Baby, See the Colors! : Chew Proof * Rip Proof * Nontoxic * 100% Washable (Book for Babies, Newborn Books, Safe to Chew)","Amy Pixton, Ekaterina Trukhan",12,Workman Publishing,2019-09-03,4.40,0.55,4.48,31,0,0,2,12,17,38779,9781523506231,English,"Children, Books"
Mushoku Tensei: Jobless Reincarnation (Light Novel) Vol. 5,Rifujin Na Magonote,320,"Seven Seas Entertainment, LLC",2020-04-14,14.34,0.66,4.41,1527,9,25,166,465,862,3019,9781645052289,English,"Children, Books"
Our Dreams at Dusk: Shimanami Tasogare Vol. 3,Yuhki Kamatani,180,"Seven Seas Entertainment, LLC",2019-10-01,10.31,3.69,4.42,3592,6,45,346,1241,1954,34556,9781642750621,English,"Children, Books"
The Secret Seven Collection 5 : Books 13-15,Enid Blyton,432,Hachette Children's Group,2017-08-10,10.96,1.54,4.57,131,3,0,15,14,99,43419,9781444952490,English,"Children, Books"
A Chair for My Mother,Vera B Williams,32,HarperCollins Publishers Inc,2007-01-23,9.42,0.58,4.21,25713,566,1032,3888,7096,13131,20025,9780688040741,English,"Children, Books"
"Konosuba: God's Blessing on This Wonderful World!, Vol. 7 (Light Novel)","Natsume Akatsuki, Kurone Mishima",224,"Little, Brown & Company",2018-12-11,13.20,1.80,4.34,589,4,8,70,211,296,24064,9780316468824,English,"Children, Books"
The Penguin Guide to Punctuation,R L Trask,176,Penguin Books Ltd,1999-06-01,10.32,2.84,4.27,255,3,7,30,94,121,62691,9780140513660,English,"Children, Books"
On the Go Mazes,Becky Radtke,64,Dover Publications Inc.,2005-04-27,3.48,0.02,4.4,10,0,1,1,1,7,56301,9780486441030,English,"Children, Books"
Easy Carpentry Projects for Children,Jerome E. Leavitt,96,Dover Publications Inc.,2000-01-02,6.41,0.59,3.67,66,4,7,14,23,18,52786,9780486250571,English,"Children, Books"
Last Night at the Telegraph Club : A NATIONAL BOOK AWARD WINNER AND NEW YORK TIMES BESTSELLER,Malinda Lo,416,Hodder & Stoughton,2021-03-18,10.88,0.62,4.26,51665,187,1002,6805,20957,22714,1984,9781529366587,English,"Children, Books"
"My Youth Romantic Comedy Is Wrong, As I Expected, Vol. 2 (light novel)","Wataru Watari, Ponkan 8",208,"Little, Brown & Company",2017-05-23,13.63,1.37,4.18,913,6,22,152,351,382,62000,9780316396011,English,"Children, Books"
Behaviour Matters: Monkey Needs to Listen - A book about paying attention,"Sue Graves, Trevor Dunton",32,Hachette Children's Group,2016-01-14,7.47,1.53,3.83,48,0,5,11,19,13,43570,9781445147178,English,"Children, Books"
"Bleach, Vol. 56",Tite Kubo,192,"Viz Media, Subs. of Shogakukan Inc",2013-04-25,10.08,0.92,4.15,2527,30,119,462,743,1173,39319,9781421554761,English,"Children, Books"
The Jungle Book: A Pop Up Adventure,Reinhart,12,SIMON & SCHUSTER,2006-10-24,41.03,3.97,4.49,101,0,1,11,27,62,44925,9781416918240,English,"Children, Books"
?Eres tu mi mama? (Are You My Mother? Spanish Edition),P.D. Eastman,24,Random House USA Inc,2001-09-25,6.48,0.52,4.2,234386,5535,10334,38344,57685,122488,17237,9780375815058,Spanish,"Children, Books"
Ready Player One : A Novel,Ernest Cline,384,Random House USA Inc,2012-06-05,15.84,3.66,4.24,1065195,20533,41035,135691,336871,531065,25077,9780307887443,English,"Children, Books"
?Eres tu mi mama? (Are You My Mother? Spanish Edition),P.D. Eastman,24,Random House USA Inc,2001-09-25,6.48,0.52,4.2,234386,5535,10334,38344,57685,122488,17237,9780375815058,Spanish,"Children, Books"
Humphrey Box Set (3 Books),Betty G. Birney,512,Penguin Putnam Inc,2011-11-10,18.68,2.82,4.27,98,3,3,15,21,56,179012,9780142419380,English,"Children, Books"
The Alphabet Tree,Leo Lionni,32,Alfred A. Knopf,1990-10-24,7.69,2.31,3.86,682,9,37,202,227,207,24820,9780679808350,English,"Children, Books"
I Am Love: A Book of Compassion,"Susan Verde, Peter H. Reynolds",32,ABRAMS,2019-09-17,14.07,1.93,4.41,864,1,13,102,264,484,44162,9781419737268,English,"Children, Books"
The Second Baby Book : How to cope with pregnancy number two and create a happy home for your firstborn and new arrival,Sarah Ockwell-Smith,304,"Little, Brown Book Group",2021-01-05,15.53,3.47,3.89,777,5,46,182,340,204,57840,9780349420042,English,"Children, Books"
"Splatoon, Vol. 3",Sankichi Hinodeya,160,"Viz Media, Subs. of Shogakukan Inc",2018-07-12,9.20,1.80,4.34,335,3,10,54,70,198,45060,9781421598574,English,"Children, Books"
CHERUB: The Fall : Book 7,Robert Muchamore,352,Hachette Children's Group,2007-03-15,8.95,1.05,4.22,14683,86,446,2390,4977,6784,61548,9780340911709,English,"Children, Books"
Roar of the Thunder Dragon: A Branches Book (Dragon Masters #8) : Volume 8,"Tracey West, Damien Jones",96,Scholastic US,2017-09-12,6.82,0.18,4.42,1534,19,26,174,387,928,48598,9781338042924,English,"Children, Books"
Using Picture Books to Teach Writing with the Traits: K-2 : An Annotated Bibliography of More Than 150 Mentor Texts with Teacher-Tested Lessons,"Ruth Culham, Raymond Coutu",112,Scholastic US,2008-05-01,16.89,3.11,4.38,32,0,0,5,10,17,52482,9780545025119,English,"Children, Books"
"Overlord, Vol. 7 (light novel)","Kugane Maruyama, so-bin",256,"Little, Brown & Company",2018-05-22,19.18,0.32,4.41,1732,9,31,192,516,984,4436,9780316398817,English,"Children, Books"
CHERUB: Divine Madness : Book 5,Robert Muchamore,384,Hachette Children's Group,2006-04-06,9.34,0.66,4.22,16058,104,511,2598,5451,7394,15621,9780340894347,English,"Children, Books"
Pat the Bunny: Touch n Feel,Dorothy Kunhardt,20,"Golden Books Publishing Company, Inc.",2001-05-01,9.33,1.67,4.07,24400,648,1534,4988,5565,11665,85762,9780307120007,English,"Children, Books"
Diary of a Wimpy Kid: Big Shot (Book 16),Jeff Kinney,224,Penguin Random House Children's UK,2021-10-26,14.99,1.01,4.23,8379,138,312,1371,2186,4372,52708,9780241396650,English,"Children, Books"
"Naruto: Itachi's Story, Vol. 2 : Midnight","Takashi Yano, Jocelyne Allen, Masashi Kishimoto",208,"Viz Media, Subs. of Shogakukan Inc",2016-12-15,9.77,0.23,4.57,1352,10,18,101,283,940,2732,9781421591315,English,"Children, Books"
Harry Potter Wizard's Wand with Sticker Book : Lights Up!,Running Press,16,Running Press,2016-09-19,7.64,2.35,4,4,0,1,0,1,2,10083,9780762459377,English,"Children, Books"
The Berenstain Bears and the Truth,"Stan Berenstain, Jan Berenstain",32,Random House USA Inc,1983-11-01,5.98,0.02,4.12,7906,138,333,1665,2092,3678,15388,9780394856407,English,"Children, Books"
The Big Big Big Book of Tashi,"Anna Fienberg, Barbara Fienberg, Kim Gamble",444,ALLEN & UNWIN,2002-05-01,14.73,4.77,4.15,608,11,26,98,199,274,8304,9781865085630,English,"Children, Books"
"The Girl From the Other Side: Siuil, A Run Vol. 1",Nagabe,180,"Seven Seas Entertainment, LLC",2017-01-24,9.16,4.34,4.2,17897,319,449,2447,6859,7823,6008,9781626924673,English,"Children, Books"
"Haikyu!!, Vol. 10",Haruichi Furudate,192,"Viz Media, Subs. of Shogakukan Inc",2017-04-20,9.41,1.59,4.66,3663,22,12,157,794,2678,4579,9781421591001,English,"Children, Books"
"Good Night, Gorilla",Peggy Rathmann,40,"Putnam Publishing Group,U.S.",2011-07-26,7.60,1.40,4.22,48632,762,1914,8002,12980,24974,55262,9780698116498,English,"Children, Books"
Little Giraffe: Finger Puppet Book,Image Books,12,Chronicle Books,2009-03-26,8.32,0.18,4.03,73,1,1,20,24,27,49887,9780811867870,English,"Children, Books"
Harry Potter Talking Sorting Hat and Sticker Book : Which House Are You?,Running Press,16,Running Press,2017-05-25,7.48,6.02,4.3,10,0,0,2,3,5,14343,9780762461769,English,"Children, Books"
"Is It Wrong to Try to Pick Up Girls in a Dungeon?, Vol. 5 (light novel)","Fujino Omori, Suzuhito Yasuda",288,"Little, Brown & Company",2016-04-19,14.48,0.52,4.47,1214,6,17,109,353,729,23863,9780316314794,English,"Children, Books"
Luna Coloring Book,Maria Trolle,88,Gibbs M. Smith Inc,2021-04-20,16.59,0.91,4.09,11,0,2,1,2,6,43382,9781423657415,English,"Children, Books"
"Laid-Back Camp, Vol. 1",Afro,176,"Little, Brown & Company",2018-03-27,12.08,1.92,4.18,1310,7,42,225,470,566,60794,9780316517782,English,"Children, Books"
The Whipping Boy Trade Book,"Sid Fleischman, Peter Sis",96,HarperCollins Publishers Inc,2003-04-15,7.61,1.39,3.59,26637,932,2659,8713,8468,5865,38323,9780060521226,English,"Children, Books"
2023 Guide to the Night Sky : A Month-by-Month Guide to Exploring the Skies Above Britain and Ireland,"Storm Dunlop, Wil Tirion, Royal Observatory Greenwich, Collins Astronomy, Collins Books",112,HarperCollins Publishers,2023-01-01,8.92,0.08,4.67,3,0,0,0,1,2,8179,9780008393540,English,"Children, Books"
Eric Carle Animal Babies Sound Book,Eric Carle,24,"Phoenix International Publications, Incorporated",2013-12-01,16.84,0.16,4.24,38,1,1,6,10,20,29217,9781450867740,English,"Children, Books"
Where the Red Fern Grows,Wilson Rawls,272,Random House USA Inc,1999-09-01,8.71,1.29,4.1,382057,8420,18854,66791,120288,167704,7115,9780553274295,English,"Children, Books"
Power of the Fire Dragon: A Branches Book (Dragon Masters #4) : Volume 4,"Tracey West, Graham Howells",96,Scholastic US,2015-07-28,6.73,0.27,4.44,2145,18,30,235,562,1300,55202,9780545646314,English,"Children, Books"
I Am Yoga,"Susan Verde, Peter H. Reynolds",32,Abrams,2015-09-08,14.22,1.78,4.32,1793,30,37,222,549,955,18661,9781419716645,English,"Children, Books"
"Naruto, Vol. 56",Masashi Kishimoto,192,"Viz Media, Subs. of Shogakukan Inc",2012-05-10,9.32,1.68,4.33,4614,36,143,675,1182,2578,38806,9781421542072,English,"Children, Books"
Mushoku Tensei: Jobless Reincarnation (Light Novel) Vol. 4,Rifujin Na Magonote,320,"Seven Seas Entertainment, LLC",2020-01-07,14.03,0.47,4.3,1631,16,30,217,561,807,10975,9781645051794,English,"Children, Books"
"Goblin Slayer, Vol. 3 (light novel)","Kumo Kagyu, Noboru Kannatuki",208,"Little, Brown & Company",2017-08-22,13.36,1.64,4.22,724,2,19,112,277,314,58518,9780316553230,English,"Children, Books"
"Dragon Ball Z, Vol. 3",Akira Toriyama,192,"Viz Media, Subs. of Shogakukan Inc",2008-10-06,10.48,0.52,4.41,2398,14,42,290,661,1391,8164,9781569319321,English,"Children, Books"
"re:Zero Starting Life in Another World, Vol. 7 (light novel)","Tappei Nagatsuki, Shinichirou Otsuka",192,"Little, Brown & Company",2018-06-26,12.93,2.07,4.39,460,1,9,49,150,251,16582,9780316398497,English,"Children, Books"
100 Cupboards (100 Cupboards Book 1),N. D. Wilson,320,Random House USA Inc,2014-10-10,9.18,0.82,3.79,17231,378,1296,4536,6373,4648,22850,9780375838828,English,"Children, Books"
"Is It Wrong to Try to Pick Up Girls in a Dungeon?, Vol. 5 (light novel)","Fujino Omori, Suzuhito Yasuda",288,"Little, Brown & Company",2016-04-19,14.48,0.52,4.47,1214,6,17,109,353,729,23863,9780316314794,English,"Children, Books"
I Touch,Helen Oxenbury,10,"Candlewick Press,U.S.",1995-04-03,5.79,0.21,3.33,116,9,11,47,31,18,52289,9781564025500,English,"Children, Books"
"My Youth Romantic Comedy Is Wrong, As I Expected, Vol. 2 (light novel)","Wataru Watari, Ponkan 8",208,"Little, Brown & Company",2017-05-23,13.63,1.37,4.18,913,6,22,152,351,382,62000,9780316396011,English,"Children, Books"
Henderson's Boys: The Escape : Book 1,Robert Muchamore,320,Hachette Children's Group,2009-02-05,8.86,1.14,4.11,5745,89,241,1025,1995,2395,59754,9780340956489,English,"Children, Books"
My Mouth Is a Volcano Activity and Idea Book,"Julia Cook, Carrie Hartman",24,National Center for Youth Issues,2009-12-01,9.82,2.18,4.45,62,0,3,7,11,41,9010,9781931636919,English,"Children, Books"
"Naruto, Vol. 36",Masashi Kishimoto,192,"Viz Media, Subs. of Shogakukan Inc",2009-03-02,9.52,1.48,4.38,5536,22,107,756,1485,3166,40338,9781421521725,English,"Children, Books"
The Jungle Book,Rudyard Kipling,256,Wordsworth Editions Ltd,2018-09-07,10.93,3.07,3.91,116404,1808,6730,29788,39720,38358,28284,9781840227833,English,"Children, Books"
Magic Tree House Books 1-4 Boxed Set,Mary Pope Osborne,80,Random House USA Inc,2018-07-25,20.66,3.84,4.17,3979,128,182,638,977,2054,2450,9780375813658,English,"Children, Books"
Behaviour Matters: Tiger Has a Tantrum - A book about feeling angry,"Sue Graves, Trevor Dunton",32,Hachette Children's Group,2016-01-14,7.44,1.56,3.98,48,1,3,7,22,15,25474,9781445147185,English,"Children, Books"
Monster Musume Vol. 7,Okayado,192,"Seven Seas Entertainment, LLC",2015-08-19,11.51,2.49,4.21,398,4,8,79,117,190,41622,9781626921603,English,"Children, Books"
The Berenstain Bears and the Bad Dream,"Stan Berenstain, Jan Berenstain",32,Random House USA Inc,1988-06-01,5.98,0.02,4.04,2597,32,110,671,705,1079,60275,9780394873411,English,"Children, Books"
"Bleach, Vol. 56",Tite Kubo,192,"Viz Media, Subs. of Shogakukan Inc",2013-04-25,10.08,0.92,4.15,2527,30,119,462,743,1173,39319,9781421554761,English,"Children, Books"
Colour Me: Who's in the Water?: Volume 4 : Watch Me Change Colour In Water,Surya Sajnani,8,QED Publishing,2018-05-17,10.06,3.94,4.18,17,1,0,3,4,9,15761,9781784930967,English,"Children, Books"
Moomin Book Three : The Complete Tove Jansson Comic Strip,Tove Jansson,104,Drawn and Quarterly,2008-10-08,22.49,3.01,4.38,1253,4,13,141,446,649,44518,9781897299555,English,"Children, Books"
The Secret Seven Collection 2 : Books 4-6,Enid Blyton,480,Hachette Children's Group,2019-04-04,9.98,2.52,4.78,153,0,0,6,22,125,42354,9781444952469,English,"Children, Books"
"Locke & Key, Vol. 5: Clockworks","Joe Hill, Gabriel Rodriguez",160,Idea & Design Works,2013-07-23,18.59,3.91,4.47,32200,234,469,2421,9986,19090,40253,9781613776995,English,"Children, Books"
"Spice and Wolf, Vol. 18 (light novel) : Spring Log","Isuna Hasekura, Keito Koume",240,"Little, Brown & Company",2017-06-20,13.96,1.04,4.4,261,1,6,26,83,145,32784,9780316471671,English,"Children, Books"
Beast Quest: Sepron the Sea Serpent : Series 1 Book 2,Adam Blade,144,Hachette Children's Group,2015-06-04,6.11,1.39,4.05,2259,52,167,464,518,1058,9400,9781846164828,English,"Children, Books"
"Bungo Stray Dogs, Vol. 13","Kafka Asagiri, Sango Harukawa",192,"Little, Brown & Company",2019-12-24,11.45,2.05,4.6,1424,2,10,80,378,954,5037,9781975304553,English,"Children, Books"
Hug Me Little Bear: Finger Puppet Book,Chronicle Books,10,Chronicle Books,2019-02-19,9.91,1.09,4.06,18,0,1,3,8,6,22152,9781452175218,English,"Children, Books"
The Huge Bag of Worries Board Book,"Virginia Ironside, Frank Rodgers",28,Hachette Children's Group,2018-09-20,8.80,0.20,4.41,17,0,2,0,4,11,42362,9781444944204,English,"Children, Books"
The Land of Stories: The Ultimate Book Hugger's Guide,Chris Colfer,256,Hachette Children's Group,2018-11-15,15.66,0.34,4.46,1985,10,43,198,506,1228,33404,9781510201958,English,"Children, Books"
"re:Zero Ex, Vol. 1",Tappei Nagatsuki,224,"Little, Brown & Company",2017-11-21,14.30,0.70,4.36,151,1,4,21,39,86,44868,9780316412902,English,"Children, Books"
Waking the Rainbow Dragon: A Branches Book (Dragon Masters #10) : Volume 10,"Tracey West, Damien Jones",96,Scholastic US,2018-06-26,6.99,0.01,4.46,1337,8,25,135,339,830,48530,9781338169898,English,"Children, Books"
"Heroes of Olympus, The, Book Four the House of Hades (Heroes of Olympus, The, Book Four)",Rick Riordan,608,Disney-Hyperion,2013-10-08,20.26,0.74,4.56,356321,1763,3888,24211,91038,235421,12867,9781423146728,English,"Children, Books"
"Yotsuba&!, Vol. 14",Kiyohiko Azuma,224,"Little, Brown & Company",2018-11-13,11.56,1.94,4.66,1135,1,2,46,281,805,38981,9781975328184,English,"Children, Books"
The Berenstain Bears Forget Their Manners,"Stan Berenstain, Jan Berenstain",32,Random House USA Inc,1985-08-17,6.33,0.67,4.18,14228,188,562,2800,3665,7013,4817,9780394873336,English,"Children, Books"
"This Book Is Anti-Racist: Volume 1 : 20 lessons on how to wake up, take action, and do the work","Tiffany Jewell, Aurelia Durand",160,Frances Lincoln Publishers Ltd,2020-07-13,10.82,0.68,4.44,6319,62,87,479,2092,3599,28967,9780711245204,English,"Children, Books"
"Hand, Hand, Fingers, Thumb","Al Perkins, Eric Gurney",24,Random House USA Inc,2005-09-01,6.99,0.01,4.24,29614,523,1295,4896,6850,16050,4904,9780679890485,English,"Children, Books"
Moana Little Sound Book,PI Kids,12,"Phoenix International Publications, Incorporated",2016-11-22,11.54,3.46,3.9,39,3,4,6,7,19,29889,9781503711068,English,"Children, Books"
"Laid-Back Camp, Vol. 1",Afro,176,"Little, Brown & Company",2018-03-27,12.08,1.92,4.18,1310,7,42,225,470,566,60794,9780316517782,English,"Children, Books"
The Little Red Caboose,"Marian Potter, Tibor Gergely",24,Random House USA Inc,2003-03-01,6.32,0.68,4.24,18483,196,652,3440,4364,9831,7632,9780307021526,English,"Children, Books"
Christmas in Noisy Village,"Astrid Lindgren, Florence Lamborn, Ilon Wikland",32,Penguin Putnam Inc,1981-10-29,8.10,0.90,4.21,1243,9,44,196,424,570,7116,9780140503449,English,"Children, Books"
"The Legend of Zelda, Vol. 1",Akira Himekawa,200,"Viz Media, Subs. of Shogakukan Inc",2013-10-24,10.01,0.49,4.26,4648,52,137,726,1384,2349,31614,9781421523279,English,"Children, Books"
"Haikyu!!, Vol. 27",Haruichi Furudate,192,"Viz Media, Subs. of Shogakukan Inc",2018-09-20,9.28,1.22,4.56,2085,20,10,113,575,1367,33554,9781974700417,English,"Children, Books"
The Three Bears,"Golden Books, Feodor Rojankovsky",24,Random House USA Inc,2012-08-07,6.32,0.68,4.33,684,4,16,112,169,383,16026,9780307021403,English,"Children, Books"
