title,authors,number_of_pages,publisher,publication_date,price_in_euros,discount_in_euros,rating,number_of_votes_goodreads,number_of_votes_one_star,number_of_votes_two_stars,number_of_votes_three_stars,number_of_votes_four_stars,number_of_votes_five_stars,bestsellers_rank,isbn13,language,category
Conference Interpreting : A Student's Practice Book,Andrew Gillies,296,Taylor & Francis Ltd,2013-07-03,43.83,12.67,4.65,20,0,0,1,5,14,202493,9780415532365,English,"Dictionaries, Languages"
Your First 100 Words in Arabic (Book Only),Jane Wightwick,64,McGraw-Hill Education - Europe,1999-09-16,18.53,1.47,3.6,53,4,7,10,17,15,520774,9780844223957,English,"Dictionaries, Languages"
Shadow Of The Colossus : Boss Fight Books #10,Nick Suttner,192,Boss Fight LLC,2015-12-15,12.96,3.04,3.72,275,4,12,87,125,47,570755,9781940535104,English,"Dictionaries, Languages"
The Best Dogs Come From... (Dual Language English-Francais) : A Global Search to Find the Perfect Dog Breed,Dialog Abroad Books,34,Dialog Abroad Books,2020-01-02,7.91,6.09,5,1,0,0,0,0,1,801722,9783948706036,English,"Dictionaries, Languages"
"Illustrated History of Britain, An Paper",David McDowall,192,Pearson Education Limited,1989-02-27,42.30,2.63,3.64,304,3,27,104,111,59,383720,9780582749146,English,"Dictionaries, Languages"
Final Fantasy V : Boss Fight Books #18,Chris Kohler,176,Boss Fight LLC,2017-10-26,12.55,3.45,4.19,286,0,3,42,139,102,647488,9781940535180,English,"Dictionaries, Languages"
The Book of Beginnings,"Francois Jullien, Jody Gladding",152,Yale University Press,2017-01-13,15.73,0.77,4.12,16,0,0,4,6,6,583246,9780300223569,English,"Dictionaries, Languages"
The Granta Book Of Reportage,Ian Jack,448,Granta Books,2007-09-28,15.32,2.68,4.1,59,0,3,8,28,20,606739,9781862078154,English,"Dictionaries, Languages"
Once Upon a Reader : Raising Your Children With a Love of Books,Lorraine Levis,200,Columba Books,2020-10-21,23.62,0.38,3.89,18,0,2,3,8,5,591415,9781782189206,English,"Dictionaries, Languages"
Conference Interpreting : A Student's Practice Book,Andrew Gillies,296,Taylor & Francis Ltd,2013-07-03,43.83,12.67,4.65,20,0,0,1,5,14,202493,9780415532365,English,"Dictionaries, Languages"
The Reader in the Book : A Study of Spaces and Traces,Stephen Orgel,186,Oxford University Press,2015-12-29,45.11,9.39,3.4,5,0,1,1,3,0,622341,9780198737568,English,"Dictionaries, Languages"
Oxford Discover: 3: Student Book,Lesley Koustaff,192,Oxford University Press,2013-12-05,50.16,9.84,4,1,0,0,0,1,0,570201,9780194278713,English,"Dictionaries, Languages"
"Learn Japanese Book for Beginners : Learn Practical & Conversational Japanese, Hiragana & Katakana","Yuto Kanazawa, Jpinsiders",134,Jpinsiders,2020-08-01,16.60,3.70,4.25,4,0,0,0,3,1,523407,9781735412542,English,"Dictionaries, Languages"
The American Sign Language Phrase Book,"Barbara Bernstein Fant, Betty Miller, Lou Fant",400,McGraw-Hill Education - Europe,2008-09-17,19.74,10.26,4.07,282,5,15,53,91,118,568930,9780071497138,English,"Dictionaries, Languages"
Japanese Graded Readers Level 0 vol 1+CD-Audio,日本語多読研究会,120,ASK Publishing,2016-09-13,29.96,9.04,4.26,70,0,2,8,30,30,27293,9784872177114,Japanese,"Dictionaries, Languages"
Goodfellas,"Martin Scorsese, Nicholas Pileggi",160,Faber & Faber,1990-12-01,10.13,3.87,4.35,1007,14,21,125,282,565,84316,9780571162659,English,"Dictionaries, Languages"
The Book of Feckin' Irish Slang that's great craic for cute hoors and bowsies,"Colin Murphy, Donal O'Dea",64,O'Brien Press Ltd,2020-04-15,9.47,4.03,3.71,45,0,5,14,15,11,316166,9781788491709,English,"Dictionaries, Languages"
The Everything Essential Russian Book : All You Need to Learn Russian in No Time,Julia Stakhnevich,288,Adams Media Corporation,2014-09-11,13.67,0.33,3.89,9,0,0,2,6,1,477303,9781440580826,English,"Dictionaries, Languages"
Gateway B1 Student's Book,"Spencer, David",160,MACMILLAN,2011-01-11,39.23,0.37,2,6,2,3,0,1,0,481696,9780230417601,Spanish,"Dictionaries, Languages"
Rick Steves Portuguese Phrase Book and Dictionary (Third Edition),Rick Steves,280,Avalon Travel Publishing,2019-10-17,8.16,2.84,4.5,4,0,0,0,2,2,496280,9781641711975,English,"Dictionaries, Languages"
English in Mind Level 2 Teacher's Resource Book,"Brian Hart, Mario Rinvolucri, Herbert Puchta, Jeff Stranks",176,Cambridge University Press,2010-05-17,44.80,0.71,3.4,5,2,0,0,0,3,571805,9780521170369,English,"Dictionaries, Languages"
British Sign Language: Teach Yourself : Book,Paul Redfern,192,John Murray Press,2010-10-29,24.91,8.59,4,30,0,2,5,14,9,288815,9780340991329,English,"Dictionaries, Languages"
Contatti 1 Italian Beginner's Course 3rd Edition : Activity Book,"Mariolina Freeth, Giuliana Checketts",160,John Murray Press,2011-08-29,16.84,2.16,5,4,0,0,0,0,4,42864,9781444139365,English,"Dictionaries, Languages"
Prepare! Student's Book Level 5 : student's Book,"Capel, Annette, Joseph, Niki",167,Cambridge University Press,2015-07-31,28.69,3.98,2,1,0,1,0,0,0,284201,9781107482340,Spanish,"Dictionaries, Languages"
Selected Folktales/Ausgewahlte Marchen : A Dual-Language Book,Jacob Grimm,256,Dover Publications Inc.,2003-03-28,12.33,1.67,4.17,102,0,2,20,39,41,91795,9780486424743,English,"Dictionaries, Languages"
"Hegel's Philosophy of Nature : Encyclopedia of the Philosophical Sciences (1830), Part II",A. V. Miller,484,Oxford University Press,2004-12-23,54.17,32.23,3.59,61,3,5,24,11,18,393300,9780199272679,English,"Dictionaries, Languages"
A2 Key for Schools 1 for the Revised 2020 Exam Student's Book with Answers with Audio with Resource Bank,Cambridge University Press,128,Cambridge University Press,2019-08-15,36.14,2.79,5,4,0,0,0,0,4,181985,9781108676595,English,"Dictionaries, Languages"
The New Yorker Book of Literary Cartoons,Bob Mankoff,112,Simon & Schuster,2002-11-18,14.43,1.47,3.74,232,2,15,71,98,46,390403,9780671035587,English,"Dictionaries, Languages"
"Spelling Words for Year 6 : 2,000 Words Every Child Should Know (KS2 English Ages 10-11)",Stp Books,40,Swot Tots Publishing Ltd,2020-07-09,9.95,0.05,5,1,0,0,0,0,1,1143282,9781912956197,English,"Dictionaries, Languages"
Lughatuna Al-Fusha: Book 4 : A New Course in Modern Standard Arabic,Samia Louis,264,The American University in Cairo Press,2013-08-30,38.59,6.41,5,1,0,0,0,0,1,629442,9789774165832,Arabic,"Dictionaries, Languages"
Ecce Romani Book 2 2nd Edition Rome At Last,"Scottish Classics, Group",88,Pearson Schools,1990-03-29,20.95,0.05,3.66,35,1,7,7,8,12,382141,9780050034668,English,"Dictionaries, Languages"
"The Book Lovers' Anthology : A Compendium of Writing about Books, Readers and Libraries",Bodleian Library the,352,Bodleian Library,2015-07-08,28.76,6.74,3.55,49,2,7,14,14,12,556369,9781851244188,English,"Dictionaries, Languages"
The Book of Enoch,"Enoch, Richard Laurence",116,A & D Publishing,2008-05-30,15.36,0.34,4,3923,101,251,810,1136,1625,727967,9781604593730,English,"Dictionaries, Languages"
Improve Your English: English in Everyday Life (DVD w/ Book),"Stephen Brown, Ceil Lucas",144,McGraw-Hill Education - Europe,2008-11-16,13.69,8.31,3.25,8,0,3,1,3,1,490260,9780071497176,English,"Dictionaries, Languages"
"The Times Great Quotations : Famous Quotes to Inform, Motivate and Inspire","James Owen, Times Books",352,HarperCollins Publishers,2021-03-01,9.98,0.52,3.71,7,1,0,0,5,1,515735,9780008409333,English,"Dictionaries, Languages"
Speakout Intermediate Students' Book with DVD/Active book and MyLab Pack,"J. Wilson, Antonia Clare",175,Pearson Education Limited,2012-02-16,48.06,34.54,3.65,23,4,0,5,5,9,655759,9781408276075,English,"Dictionaries, Languages"
Mindset for IELTS Foundation Student's Book with Testbank and Online Modules,"Greg Archer, Joanna Kosta, Lucy Pasmore, Jishan Uddin",136,Cambridge University Press,2017-12-14,58.11,2.42,5,1,0,0,0,0,1,640338,9781316636688,English,"Dictionaries, Languages"
The ESL/ELL Teacher's Book of Lists 2e,JE Kress,384,John Wiley & Sons Inc,2008-11-11,41.19,0.01,3.77,31,0,4,8,10,9,500103,9780470222676,English,"Dictionaries, Languages"
Get Started in Cantonese Absolute Beginner Course : (Book and audio support),Jacqueline Lam,192,John Murray Press,2014-03-25,20.66,12.34,4,1,0,0,0,1,0,211118,9781444174991,English,"Dictionaries, Languages"
Pericles : A Sourcebook and Reader,Stephen V. Tracy,248,University of California Press,2009-05-11,31.14,4.86,4.5,4,0,0,1,0,3,470949,9780520256040,English,"Dictionaries, Languages"
Blueprint for a Book,Jennie Nash,142,Tree Farm Books,2021-09-01,10.94,2.16,4.57,134,0,0,6,46,82,644374,9781733251129,English,"Dictionaries, Languages"
"Dear Ally, How Do I Write a Book?",Ally Carter,336,Hachette Children's Group,2019-04-04,8.24,0.76,4.43,541,2,8,60,158,313,502934,9781408354872,English,"Dictionaries, Languages"
Successful Writing: Intermediate Teacher's Book,"Virginia Evans, Elizabeth Gray",72,Express Publishing UK Ltd,2000-01-01,15.55,0.29,3.5,4,1,0,1,0,2,446087,9781903128510,English,"Dictionaries, Languages"
New Inside Out Pre-Intermediate Level Student Book Pack New Edition,Vaughan Jones,128,Macmillan Education,2008-01-31,39.22,26.98,3.98,126,8,11,17,30,60,269643,9781405099547,English,"Dictionaries, Languages"
The Everything Essential Russian Book : All You Need to Learn Russian in No Time,Julia Stakhnevich,288,Adams Media Corporation,2014-09-11,13.67,0.33,3.89,9,0,0,2,6,1,477303,9781440580826,English,"Dictionaries, Languages"
Gateway B1 Student's Book,"Spencer, David",160,MACMILLAN,2011-01-11,39.23,0.37,2,6,2,3,0,1,0,481696,9780230417601,Spanish,"Dictionaries, Languages"
"Sleep Tight, Little Wolf - Schlaf gut, kleiner Wolf (English - German) : Bilingual children's picture book with audiobook for download","Ulrich Renz, Pete Savill, Barbara Brinkmann",42,Sefa Verlag,2020-03-08,11.00,4.90,3.63,289,35,32,48,63,111,21357,9783739906041,English,"Dictionaries, Languages"
Ruslan Russian 1: Communicative Russian Course with MP3 audio download 2021 : Course book,"John Langran, Natalia Veshneva",176,Ruslan Ltd,2021-12-23,26.37,0.63,4.4,5,0,0,0,3,2,147422,9781899785827,English,"Dictionaries, Languages"
In Company 3.0 Intermediate Level Student's Book Pack,Mark Powell,160,Macmillan Education,2014-01-08,40.08,1.92,4,1,0,0,0,1,0,490551,9780230455238,English,"Dictionaries, Languages"
Interactive 2 Student's Book : Interactive 2 Student's Book With Web Zone access,"Hadkins, Helen, Lewis, Samantha, Joanna Budden",128,Cambridge University Press,2011-02-14,24.78,4.67,4,1,0,0,0,1,0,482774,9780521712125,Spanish,"Dictionaries, Languages"
Rick Steves Italian Phrase Book & Dictionary (Eighth Edition),Rick Steves,464,Avalon Travel Publishing,2019-09-26,10.12,1.38,4.83,12,0,0,0,2,10,11284,9781641711968,English,"Dictionaries, Languages"
Get Started in Hindi Absolute Beginner Course : (Book and audio support),Dr Dr Rupert Snell,352,John Murray Press,2014-08-04,20.59,9.91,4.24,21,0,1,3,7,10,143035,9781444174687,English,"Dictionaries, Languages"
BUSINESS BENCHMARK UPPER INTERMEDIATE BUSINESS : STUDENT'S BOOK,"BROOK HART, GUY",208,Cambridge University Press,2013-12-09,39.00,0.67,3.93,14,0,1,4,4,5,245231,9781107680982,Spanish,"Dictionaries, Languages"
The New Oxford Book of Seventeenth-Century Verse,Alastair Fowler,880,Oxford University Press,2008-12-15,19.00,9.50,4,43,0,1,13,14,15,528378,9780199556298,English,"Dictionaries, Languages"
Business Start-Up 1 Student's Book,"Mark Ibbotson, Bryan Stephens",128,Cambridge University Press,2006-02-28,27.72,0.28,3.8,5,0,0,2,2,1,595818,9780521534659,English,"Dictionaries, Languages"
"Cambridge English Empower Upper Intermediate Student's Book with Online Assessment and Practice, and Online Workbook","Adrian Doff, Craig Thaine, Herbert Puchta, Jeff Stranks, Peter Lewis-Jones",176,Cambridge University Press,2015-08-07,50.39,5.28,5,1,0,0,0,0,1,427458,9781107468757,English,"Dictionaries, Languages"
How to Publish Your Own Book,Stewart Ferris,160,Octopus Publishing Group,2017-09-08,4.60,3.40,3,7,0,2,3,2,0,474554,9781840245196,English,"Dictionaries, Languages"
Resource Books for Teachers the Internet,"Scott Windeatt, David Hardisty, David Eastment",144,Oxford University Press,2000-04-24,29.07,12.63,3.33,3,0,0,2,1,0,1833347,9780194372237,English,"Dictionaries, Languages"
Incredible English: 6: Class Book,Sarah Phillips,96,Oxford University Press,2012-07-12,30.30,5.70,5,1,0,0,0,0,1,594347,9780194442336,English,"Dictionaries, Languages"
The Book of Forms : A Handbook of Poetics,Lewis Turco,448,University of New Mexico Press,2020-09-01,30.49,1.01,4.09,68,1,3,16,17,31,686473,9780826361882,English,"Dictionaries, Languages"
Oxford Read and Discover: Level 1: Young Animals Activity Book,Rachel Bladon,16,Oxford University Press,2013-02-21,5.75,1.25,5,1,0,0,0,0,1,62969,9780194646543,English,"Dictionaries, Languages"
Complete Urdu Beginner to Intermediate Course : (Book and audio support),"David Matthews, Mohamed Kasim Dalvi",472,John Murray Press,2014-11-28,43.60,10.90,3.41,17,1,3,4,6,3,46168,9781444195941,English,"Dictionaries, Languages"
Oxford Reading Tree TreeTops Classics: Level 15: The Jungle Book,"Rudyard Kipling, Pippa Goodhart, Mike Spoor",80,Oxford University Press,2014-01-09,7.84,2.66,3.2,5,1,1,0,2,1,465846,9780198448624,English,"Dictionaries, Languages"
Oxford Read and Discover: Level 1: Young Animals Activity Book,Rachel Bladon,16,Oxford University Press,2013-02-21,5.75,1.25,5,1,0,0,0,0,1,62969,9780194646543,English,"Dictionaries, Languages"
Get Started in Beginner's Greek: Teach Yourself : (Book and audio support),Aristarhos Matsukas,224,John Murray Press,2014-12-26,23.58,9.42,4,5,0,0,2,1,2,269089,9781444174656,English,"Dictionaries, Languages"
"Cambridge English Empower Upper Intermediate Student's Book with Online Assessment and Practice, and Online Workbook","Adrian Doff, Craig Thaine, Herbert Puchta, Jeff Stranks, Peter Lewis-Jones",176,Cambridge University Press,2015-08-07,50.39,5.28,5,1,0,0,0,0,1,427458,9781107468757,English,"Dictionaries, Languages"
Get Started in Modern Hebrew Absolute Beginner Course : (Book and audio support),Shula Gilboa,192,John Murray Press,2014-06-03,20.68,15.82,2,1,0,1,0,0,0,256925,9781444175110,English,"Dictionaries, Languages"
Get Started in Beginner's Greek: Teach Yourself : (Book and audio support),Aristarhos Matsukas,224,John Murray Press,2014-12-26,23.58,9.42,4,5,0,0,2,1,2,269089,9781444174656,English,"Dictionaries, Languages"
Katamari Damacy : Boss Fight Books #17,L. E. Hall,192,Boss Fight LLC,2018-11-15,12.13,5.37,3.75,191,0,8,64,86,33,756308,9781940535173,English,"Dictionaries, Languages"
Level 4: Tears of the Giraffe Book and MP3 Pack,Alexander McCall Smith,79,Pearson Education Limited,2012-04-25,12.02,1.05,3.97,54001,253,1390,12666,24978,14714,629708,9781408294444,Spanish,"Dictionaries, Languages"
Earthbound : Boss Fight Books #1,Ken Baumann,208,Boss Fight LLC,2014-01-16,15.14,0.36,3.66,490,20,54,114,186,116,754523,9781940535005,English,"Dictionaries, Languages"
No Shelf Required : E-books in Libraries,Sue Polanka,200,American Library Association,2010-10-01,66.84,0.66,3.51,67,1,4,31,22,9,722713,9780838910542,English,"Dictionaries, Languages"
Level 4: Three Adventures of Sherlock Holmes Book and MP3 Pack : Industrial Ecology,"Arthur Conan Doyle, Arthur Doyle",9998,Pearson Education Limited,2015-07-18,11.82,1.01,3.74,129,3,7,46,38,35,531247,9781408294468,English,"Dictionaries, Languages"
Cambridge IELTS 13 General Training Student's Book with Answers with Audio : Authentic Examination Papers,,138,Cambridge University Press,2018-08-31,40.02,6.10,4.36,11,1,0,1,1,8,216783,9781108553193,English,"Dictionaries, Languages"
Ecce Romani Book 1. Meeting the Family 2nd Edition,"Scottish Classics, Group",80,Pearson Schools,1982-03-29,20.67,0.33,3.8,105,7,11,22,21,44,211914,9780050034651,English,"Dictionaries, Languages"
Creativity Book : A Years Worth of Inspiration and Guidance,Eric Maisel,304,Penguin Putnam Inc,2000-06-19,15.36,0.64,3.84,196,6,14,49,63,64,351480,9781585420292,English,"Dictionaries, Languages"
Cambridge IELTS 11 General Training Student's Book with answers with Audio : Authentic Examination Papers,AA.VV.,144,Cambridge University Press,2016-05-17,41.45,5.77,4,13,1,2,1,1,8,212205,9781316503973,English,"Dictionaries, Languages"
Think Level 4 Student's Book with Online Workbook and Online Practice,"Herbert Puchta, Jeff Stranks, Peter Lewis-Jones",128,Cambridge University Press,2016-06-27,36.71,7.51,5,1,0,0,0,0,1,204553,9781107573253,English,"Dictionaries, Languages"
In Search of Lost Books : The forgotten stories of eight mythical volumes,"Giorgio van Straten, Simon Carnell, Erica Segre",144,Pushkin Press,2018-10-16,9.66,1.84,3.58,443,3,31,178,170,61,765841,9781782273745,English,"Dictionaries, Languages"
Eyes Open Level 2 Student's Book,"Ben Goldstein, Ceri Jones, Emma Heyderman",128,Cambridge University Press,2017-03-01,29.42,4.41,5,1,0,0,0,0,1,249863,9781107467446,English,"Dictionaries, Languages"
The Book of Feckin' Irish Sayings For When You Go On The Batter With A Shower of Savages,"Colin Murphy, Donal O'Dea",64,O'Brien Press Ltd,2005-04-14,13.14,0.86,3.63,19,1,5,2,3,8,240911,9780862789206,English,"Dictionaries, Languages"
Level 3: Billy Elliot Book and MP3 Pack : Industrial Ecology,Melvin Burgess,9998,Pearson Education Limited,2015-07-18,10.38,0.31,3.79,1685,31,105,466,667,416,280559,9781447925378,English,"Dictionaries, Languages"
Access Accents: General American : An Accent Training Resource for Actors,"Gwyneth Strong, Penny Dyer",1,Bloomsbury Publishing PLC,2009-08-04,6.97,24.53,1,2,2,0,0,0,0,238416,9780713685091,English,"Dictionaries, Languages"
Crafty Tv Writing : Thinking Inside the Box,Alex Epstein,336,Henry Holt & Company Inc,2006-08-10,19.19,1.81,4.01,308,0,11,69,134,94,221604,9780805080285,English,"Dictionaries, Languages"
Young Readers and Their Books : Suggestions and Strategies for Using Texts in the Literacy Hour,Gervase Phinn,139,Taylor & Francis Ltd,2000-04-06,37.95,2.75,4.33,3,0,0,1,0,2,988484,9781853466816,English,"Dictionaries, Languages"
Resource Books for Teachers Project Work 2nd Edition,Diana L. Fried-Booth,136,Oxford University Press,2002-05-09,29.39,11.61,4,10,1,1,0,3,5,925843,9780194372251,English,"Dictionaries, Languages"
Get ready for...: Flyers: Student's Book with downloadable audio,"Petrina Cliff, Kirstie Grainger",120,Oxford University Press,2020-06-22,31.75,2.75,1,1,1,0,0,0,0,336390,9780194029513,English,"Dictionaries, Languages"
Romance Writer's Phrase Book : The Essential Source Book for Every Romantic Novelist,J. Kent,144,Penguin Putnam Inc,1984-04-01,11.60,0.40,4.28,170,0,8,26,46,90,323828,9780399510021,English,"Dictionaries, Languages"
What Is a Book? : The Study of Early Printed Books,Joseph Dane,294,University of Notre Dame Press,2012-03-30,30.21,0.78,3.48,29,0,0,16,12,1,718044,9780268026097,English,"Dictionaries, Languages"
"Five Chapter Books 4 : Sound-Out Phonics Books Help Developing Readers, including Students with Dyslexia, Learn to Read (Step 4 in a Systematic Series of Decodable Books)",Pamela Brookes,186,DOG ON A LOG Books,2017-10-11,14.29,0.81,5,1,0,0,0,0,1,1992330,9781949471038,English,"Dictionaries, Languages"
Get Started in Arabic Absolute Beginner Course : (Book and audio support),"Frances Smart, Jack Smart, Mairi Smart",208,John Murray Press,2014-06-03,17.96,9.54,4,2,0,0,0,2,0,212438,9781444174960,English,"Dictionaries, Languages"
Get Started in Mandarin Chinese Absolute Beginner Course : (Book and audio support),"Elizabeth Scurfield, Song Lianyi",240,John Murray Press,2014-05-28,18.27,25.23,5,1,0,0,0,0,1,46349,9781444174809,English,"Dictionaries, Languages"
Making Out in Turkish : (Turkish Phrasebook),Ashley Carman,128,Tuttle Publishing,2013-03-11,7.21,1.29,4.14,7,0,0,1,4,2,438353,9780804840255,English,"Dictionaries, Languages"
Get Ready for IELTS: Student's Book : IELTS 3.5+ (A2+),"Fiona Aish, Jane Short, Rhona Snelling, Jo Tomlinson, Els Van Geyte",160,HarperCollins Publishers,2016-04-14,25.93,0.07,4,3,0,1,0,0,2,423957,9780008139179,English,"Dictionaries, Languages"
Complete Korean Beginner to Intermediate Course : (Book and audio support),"Mark Vincent, Jaehoon Yeon",256,John Murray Press,2014-08-28,32.59,14.91,3.7,10,0,3,1,2,4,169917,9781444195774,English,"Dictionaries, Languages"
How Words Get Good : The Story of Making a Book,Rebecca Lee,384,Profile Books Ltd,2022-03-17,18.35,0.15,4.08,59,0,1,9,33,16,177407,9781788166379,English,"Dictionaries, Languages"
Easystart: Maisie and the Dolphin Book and CD Pack,Stephen Rabley,9998,Pearson Education Limited,2015-08-07,9.98,1.42,3.62,47,4,2,19,5,17,450672,9781405880633,English,"Dictionaries, Languages"
Save the Cat!(r) Writes for TV : The Last Book on Creating Binge-Worthy Content You'll Ever Need,Jamie Nash,254,Save the Cat Press,2021-03-30,24.50,3.00,4.38,222,0,6,24,71,121,49949,9780984157693,English,"Dictionaries, Languages"
"The Drama Book : Lesson Plans, Activities, and Scripts for English-Language Learners","Alice Savage, Annabel Brandon, Walton Burns",206,Alphabet Publishing,2019-08-01,21.68,2.22,3.67,3,0,0,2,0,1,472546,9781948492324,English,"Dictionaries, Languages"
A Multimodal Analysis of Picture Books for Children : A Systemic Functional Approach,Arsenio Jesús Moya Guijarro,316,Equinox Publishing Ltd,2014-11-30,36.94,5.86,4,1,0,0,0,1,0,1294466,9781908049780,English,"Dictionaries, Languages"
The Cambridge Guide to OET Nursing Student's Book with Audio and Resources Download,"Catherine Leyshon, Gurleen Khaira, Virginia Allum",254,Cambridge University Press,2020-02-29,53.28,8.22,4,1,0,0,0,1,0,301393,9781108881647,English,"Dictionaries, Languages"
Grammar Time 1 Student Book Pack New Edition,"Sandy Jervis, Amanda Thomas",96,Pearson Education Limited,2016-01-01,24.25,0.25,5,2,0,0,0,0,2,301590,9781405866972,English,"Dictionaries, Languages"
The Books of Ezra and Nehemiah,F Charles Fensham,304,William B. Eerdmans Publishing Company,2022-05-10,30.50,5.00,3.98,57,2,0,13,24,18,1109821,9780802882288,English,"Dictionaries, Languages"
Complete Czech Beginner to Intermediate Course : (Book and audio support),David Short,352,John Murray Press,2010-12-31,34.28,9.72,4,6,0,0,2,2,2,44451,9781444106916,English,"Dictionaries, Languages"
What Is a Book? : The Study of Early Printed Books,Joseph Dane,294,University of Notre Dame Press,2012-03-30,30.21,0.78,3.48,29,0,0,16,12,1,718044,9780268026097,English,"Dictionaries, Languages"
"Complete Bulgarian Beginner to Intermediate Book and Audio Course : Learn to read, write, speak and understand a new language with Teach Yourself","Michael Holman, Mira Kovatcheva",432,John Murray Press,2018-09-13,30.33,17.67,2.75,4,1,1,0,2,0,385097,9781444106923,English,"Dictionaries, Languages"
What's The Missing Letter? Basic Vocabulary for Kids Picture Book Children's Reading and Writing Books,Baby Professor,64,Baby Professor,2017-09-15,14.03,6.17,5,1,0,0,0,0,1,1200367,9781541925717,English,"Dictionaries, Languages"
Easy French Phrase Book : Over 1500 Common Phrases For Everyday Use And Travel,Lingo Mastery,202,Lingo Mastery,2020-02-19,13.75,1.05,4.43,14,0,1,0,5,8,40312,9781951949082,English,"Dictionaries, Languages"
Words Fail Me,Patricia T. O'Conner,240,Cengage Learning EMEA,2000-12-28,14.58,1.92,3.96,549,5,15,137,234,158,251262,9780156010870,English,"Dictionaries, Languages"
Introduction to Italian Poetry : A Dual-Language Book,Luciano Rebay,160,Dover Publications Inc.,2000-01-02,9.08,1.42,4.19,52,0,0,11,20,21,124213,9780486267159,English,"Dictionaries, Languages"
Teaching Other Subjects Through English (CLIL),"Sheelagh Deller, Christine Price",168,Oxford University Press,2007-05-10,32.06,14.44,4,8,0,1,1,3,3,260783,9780194425780,English,"Dictionaries, Languages"
"Five Chapter Books 4 : Sound-Out Phonics Books Help Developing Readers, including Students with Dyslexia, Learn to Read (Step 4 in a Systematic Series of Decodable Books)",Pamela Brookes,186,DOG ON A LOG Books,2017-10-11,14.29,0.81,5,1,0,0,0,0,1,1992330,9781949471038,English,"Dictionaries, Languages"
Polish Phrase Book,DK,128,Dorling Kindersley Ltd,2003-06-05,5.85,0.65,3.75,4,0,1,0,2,1,263726,9780751320473,English,"Dictionaries, Languages"
"The Dragon Grammar Book : Grammar for Kids, Dragons, and the Whole Kingdom","Diane Mae Robinson, Breadcrumbs Ink",140,Diane Mae Robinson,2017-12-10,14.24,0.26,4.45,115,3,3,10,22,77,273285,9781988714011,English,"Dictionaries, Languages"
The Superior Person's Book of Words,Peter Bowler,176,Bloomsbury Publishing Plc,2017-06-15,14.02,1.98,3.81,468,12,32,125,165,134,247604,9781408885963,English,"Dictionaries, Languages"
Complete Croatian Beginner to Intermediate Course : (Book and audio support),"David Norris, Vladislava Ribnikar",272,John Murray Press,2014-09-26,33.13,15.37,3.83,29,0,3,9,7,10,45423,9781444102321,English,"Dictionaries, Languages"
Cambridge English Advanced 2 Student's Book with answers and Audio : Authentic Examination Papers,Cambridge University Press,184,Cambridge University Press,2016-11-14,40.52,6.67,3,1,0,0,1,0,0,163369,9781316504499,English,"Dictionaries, Languages"
Complete Thai Beginner to Intermediate Course : (Book and audio support),David Smyth,304,John Murray Press,2017-03-09,34.25,11.25,4.13,15,0,0,2,9,4,6632,9781444101911,English,"Dictionaries, Languages"
Cambridge IELTS 12 General Training Student's Book with Answers with Audio,VV.AA.,144,Cambridge University Press,2017-07-06,40.02,7.00,3.89,28,3,1,6,4,14,164819,9781316637876,English,"Dictionaries, Languages"
The Book of Acts in its Graeco-Roman Setting,"David W. J. Gill, Conrad Gempf",644,William B Eerdmans Publishing Co,1994-12-19,48.21,8.69,3.88,8,0,1,2,2,3,574653,9780802848475,English,"Dictionaries, Languages"
Complete Catalan Beginner to Intermediate Course : (Book and audio support),"Alan Yates, Alan Yate, Anna Poch",288,John Murray Press,2011-04-29,33.72,9.78,3.83,6,0,0,3,1,2,46534,9781444105650,English,"Dictionaries, Languages"
