title,authors,number_of_pages,publisher,publication_date,price_in_euros,discount_in_euros,rating,number_of_votes_goodreads,number_of_votes_one_star,number_of_votes_two_stars,number_of_votes_three_stars,number_of_votes_four_stars,number_of_votes_five_stars,bestsellers_rank,isbn13,language,category
"Talking With Your Toddler Activity Book : Fun Exercises and Games That Promote Verbalizing, Teach New Words and Encourage Language","Teresa Laikko, Laura Laikko",228,Ulysses Press,2021-06-17,18.14,2.86,5,2,0,0,0,0,2,1077357,9781646041947,English,"Dictionaries, Languages"
"Literally, the Best Language Book Ever : Annoying Words and Abused Phrases You Should Never Use Again",Paul Yeager,208,Penguin Putnam Inc,2008-05-06,13.08,1.92,2.66,149,28,43,40,28,10,1053623,9780399534232,English,"Dictionaries, Languages"
Listen Here Book 1 - Akou na Deis: Listening Comprehension in Greek 2018: Book 1,"Lelia Panteloglou, F. Arvanitaki",94,Deltos,2018-02-15,30.59,2.53,4.67,3,0,0,0,1,2,990098,9789607914309,"Greek, Modern (1453-)","Dictionaries, Languages"
Farley the Red Panda + Book with Multi-ROM : Footprint Reading Library 1000,"National Geographic, Rob Waring",24,"Cengage Learning, Inc",2008-02-20,6.05,5.35,4.6,5,0,0,1,0,4,643805,9781424023059,English,"Dictionaries, Languages"
"Yiddish : An Introduction to the Language, Literature and Culture, Vol. 2",Sheva Zucker,394,"Workmen's Circle/Arbeter Ring, Inc.",2020-08-31,44.93,1.37,4.8,5,0,0,0,1,4,27652,9781877909757,Yiddish,"Dictionaries, Languages"
New Cutting Edge Advanced Teachers Book and Test Master CD-Rom Pack,"Jane Comyns Carr, David Albery, Cindy Cheetham",176,Pearson Education Limited,2006-11-02,49.28,0.12,4.64,11,0,0,1,2,8,769925,9781405843645,English,"Dictionaries, Languages"
The Content Machine : Towards a Theory of Publishing from the Printing Press to the Digital Network,Michael Bhaskar,226,Anthem Press,2013-10-01,18.67,4.53,3.8,104,4,3,24,52,21,573821,9780857281111,English,"Dictionaries, Languages"
An Historical Commentary on Thucydides: Volume 4. Books V(25)-VII,"A. W. Gomme, A. Andrewes, K. J. Dover",518,Oxford University Press,1970-06-15,266.33,56.17,3.67,9,0,0,4,4,1,2023460,9780198141785,English,"Dictionaries, Languages"
"Project X Origins: Purple Book Band, Oxford Level 8: Habitat: Dinosaur Safari",Claire Llewellyn,24,Oxford University Press,2014-01-09,6.58,3.42,4,4,0,0,1,2,1,804948,9780198301882,English,"Dictionaries, Languages"
Ovid: Amores Book II,Joan Booth,208,Liverpool University Press,1991-01-01,31.72,0.47,3.96,315,5,15,75,114,106,1261206,9780856681752,Latin,"Dictionaries, Languages"
Author's Guide to Building an Online Platform: Leveraging the Internet to Sell More Books,Stephanie Chandler,144,"Quill Driver Books, U.S.",2008-06-01,15.62,0.38,3.96,26,0,2,9,3,12,2722929,9781884956829,English,"Dictionaries, Languages"
Arthur's Christmas Cookies,Lillian Hoban,63,HARPERCOLLINS,1984-12-31,5.70,0.30,3.87,147,1,8,41,56,41,759937,9780064440554,English,"Dictionaries, Languages"
"Project X Origins: Grey Book Band, Oxford Level 13: Great Escapes: The Deep","Margaret Su, Anthony Hope-Smith",56,Oxford University Press,2014-01-09,7.13,3.37,4.67,3,0,0,0,1,2,804970,9780198303091,English,"Dictionaries, Languages"
Content and Copywriting Secrets : Learn SEO Content Writing and How to Create a Compelling Promotional Content to Win More Clients,Goldink Books,102,GoldInk Publishers LLC,2021-10-16,13.72,3.88,4,1,0,0,0,1,0,2277894,9781956913064,English,"Dictionaries, Languages"
"Project X Origins: Red Book Band, Oxford Level 2: Big and Small: Ben and Paul","Alex Lane, Deborah Allwright",16,Oxford University Press,2014-01-09,4.75,1.75,3,1,0,0,1,0,0,804965,9780198300779,English,"Dictionaries, Languages"
Child Language : A Resource Book for Students,Jean Stilwell Peccei,192,Taylor & Francis Ltd,2006-03-30,29.58,0.32,3.45,11,0,1,6,2,2,523956,9780415281034,English,"Dictionaries, Languages"
Early Reading Development and Dyslexia,V Muter,230,John Wiley and Sons Ltd,2003-02-24,46.49,31.01,4,2,0,0,0,2,0,1605494,9781861563279,English,"Dictionaries, Languages"
"Project X Origins: White Book Band, Oxford Level 10: Working as a Team: The Balloon Team",Chris Powling,32,Oxford University Press,2014-01-09,6.99,3.01,4,4,0,0,1,2,1,804758,9780198302278,English,"Dictionaries, Languages"
The Art of Making Magazines : On Being an Editor and Other Views from the Industry,"Victor Navasky, Evan Cornog",200,Columbia University Press,2012-09-14,22.01,5.49,3.87,75,1,2,21,33,18,853948,9780231131377,English,"Dictionaries, Languages"
"Project X Origins: Brown Book Band, Oxford Level 9: Chocolate: Choc-bot Charge",James Noble,48,Oxford University Press,2014-09-25,7.40,2.60,4.5,4,0,0,1,0,3,804798,9780198393696,English,"Dictionaries, Languages"
"Project X Origins: Lime Book Band, Oxford Level 11: Underground: Ants at Home",Haydn Middleton,24,Oxford University Press,2014-01-09,6.93,3.57,4.33,3,0,0,1,0,2,830559,9780198302445,English,"Dictionaries, Languages"
"Project X Origins: Dark Blue Book Band, Oxford Level 16: Hidden Depths: Toxic!","Jan Burchett, Sara Vogler",56,Oxford University Press,2014-01-09,7.46,3.54,4,2,0,0,1,0,1,65382,9780198303473,English,"Dictionaries, Languages"
Lost Books : Reconstructing the Print World of Pre-Industrial Europe,"Flavia Bruni, Andrew Pettegree",526,Brill,2016-04-19,214.53,69.97,5,1,0,0,0,0,1,9789004311817,9789004311817,English,"Dictionaries, Languages"
Bindi Baby Animals (Tamil) : A Beginner Language Book for Tamil Children,"Aruna Hatti, Advisor S Ramesh, Kate Armstrong",46,Gnaana Publishing,2015-03-16,20.95,6.65,4,1,0,0,0,1,0,565928,9781943018048,Tamil,"Dictionaries, Languages"
Rejected Books : The Most Unpublishable Books of All Time,"Graham Johnson, Rob Hibbert",112,Transworld Publishers Ltd,2022-10-27,15.30,0.70,3,3,0,1,1,1,0,9781787636453,9781787636453,English,"Dictionaries, Languages"
"Project X Origins: Gold Book Band, Oxford Level 9: Head to Head: Game On!",Jane Penrose,24,Oxford University Press,2014-01-09,6.90,3.10,5,1,0,0,0,0,1,804757,9780198302124,English,"Dictionaries, Languages"
"Project X Origins: Yellow Book Band, Oxford Level 3: Weather: The Rainy Day",Tony Bradman,16,Oxford University Press,2014-01-09,4.72,1.78,3,1,0,0,1,0,0,830556,9780198300991,English,"Dictionaries, Languages"
"Project X Origins: Pink Book Band, Oxford Level 1+: My Home: Hamster on the Run",Alex Lane,12,Oxford University Press,2014-01-09,4.12,1.38,2,3,1,1,1,0,0,830555,9780198300687,English,"Dictionaries, Languages"
"Project X Alien Adventures: Brown Book Band, Oxford Level 11: The Craggrox Awake",Steve Cole,48,Oxford University Press,2014-01-09,7.40,1.90,4.8,5,0,0,0,1,4,795201,9780198391241,English,"Dictionaries, Languages"
"Project X Alien Adventures: Dark Red + Book Band, Oxford Level 19: The Rise of the Empty People","Julia Golding, Dynamo",96,Oxford University Press,2015-04-23,10.03,2.37,5,1,0,0,0,0,1,804976,9780198310709,English,"Dictionaries, Languages"
Rigby Star Guided 1 Green Level: Stone Soup Pupil Book (single),Alison Hawes,16,Pearson Education Limited,2000-04-15,8.37,0.13,3.96,138,2,3,32,62,39,807160,9780433027959,English,"Dictionaries, Languages"
Books To Bucks : The Top 20 Ways to Make Money From Your Book (even if you haven't written it yet),"Jenn Foster, Everett O'Keefe",142,Createspace Independent Publishing Platform,2015-05-20,12.08,1.79,5,1,0,0,0,0,1,9781511981354,9781511981354,English,"Dictionaries, Languages"
A Passion for Books,D. Salwak,208,Palgrave Macmillan,1999-04-23,66.00,8.00,3.57,21,2,0,8,6,5,9780333714485,9780333714485,English,"Dictionaries, Languages"
A Century in Books : Princeton University Press 1905-2005,Princeton University Press Staff,192,Princeton University Press,2005-05-27,31.40,0.60,5,1,0,0,0,0,1,3055483,9780691122922,English,"Dictionaries, Languages"
Histoires Inedites du Petit Nicholas: v. 2,"Goscinny, Sempe",376,IMAV Editions,2006-09-15,34.38,6.01,4.3,1379,5,29,173,514,658,1038671,9782915732023,French,"Dictionaries, Languages"
Level 4: Seven Book and MP3 Pack,Anthony Bruno,58,Pearson Education Limited,2008-05-21,15.83,5.57,4.44,9,1,0,0,1,7,1052344,9781405879743,English,"Dictionaries, Languages"
This is One Direction! Book & CD (A1 600 Headwords),Fiona Davis,40,Scholastic,2014-03-06,7.77,0.72,4.33,3,0,0,1,0,2,1039905,9781909221864,English,"Dictionaries, Languages"
Level 5: The Phantom of the Opera Book and MP3 Pack,Gaston Leroux,91,Pearson Education Limited,2015-07-30,11.82,0.58,3.74,99,4,11,22,32,30,1117987,9781408276471,English,"Dictionaries, Languages"
"Project X Origins: Grey Book Band, Oxford Level 12: Dilemmas and Decisions: The Missing Statue",Alex Lane,48,Oxford University Press,2014-01-09,7.37,3.13,4,2,0,0,1,0,1,830561,9780198302995,English,"Dictionaries, Languages"
Los cuadernos azul y marrón / The Blue and Brown Books,Ludwig Wittgenstein,239,Grupo Anaya Comercial,2013-02-03,32.78,2.80,4.12,2377,36,98,436,772,1035,2810576,9788430948444,Spanish,"Dictionaries, Languages"
Reporting Vietnam Vol. 2 (LOA #105) : American Journalism 1969-1975,"Milton J. Bates, Lawrence Lichty, Paul Miles, Ronald H. Spector, Marilyn Young",900,The Library of America,1998-10-01,38.87,4.63,4.28,76,0,0,14,27,35,1124878,9781883011598,English,"Dictionaries, Languages"
Gold Experience 2nd Edition A1 Student's Book,Carolyn Barraclough,152,Pearson Education Limited,2018-11-23,41.42,0.08,3.5,2,0,1,0,0,1,971364,9781292194141,English,"Dictionaries, Languages"
Listening,"Goodith White, Alan Maley",152,Oxford University Press,1998-05-14,31.01,10.69,3.33,9,2,0,3,1,3,829993,9780194372169,English,"Dictionaries, Languages"
Buckley: The Right Word,"William F Buckley, Jr.",544,Harper Paperbacks,1998-05-01,32.12,5.88,4.11,148,3,2,26,61,56,887812,9780156005692,English,"Dictionaries, Languages"
I Love to Sleep in My Own Bed - Ich Schlafe Gern in Meinem Eigenen Bett : English German Bilingual Edition,"Shelley Admont, Kidkiddos Books, Tess Parthum",36,S.A Publishing,2015-06-30,17.44,8.66,4.06,746,33,49,120,181,363,1387544,9781926432731,German,"Dictionaries, Languages"
Rejected Books : The Most Unpublishable Books of All Time,"Graham Johnson, Rob Hibbert",112,Transworld Publishers Ltd,2022-10-27,15.30,0.70,3,3,0,1,1,1,0,9781787636453,9781787636453,English,"Dictionaries, Languages"
The Writer's Source Book : Inspirational ideas for your creative writing,Chris Sykes,224,John Murray Press,2019-05-21,12.86,5.64,4,5,0,0,0,5,0,1272135,9781473688476,English,"Dictionaries, Languages"
The Book is Dead (Long Live the Book),Sherman Young,208,NewSouth Publishing,2016-07-01,14.46,9.54,3.72,25,1,1,8,9,6,1373769,9781742234762,English,"Dictionaries, Languages"
Imparare leggendo : Villa dei Mughetti - book & CD,Stefano Giordano,96,CIDEB s.r.l.,2010-02-24,16.01,8.96,3.57,7,0,1,2,3,1,490387,9788853010391,Italian,"Dictionaries, Languages"
An Introduction to Old Norse,"E. V. Gordon, A. R. Taylor",496,Oxford University Press,1981-07-23,86.15,31.95,4.1,118,1,2,24,48,43,570864,9780198111849,English,"Dictionaries, Languages"
"Project X Origins: Pink Book Band, Oxford Level 1+: My Family: Ducks",Alex Lane,12,Oxford University Press,2014-01-09,4.12,1.38,3.33,3,0,1,1,0,1,717254,9780198300618,English,"Dictionaries, Languages"
"Project X Alien Adventures: Brown Book Band, Oxford Level 10: The Giants of Ariddas",Steve Cole,32,Oxford University Press,2014-01-09,6.99,3.51,5,1,0,0,0,0,1,737207,9780198391234,English,"Dictionaries, Languages"
"Project X Origins: Yellow Book Band, Oxford Level 3: Food: The Birthday Cake",Alex Lane,16,Oxford University Press,2014-01-09,4.72,1.78,4,1,0,0,0,1,0,717256,9780198300922,English,"Dictionaries, Languages"
MINNA NO NIHONGO SHOKYU [2ND ED.] VOL. 1 TRANSLATION & GRAMMATICAL NOTES SPANISH VER.,3A Corporation,182,3A Corporation,2012-12-01,32.38,16.12,4.12,224,3,7,39,87,88,574373,9784883196272,Spanish,"Dictionaries, Languages"
"Project X Origins: Green Book Band, Oxford Level 5: Flight: Charlie Smith, Superkid","Emma Lynch, Bill Greenhead",16,Oxford University Press,2014-01-09,5.61,1.89,3,1,0,0,1,0,0,717211,9780198301332,English,"Dictionaries, Languages"
"Project X Origins: Pink Book Band, Oxford Level 1+: My Home: In the Home",Alex Lane,12,Oxford University Press,2014-01-09,4.12,1.38,2,1,0,1,0,0,0,699095,9780198300694,English,"Dictionaries, Languages"
"Project X Origins: Red Book Band, Oxford Level 2: Pets: My Cat Moggy",Tony Bradman,16,Oxford University Press,2014-01-09,4.72,1.78,5,1,0,0,0,0,1,737171,9780198300847,English,"Dictionaries, Languages"
Imparare leggendo : Mistero all'Abbazia Book + CD,"Maria Luisa Banfi, Simona Gavelli",128,CIDEB s.r.l.,2011-09-16,21.34,7.66,2.81,16,2,4,6,3,1,449854,9788853007308,Italian,"Dictionaries, Languages"
Cicero Rhetorica. Vol. I : (De Oratore),A. S. Wilkins,264,Oxford University Press,2012-09-20,43.12,20.38,3.85,404,5,32,106,137,124,857784,9780198146155,English,"Dictionaries, Languages"
"Project X Origins: Dark Red Book Band, Oxford Level 18: Unexplained: Ultimate Takeover","Alex Lane, Bede Rogerson, Paul McCaffrey, Kel Dyson",80,Oxford University Press,2014-01-09,8.20,3.80,5,4,0,0,0,0,4,62850,9780198303732,English,"Dictionaries, Languages"
"Project X Origins: White Book Band, Oxford Level 10: Journeys: Human Body Adventures",Alison Blank,24,Oxford University Press,2014-01-09,6.88,3.62,4.5,2,0,0,0,1,1,699098,9780198302223,English,"Dictionaries, Languages"
"Project X Origins: Pink Book Band, Oxford Level 1+: My Home: Otters at Home",Alex Lane,12,Oxford University Press,2014-01-09,4.97,0.53,3,1,0,0,1,0,0,698803,9780198300717,English,"Dictionaries, Languages"
Happiness Street - Strasse des Glucks : Α bilingual children's picture book in English and German,"Elisavet Arkolaki, Helmut Dworschak, Charikleia Arkolaki",32,Independently Published,2020-08-22,11.66,0.37,4.64,92,1,1,5,16,69,17260,9798677865343,German,"Dictionaries, Languages"
"Project X Origins: Pink Book Band, Oxford Level 1+: My Family: Go To Bed!",Andrea Smith,16,Oxford University Press,2014-01-09,4.15,1.35,4,1,0,0,0,1,0,681692,9780198300601,English,"Dictionaries, Languages"
"Project X Alien Adventures: Brown Book Band, Oxford Level 9: The Destroyer",Tony Bradman,32,Oxford University Press,2014-01-09,7.05,3.45,4.75,4,0,0,0,1,3,699119,9780198391166,English,"Dictionaries, Languages"
Level 3: The Black Cat and Other Stories Book & MP3 Pack : Industrial Ecology,Edgar Poe,9998,Pearson Education Limited,2015-08-07,10.11,4.89,3.89,3733,69,224,912,1379,1149,812381,9781447925385,English,"Dictionaries, Languages"
"Project X Alien Adventures: Grey Book Band, Oxford Level 13: Cyberbee Break Out",Mike Tucker,48,Oxford University Press,2014-01-09,7.40,2.10,3.33,6,1,1,1,1,2,700864,9780198391371,English,"Dictionaries, Languages"
Plot : The Art of Story,Amy Jones,64,Wooden Books,2021-10-01,6.95,0.55,4.5,4,0,0,0,2,2,769814,9781904263104,English,"Dictionaries, Languages"
Pragmatics : An Advanced Resource Book for Students,"Dawn Archer, Karin Aijmer, Anne Wichmann",328,Taylor & Francis Ltd,2012-06-12,56.71,3.79,3.25,4,0,1,1,2,0,452674,9780415497879,English,"Dictionaries, Languages"
Level 5: Four Weddings and a Funeral Book and MP3 Pack,Richard Curtis,77,Pearson Education Limited,2011-04-21,12.11,0.39,3.72,573,23,57,154,164,175,785988,9781408276334,English,"Dictionaries, Languages"
Eyes Open Level 2 Student's Book with Online Workbook and Online Practice,"Ben Goldstein, Ceri Jones, Vicki Anderson, Emma Heyderman, Eoin Higgins",128,Cambridge University Press,2015-05-21,38.17,2.45,1,1,1,0,0,0,0,789241,9781107467491,English,"Dictionaries, Languages"
An Introduction to Old Norse,"E. V. Gordon, A. R. Taylor",496,Oxford University Press,1981-07-23,86.15,31.95,4.1,118,1,2,24,48,43,570864,9780198111849,English,"Dictionaries, Languages"
"Project X Origins: Grey Book Band, Oxford Level 13: Great Escapes: The Deep","Margaret Su, Anthony Hope-Smith",56,Oxford University Press,2014-01-09,7.13,3.37,4.67,3,0,0,0,1,2,804970,9780198303091,English,"Dictionaries, Languages"
"Project X Origins: Red Book Band, Oxford Level 2: Big and Small: Ben and Paul","Alex Lane, Deborah Allwright",16,Oxford University Press,2014-01-09,4.75,1.75,3,1,0,0,1,0,0,804965,9780198300779,English,"Dictionaries, Languages"
"Project X Origins: Purple Book Band, Oxford Level 8: Habitat: Dinosaur Safari",Claire Llewellyn,24,Oxford University Press,2014-01-09,6.58,3.42,4,4,0,0,1,2,1,804948,9780198301882,English,"Dictionaries, Languages"
Easy Swedish Phrase Book : Over 1500 Common Phrases For Everyday Use And Travel,Lingo Mastery,192,Lingo Mastery,2021-08-15,13.55,0.55,4.59,22,0,0,1,7,14,2747389,9781951949402,English,"Dictionaries, Languages"
The Bare Bones Book of Screenwriting,Josh Clark,104,"Written by Clark, Publishing",2007-06-10,20.20,0.10,4,5,0,0,1,3,1,1262065,9780979510205,English,"Dictionaries, Languages"
face2face Starter Student's Book,"Chris Redston, Gillie Cunningham",136,Cambridge University Press,2019-11-22,47.38,2.58,5,1,0,0,0,0,1,1115236,9781108733335,English,"Dictionaries, Languages"
A Multimodal Analysis of Picture Books for Children : A Systemic Functional Approach,Arsenio Jesús Moya Guijarro,316,Equinox Publishing Ltd,2014-11-30,92.79,8.91,4,2,0,0,0,2,0,9781908049773,9781908049773,English,"Dictionaries, Languages"
The Banned Books of England and Other Countries : A Study of the Conception of Literary Obscenity,Alec Craig,243,ABC-CLIO,1977-09-29,87.08,6.22,3.57,7,0,1,3,1,2,9780837197098,9780837197098,English,"Dictionaries, Languages"
A Book of Middle English Third Edition,JA Burrow,436,John Wiley and Sons Ltd,2004-12-07,107.19,65.71,3.93,111,2,5,22,52,30,1445567,9781405117081,English,"Dictionaries, Languages"
Get Your Book Into Australian Libraries,Ebony Mckenna,118,Ebony McKenna,2018-08-30,14.86,1.24,5,1,0,0,0,0,1,1533481,9780648284208,English,"Dictionaries, Languages"
Kant's Metaphysic Of Experience - Vol I,H.J. Paton,584,Read Books,2008-11-30,46.72,12.58,3.67,6,0,1,2,1,2,1568159,9781443724074,English,"Dictionaries, Languages"
"Subject Guide to Children's Books In Print, 2019",RR Bowker,2900,R.R. Bowker,2018-12-01,779.39,18.11,5,1,0,0,0,0,1,9781682178591,9781682178591,English,"Dictionaries, Languages"
First Six Books of Caesar's Commentaries on the Gallic War,"Julius Caesar, Edward Brooks",244,Franklin Classics Trade Press,2018-10-24,22.05,0.90,4,7,0,0,2,3,2,9780344153747,9780344153747,English,"Dictionaries, Languages"
The Colors in French - Coloring While Learning French - Language Books for Grade 1 Children's Foreign Language Books,Baby Professor,64,Baby Professor,2017-09-15,14.03,6.17,5,1,0,0,0,0,1,3553144,9781541925649,English,"Dictionaries, Languages"
Cooking the Books - a cartoon humor book about idioms,Diana Huang,42,Lulu.com,2019-03-15,20.35,5.85,4,2,0,0,1,0,1,3339036,9781387630684,English,"Dictionaries, Languages"
"Building Bridges with Bilingual Books and Multicultural Resources : A Practical Manual of Lesson Plans, Literacy Games, and Fun Activities from Around the World to Celebrate Diversity in the Classroom and at Home (Supporting Culturally Responsive Teaching)","Anneke Vanmarcke Forzani, Heather Leaman, Edmond Gubbins",236,"Language Lizard, LLC",2019-11-27,34.80,0.40,4.6,5,0,0,0,2,3,9781951787004,9781951787004,English,"Dictionaries, Languages"
"Controversial Books in K-12 Classrooms and Libraries : Challenged, Censored, and Banned",Randy Bobbitt,226,Lexington Books,2021-07-15,37.92,12.28,3.5,2,0,0,1,1,0,9781498569743,9781498569743,English,"Dictionaries, Languages"
Cooking the Books - a cartoon humor book about idioms,Diana Huang,42,Lulu.com,2019-03-15,20.35,5.85,4,2,0,0,1,0,1,3339036,9781387630684,English,"Dictionaries, Languages"
Armenian-English / English-Armenian Concise Dictionary,"Diana Aroutunian, Susanna Aroutunian",378,"Hippocrene Books Inc.,U.S.",1993-05-20,18.25,2.74,4.29,7,0,0,1,3,3,971201,9780781801508,English,"Dictionaries, Languages"
The Black Book of Speaking Fluent English : The Quickest Way to Improve Your Spoken English,"Christopher Hill, Mark Sherman, Carter Hoffman",98,Christopher Hill,2020-01-13,21.43,3.57,4,29,0,5,4,6,14,1490037,9781999263171,English,"Dictionaries, Languages"
The Fairchild Books Dictionary of Interior Design,Mark  Hinchman,312,Bloomsbury Publishing PLC,2021-12-16,180.15,32.92,4,2,0,0,1,0,1,9781501366710,9781501366710,English,"Dictionaries, Languages"
Reading Books and Prints as Cultural Objects,Evanghelia Stead,317,Springer International Publishing AG,2018-01-12,45.67,72.02,5,1,0,0,0,0,1,9783319538310,9783319538310,English,"Dictionaries, Languages"
Level 2: The Secret Garden Book and Multi-ROM with MP3 Pack : Industrial Ecology,Frances Burnett,60,Pearson Education Limited,2015-09-04,13.24,0.66,4.02,89,5,3,16,26,39,1194649,9781447967484,English,"Dictionaries, Languages"
Cambridge English Prepare! Level 4 Student's Book and Online Workbook,"Annette Capel, James Styring, Nicholas Tims, Niki Joseph",160,Cambridge University Press,2015-04-30,32.26,12.61,4,2,0,0,1,0,1,1189473,9781107497856,English,"Dictionaries, Languages"
A Book of Middle English Third Edition,JA Burrow,436,John Wiley and Sons Ltd,2004-12-07,107.19,65.71,3.93,111,2,5,22,52,30,1445567,9781405117081,English,"Dictionaries, Languages"
A is for Anaar : My First Hindi Alphabet Book,"Aruna K Hatti, Kalyani Ganapathy",58,Gnaana Publishing,2016-01-10,24.14,8.96,5,2,0,0,0,0,2,22638,9781943018222,Hindi,"Dictionaries, Languages"
FIRST FRIENDS 1 STUDENT BOOK,Susan Iannuzzi,61,Oxford University Press (Us),2011-09-08,30.57,0.33,5,1,0,0,0,0,1,1408468,9780194433433,Spanish,"Dictionaries, Languages"
American Catholics : A History of the Roman Catholic Community in the United States,James Hennesey,414,Oxford University Press Inc,1983-06-02,30.31,22.69,4,19,0,1,5,6,7,1222799,9780195032680,English,"Dictionaries, Languages"
The Reference Book,"John Hawthorne, David Manley",274,Oxford University Press,2012-05-23,75.78,24.72,4.25,4,0,0,1,1,2,1639413,9780199693672,English,"Dictionaries, Languages"
"The Book of Tobit : The Text in Aramaic, Hebrew, and Old Latin with English Translations",Adolf Neubauer,148,Wipf & Stock Publishers,2005-09-16,19.70,4.20,3.25,4,1,1,0,0,2,1943120,9781597523745,English,"Dictionaries, Languages"
Other People's Money : The Ultimate Seduction,Jerry Sterner,108,Hal Leonard Corporation,2000-04-01,8.32,0.88,3.55,56,4,5,18,14,15,1360340,9781557830623,English,"Dictionaries, Languages"
"Project X Origins: Orange Book Band, Oxford Level 6: Invasion: Go Away, Molly!",Shoo Rayner,24,Oxford University Press,2014-01-09,5.98,2.52,3.5,2,0,1,0,0,1,998887,9780198301479,English,"Dictionaries, Languages"
100 French Short Stories for Beginners Learn French with Stories Including AudiobookFrench Edition Foreign Language Book 1,Christian Stahl,178,Lulu.com,2018-06-02,21.63,3.17,3.83,12,0,1,3,5,3,1016487,9781387835409,English,"Dictionaries, Languages"
"Project X Origins: Dark Red Book Band, Oxford Level 17: Extreme: Volcano!","Jan Burchett, Sara Vogler",56,Oxford University Press,2014-01-09,7.73,4.27,5,1,0,0,0,0,1,998894,9780198303541,English,"Dictionaries, Languages"
Q Skills for Success: Level 4: Listening & Speaking Student Book with iQ Online,"Robert Freire, Tamara Jones",209,Oxford University Press,2015-07-14,50.95,3.55,3.5,4,0,1,1,1,1,1046213,9780194819282,English,"Dictionaries, Languages"
"The Wild Swans - قوهای وحشی (English - Persian, Farsi, Dari) : Bilingual children's book based on a fairy tale by Hans Christian Andersen, with audiobook for download","Ulrich Renz, Jahan Mortezai, Marc Robitzky",42,Sefa Verlag,2018-07-30,11.00,1.10,3.84,143,18,8,23,24,70,27559,9783739959016,English,"Dictionaries, Languages"
"The Book of Tobit : The Text in Aramaic, Hebrew, and Old Latin with English Translations",Adolf Neubauer,148,Wipf & Stock Publishers,2005-09-16,19.70,4.20,3.25,4,1,1,0,0,2,1943120,9781597523745,English,"Dictionaries, Languages"
The Reference Book,"John Hawthorne, David Manley",274,Oxford University Press,2012-05-23,75.78,24.72,4.25,4,0,0,1,1,2,1639413,9780199693672,English,"Dictionaries, Languages"
Grammar Time Level 4 Teachers Book New Edition,"Sandy Jervis, Maria Carling",64,Pearson Education Limited,2008-12-18,35.78,0.72,2.33,3,1,1,0,1,0,1190320,9781405852760,English,"Dictionaries, Languages"
"Writing Books for Fun, Fame, and Fortune!",Rik Feeney,166,RICHARDSON PUBLISHING,2018-08-01,22.23,5.97,4.67,3,0,0,0,1,2,9781935683070,9781935683070,English,"Dictionaries, Languages"
The Fairchild Books Dictionary of Interior Design,Mark  Hinchman,312,Bloomsbury Publishing PLC,2021-12-16,180.15,32.92,4,2,0,0,1,0,1,9781501366710,9781501366710,English,"Dictionaries, Languages"
Rick Steves Spanish Phrase Book & Dictionary (Fourth Edition),Rick Steves,448,Avalon Travel Publishing,2019-10-17,10.11,1.39,4.6,5,0,0,0,2,3,1081138,9781641712002,English,"Dictionaries, Languages"
"American Sign Language Green Books, Teacher's Curriculum",Charlotte Bakershenk,187,"Gallaudet University Press,U.S.",1991-04-01,41.85,1.65,4.56,9,0,0,0,4,5,9780930323851,9780930323851,English,"Dictionaries, Languages"
Other People's Money : The Ultimate Seduction,Jerry Sterner,108,Hal Leonard Corporation,2000-04-01,8.32,0.88,3.55,56,4,5,18,14,15,1360340,9781557830623,English,"Dictionaries, Languages"
"Audio For Authors : Audiobooks, Podcasting, And Voice Technologies",Joanna Penn,324,Curl Up Press,2020-03-05,17.55,0.55,4.64,88,0,2,1,24,61,1296982,9781913321215,English,"Dictionaries, Languages"
"The Wild Swans - قوهای وحشی (English - Persian, Farsi, Dari) : Bilingual children's book based on a fairy tale by Hans Christian Andersen, with audiobook for download","Ulrich Renz, Jahan Mortezai, Marc Robitzky",42,Sefa Verlag,2018-07-30,11.00,1.10,3.84,143,18,8,23,24,70,27559,9783739959016,English,"Dictionaries, Languages"
"Project X Origins: Light Blue Book Band, Oxford Level 4: Bugs: Bug Hunt",Claire Llewellyn,16,Oxford University Press,2014-01-09,5.09,1.91,4,1,0,0,0,1,0,1046687,9780198301080,English,"Dictionaries, Languages"
