title,authors,number_of_pages,publisher,publication_date,price_in_euros,discount_in_euros,rating,number_of_votes_goodreads,number_of_votes_one_star,number_of_votes_two_stars,number_of_votes_three_stars,number_of_votes_four_stars,number_of_votes_five_stars,bestsellers_rank,isbn13,language,category
"Project X Origins: Gold Book Band, Oxford Level 9: Communication: Message in an X-bot",Tony Bradman,24,Oxford University Press,2014-01-09,6.82,3.68,3,1,0,0,1,0,0,47103,9780198302032,English,"Dictionaries, Languages"
Oxford EAP: Intermediate/B1+: Student's Book and DVD-ROM Pack,"Edward De Chazal, Louis Rogers",223,Oxford University Press,2013-03-12,48.19,11.01,4.75,4,0,0,0,1,3,64875,9780194002011,English,"Dictionaries, Languages"
This Is Not A Book,Keri Smith,224,Penguin Books Ltd,2011-06-16,14.58,1.42,4.02,1505,37,93,307,434,634,23512,9781846144448,English,"Dictionaries, Languages"
Penguin Pocket Rhyming Dictionary,"Rosalind Fergusson, Market House Books Ltd, Daniele O. Arati, Peter Lewis",512,Penguin Books Ltd,2007-04-01,14.26,1.74,4,11,0,0,3,5,3,276355,9780141027210,English,"Dictionaries, Languages"
50 Steps to Improving Your Academic Writing Study Book,Chris Sowton,237,Garnet Publishing,2012-01-01,36.54,18.46,4.12,17,0,0,3,9,5,247408,9781859646557,English,"Dictionaries, Languages"
Chinese Flash Cards Kit Volume 3: Volume 3 : HSK Upper Intermediate Level (Online Audio Included),"Philip Yungkin Lee, Jun Yang",32,Tuttle Publishing,2014-03-04,26.39,3.11,4.56,9,0,0,1,2,6,146406,9780804842037,English,"Dictionaries, Languages"
The POLYNESIAN TATTOO Handbook Vol.2 : An in-depth study of Polynesian tattoos and their foundational symbols,Roberto Gemori,208,Roberto Gemori,2018-09-15,24.29,2.71,4.29,7,0,1,0,2,4,376765,9788894205657,English,"Dictionaries, Languages"
English for Primary Teachers,"Mary Slattery, Jane Willis",156,Oxford University Press,2002-11-07,32.26,6.24,3.81,36,2,4,6,11,13,336392,9780194375627,English,"Dictionaries, Languages"
A Multimodal Analysis of Picture Books for Children : A Systemic Functional Approach,Arsenio Jesús Moya Guijarro,316,Equinox Publishing Ltd,2014-11-30,36.94,5.86,4,1,0,0,0,1,0,1294466,9781908049780,English,"Dictionaries, Languages"
Book Production,Adrian Bullock,206,Taylor & Francis Ltd,2012-08-15,44.34,0.66,4.06,31,0,0,8,13,10,595766,9780415593809,English,"Dictionaries, Languages"
Making Out in Korean : A Korean Language Phrase Book,"Peter Constantine, Gene Baij, Laura Kingdon, Chris Backe",160,Tuttle Publishing,2014-09-23,7.21,1.29,3.65,57,3,3,17,22,12,359268,9780804843546,English,"Dictionaries, Languages"
The Book of Letters : A Mystical Hebrew Alphabet,Rabbi Lawrence Kushner,80,Jewish Lights Publishing,1990-11-15,9.94,4.56,4.39,198,1,5,22,57,113,223482,9781683363446,English,"Dictionaries, Languages"
Understanding Children's Books : A Guide for Education Professionals,Prue Goodwin,144,SAGE Publications Ltd,2008-07-15,38.44,18.06,4.33,6,0,0,0,4,2,752649,9781847870322,English,"Dictionaries, Languages"
Cambridge English Advanced 3 Student's Book with Answers with Audio,Cambridge University Press,184,Cambridge University Press,2018-06-21,40.66,5.23,4,3,0,0,1,1,1,50819,9781108431224,English,"Dictionaries, Languages"
"Project X Origins: Turquoise Book Band, Oxford Level 7: Hide and Seek: Animal Magic",Mick Gowar,16,Oxford University Press,2014-01-09,6.35,3.65,4,8,0,0,3,2,3,344693,9780198301646,English,"Dictionaries, Languages"
"Five Chapter Books 1 : Sound-Out Phonics Books Help Developing Readers, including Students with Dyslexia, Learn to Read (Step 1 in a Systematic Series of Decodable Books)",Pamela Brookes,142,DOG ON A LOG Books,2017-10-10,12.14,1.96,4.4,5,0,0,1,1,3,734179,9781949471007,English,"Dictionaries, Languages"
Cambridge Academic English B1+ Intermediate Student's Book : An Integrated Skills Course for EAP,"Michael Mccarthy, Craig Thaine",176,Cambridge University Press,2012-03-19,38.39,0.11,4.18,11,0,0,2,5,4,173114,9780521165198,English,"Dictionaries, Languages"
The Wordless Travel Book : Point at These Pictures to Communicate with Anyone,Jonathan Meader,18,Random House USA Inc,1995-12-01,5.09,1.91,3.88,8,1,1,0,2,4,234045,9780898158090,English,"Dictionaries, Languages"
The Social Life of Books : Reading Together in the Eighteenth-Century Home,Abigail Williams,368,Yale University Press,2017-08-02,37.43,1.07,3.87,79,1,7,8,48,15,695153,9780300208290,English,"Dictionaries, Languages"
Introduction to French Poetry : A Dual-Language Book,Stanley Appelbaum,192,Dover Publications Inc.,2003-03-28,11.20,2.80,3.79,97,1,5,29,40,22,52968,9780486267111,English,"Dictionaries, Languages"
E-books in Libraries : A Practical Guide,"Kate Price, Virginia Havergal",368,Facet Publishing,2011-02-20,80.62,11.98,3.67,3,0,1,0,1,1,727450,9781856045728,English,"Dictionaries, Languages"
The Little Blue Book : The Essential Guide to Thinking and Talking Democratic,"George Lakoff, Elisabeth Wehling",160,Free Press,2012-06-26,13.75,1.75,4.01,337,4,11,74,137,111,236985,9781476700014,English,"Dictionaries, Languages"
MINNA NO NIHONGO SHOKYU [2ND ED.] VOL. 2 WORKBOOK HYOJUN MONDAISHU,3A Corporation,64,3A Corporation,2013-06-01,15.77,11.73,4.12,64,1,4,9,22,28,19833,9784883196630,Japanese,"Dictionaries, Languages"
Level 5: Sherlock Holmes Short Stories Book and MP3 Pack : Industrial Ecology,"Arthur Conan Doyle, Arthur Doyle",9998,Pearson Education Limited,2015-08-07,12.11,0.72,3.88,336,9,12,86,132,97,446326,9781408276549,English,"Dictionaries, Languages"
Ragdoll : Now a major TV series,Daniel Cole,400,Orion Publishing Co,2017-10-19,10.12,1.38,3.88,18981,322,1103,4546,7646,5364,47537,9781409168768,English,"Dictionaries, Languages"
"Illustrated History of Britain, An Paper",David McDowall,192,Pearson Education Limited,1989-02-27,42.30,2.63,3.64,304,3,27,104,111,59,383720,9780582749146,English,"Dictionaries, Languages"
Oxford Discover: 3: Student Book,Lesley Koustaff,192,Oxford University Press,2013-12-05,50.16,9.84,4,1,0,0,0,1,0,570201,9780194278713,English,"Dictionaries, Languages"
"The Books of Nahum, Habakkuk, and Zephaniah",Thomas Renz,743,William B Eerdmans Publishing Co,2021-06-08,53.15,2.85,5,2,0,0,0,0,2,611219,9780802826268,English,"Dictionaries, Languages"
Cambridge English Proficiency 2 Student's Book with Answers with Audio : Authentic Examination Papers from Cambridge English Language Assessment,Various,176,Cambridge University Press,2015-05-21,43.74,3.91,3,1,0,0,1,0,0,119504,9781107646513,English,"Dictionaries, Languages"
Nelson International Science Student Book 6,Anthony Russell,136,Oxford University Press,2014-11-01,19.10,1.40,5,1,0,0,0,0,1,571037,9781408517253,English,"Dictionaries, Languages"
Nuevo Espanol en Marcha 3: Student Book with CD Level B1: Level 3 : Curso de Espanol Como Lengua Extranjera,"Francisco Castro Viudez, Ignacio Rodero Díez, Carmen Sardinero Francos",182,Sociedad General Espanola de Libreria,2014-09-15,41.04,3.76,5,1,0,0,0,0,1,4785,9788497787406,Spanish,"Dictionaries, Languages"
Talk French 2 Book,Sue Purcell,160,Pearson Education Limited,2014-08-15,8.64,1.36,5,1,0,0,0,0,1,468974,9781406679106,English,"Dictionaries, Languages"
Cambridge English Proficiency 1 for Updated Exam Self-study Pack (Student's Book with Answers and Audio CDs (2)) : Authentic Examination Papers from Cambridge ESOL,Cambridge Esol,164,Cambridge University Press,2012-11-30,44.76,3.14,3.9,10,0,1,3,2,4,89306,9781107691643,English,"Dictionaries, Languages"
Easy Steps to Chinese: Textbook v. 4,Yamin Ma,163,"Beijing Language & Culture University Press,China",2007-12-01,31.79,15.20,4.75,4,0,0,0,1,3,22363,9787561919965,English,"Dictionaries, Languages"
This Is Not A Book,Keri Smith,224,Penguin Books Ltd,2011-06-16,14.58,1.42,4.02,1505,37,93,307,434,634,23512,9781846144448,English,"Dictionaries, Languages"
Save the Cat! : The Last Book on Screenwriting You'll Ever Need,Blake Snyder,216,Michael Wiese Productions,2007-01-29,18.31,0.19,4.04,16749,318,838,3076,6134,6383,24085,9781932907001,English,"Dictionaries, Languages"
An Illustrated Book of Bad Arguments,"Ali Almossawi, Alejandro Giraldo",64,Scribe Publications,2014-12-04,16.68,1.82,3.8,4687,56,363,1317,1676,1275,16145,9781922247810,English,"Dictionaries, Languages"
Complete Ukrainian Beginner to Intermediate Course : (Book and audio support),"Olena Bekh, James Dingley",320,John Murray Press,2010-10-13,47.77,1.73,3.86,7,0,0,3,2,2,45421,9781444104134,English,"Dictionaries, Languages"
Two Sides of a Coin: Juxtaposing Views on Interpreting the Book of the Twelve / the Twelve Prophetic Books,"James D. Nogalski, Thomas Roemer, Ehud Ben Zvi",102,Gorgias Press,2009-08-27,33.94,5.76,3,1,0,0,1,0,0,795340,9781607243038,English,"Dictionaries, Languages"
Words Fail Me,Patricia T. O'Conner,240,Cengage Learning EMEA,2000-12-28,14.56,1.94,3.96,549,5,15,137,234,158,251262,9780156010870,English,"Dictionaries, Languages"
Introduction to Italian Poetry : A Dual-Language Book,Luciano Rebay,160,Dover Publications Inc.,2000-01-02,9.08,1.42,4.19,52,0,0,11,20,21,124213,9780486267159,English,"Dictionaries, Languages"
Macmillan Books for Teachers: Discover English,"Rod Bolitho, Brian Tomlinson",128,Hueber Verlag GmbH,2009-02-09,41.71,1.29,3.7,23,1,4,5,4,9,1142296,9783190125838,English,"Dictionaries, Languages"
Great Russian Short Stories of the Twentieth Century : A Dual-Language Book,Francis,288,Dover Publications Inc.,2013-04-29,15.03,3.47,3.9,20,0,0,5,12,3,59321,9780486488738,English,"Dictionaries, Languages"
The Book of Language : Exploring the Spritual Vocabulary of Islam,Kabir Helminski,184,The Book Foundation,2006-11-09,14.61,4.39,3.45,11,1,2,3,1,4,557126,9781904510161,English,"Dictionaries, Languages"
Teaching Other Subjects Through English (CLIL),"Sheelagh Deller, Christine Price",168,Oxford University Press,2007-05-10,32.07,14.43,4,8,0,1,1,3,3,260783,9780194425780,English,"Dictionaries, Languages"
Power Up Level 2 Pupil's Book,Caroline Nixon,124,Cambridge University Press,2018-09-06,27.83,0.17,4,2,0,0,1,0,1,350603,9781108413763,English,"Dictionaries, Languages"
The Book of Lamentations,John Goldingay,240,William B Eerdmans Publishing Co,2022-03-01,34.10,9.40,4.4,5,0,0,1,1,3,335351,9780802825421,English,"Dictionaries, Languages"
Get Started in Italian Absolute Beginner Course : (Book and audio support),Vittoria Bowles,224,John Murray Press,2014-09-26,16.38,17.62,4,2,0,0,0,2,0,113336,9781444174717,English,"Dictionaries, Languages"
Storyfun for Flyers Teacher's Book with Audio CDs (2),Karen Saxby,64,Cambridge University Press,2011-07-31,18.64,4.24,5,2,0,0,0,0,2,408532,9780521126670,English,"Dictionaries, Languages"
The Little Red Writing Book,Brandon Royal,130,Maven Publishing,2012-02-01,10.23,2.77,3.79,436,8,30,125,157,116,421890,9781897393208,English,"Dictionaries, Languages"
Eyes Open Level 3 Student's Book,"Ben Goldstein, Ceri Jones, Eoin Higgins",128,Cambridge University Press,2017-03-01,29.73,4.10,2,1,0,1,0,0,0,406856,9781107467620,English,"Dictionaries, Languages"
Technical English Level 1 Course Book,David Bonamy,128,Pearson Education Limited,2013-02-25,26.10,12.41,3.6,43,8,7,1,5,22,45974,9781405845458,English,"Dictionaries, Languages"
Eugene O'Neill: Complete Plays Vol. 3 1932-1943 (LOA #42),Eugene O'Neill,1000,The Library of America,1988-11-01,40.04,4.96,4.34,320,3,5,42,99,171,49662,9780940450509,English,"Dictionaries, Languages"
"Writing Children's Books For Dummies, 3rd Edition",L Rojany Buccieri,432,John Wiley & Sons Inc,2022-06-30,21.17,4.83,3.92,268,7,14,61,97,89,972936,9781119870012,English,"Dictionaries, Languages"
Great Russian Short Stories of the Twentieth Century : A Dual-Language Book,Francis,288,Dover Publications Inc.,2013-04-29,15.03,3.47,3.9,20,0,0,5,12,3,59321,9780486488738,English,"Dictionaries, Languages"
New English File: Beginner: Teacher's Book with Test and Assessment CD-ROM : Six-level general English course for adults,"Clive Oxenden, Christina Latham-Koenig, Jane Hudson, David Jay, Gill Hamilton",208,Oxford University Press,2009-04-23,55.06,0.04,4.71,7,0,0,0,2,5,315126,9780194518772,English,"Dictionaries, Languages"
Complete Romanian Beginner to Intermediate Course : (Book and audio support),"Dennis Deletant, Yvonne Alexandrescu",256,John Murray Press,2010-09-24,32.84,15.16,3.86,14,0,2,3,4,5,44454,9781444105599,English,"Dictionaries, Languages"
The Art of Adaptation : Turning Fact and Fiction into Film,Linda Seger,238,Henry Holt & Company Inc,2000-09-05,18.62,1.18,3.66,176,2,13,54,81,26,322102,9780805016260,English,"Dictionaries, Languages"
"Book Lust : Recommended Reading for Every Mood, Moment, and Reason",Nancy Pearl,304,SASQUATCH BOOKS,2003-09-01,17.57,0.43,3.77,3592,58,259,1031,1354,890,225833,9781570613814,English,"Dictionaries, Languages"
Easy Steps to Chinese vol.4 - Workbook,Ma Yamin,190,"Beijing Language & Culture University Press,China",2007-12-01,31.06,13.22,4,5,1,0,0,1,3,20213,9787561920008,English,"Dictionaries, Languages"
Get Started in Beginner's Portuguese: Teach Yourself : (Book and audio support),Sue Tyson-Ward,224,John Murray Press,2014-03-25,18.03,26.97,3.73,11,1,1,2,3,4,137514,9781444174861,English,"Dictionaries, Languages"
The Oxford Book of Aphorisms,John Gross,394,Oxford University Press,2003-04-24,22.32,12.48,4.19,117,2,4,24,27,60,197871,9780192804563,English,"Dictionaries, Languages"
Get Started in Norwegian Absolute Beginner Course : (Book and audio support),Irene Burdese,240,John Murray Press,2016-02-16,18.22,13.28,3,3,0,0,3,0,0,42095,9781473612709,English,"Dictionaries, Languages"
Oxford EAP: Intermediate/B1+: Student's Book and DVD-ROM Pack,"Edward De Chazal, Louis Rogers",223,Oxford University Press,2013-03-12,48.24,10.96,4.75,4,0,0,0,1,3,64875,9780194002011,English,"Dictionaries, Languages"
Biblical Hebrew Vocabulary in Context : Building Competency with Words Occurring 50 Times or More,"Miles V. Van Pelt, Gary D. Pratico",144,Zondervan,2019-08-22,15.24,4.66,4.75,4,0,0,0,1,3,571856,9780310098478,English,"Dictionaries, Languages"
Three Uses of the Knife : On the Nature and Purpose of Drama,David Mamet,96,Random House USA Inc,2000-06-13,11.59,2.91,3.87,1650,35,93,417,608,497,121105,9780375704239,English,"Dictionaries, Languages"
"Complete Japanese Beginner to Intermediate Book and Audio Course : Learn to read, write, speak and understand a new language with Teach Yourself",Helen Gilhooly,288,John Murray Press,2017-03-28,27.77,9.83,4,2,0,0,0,2,0,12824,9781471800498,English,"Dictionaries, Languages"
The Little Book of Foreign Swear Words,Sid Finch,96,Octopus Publishing Group,2022-10-04,7.17,1.83,3.82,22,2,2,3,6,9,28932,9781787837690,English,"Dictionaries, Languages"
IELTS 16 General Training Student's Book with Answers with Audio with Resource Bank,Cambridge University Press,144,Cambridge University Press,2021-07-08,39.01,2.57,4,1,0,0,0,1,0,181986,9781108933865,English,"Dictionaries, Languages"
First Italian Reader : A Beginner's Dual-Language Book,Stanley Applebaum,240,Dover Publications Inc.,2008-09-25,12.64,2.86,4.23,13,0,0,1,8,4,59944,9780486465357,English,"Dictionaries, Languages"
Speakout Starter Students Book with DVD/Active Book Multi Rom Pack,"Frances Eales, Steve Oakes",160,Pearson Education Limited,2012-03-29,34.05,7.67,3.2,5,1,1,1,0,2,259526,9781408291818,English,"Dictionaries, Languages"
Cutting Edge Starter New Edition Students' Book and DVD Pack,"Sarah Cunningham, Peter Moor, Araminta Crace",128,Pearson Education Limited,2016-01-01,32.83,7.82,3,1,0,0,1,0,0,177245,9781447936947,English,"Dictionaries, Languages"
"If You Want to Write : A Book about Art, Independence and Spirit",Brenda Ueland,164,www.bnpublishing.com,2013-01-21,12.61,0.59,4.12,8098,167,397,1428,2410,3696,66226,9789650060282,English,"Dictionaries, Languages"
BANANAGRAMS (R): The Insider Secrets to Help you Become Top Banana!,"Collins Dictionaries, Deej Johnson",128,HarperCollins Publishers,2014-12-01,5.61,3.19,4,6,1,0,0,2,3,17118,9780007588305,English,"Dictionaries, Languages"
Get Started in French Absolute Beginner Course : (Book and audio support),Catrine Carpenter,240,John Murray Press,2014-03-25,20.94,1.06,4.1,10,1,0,0,5,4,45415,9781444174595,English,"Dictionaries, Languages"
Dark Archives : A Librarian's Investigation into the Science and History of Books Bound in Human Skin,Megan Rosenbloom,288,St Martin's Press,2021-10-19,13.13,5.37,4.06,3761,30,141,662,1662,1266,198339,9781250800169,English,"Dictionaries, Languages"
Destination Grammar C1 & C2 : Student's Book with Key,"Malcolm Mann, Steve Taylore-Knowles",312,Macmillan Education,2008-01-31,43.88,11.70,4.62,32,0,0,4,4,24,66794,9780230035409,English,"Dictionaries, Languages"
Dark Archives : A Librarian's Investigation into the Science and History of Books Bound in Human Skin,Megan Rosenbloom,288,"Farrar, Straus & Giroux Inc",2020-10-20,19.88,4.62,4.06,3766,30,142,662,1662,1270,197911,9780374134709,English,"Dictionaries, Languages"
Eyewitness Travel Guides: French Phrase Book & CD,Dk,144,DK,2003-04-21,9.94,1.06,3.75,16,1,0,5,6,4,50481,9780789495051,English,"Dictionaries, Languages"
Children's Writer's Word Book,Alijandra Mogilner,352,F&W Publications Inc,2006-07-26,20.06,0.44,4.2,153,2,4,27,49,71,262223,9781582974132,English,"Dictionaries, Languages"
Key Words: 11c Books are exciting,"Ladybird, William Murray",56,Penguin Random House Children's UK,2009-07-02,5.33,1.62,3.83,6,0,0,3,1,2,167366,9781409301394,English,"Dictionaries, Languages"
Easy Spanish Phrase Book NEW EDITION,Garcia Loaeza,80,Dover Publications Inc.,2013-04-29,4.73,0.27,3.73,360,15,38,86,111,110,57304,9780486499055,English,"Dictionaries, Languages"
Easy and Engaging ESL Activities and Mini-books for Every Classroom,Kama Eilnhorn,64,Scholastic US,2001-06-01,12.68,0.32,3.44,36,2,4,13,10,7,88296,9780439153911,English,"Dictionaries, Languages"
"Book Business : Publishing Past, Present, and Future",Jason Epstein,226,WW Norton & Co,2002-03-27,17.52,0.58,3.48,411,6,40,171,138,56,622232,9780393322347,English,"Dictionaries, Languages"
The Only Grammar Book You'll Ever Need : A One-Stop Source for Every Writing Assignment,"Susan Thurman, Larry Shea",192,Adams Media Corporation,2003-05-01,10.55,0.95,4.04,1044,26,54,191,359,414,37534,9781580628556,English,"Dictionaries, Languages"
Do Present : How To Give A Talk And Be Heard,Mark Shayler,128,The Do Book Co,2020-07-07,10.01,2.49,4.04,28,0,2,6,9,11,442124,9781907974762,English,"Dictionaries, Languages"
"Read Harder (A Reading Log): Track Books, Chart Progress","Book Riot, Piet Aukeman",160,ABRAMS,2018-09-04,12.03,5.47,4.63,27,0,0,2,6,19,46414,9781419732553,English,"Dictionaries, Languages"
Oxford Latin Course: Part I: Student's Book,"Maurice Balme, James Morwood",160,Oxford University Press,1996-05-30,30.09,9.91,3.78,138,5,11,39,37,46,24120,9780199122264,Latin,"Dictionaries, Languages"
Reading Like a Writer : A Guide for People Who Loves Books and for Those Who Want to Write Them,Francine Prose,272,HarperCollins Publishers Inc,2011-09-13,16.28,0.52,3.77,10726,215,793,2857,4189,2672,66858,9780060777050,English,"Dictionaries, Languages"
"Aristotle: Nicomachean Ethics, Books II-IV : Translated with an introduction and commentary",C. C. W. Taylor,284,Oxford University Press,2006-10-05,52.64,8.26,4,5,0,0,1,3,1,1238685,9780198250678,English,"Dictionaries, Languages"
Nuevo Espanol 2000 Medio Student Book + CD,"Jesús Sánchez Lobato, Nieves Garcia Fernández",263,Sociedad General Espanola de Libreria,2008-02-01,41.96,1.54,4,1,0,0,0,1,0,489428,9788497783040,Spanish,"Dictionaries, Languages"
Children's Books in Children's Hands : A Brief Introduction to Their Literature,"Charles Temple, Miriam Martinez, Junko Yokota",416,Pearson Education (US),2018-08-26,86.24,5.26,4.15,104,1,4,15,42,42,1406912,9780134798684,English,"Dictionaries, Languages"
Biblical Hebrew Vocabulary in Context : Building Competency with Words Occurring 50 Times or More,"Miles V. Van Pelt, Gary D. Pratico",144,Zondervan,2019-08-22,15.24,4.66,4.75,4,0,0,0,1,3,571856,9780310098478,English,"Dictionaries, Languages"
JUST READING & WRITING BRE INTSTUDENT BOOK,"Jeremy Harmer, Carol Lethaby, Ana Acevedo",250,Cengage Learning EMEA,2003-05-31,17.34,7.66,4.12,8,1,0,0,3,4,482562,9780462007113,English,"Dictionaries, Languages"
Book Architecture : How to Plot and Outline Without Using a Formula,Stuart Horwitz,156,Book Architecture,2015-05-05,19.98,15.82,4.17,198,3,5,34,69,87,614051,9780986420405,English,"Dictionaries, Languages"
Get Started in Hungarian Absolute Beginner Course : (Book and audio support),Zsuzsa Pontifex,208,John Murray Press,2014-11-28,20.97,16.03,4.57,7,0,0,1,1,5,200383,9781444183177,English,"Dictionaries, Languages"
Get Started in Japanese Absolute Beginner Course : (Book and audio support),Helen Gilhooly,240,John Murray Press,2014-12-12,18.25,13.25,3.43,7,1,0,1,5,0,50746,9781444174748,English,"Dictionaries, Languages"
"Aleph Isn't Tough: An Introduction to Hebrew for Adults, Book 1",Behrman House,112,UAHC Press,2000-03-01,20.25,4.74,4.4,105,1,1,12,32,59,351226,9780807407264,Hebrew,"Dictionaries, Languages"
The Trade in Rare Books and Manuscripts between Britain and America c. 1890-1929,"Danielle Magnusson, Laura Cleaver",75,Cambridge University Press,2022-09-08,13.98,0.60,3,1,0,0,1,0,0,1344202,9781009069052,English,"Dictionaries, Languages"
Books of the Beast : New Edition,Timothy D'Arch Smith,128,Mandrake of Oxford,2022-04-03,16.78,7.92,4.08,13,0,0,2,8,3,1486908,9781869928179,English,"Dictionaries, Languages"
Eyewitness Travel Guides: Portuguese Phrase Book & CD,Dk,128,DK,2003-07-21,9.72,3.23,3.14,7,0,3,1,2,1,508623,9780789495082,English,"Dictionaries, Languages"
The Uncollected Essays of Elizabeth Hardwick,"Elizabeth Hardwick, Alex Andriesse",304,"The New York Review of Books, Inc",2022-05-24,16.45,3.55,4.2,49,0,0,7,25,17,295965,9781681376233,English,"Dictionaries, Languages"
The Choreography of Presenting : The 7 Essential Abilities of Effective Presenters,"Kendall V. Zoller, Claudette Landry",168,SAGE Publications Inc,2010-04-08,27.51,7.99,4.05,44,0,2,8,20,14,521765,9781412976923,English,"Dictionaries, Languages"
Selected Fables : A Dual-Language Book,Jean de La Fontaine,224,Dover Publications Inc.,2003-03-28,12.36,0.14,3.76,387,10,23,110,149,95,59275,9780486295749,English,"Dictionaries, Languages"
Complete Brazilian Portuguese Beginner to Intermediate Course : (Book and audio support),"E Pereira de Almeida Rowbotham, Ethel Pereira De Almeida Rowbotham, Sue Tyson-Ward",336,John Murray Press,2016-11-15,31.06,6.94,3.37,35,5,1,12,10,7,128094,9781444198447,English,"Dictionaries, Languages"
How To Write A Book : Writing A Novel That Sells,Dan Brown,104,NMD Books,2016-03-17,24.22,0.28,2.8,5,1,2,0,1,1,463356,9781936828449,English,"Dictionaries, Languages"
"HSK 2 Storybook Vol 1 : Stories in Simplified Chinese and Pinyin, 300 Word Vocabulary Level","B Y Leong, Y L Hoe",156,Independently Published,2019-08-01,15.59,0.15,4.23,13,1,0,3,0,9,507379,9781086549850,English,"Dictionaries, Languages"
B1 Preliminary 1 for the Revised 2020 Exam Student's Book with Answers with Audio with Resource Bank : Authentic Practice Tests,Cambridge University Press,160,Cambridge University Press,2019-08-15,39.71,1.83,3,1,0,0,1,0,0,286055,9781108676410,English,"Dictionaries, Languages"
The Little Black Book of Business Writing,"Mark Tredinnick, Geoff Whyte",224,NewSouth Publishing,2010-06-01,22.75,11.25,4,18,0,0,5,8,5,365759,9781742230061,English,"Dictionaries, Languages"
Level 3:Notting Hill Book & MP3 Pack : Industrial Ecology,Richard Curtis,9998,Pearson Education Limited,2015-07-18,12.41,3.09,3.54,92,6,13,23,25,25,326502,9781447925712,English,"Dictionaries, Languages"
A Dictionary of Symbols,"Juan Eduardo Cirlot, Philip Pullman",528,"The New York Review of Books, Inc",2020-09-22,35.25,0.75,4.14,752,17,31,128,228,348,226485,9781681371979,English,"Dictionaries, Languages"
"The McGraw-Hill Desk Reference for Editors, Writers, and Proofreaders(Book + CD-Rom)","K. D. Sullivan, Merilee Eggleston",304,McGraw-Hill Education - Europe,2006-07-13,18.60,1.40,3.94,67,1,3,15,28,20,265672,9780071470001,English,"Dictionaries, Languages"
Complete Nepali Beginner to Intermediate Course : (Book and audio support),"Michael Hutt, Abhi Subedi",368,John Murray Press,2014-03-25,37.66,7.84,3.35,23,4,1,6,7,5,43819,9781444101973,English,"Dictionaries, Languages"
"Project X Origins: Grey Book Band, Oxford Level 13: Great Escapes: Revenge of the X-bots!",Anthony McGowan,48,Oxford University Press,2014-01-09,7.37,3.13,4.17,6,1,0,0,1,4,35897,9780198303060,English,"Dictionaries, Languages"
A Purple Summer : Notes on the Lyrics of Spring Awakening,Steven Sater,100,Hal Leonard Corporation,2012-02-01,10.60,2.35,4.07,207,0,8,51,67,81,278000,9781557838247,English,"Dictionaries, Languages"
English in Mind Level 2 Student's Book,"Herbert Puchta, Jeff Stranks",128,Cambridge University Press,2004-02-09,37.54,0.96,4.33,18,1,1,1,3,12,305940,9780521750554,English,"Dictionaries, Languages"
Wordless Books : So Much to Say!,"Gilda Martinez-Alba, Judith Cruzado-Guerrero",138,"Teachers of English to Speakers of Other Languages, Incorporated (TESOL)",2016-03-30,29.92,8.58,3,2,0,0,2,0,0,2748124,9781942223337,English,"Dictionaries, Languages"
Cambridge English First for Schools 3 Student's Book with Answers with Audio,Cambridge University Press,192,Cambridge University Press,2018-05-24,40.95,4.94,3,3,1,0,1,0,1,269255,9781108380850,English,"Dictionaries, Languages"
Children's Speech and Literacy Difficulties Book 1 - A Psycholinguistic Framework,J Stackhouse,398,John Wiley and Sons Ltd,2005-11-29,51.09,39.61,3.67,3,0,1,0,1,1,269553,9781861560308,English,"Dictionaries, Languages"
Chinese Flash Cards Kit Volume 3: Volume 3 : HSK Upper Intermediate Level (Online Audio Included),"Philip Yungkin Lee, Jun Yang",32,Tuttle Publishing,2014-03-04,26.39,3.11,4.56,9,0,0,1,2,6,146406,9780804842037,English,"Dictionaries, Languages"
