title,authors,number_of_pages,publisher,publication_date,price_in_euros,discount_in_euros,rating,number_of_votes_goodreads,number_of_votes_one_star,number_of_votes_two_stars,number_of_votes_three_stars,number_of_votes_four_stars,number_of_votes_five_stars,bestsellers_rank,isbn13,language,category
The Southerner's Handbook : A Guide to Living the Good Life,Editors of Garden and Gun,304,HARPER WAVE,2013-10-29,29.37,3.13,3.97,904,10,44,225,310,315,580034,9780062242389,English,"Food, Drink"
The Stick Man Family Tree Recipe Book (HB),"Julia Donaldson, Axel Scheffler",64,Scholastic,2020-07-23,14.97,1.03,5,1,0,0,0,0,1,364576,9781407196824,English,"Food, Drink"
"Spirituous Journey: Book 2 : A History of Drink, Book Two","Jared McDaniel Brown, Anistatia Renard Miller, Gary Regan",272,Mixellany Limited,2010-03-10,20.11,4.49,4.5,6,0,0,1,1,4,825045,9781907434068,English,"Food, Drink"
"The Ultimate Peanut Butter Book : Savory and Sweet, Breakfast to Dessert, Hundereds of Ways to Use America's Favorite Spread","Bruce Weinstein, Mark Scarbrough",264,HarperCollins Publishers Inc,2012-06-05,19.07,2.93,3.75,28,0,3,8,10,7,444650,9780060562762,English,"Food, Drink"
A Book of Feasts and Seasons,Joanna Bogle,212,Gracewing,1993-01-01,16.36,2.04,4.09,22,0,1,5,7,9,492562,9780852442173,English,"Food, Drink"
Braai : The South African Barbecue Book,Jan Braai,200,"Little, Brown Book Group",2017-04-25,22.82,0.68,3.33,9,1,2,1,3,2,326841,9781472137616,English,"Food, Drink"
Martha Lloyd's Household Book : The Original Manuscript from Jane Austen's Kitchen,"Deirdre Le Faye, Julienne Gehrer",312,Bodleian Library,2021-07-22,43.18,6.82,4.25,12,0,0,2,5,5,428031,9781851245604,English,"Food, Drink"
"Do Wild Baking : Food, Fire and Good Times",Tom Herbert,160,The Do Book Co,2017-11-02,10.68,2.32,4.1,20,0,1,4,7,8,310165,9781907974359,English,"Food, Drink"
Cooking Books : Cooking with Quinoa and Gluten Free,Debra Laguire,124,Healthy Lifestyles,2013-03-12,9.26,2.24,3.3,10,2,1,3,0,4,1285619,9781631878091,English,"Food, Drink"
Corkscrewed : Adventures in the New French Wine Country,Robert V. Camuto,216,University of Nebraska Press,2010-06-01,15.99,1.01,3.81,63,0,5,16,28,14,969407,9780803229785,English,"Food, Drink"
Hot Fat,"Russell Alford, Patrick Hanlon",72,Nine Bean Rows Books,2022-05-05,14.43,1.57,4.88,16,0,0,0,2,14,335852,9781999379919,English,"Food, Drink"
"Real Ale Record Book : 40 Pubs, 170 Beers",Adrian Tierney-Jones,124,The History Press Ltd,2010-05-26,11.91,1.09,5,1,0,0,0,0,1,964164,9780752457154,English,"Food, Drink"
Complete Coconut Cookbook,Camilla V. Saulsbury,320,Robert Rose Inc,2014-09-11,20.71,4.29,3.72,18,1,1,4,8,4,439590,9780778804888,English,"Food, Drink"
The Little Book of Big Weight Loss,Bernadette Fisers,144,Atria Books,2017-12-26,15.15,0.85,3.42,74,4,7,27,26,10,396073,9781501183782,English,"Food, Drink"
The Little Bach Book : An eclectic Omnibus of Notable Details about the Life and Times of the esteemed and highly respected Johann Sebastian Bach,David Gordon,160,Lucky Valley Press,2017-06-14,19.58,3.12,4.6,20,0,0,2,4,14,426295,9780692878415,English,"Food, Drink"
A Little Book of Scottish Baking,"Marion Maxwell, Catherine McWilliams",60,Pelican Publishing Co,1997-07-31,9.32,0.18,3.9,10,0,0,4,3,3,942081,9781565542907,English,"Food, Drink"
Book for Cooks: 100 Classic Cookbooks,Leslie Geddes-Brown,224,Merrell Publishers Ltd,2012-10-16,42.35,10.65,3.67,12,1,0,4,4,3,1023285,9781858945798,English,"Food, Drink"
Diet Recipe Book : Intermittent Fasting and Metabolism Foods for Weight Loss,"Francis Harris, Rosie Townsend",186,Healthy Lifestyles,2014-06-26,11.76,0.94,1,2,2,0,0,0,0,9781633830677,9781633830677,English,"Food, Drink"
The Complete Book of Cheese,Bob Brown,332,Read Books,2011-08-12,31.57,8.83,3.61,94,6,11,22,30,25,9781447422150,9781447422150,English,"Food, Drink"
An Indian Family Recipe Book : Over 100 traditional recipes,Laxmi Khurana,224,"Little, Brown Book Group",2022-06-14,7.19,4.31,3.5,2,0,0,1,1,0,9781472146984,9781472146984,English,"Food, Drink"
Pieman - The Papa D Story : The Secret To Life Through Comfort Foods,"June V Bourgo, Dennis Bourgo",222,Next Chapter,2022-09-06,17.23,2.37,5,3,0,0,0,0,3,9784824148766,9784824148766,English,"Food, Drink"
The Little Book of Coffee : No filter,Orange Hippo!,192,Welbeck Publishing Group,2021-06-15,9.90,0.10,4,2,0,0,0,2,0,9781800690172,9781800690172,English,"Food, Drink"
Cookery Blue Book,First Unitarian Society of San Francisco Society for Christian Work,132,Applewood Books,2008-01-04,11.59,0.41,3.65,17,1,2,6,1,7,9781429011402,9781429011402,English,"Food, Drink"
Merrie Christmas Drink Book,Ruth Mccrea,64,Read Books,2010-07-27,25.30,8.00,4,1,0,0,0,1,0,9781445513928,9781445513928,English,"Food, Drink"
Freezing of Fruits and Vegetables : An Agribusiness Alternative for Rural and Semi-Rural Areas,"Gustavo V. Barbosa-Canovas, Bilge Altunakar, Danilo J. Mejia-Lorio",82,Food & Agriculture Organization of the United Nations (FAO),2010-07-30,15.80,2.20,4,1,0,0,0,1,0,4088540,9789251052952,English,"Food, Drink"
"Enlightened Soups : More Than 135 Light, Healthy, Delicious, and Beautiful Soups in 60 Minutes or Less",Camilla V. Saulsbury,184,"Cumberland House Publishing,US",2008-11-10,24.97,7.03,4.07,15,0,2,3,2,8,3569225,9781581826647,English,"Food, Drink"
The Tea & Sympathy Mysteries : Books 4 - 6,J New,522,J. New,2022-10-10,32.71,0.99,5,2,0,0,0,0,2,9798215485439,9798215485439,English,"Food, Drink"
Happy Food For the Tummy : Food Coloring Books,Jupiter Kids,106,Jupiter Kids,2016-04-01,13.47,2.63,1,1,1,0,0,0,0,9781683052326,9781683052326,English,"Food, Drink"
The Kama Sutra Kitchen : An Aphrodisiac Recipe Book,Ashley Apple,130,Ashley Apple,2014-04-30,16.07,10.53,4.67,3,0,0,0,1,2,1530042,9780615998930,English,"Food, Drink"
"A Parrot's Healthy Meal Planner : Easy Recipes to Help You Feed Your Bird a Balanced Nutritional Diet, Book 1",Karmen Budai,40,K&S Natural Company Ltd,2020-05-15,14.94,7.46,5,1,0,0,0,0,1,941328,9781527259386,English,"Food, Drink"
"John Evelyn, Cook : The Manuscript Recipe Book of John Evelyn","John Evelyn, Christopher Driver",250,PROSPECT BOOKS,1997-10-02,29.43,18.57,3,1,0,0,1,0,0,1531370,9780907325659,English,"Food, Drink"
The Lady Jewel Diviner : Book 1 in the Lady Diviner series,Rosalie Oaks,266,Parkerville Press,2021-01-17,14.88,0.92,3.85,932,14,52,249,359,258,1177369,9780645027853,English,"Food, Drink"
Foods That Combat Aging : The Nutritional Way to Stay Healthy Longer,Deborah Mitchell,240,HarperCollins Publishers Inc,2008-01-14,7.58,0.42,2.82,11,0,3,7,1,0,2029012,9780061346200,English,"Food, Drink"
"The Mushroom Book : A Popular Guide to the Identification and Study of Our Commoner Fungi, with Special Emphasis on the Edible Varieties",Nina Lovering Marshall,338,Franklin Classics Trade Press,2018-10-22,26.32,0.63,5,1,0,0,0,0,1,9780344009525,9780344009525,English,"Food, Drink"
Are You My Wine? : A Children's Book Parody for Adults Exploring the World of Wine,Reese Ling,32,Ulysses Press,2021-06-17,8.52,2.48,4.43,21,0,1,3,3,14,29115,9781646042579,English,"Food, Drink"
Adventures in the Slavic Kitchen : A book of Essays with Recipes,Igor Klekh,186,GLAGOSLAV PUBLICATIONS B.V.,2016-09-30,29.85,3.15,3.6,5,0,0,3,1,1,1601350,9781784379971,English,"Food, Drink"
The Yummiest Githeri,Kwame Nyong'o,36,Kwame Nyong'o,2019-01-15,11.33,1.17,5,1,0,0,0,0,1,2880301,9789966825520,English,"Food, Drink"
I Love Ugali and Sukuma Wiki,Kwame Nyong'o,36,Kwame Nyong'o,2019-04-06,11.33,0.27,4,3,0,0,1,1,1,2877032,9789966825483,English,"Food, Drink"
Foods That Combat Aging : The Nutritional Way to Stay Healthy Longer,Deborah Mitchell,240,HarperCollins Publishers Inc,2008-01-14,7.58,0.42,2.82,11,0,3,7,1,0,2029012,9780061346200,English,"Food, Drink"
"Kebab Recipes : 25 Kebab Recipes will take you through a journey of flavorful, colorful, and marinated steak, beef, chicken, lamb, fish, and pork kebab recipes with quarters of fresh vegetables",George V,56,George V.,2020-12-22,9.24,3.96,4.4,5,0,0,1,1,3,9781716308130,9781716308130,English,"Food, Drink"
Laxiba The Sorbitol Navigator : The Standard for Sorbitol Intolerance,J N Stratbucker,236,LAXIBA,2016-04-14,35.64,7.06,4,2,0,0,0,2,0,2279617,9781941978399,English,"Food, Drink"
"Kebab Recipes : 25 Kebab Recipes will take you through a journey of flavorful, colorful, and marinated steak",George V,56,Blurb,2022-11-10,23.27,9.73,4.4,5,0,0,1,1,3,9781034139812,9781034139812,English,"Food, Drink"
"The Low Carb Vegan Cookbook : Ketogenic Breads, Fat Bombs & Delicious Plant Based Recipes (Full-Color Edition)",Eva Hammond,210,HMPL Publishing,2017-11-25,30.26,16.74,3.67,21,1,2,7,4,7,2027802,9789492788115,English,"Food, Drink"
The Book Of Cheese,"Charles Thom, Walter Warner Fisk",276,Lector House,2020-06-06,17.70,0.70,3.85,13,0,0,6,3,4,9789389614121,9789389614121,English,"Food, Drink"
Body And Soul Food,Abby Collette,336,Bantam Doubleday Dell Publishing Group Inc,2021-11-30,9.67,0.33,3.5,620,10,57,249,220,84,2420170,9780593336175,English,"Food, Drink"
"Gilded Age Cocktails : History, Lore, and Recipes from America's Golden Age",Cecelia Tichi,176,New York University Press,2021-05-04,20.09,0.41,4.03,67,0,5,11,28,23,2178314,9781479805259,English,"Food, Drink"
The Book of Tea,"Kakuzo Okakura, 1stworldpublishing, 1stworldlibrary",108,1st World Publishing,2013-11-10,22.91,10.49,3.86,13112,248,854,3297,4796,3917,9781421851457,9781421851457,English,"Food, Drink"
The Book of Tea,"Kakuzo Okakura, Anita B Schafer",90,Littleberry Press LLC,2022-06-06,10.60,1.50,3.86,13112,248,854,3297,4796,3917,9781940750965,9781940750965,English,"Food, Drink"
"The Honey Book : Health, Healing & Recipes","Andrea Kirk Assaf, Amy Holliday",144,HarperCollins Publishers,2022-05-03,14.23,2.27,4,5,0,0,1,3,1,2901435,9780008430115,English,"Food, Drink"
Laxiba The Sorbitol Navigator : The Standard for Sorbitol Intolerance,J N Stratbucker,236,LAXIBA,2016-04-14,35.64,7.06,4,2,0,0,0,2,0,2279617,9781941978399,English,"Food, Drink"
"Gilded Age Cocktails : History, Lore, and Recipes from America's Golden Age",Cecelia Tichi,176,New York University Press,2021-05-04,20.09,0.41,4.03,67,0,5,11,28,23,2178314,9781479805259,English,"Food, Drink"
Body And Soul Food,Abby Collette,336,Bantam Doubleday Dell Publishing Group Inc,2021-11-30,9.67,0.33,3.5,620,10,57,249,220,84,2420170,9780593336175,English,"Food, Drink"
The Crawfish Book,Glen Pitre,277,University Press of Mississippi,1993-04-01,28.02,5.98,4,4,0,0,0,4,0,3160168,9780878055999,English,"Food, Drink"
The Book of Tea,Kakuzo Okakura,44,Alpha Edition,2021-11-22,11.03,1.57,3.86,13112,248,854,3297,4796,3917,9789355392176,9789355392176,English,"Food, Drink"
"A Book of Cookery : Containing Above Three Hundred Receipts Made at Hearth, Suitable for an Elegant Entertainment or Common Fare for Prepa",Kimberly K Walters,348,Kimberly K. Walters,2014-08-28,38.04,9.96,3.5,2,0,1,0,0,1,9780692269800,9780692269800,English,"Food, Drink"
The Book Of Cheese,Charles Thom,410,Read Books,2009-10-23,35.32,2.38,3.85,13,0,0,6,3,4,9781444653182,9781444653182,English,"Food, Drink"
The Book Of Cheese,Charles Thom,410,Read Books,2009-10-23,29.38,4.82,3.85,13,0,0,6,3,4,9781444653502,9781444653502,English,"Food, Drink"
The Book of the Chef,Chef Gilberto Barrera Prada,164,Xlibris,2009-10-27,22.58,27.22,5,1,0,0,0,0,1,9781441572929,9781441572929,Multiple languages,"Food, Drink"
Handbook of Herbs and Spices,K V Peter,624,Elsevier Science & Technology,2016-09-02,159.96,60.04,4,1,0,0,0,1,0,2909156,9780081016176,English,"Food, Drink"
"Seat Yourself : The Best of South Louisiana's Local Diners, Lunch Houses, and Roadside Stops",Alex V. Cook,192,Louisiana State University Press,2016-04-04,17.43,3.57,4,4,0,1,0,1,2,3120338,9780807162538,English,"Food, Drink"
Rockin' Chair Cowboys : and Other Short Stories,"V M Wolter, Joseph A Zapalac",290,Outskirts Press,2010-06-24,21.95,0.65,5,1,0,0,0,0,1,9781432760601,9781432760601,English,"Food, Drink"
The Book of the Chef,Chef Gilberto Barrera Prada,164,Xlibris,2009-10-27,22.58,27.22,5,1,0,0,0,0,1,9781441572929,9781441572929,Multiple languages,"Food, Drink"
Pieman - The Papa D Story : The Secret To Life Through Comfort Foods,"June V Bourgo, Dennis Bourgo",164,Next Chapter,2022-09-06,12.73,2.07,5,3,0,0,0,0,3,9784824148735,9784824148735,English,"Food, Drink"
The Book of Eating : Adventures in Professional Gluttony,Adam Platt,272,ECCO Press,2020-11-03,17.78,1.22,3.38,348,14,42,137,109,46,9780062293558,9780062293558,English,"Food, Drink"
The Faygo Book,Joe Grimm,136,Wayne State University Press,2018-10-01,34.70,13.10,4,57,0,2,12,27,16,9780814345856,9780814345856,English,"Food, Drink"
The Faygo Book,Joe Grimm,136,Wayne State University Press,2018-10-01,34.70,13.10,4,57,0,2,12,27,16,9780814345856,9780814345856,English,"Food, Drink"
The Book of Tea,Kakuzo Okakura,44,Alpha Edition,2021-11-22,11.03,1.57,3.86,13112,248,854,3297,4796,3917,9789355392176,9789355392176,English,"Food, Drink"
The Crawfish Book,Glen Pitre,277,University Press of Mississippi,1993-04-01,28.02,5.98,4,4,0,0,0,4,0,3160168,9780878055999,English,"Food, Drink"
The Catfish Book,"Linda Crawford, Craig Claiborne",140,University Press of Mississippi,2009-08-20,27.86,5.84,2.5,2,0,1,1,0,0,9781604733891,9781604733891,English,"Food, Drink"
This Book Cooks,Kerry Dunnington,236,Xlibris,2004-11-12,20.40,2.00,4.5,2,0,0,0,1,1,9781413465440,9781413465440,English,"Food, Drink"
"Recipe Book : The Best Food Recipes That Are Delicious, Healthy, Great For Energy And Easy To Make",Ace Mccloud,48,Pro Mastery Publishing,2017-03-21,21.30,1.60,2.4,5,1,2,1,1,0,9781640483156,9781640483156,English,"Food, Drink"
The Book of Tea,Kakuzo Okakura,108,Akasha Classics,2009-03-12,22.45,5.45,3.86,12987,246,845,3269,4744,3883,3611029,9781605123776,English,"Food, Drink"
Book of Donair : Everything You Wanted to Know about the Halifax Street Food That Became Canada's Favourite Kebab,Lindsay Wickstrom,192,MacIntyre Purcell Publishing Inc.,2020-08-17,22.88,1.12,4.4,10,0,0,1,4,5,9781772761542,9781772761542,English,"Food, Drink"
The Book of Tea,"Kakuzo Okakura, 1stworldpublishing, 1stworldlibrary",72,1st World Publishing,2013-11-10,9.36,5.14,3.86,13112,248,854,3297,4796,3917,9781421850474,9781421850474,English,"Food, Drink"
The Book of Tea,Kakuzo Okakura,94,Spinebill Press,2020-10-20,10.03,3.77,3.86,13112,248,854,3297,4796,3917,3051425,9780648531593,English,"Food, Drink"
The Book of Tea,Okakura Kakuzo,42,Digireads.com,2019-06-13,8.73,1.77,3.86,13112,248,854,3297,4796,3917,9781420962116,9781420962116,English,"Food, Drink"
The Book of Tea,Kakuzo Okakura,84,Wilder Publications,2009-01-30,10.97,2.03,3.86,13112,248,854,3297,4796,3917,9781604596434,9781604596434,English,"Food, Drink"
The Book of Tea,Kakuzo Okakura,76,Cosimo Classics,2007-03-31,12.32,2.18,3.86,13112,248,854,3297,4796,3917,9781602060432,9781602060432,English,"Food, Drink"
The Book of Tea,Kakuzo Okakura,108,Akasha Classics,2009-03-12,22.45,5.45,3.86,12987,246,845,3269,4744,3883,3611029,9781605123776,English,"Food, Drink"
Book of Donair : Everything You Wanted to Know about the Halifax Street Food That Became Canada's Favourite Kebab,Lindsay Wickstrom,192,MacIntyre Purcell Publishing Inc.,2020-08-17,22.88,1.12,4.4,10,0,0,1,4,5,9781772761542,9781772761542,English,"Food, Drink"
The Book of Tea,Kakuzo Okakura,108,Akasha Classics,2009-03-12,22.45,5.45,3.86,12987,246,845,3269,4744,3883,3611029,9781605123776,English,"Food, Drink"
The Book of Tea,"Kakuzo Okakura, 1stworldpublishing, 1stworldlibrary",72,1st World Publishing,2013-11-10,9.36,5.14,3.86,13112,248,854,3297,4796,3917,9781421850474,9781421850474,English,"Food, Drink"
"Recipe Book : The Best Food Recipes That Are Delicious, Healthy, Great For Energy And Easy To Make",Ace Mccloud,48,Pro Mastery Publishing,2017-03-21,21.30,1.60,2.4,5,1,2,1,1,0,9781640483156,9781640483156,English,"Food, Drink"
The Book of Tea,Kakuzo Okakura,94,Spinebill Press,2020-10-20,10.03,3.77,3.86,13112,248,854,3297,4796,3917,3051425,9780648531593,English,"Food, Drink"
Detox Diet Book : The Detox Diet Guide for Detoxing for Health. Detox Cleanse for Your Optimum Detoxification Health,Melissa Doviak,84,WebNetworks Inc,2013-02-14,9.19,0.71,3.1,10,1,3,2,2,2,9781631876011,9781631876011,English,"Food, Drink"
Kids Recipes Book : 70 of the Best Ever Dinner Recipes That All Kids Will Eat....Revealed!,Samantha Michaels,54,Cooking Genius,2013-05-14,11.04,5.16,4.54,13,0,0,2,2,9,3640746,9781628840636,English,"Food, Drink"
Merrie Christmas Drink Book,Ruth Mccrea,64,Read Books,2010-08-04,18.54,9.46,4,1,0,0,0,1,0,3409901,9781445510088,English,"Food, Drink"
"A Book Of Fruits & Flowers : Shewing The Nature And Use Of Them, Either For Meat Or Medicine.",Anonymous,56,Lector House,2019-07-08,9.42,1.48,5,1,0,0,0,0,1,9789353445584,9789353445584,English,"Food, Drink"
Frootie and Her Fruity Friends : Mini Coloring Books For Kids,Jupiter Kids,106,Jupiter Kids,2016-04-01,13.47,2.83,4,1,0,0,0,1,0,9781683052166,9781683052166,English,"Food, Drink"
"Favorite Dishes : A Columbian Autograph Souvenir Cookery Book. Over Three Hundred Autograph Recipes, and Twenty-Three Portraits, Contributed by the Board of Lady Managers of the World's Columbian Exposition. Illustrated by May Root-Kern, Mellie Ingels Juli",Carrie V Shuman,274,Franklin Classics Trade Press,2018-10-17,24.26,0.69,2.91,11,1,3,4,2,1,9780343692469,9780343692469,English,"Food, Drink"
"Complete Book of Fire : Building Campfires for Warmth, Light, Cooking, and Survival",Buck Tilton,160,Menasha Ridge Press Inc.,2018-07-19,24.07,6.43,3.56,16,1,0,7,5,3,9781634042543,9781634042543,English,"Food, Drink"
Little book of lazy lunches,Marlene van der Westhuizen,160,BOOKSTORM,2010-10-01,12.01,1.99,5,1,0,0,0,0,1,9781920434069,9781920434069,English,"Food, Drink"
The Complete Book of Cheese,Bob Brown,254,IndoEuropeanPublishing.com,2022-02-22,20.69,1.91,3.61,94,6,11,22,30,25,9781644395998,9781644395998,English,"Food, Drink"
A Book of Dorcas Dishes : Family Recipes Contributed by the Dorcas Society of Hollis and Buxton,Kate Douglas Smith Wiggin,122,Franklin Classics Trade Press,2018-10-20,17.24,5.76,4.5,2,0,0,0,1,1,9780343848903,9780343848903,English,"Food, Drink"
"A Hearty Book of Veggie Sandwiches : Vegan and Vegetarian Paninis, Wraps, Rolls, and More",Jackie Freeman,176,SASQUATCH BOOKS,2022-01-04,20.14,3.86,3.84,43,0,3,11,19,10,9781632173720,9781632173720,English,"Food, Drink"
Detox Diet Book : The Detox Diet Guide for Detoxing for Health. Detox Cleanse for Your Optimum Detoxification Health,Melissa Doviak,84,WebNetworks Inc,2013-02-14,9.19,0.71,3.1,10,1,3,2,2,2,9781631876011,9781631876011,English,"Food, Drink"
Kids Recipes Book : 70 of the Best Ever Lunch Recipes That All Kids Will Eat...Revealed!,Samantha Michaels,50,Cooking Genius,2013-05-14,10.98,4.92,4.33,12,1,0,1,2,8,3640747,9781628840650,English,"Food, Drink"
The Up-To-Date Sandwich Book : 400 Ways to Make a Sandwich,Eva Greene Fuller,194,Franklin Classics Trade Press,2018-10-18,19.44,2.51,3,1,0,0,1,0,0,9780343728991,9780343728991,English,"Food, Drink"
"The Town and Country Brewery Book : Or, Every Man His Own Brewer, and Cellarman, Malster and Hop-Merchant: Conducted on Principles of Health, Profit, & Economy",W Brande,306,Franklin Classics Trade Press,2018-10-27,25.72,1.23,5,1,0,0,0,0,1,9780344342462,9780344342462,English,"Food, Drink"
Little book of lazy lunches,Marlene van der Westhuizen,160,BOOKSTORM,2010-10-01,12.01,1.99,5,1,0,0,0,0,1,9781920434069,9781920434069,English,"Food, Drink"
The Little Book of Rose : Summer Perfection,Orange Hippo!,192,Welbeck Publishing Group,2021-06-29,9.57,0.43,5,1,0,0,0,0,1,9781800690516,9781800690516,English,"Food, Drink"
The Effrontery Book of Drinkery,Tony Arnold,152,Lulu.com,2019-03-15,20.58,3.32,5,1,0,0,0,0,1,9780359458103,9780359458103,English,"Food, Drink"
The Effrontery Book of Drinkery,Tony Arnold,152,Lulu.com,2019-03-15,20.58,3.32,5,1,0,0,0,0,1,9780359458103,9780359458103,English,"Food, Drink"
The Complete Book of Cheese,Bob Brown,254,IndoEuropeanPublishing.com,2022-02-22,20.69,1.91,3.61,94,6,11,22,30,25,9781644395998,9781644395998,English,"Food, Drink"
Little book of lazy lunches,Marlene van der Westhuizen,160,BOOKSTORM,2010-10-01,12.01,1.99,5,1,0,0,0,0,1,9781920434069,9781920434069,English,"Food, Drink"
"A Book Of Fruits & Flowers : Shewing The Nature And Use Of Them, Either For Meat Or Medicine.",Anonymous,56,Lector House,2019-07-08,9.42,1.48,5,1,0,0,0,0,1,9789353445584,9789353445584,English,"Food, Drink"
The Little Tea Book,Arthur Gray,72,Dogma,2012-11-20,17.35,1.55,3.24,83,0,21,34,15,13,9783954542307,9783954542307,German,"Food, Drink"
The Smoothie Cleanse Book : Healthy Recipes Including Green and Colorful Smoothies for Weight Loss +10 Day Detox Plan,Emma Green,98,Pulsar Publishing,2020-06-11,17.27,1.83,4.4,10,1,0,0,2,7,9781733447669,9781733447669,English,"Food, Drink"
The Book for All Households : Or the Art of Preserving Animal and Vegetable Substances for Many Years,Nicolas Appert,158,Sagwan Press,2018-02-02,18.32,0.18,3.67,3,0,0,2,0,1,9781376534054,9781376534054,English,"Food, Drink"
A Book of Dorcas Dishes : Family Recipes Contributed by the Dorcas Society of Hollis and Buxton,Kate Douglas Smith Wiggin,122,FRANKLIN CLASSICS,2018-10-09,16.41,0.59,4.5,2,0,0,0,1,1,9780341891901,9780341891901,English,"Food, Drink"
Cider : A Poem in Two Books,John Philips,206,Franklin Classics Trade Press,2018-10-22,21.32,1.63,2.5,2,0,1,1,0,0,9780344003240,9780344003240,English,"Food, Drink"
Little Book of Questions on Cocktails,Two Magpies Publishing,76,READ BOOKS,2013-08-22,18.65,11.15,4,1,0,0,0,1,0,9781473311077,9781473311077,English,"Food, Drink"
Rockin' Chair Cowboys : and Other Short Stories,"V M Wolter, Joseph A Zapalac",290,Outskirts Press,2010-06-24,21.95,0.65,5,1,0,0,0,0,1,9781432760601,9781432760601,English,"Food, Drink"
Pieman - The Papa D Story : The Secret To Life Through Comfort Foods,"June V Bourgo, Dennis Bourgo",170,Next Chapter,2022-09-06,11.35,5.65,5,3,0,0,0,0,3,9784824148742,9784824148742,English,"Food, Drink"
Tiny Book of Rum,"Rebecca Du Pontet, Raphaella Thompson",96,ICE HOUSE BOOKS,2020-09-01,6.93,0.57,4,1,0,0,0,1,0,9781913308117,9781913308117,English,"Food, Drink"
Pieman - The Papa D Story : The Secret To Life Through Comfort Foods,"June V Bourgo, Dennis Bourgo",164,Next Chapter,2022-09-06,12.73,2.07,5,3,0,0,0,0,3,9784824148735,9784824148735,English,"Food, Drink"
Diet Recipe Book : Intermittent Fasting and Metabolism Foods for Weight Loss,"Francis Harris, Rosie Townsend",186,Healthy Lifestyles,2014-06-26,11.76,0.94,1,2,2,0,0,0,0,9781633830677,9781633830677,English,"Food, Drink"
A Book of Dorcas Dishes : Family Recipes Contributed by the Dorcas Society of Hollis and Buxton,Kate Douglas Smith Wiggin,122,Franklin Classics Trade Press,2018-10-20,17.24,5.76,4.5,2,0,0,0,1,1,9780343848903,9780343848903,English,"Food, Drink"
Cider : A Poem in Two Books...,John Philips,198,Nabu Press,2012-04-07,22.63,1.36,2.5,2,0,1,1,0,0,9781279703687,9781279703687,English,"Food, Drink"
Healthy Diet Book : Dieting Recipe Selection,"Minnie Phillips, Cassandra Wise",326,Healthy Lifestyles,2014-09-04,25.29,19.11,4,2,0,0,0,2,0,9781634280327,9781634280327,English,"Food, Drink"
The Easy to Cook Hypothroidism Recipe Book : The Thyroid Healthy Tasty Cookbook for Healing Hashimoto Disease and Completely Restoring Hypothyroid Health,Cleta Arun M D,110,Independently Published,2021-06-13,10.85,0.26,4,1,0,0,0,1,0,9798519966436,9798519966436,English,"Food, Drink"
