title,authors,number_of_pages,publisher,publication_date,price_in_euros,discount_in_euros,rating,number_of_votes_goodreads,number_of_votes_one_star,number_of_votes_two_stars,number_of_votes_three_stars,number_of_votes_four_stars,number_of_votes_five_stars,bestsellers_rank,isbn13,language,category
"M'Lady's Book of Household Secrets : Recipes, Remedies and Essential Etiquette",The Hon. Sarah Connolly Carew Macpherson,144,The History Press Ltd,2014-04-01,12.72,13.28,5,1,0,0,0,0,1,1139046,9781845887810,English,"Food, Drink"
The Waldorf Book of Soups,"Marsha Post, Andrea Huff, Jo Valens",49,Anthroposophic Press Inc,2007-01-30,13.31,2.69,4.09,23,0,2,5,5,11,159028,9780880105750,English,"Food, Drink"
The Savoy Cocktail Book,Harry Craddock,288,Chump Change,2018-07-07,30.60,20.60,4.25,368,3,10,57,119,179,33795,9781640321076,English,"Food, Drink"
"The Essential Sugar Free Desserts Recipe Book : A Quick Start Guide To Cooking Sugar-Free Cakes, Desserts and Sweet Treats. Over 80 Sweet And Delicious Sugar-Free Recipes To Make Quitting Sugar Easy",Quick Start Guides,102,Erin Rose Publishing,2016-09-16,10.43,0.57,3.89,9,0,1,1,5,2,856266,9781911492023,English,"Food, Drink"
Little Guide Book: Asian Leaves & Roots,"Devagi Sanmugam, Christopher Tan",80,Marshall Cavendish International (Asia) Pte Ltd,2014-11-07,7.50,1.50,3,2,0,0,2,0,0,956620,9789814561303,English,"Food, Drink"
"The Sweet Book of Candy Making : From the Simple to the Spectacular-How to Make Caramels, Fudge, Hard Candy, Fondant, Toffee, and More!",Elizabeth Labau,160,QUARRY BOOKS,2012-09-01,20.16,6.34,4.06,131,2,4,28,47,50,150058,9781592538102,English,"Food, Drink"
The Dash Diet Action Plan : Proven to Lower Blood Pressure and Cholesterol without Medication,Marla Heller,224,"Little, Brown & Company",2015-01-29,13.28,2.72,3.58,738,30,69,255,211,173,62369,9781455512829,English,"Food, Drink"
"Welcoming Food, Book 1 : Energetics of Food and Healing: Diet as Medicine for Home Cooks and Other Healers",Andrew Sterman,220,"Ann Cecil-Sterman, PLLC",2020-01-22,36.77,30.03,4.75,8,0,0,0,2,6,159196,9780983772095,English,"Food, Drink"
"The Forager Chef's Book of Flora : Recipes and Techniques for Edible Plants from Garden, Field, and Forest",Alan Bergo,288,Chelsea Green Publishing Co,2021-09-23,33.83,1.67,4.56,32,0,2,2,4,24,36009,9781603589482,English,"Food, Drink"
Relae : A Book of Ideas,Christian F. Puglisi,448,Random House USA Inc,2014-11-11,46.68,4.32,4.56,106,0,1,7,30,68,31548,9781607746492,English,"Food, Drink"
"Nutribullet Recipe Book : Smoothie Recipes for Weight-Loss, Detox, Anti-Aging & So Much More!",Stephanie Shaw,100,Get Publishing,2015-09-29,9.48,8.12,3.83,291,10,16,88,76,101,26916,9781910175224,English,"Food, Drink"
Cooking My Books : What the fork to cook tonight,Yvette Hewett,136,Bei Management,2020-02-14,21.63,0.87,5,1,0,0,0,0,1,2728492,9781922337269,English,"Food, Drink"
"The Vertical Veg Guide to Container Gardening : How to Grow an Abundance of Herbs, Vegetables and Fruit in Small Spaces (Winner - Garden Media Guild Practical Book of the Year Award 2022)",Mark Ridsdill Smith,320,Chelsea Green Publishing Co,2022-03-24,26.66,3.84,4.18,17,0,0,4,6,7,186181,9781645020790,English,"Food, Drink"
Healthy Diet Recipe Books : Intermittent Fasting Diet and Slow Cooker Recipes,"Hyacinth Wilding, Hicks Iesha",172,Healthy Lifestyles,2014-03-18,11.23,1.17,3.67,3,0,0,2,0,1,2663626,9781631878824,English,"Food, Drink"
The Most Excellent Book Of Cookery : 'An Edition and Translation of the 16th-century 'Livre Fort Excellent De Cuysine',"Timothy J. Tomasik, Ken Albala",192,Prospect Books,2013-06-30,20.65,1.35,4,4,1,0,0,0,3,914738,9781903018965,English,"Food, Drink"
The Little Book of Cocktail Tips,Craig Edney,112,Absolute Press,2011-05-01,3.93,0.57,1,1,1,0,0,0,0,442056,9781904573975,English,"Food, Drink"
BBQ Recipe Book : 70 of the Best Ever Healthy Barbecue Recipes...Revealed!,Samantha Michaels,98,Cooking Genius,2013-05-14,13.46,8.44,4.43,7,0,0,0,4,3,909395,9781628840124,English,"Food, Drink"
"Book of Coffee and Tea : A Guide to the Appreciation of Fine Coffees, Teas and Herbal Beverages",Joel Schapira,313,St Martin's Press,1996-03-15,22.49,2.51,4.06,33,0,1,7,14,11,890241,9780312140991,English,"Food, Drink"
Favorite Bread Machine Recipes,Donna Rathmell German,62,"Bristol Publishing Enterprises Inc.,U.S.",2001-05-01,5.27,0.73,4,1,0,0,0,1,0,58206,9781558671522,English,"Food, Drink"
Bayou Book Thief,Ellen Byron,304,Penguin Putnam Inc,2022-06-09,9.67,0.33,4.05,819,14,25,149,347,284,862550,9780593437612,English,"Food, Drink"
"The Negroni : Drinking to La Dolce Vita, with Recipes & Lore [A Cocktail Recipe Book]",Gary Regan,176,Random House USA Inc,2015-05-05,18.47,1.03,4.13,70,0,3,9,34,24,255026,9781607747796,English,"Food, Drink"
Death & Co Welcome Home : A Cocktail Recipe Book,"Alex Day, Nick Fauchald",320,Potter/Ten Speed/Harmony/Rodale,2021-11-16,39.71,10.79,4.23,60,0,2,4,32,22,128724,9781984858412,English,"Food, Drink"
The Bulawayo Cookery Book : Zimbabwe's Original 1909 Cookery Book,"Louise Chataway, David Saffery",160,Jeppestown Press,2006-09-30,17.63,5.37,3.8,5,0,1,1,1,2,868795,9780955393624,English,"Food, Drink"
Aunt Barb's Bread Book : Yesterday's Breads for Today's Kitchens,Barbara Swell,72,"Native Ground Music, Incorporated",2011-07-01,8.99,0.01,3.94,47,2,1,11,17,16,1973225,9781883206628,English,"Food, Drink"
The Little Book of Etiquette,Rufus Cavendish,96,Octopus Publishing Group,2015-10-01,7.26,0.54,2.7,10,2,2,4,1,1,1021020,9781849536523,English,"Food, Drink"
The Little Curry Cookbook,Murdoch Books Test Kitchen,192,MURDOCH BOOKS,2018-07-25,13.01,2.99,3,2,0,1,0,1,0,1473141,9781760527563,English,"Food, Drink"
Complete Book of Thai Cooking,Linda Stephen,288,Robert Rose Inc,2008-03-14,23.90,1.10,3.89,19,1,1,4,6,7,398649,9780778801801,English,"Food, Drink"
"The Skinny Slow Cooker Summer Recipe Book : Fresh & Seasonal Summer Recipes for Your Slow Cooker. All Under 300, 400 and 500 Calories.",Cooknation,106,Bell & Mackenzie Publishing,2014-03-19,9.72,0.98,3.56,16,0,5,2,4,5,951186,9781909855380,English,"Food, Drink"
"The Skinny Takeaway Recipe Book Healthier Versions of Your Fast Food Favourites : Chinese, Indian, Pizza, Burgers, Southern Style Chicken, Mexican & Mo",Cooknation,102,Bell & Mackenzie Publishing,2014-09-12,10.79,0.01,3,6,1,0,3,2,0,825240,9781909855557,English,"Food, Drink"
Making Whoopies : The Official Whoopie Pie Book,Nancy Griffin,88,ROWMAN & LITTLEFIELD,2010-08-16,12.60,0.35,3.67,27,1,3,9,5,9,420914,9780892728107,English,"Food, Drink"
A Book of Honey,Eva Crane,204,International Bee Research Association,2019-01-28,40.49,28.41,4,9,0,0,3,3,3,1184277,9780860982883,English,"Food, Drink"
The Little Book of Mushrooms : An Introduction to the Wonderful World of Mushrooms,Felicity Hart,128,Octopus Publishing Group,2022-07-14,8.10,1.90,3.5,2,0,0,1,1,0,30784,9781800073876,English,"Food, Drink"
The Book of Tea,"Kakuzo Okakura, Yasuhiro Okawa",256,"Pie International Co., Ltd.",2021-04-06,26.15,6.85,3.86,13112,248,854,3297,4796,3917,856901,9784756254351,English,"Food, Drink"
"Naked Kitchen Veggie Burger Book : Delicious Plant-Based Burgers, Fries, Sides, And More","Sarah Davies, Kristy Taylor",240,Rowman & Littlefield,2014-07-06,13.42,6.53,4.05,44,0,2,8,20,14,721595,9780762793297,English,"Food, Drink"
"The Unofficial Hogwarts Cocktail Book : Spellbinding Spritzes, Fantastical Old Fashioneds, Magical Margaritas, and More Enchanting Recipes",Bertha Barmann,128,Ulysses Press,2022-10-27,19.42,1.08,4.67,3,0,0,0,1,2,795928,9781646043507,English,"Food, Drink"
Little Book of Big Magical Stickers,Pipsticks(r)+Workman(r),20,Workman Publishing,2019-05-28,7.19,1.76,3,1,0,0,1,0,0,804556,9781523507139,English,"Food, Drink"
The Little Book of Ice Cream Tips,Andrew Langley,112,Bloomsbury Publishing PLC,2012-07-01,4.43,1.57,5,1,0,0,0,0,1,728324,9781906650445,English,"Food, Drink"
The Elven Cookbook : A Recipe Book Inspired by the Elves of Tolkien,Robert Tuesley Anderson,160,Octopus Publishing Group,2022-08-04,23.04,1.46,1.5,2,1,1,0,0,0,268930,9780753734681,English,"Food, Drink"
The Complete Book of Pies : 200 Recipes from Sweet to Savoury,Julie Hasson,272,ROBERT ROSE INC,2008-08-22,19.32,6.68,3.87,15,0,0,6,5,4,786567,9780778801917,English,"Food, Drink"
The Book of Marmalade,C. Anne Wilson,208,Prospect Books,2010-12-30,12.06,0.44,4.21,19,0,0,5,5,9,331515,9781903018774,English,"Food, Drink"
Edmonds Cookery Book (Fully Revised),Goodman Fielder,252,Hachette Aotearoa New Zealand,2022-12-06,23.79,2.21,4.5,4,0,0,1,0,3,27082,9781869713423,English,"Food, Drink"
Radiant : Recipes to heal your skin from within,Hanna Sillitoe,192,Octopus Publishing Group,2019-03-19,23.39,0.11,4.12,100,3,4,16,32,45,21752,9780857833921,English,"Food, Drink"
Look of the Book,"Mendelsund, David J. Alworth",256,Ten Speed Press,2020-10-12,46.61,9.89,3.89,271,1,12,74,113,71,338769,9780399581021,English,"Food, Drink"
Best Book of Greek Cookery,Chrissa Paradissis,200,Echo Point Books & Media,2017-09-05,20.11,1.99,3.86,7,1,0,2,0,4,304903,9781974800025,English,"Food, Drink"
The Savoy Cocktail Book,Harry Craddock,288,Dover Publications Inc.,2018-11-30,23.49,5.51,4.25,368,3,10,57,119,179,274016,9780486828411,English,"Food, Drink"
"The Essential Bar Book : An A-to-Z Guide to Spirits, Cocktails, and Wine, with 115 Recipes for the World's Great Drinks","Jennifer Fiedler, Editors of Punch",336,Random House USA Inc,2014-10-14,19.64,0.86,4.12,57,1,1,11,21,23,289818,9781607746539,English,"Food, Drink"
The Great British Book of Baking : Discover over 120 delicious recipes in the official tie-in to Series 1 of The Great British Bake Off,Linda Collister,352,Penguin Books Ltd,2010-10-28,41.03,8.47,4.2,164,3,4,29,50,78,42219,9780718157111,English,"Food, Drink"
"Do Preserve : Make Your Own Jams, Chutneys, Pickles and Cordials","Anja Dunk, Jen Goss",176,The Do Book Co,2019-02-26,10.68,2.32,3.67,18,1,0,8,4,5,197284,9781907974243,English,"Food, Drink"
The Little Book of Big Weightloss,Bernadette Fisers,136,Transworld Publishers Ltd,2017-07-13,12.02,0.48,3.69,127,7,9,35,41,35,43295,9780593079423,English,"Food, Drink"
The Inflammation-Free Diet Plan,Monica Reinagel,304,McGraw-Hill Education - Europe,2007-05-16,18.18,2.82,3.54,162,7,22,48,46,39,174215,9780071486019,English,"Food, Drink"
The Little Book of Drinking Games,Quentin Parker,96,Octopus Publishing Group,2015-10-01,7.04,1.96,3.41,37,1,9,10,8,9,44872,9781849535861,English,"Food, Drink"
"The Skinny 5:2 Diet Slow Cooker Recipe Book : Skinny Slow Cooker Recipe and Menu Ideas Under 100, 200, 300 and 400 Calories for Your 5:2 Diet",Cooknation,134,Bell & Mackenzie Publishing,2013-05-23,9.61,1.89,5,1,0,0,0,0,1,51140,9780957644700,English,"Food, Drink"
150 Best Ebelskiver Recipes,Camilla V. Saulsbury,248,Robert Rose Inc,2013-01-23,19.72,1.28,4.26,19,0,2,2,4,11,573170,9780778804420,English,"Food, Drink"
The Primrose Bakery Book,"Lisa Thomas, Martha Swift",240,Vintage Publishing,2012-10-05,35.03,0.47,4.2,128,2,6,19,38,63,41433,9780224086882,English,"Food, Drink"
The Savoy Cocktail Book,Harry Craddock,292,Martino Fine Books,2015-07-03,35.78,34.62,4.26,370,3,10,57,119,181,37459,9781614278375,English,"Food, Drink"
Red Sky at Night : The Book of Lost Country Wisdom,Jane Struthers,288,Ebury Publishing,2010-07-09,17.36,0.14,3.7,341,5,30,96,141,69,105660,9780091932442,English,"Food, Drink"
The Book of Tea,Kakuzo Okakura,154,Martino Fine Books,2012-11-14,10.44,1.86,3.86,13112,248,854,3297,4796,3917,427358,9781614273752,English,"Food, Drink"
"Are You There God? It's Me, Margarita : More Cocktails with a Literary Twist",Tim Federle,160,"Running Press,U.S.",2018-10-11,12.95,2.55,3.96,225,3,9,46,102,65,189676,9780762464159,English,"Food, Drink"
The Sprout Book : Tap into the Power of the Planet's Most Nutritious Food,Doug Evans,272,St Martin's Press,2020-04-07,16.71,0.28,4.2,285,1,8,38,124,114,37558,9781250226174,English,"Food, Drink"
The Little Book of Cocktails,Rufus Cavendish,96,Octopus Publishing Group,2015-10-01,7.11,1.89,3.44,16,0,2,6,7,1,5992,9781849535854,English,"Food, Drink"
The Best of Mauritian Cuisine : History of Mauritian Cuisine and Recipes from Mauritius,"Madeleine V Philippe, Clancy J Philippe",292,Clancy J Philippe & Ass. Pty Ltd,2016-11-16,46.82,44.58,5,2,0,0,0,0,2,359547,9780994199614,English,"Food, Drink"
Skinny Steamer Recipe Book : Delicious Healthy Low Calorie Low Fat,Cooknation,96,Bell & Mackenzie Publishing,2014-10-08,10.66,0.04,3.42,69,7,10,16,19,17,381562,9781909855670,English,"Food, Drink"
The Savoy Cocktail Book,Harry Craddock,292,Martino Fine Books,2013-05-08,24.15,19.05,4.25,368,3,10,57,119,179,36212,9781614274308,English,"Food, Drink"
"Piece of Cake! One-bowl, No-fuss, From-scratch Cakes",Camilla V. Saulsbury,288,ROBERT ROSE INC,2011-08-04,27.67,4.33,4.02,45,2,3,6,15,19,377449,9780778802778,English,"Food, Drink"
The Gut Makeover Recipe Book,Jeannette Hyde,224,Quercus Publishing,2016-06-16,9.83,4.17,3.58,43,3,6,8,15,11,33669,9781786481528,English,"Food, Drink"
Biscuiteers Book of Iced Gifts,Biscuiteers Baking Company Ltd,192,Penguin Books Ltd,2018-06-26,28.66,10.84,3.33,3,1,0,0,1,1,347106,9780718188597,English,"Food, Drink"
Hungarian Specialties Cookery Book,Nelly De Sacellary,112,Applewood Books,2008-07-21,10.16,0.84,4,2,0,0,0,2,0,346615,9781429012119,English,"Food, Drink"
"The Skinny Slow Cooker Vegetarian Recipe Book : Meat Free Recipes Under 200,300 And 400 Calories",Cooknation,112,Caton Books,2013-06-28,9.54,1.16,3.51,35,2,5,12,5,11,290469,9781909855007,English,"Food, Drink"
Ball Blue Book Of Canning And Preserving Recipes,various,58,Read Books,2010-09-10,29.76,12.34,4.18,49,1,2,10,10,26,542216,9781445510262,English,"Food, Drink"
"The Book of Yields - Accuracy in Food Costing and Purchasing, 8e",FT Lynch,320,John Wiley & Sons Inc,2011-01-28,66.37,1.63,4.3,80,2,3,10,19,46,538662,9780470197493,English,"Food, Drink"
250 Best Meals in a Mug: Delicious Homemade Microwave Meals in Minutes,Camilla V. Saulsbury,312,ROBERT ROSE INC,2014-01-16,21.17,5.83,3.67,64,5,5,15,20,19,50662,9780778804741,English,"Food, Drink"
"The Essential Bar Book for Home Mixologists : Tools, Techniques, and Spirits to Master Cocktails",Amy Traynor,188,Rockridge Press,2020-09-22,15.82,1.18,4.27,30,0,1,5,9,15,555835,9781646117154,English,"Food, Drink"
The Little Book of Chefs' Tips,Richard Maggs,112,Absolute Press,2006-08-30,4.09,1.91,3,1,0,0,1,0,0,646693,9781904573388,English,"Food, Drink"
150 Best Gluten-Free Muffin Recipes,Camilla V. Saulsbury,208,ROBERT ROSE INC,2012-01-26,16.61,4.39,4,14,1,0,4,2,7,654228,9780778802914,English,"Food, Drink"
The Unplugged Family Activity Book : 60+ Simple Crafts and Recipes for Year-Round Fun,Rachel Jepson Wolf,144,Fair Winds Press,2020-06-23,20.48,0.52,4.38,66,1,1,9,16,39,629124,9781592339433,English,"Food, Drink"
"The Everything Big Book of Fat Bombs : 200 Irresistible Low-carb, High-fat Recipes for Weight Loss the Ketogenic Way",Vivica Menegaz,256,Adams Media Corporation,2016-07-03,17.13,1.87,3.62,21,0,1,12,2,6,601081,9781440596759,English,"Food, Drink"
Panna Cotta : Italy's Elegant Custard Made Easy,Camilla V. Saulsbury,141,"Cumberland House Publishing,US",2007-03-30,24.44,4.55,4.42,12,0,1,0,4,7,621687,9781581825954,English,"Food, Drink"
"The Book of Difficult Fruit : Arguments for the Tart, Tender, and Unruly (with Recipes)",Kate Lebo,416,"Farrar, Straus and Giroux",2021-04-06,23.97,7.53,3.74,818,14,70,241,284,209,650748,9780374110321,English,"Food, Drink"
"The Elderberry Book : Forage, Cultivate, Prepare, Preserve",John Moody,128,New Society Publishers,2019-09-24,21.38,0.61,4.12,24,0,0,6,9,9,663636,9780865719194,English,"Food, Drink"
Waldorf Book of Breads,"Marsha Post, Jo Valens, Winslow Eliot",64,Anthroposophic Press Inc,2009-12-15,13.72,1.78,4.52,21,0,0,3,4,14,146394,9780880107037,English,"Food, Drink"
Mrs Beeton's Cookery Book - Diamond Jubilee Edition,Isabella  Mrs Beeton,332,Impala (InternationalMedia Publication and Literary Associates,2006-01-30,28.55,8.95,3.83,1296,34,84,343,442,393,517944,9781905530007,English,"Food, Drink"
150 Best Vegan Muffin Recipes,Camilla V. Saulsbury,208,ROBERT ROSE INC,2012-01-26,16.61,4.39,3.97,34,1,1,8,12,12,625057,9780778802921,English,"Food, Drink"
"The Essential Vegetarian Keto Cookbook : 65 Low-Carb, High-Fat, Plant-Based Recipes",Editors of Rodale Books,144,Potter/Ten Speed/Harmony/Rodale,2018-11-20,15.13,0.37,3.4,52,1,9,18,16,8,287486,9781984825865,English,"Food, Drink"
The Wonderful Weekend Book : Reclaiming Life's Simple Pleasures,Elspeth Thompson,352,John Murray Press,2010-01-07,12.46,3.54,3.79,118,5,8,28,43,34,134075,9781848540538,English,"Food, Drink"
"The Bar and Beverage Book, 5e",C Katsigris,736,John Wiley & Sons Inc,2011-02-18,121.83,4.17,3.82,39,1,4,9,12,13,1051822,9780470248454,English,"Food, Drink"
Vegetable Dyes: A Book of Recipes and Information Useful to the Dyer,Ethel M. Mairet,84,Lulu.com,2008-10-07,9.51,2.79,3.63,43,1,3,16,14,9,58794,9780557000418,English,"Food, Drink"
The Little Book of Mushrooms : An Introduction to the Wonderful World of Mushrooms,Felicity Hart,128,Octopus Publishing Group,2022-07-14,8.10,1.90,3.5,2,0,0,1,1,0,30784,9781800073876,English,"Food, Drink"
The Book of Tea,"Okakura Kakuzo, Anna Sherman, Sayuri Romei",160,Pan Macmillan,2020-02-06,10.87,1.63,3.86,13202,249,859,3319,4833,3942,40923,9781529021066,English,"Food, Drink"
The Tassajara Bread Book,Edward Espe Brown,192,Shambhala Publications Inc,2011-02-15,20.49,5.51,4.05,4663,167,227,855,1361,2053,115680,9781590308363,English,"Food, Drink"
The Vegan Book of Permaculture,Graham Burnett,304,Permanent Publications,2015-01-15,20.24,0.26,4.26,46,0,4,3,16,23,26332,9781856232012,English,"Food, Drink"
The Proposal : The sensational Reese's Book Club Pick hit!,Jasmine Guillory,336,Headline Publishing Group,2018-10-30,10.12,2.38,3.49,104521,3393,11730,36585,36321,16492,42435,9781472255860,English,"Food, Drink"
"Book of Welsh Fish Cookery, A",Bobby Freeman,32,Y Lolfa,2002-08-01,4.66,1.54,5,1,0,0,0,0,1,1001798,9780862431419,English,"Food, Drink"
"Little Guide Book: Chinese Herbs, Spices & More",Terry Tan,80,Marshall Cavendish International (Asia) Pte Ltd,2014-11-07,7.66,1.34,3,1,0,0,1,0,0,918087,9789814561297,English,"Food, Drink"
Should We Eat Meat? : Evolution and Consequences of Modern Carnivory,V Smil,276,John Wiley & Sons Inc,2013-06-04,34.42,18.88,3.54,566,20,58,180,212,96,140630,9781118278727,English,"Food, Drink"
A Baghdad Cookery Book : Tthe Book of Dishes (Kitaab Al-oTabaikh),"Muhammad Ibn Al-H Al-Baghdadi, Charles Perry",128,PROSPECT BOOKS,2006-03-24,11.15,9.85,4.1,21,0,3,2,6,10,120985,9781903018422,English,"Food, Drink"
Sushi,PIE Books,208,PIE Books,2014-02-28,20.80,3.70,4.41,22,0,0,3,7,12,344168,9784756241344,English,"Food, Drink"
Sayuri's Raw Food Cafe Vol. 2,Tanaka Sayuri,176,Seeds of Life,2015-09-05,27.73,21.47,4,1,0,0,0,1,0,874987,9786027167360,English,"Food, Drink"
The Sous Vide Recipe Book,Norma Miller,160,"Little, Brown Book Group",2015-06-02,7.78,3.72,3.78,9,0,2,1,3,3,107441,9780716023340,English,"Food, Drink"
Where Does Broccoli Come From? A Book of Vegetables,"Arielle Dani Lebovitz, Mary Navarro, Brette Fishman",164,Experience Delicious LLC,2018-10-08,49.87,6.53,4.33,3,0,0,0,2,1,777116,9781947001152,English,"Food, Drink"
"The Skinny Juice Diet Recipe Book : 5lbs, 5 Days. the Ultimate Kick-Start Diet and Detox Plan to Lose Weight & Feel Great!",Cooknation,126,Bell & Mackenzie Publishing,2014-03-12,10.04,0.76,3.17,6,1,1,2,0,2,951185,9781909855168,English,"Food, Drink"
Lola Berry's Little Book of Smoothies and Juices : 60 Super-fast Recipes for Radiance and Wellbeing,Lola Berry,160,Pan Macmillan Australia,2015-10-27,14.62,5.38,4.11,19,1,1,2,6,9,880131,9781743538838,English,"Food, Drink"
This Is a Book for People Who Love Hot Sauce,Matt Garczynski,128,Orion Publishing Co,2019-10-10,10.73,1.77,3.77,13,0,0,5,6,2,841986,9781409194583,English,"Food, Drink"
"The Gentleman's Companion : Being an Exotic Drinking Book Or, Around the World with Jigger, Beaker and Flask",Charles Henry Baker,232,Martino Fine Books,2013-02-06,17.42,0.28,4.36,25,0,0,2,12,11,440751,9781614273967,English,"Food, Drink"
Ball Blue Book Of Canning And Preserving Recipes,various,60,Read Books,2010-08-11,26.89,20.81,4.18,49,1,2,10,10,26,469387,9781445514109,English,"Food, Drink"
The Little Black Book of Classic Cocktails : A Pocket-Sized Collection of Drinks for a Night In or a Night Out,Pyramid,96,Octopus Publishing Group,2019-09-05,8.68,1.82,2,1,0,1,0,0,0,496783,9780753733325,English,"Food, Drink"
"The Skinny 15 Minute Meals Recipe Book : Delicious, Nutritious & Super-Fast Meals in 15 Minutes or Less. All Under 300, 400 & 500 Calories.",Cooknation,100,Bell & Mackenzie Publishing,2014-04-01,9.65,0.95,3.18,11,1,1,6,1,2,490465,9781909855427,English,"Food, Drink"
"Weight Loss Surgery Cookbook For Dummies, 2e",BK Davidson,416,John Wiley & Sons Inc,2016-12-16,19.76,0.74,3.84,147,6,6,43,43,49,650621,9781119286158,English,"Food, Drink"
Chasing the Gator : Isaac Toups and the New Cajun Cooking,"Isaac Toups, Jennifer V. Cole, Emeril Lagasse",256,"Little, Brown & Company",2018-11-15,35.83,2.67,4.44,97,0,3,9,27,58,58590,9780316465779,English,"Food, Drink"
The Everything Cooking for Dogs Book : 100 quick and easy healthy recipes your dog will bark for!,Lisa Fortunato,224,Adams Media Corporation,2007-09-01,16.26,1.04,3.86,59,5,3,10,18,23,462560,9781598694314,English,"Food, Drink"
"Complete Root Cellar Book: Building Plans, Uses and 100 Recipes","Steve Maxwell, Jennifer Mackenzie",256,ROBERT ROSE INC,2010-04-23,20.05,5.45,3.87,52,0,4,15,17,16,406271,9780778802433,English,"Food, Drink"
Star Wars Cookbook: BB-Ate : Awaken to the Force of Breakfast and Brunch,Lara Starr,60,Chronicle Books,2018-02-12,16.69,0.81,3.44,57,3,9,19,12,14,299836,9781452162980,English,"Food, Drink"
The Salad Book,"Clare Connery, Christopher Hill",121,Orion Publishing Co,1999-04-08,10.75,1.82,2,1,0,1,0,0,0,898214,9780753807132,,"Food, Drink"
The Instant Pot Bible : The only book you need for every model of instant pot - with more than 350 recipes,"Bruce Weinstein, Mark Scarbrough",496,Hodder & Stoughton,2019-11-14,22.45,2.05,3.94,371,5,22,94,119,131,184814,9781529362053,English,"Food, Drink"
"The $5 a Meal College Vegetarian Cookbook : Good, Cheap Vegetarian Recipes for When You Need to Eat",Nicole Cormier,224,Adams Media Corporation,2013-04-18,13.34,0.66,3.59,68,4,8,20,16,20,629734,9781440552670,English,"Food, Drink"
"Naked Kitchen Veggie Burger Book : Delicious Plant-Based Burgers, Fries, Sides, And More","Sarah Davies, Kristy Taylor",240,Rowman & Littlefield,2014-07-06,13.42,6.53,4.05,44,0,2,8,20,14,721595,9780762793297,English,"Food, Drink"
Cracker Book : Artisanal Crackers for Every Occasion,Lee E Cart,96,"Burford Books,U.S.",2012-12-16,11.02,2.98,3.9,10,0,1,2,4,3,910425,9781580801706,English,"Food, Drink"
How to Eat: The Last Book on Food You'll Ever Need,"Mark Bittman, M.D.  David L. Katz",256,Houghton Mifflin Harcourt Publishing Company,2020-04-01,16.61,1.89,3.37,2584,304,335,625,732,588,571104,9780358128823,English,"Food, Drink"
The Book of Eating : Adventures in Professional Gluttony,Adam Platt,384,"Newbury House Publishers,U.S.",2019-11-12,21.96,8.04,3.38,348,14,42,137,109,46,859338,9780062944887,English,"Food, Drink"
Cookbook Book,"Florian Boehm, Annahita Kamali, Colman Andrews",320,Phaidon Press Ltd,2014-11-26,53.57,4.43,3.63,38,0,4,14,12,8,316352,9780714867502,English,"Food, Drink"
"The Dash Diet Cookbook : Quick and Delicious Recipes for Losing Weight, Preventing Diabetes, and Lowering Blood Pressure","Mariza Snyder, Lauren Clum, Anna V. Zulaica",224,Ulysses Press,2012-03-29,14.90,0.20,3.45,142,7,25,39,39,32,85830,9781612430478,English,"Food, Drink"
"The Reboot with Joe Juice Diet Recipe Book: Over 100 recipes inspired by the film 'Fat, Sick & Nearly Dead'",Joe Cross,272,Hodder & Stoughton,2017-05-04,11.24,4.76,4.09,11,0,0,3,4,4,12883,9781444798357,English,"Food, Drink"
The Diabetes Cooking Book,"Fiona Hunter, Heather Whinney",352,Penguin Books Ltd,2010-08-02,22.97,1.53,3.35,23,2,3,9,3,6,236760,9781405341783,English,"Food, Drink"
The Little Book of Scones,"Grace Hall, Liam D'Arcy",128,Vintage Publishing,2014-10-01,12.15,0.35,4.21,19,0,2,3,3,11,254729,9780224096041,English,"Food, Drink"
"Alkaline Diet Recipe Book : Alkaline Diet Recipes for Weight Loss, Health and Wellness",Valerie Alston,48,Mihails Konoplovs,2014-05-17,7.50,1.00,1,1,1,0,0,0,0,238310,9781632872739,English,"Food, Drink"
"Animal, Vegetable, Junk : A History of Food, from Sustainable to Suicidal: A Food Science Nutrition History Book",Mark Bittman,384,HarperCollins Publishers Inc,2021-03-04,28.14,1.36,3.9,2617,47,140,597,1070,763,247530,9781328974624,English,"Food, Drink"
The DASH Diet Mediterranean Solution : The Best Eating Plan to Control Your Weight and Improve Your Health for Life,Marla Heller,272,"Little, Brown & Company",2020-12-22,14.56,2.94,3.65,342,7,25,112,133,65,469786,9781538730973,English,"Food, Drink"
Diet for a Small Planet : The Book That Started a Revolution in the Way Americans Eat,Frances Moore Lappe,480,Random House USA Inc,2021-09-21,17.40,1.10,3.96,5968,131,344,1336,1982,2175,15264,9780593357774,English,"Food, Drink"
This Is a Book About Noodles,Brendan Pang,168,Page Street Publishing Co.,2023-01-20,20.98,4.52,5,2,0,0,0,0,2,5770,9781645675785,English,"Food, Drink"
"Book of Coffee and Tea : A Guide to the Appreciation of Fine Coffees, Teas and Herbal Beverages",Joel Schapira,313,St Martin's Press,1996-03-15,22.49,2.51,4.06,33,0,1,7,14,11,890241,9780312140991,English,"Food, Drink"
The Little Book of Whisky Tips,Andrew Langley,112,Absolute Press,2017-11-28,8.27,0.73,3.47,34,3,4,8,12,7,861588,9781472954534,English,"Food, Drink"
Cook without a Book: Meatless Meals : Recipes and Techniques for Part-Time and Full-Time Vegetarians: A Cookbook,Pam Anderson,288,Rodale Press,2011-10-25,32.90,1.60,4.12,204,1,12,31,77,83,821135,9781605291765,English,"Food, Drink"
