title,authors,number_of_pages,publisher,publication_date,price_in_euros,discount_in_euros,rating,number_of_votes_goodreads,number_of_votes_one_star,number_of_votes_two_stars,number_of_votes_three_stars,number_of_votes_four_stars,number_of_votes_five_stars,bestsellers_rank,isbn13,language,category
A Book of Surrealist Games,Mel Gooding,165,Shambhala Publications Inc,1995-07-04,13.24,2.26,4.08,611,8,27,126,198,252,52625,9781570620843,English,"Society, Social, Sciences"
"The Little Book of Humanism : Universal lessons on finding purpose, meaning and joy","Alice Roberts, Andrew Copson",256,"Little, Brown Book Group",2022-07-05,10.04,0.46,4.15,709,10,30,118,239,312,60686,9780349425467,English,"Society, Social, Sciences"
The Little Book of Ikigai : The secret Japanese way to live a happy and long life,Ken Mogi,208,Quercus Publishing,2018-09-20,8.95,3.55,3.61,8735,184,800,3008,2986,1757,10023,9781787470279,English,"Society, Social, Sciences"
The Little Book of Big Change : The No-Willpower Approach to Breaking Any Habit,Amy Johnson,200,New Harbinger Publications,2016-03-31,11.73,4.27,3.84,919,28,83,220,261,327,54092,9781626252301,English,"Society, Social, Sciences"
Pocket Coco Chanel Wisdom : Witty Quotes and Wise Words From a Fashion Icon,Hardie Grant Books,96,Hardie Grant Books (UK),2018-02-06,10.09,1.91,3.67,60,1,7,18,19,15,56242,9781784881399,English,"Society, Social, Sciences"
Cunt Coloring Book,Tee Corinne,48,"Last Gasp,U.S.",2003-06-01,17.72,0.78,4.34,87,2,3,12,16,54,21879,9780867193718,English,"Society, Social, Sciences"
The Book of Delights : The life-affirming New York Times bestseller,Ross Gay,288,Hodder & Stoughton,2020-09-08,10.17,3.83,4.19,10426,127,437,1514,3551,4797,12520,9781529349771,English,"Society, Social, Sciences"
This Book Is for You : I Hope You Find It Mildly Uplifting,Worry Lines,176,Potter/Ten Speed/Harmony/Rodale,2021-10-12,16.85,0.65,4.5,480,0,8,47,123,302,20950,9781984860262,English,"Society, Social, Sciences"
Breaking Negative Thinking Patterns - A Schema Therapy Self-Help and Support Book,G Jacob,200,John Wiley & Sons Inc,2015-03-16,16.15,16.55,3.94,1066,11,43,250,455,307,8663,9781118877715,English,"Society, Social, Sciences"
The Handmaid's Tale : the book that inspired the hit TV series,Margaret Atwood,336,Vintage Publishing,2018-05-07,11.78,0.72,4.13,1848496,38334,78384,284039,652698,795041,29717,9781784873189,English,"Society, Social, Sciences"
The Book of Life,Jiddu Krishnamurti,400,HarperCollins Publishers,1995-09-25,18.22,1.78,4.34,1342,25,43,155,346,773,16668,9780060648794,English,"Society, Social, Sciences"
The Secret Diaries Of Miss Anne Lister: Vol. 1 : I Know My Own Heart,"Anne Lister, Helena Whitbread",448,"Little, Brown Book Group",2012-06-19,11.73,1.77,3.96,1597,33,83,357,570,554,12073,9781844087198,English,"Society, Social, Sciences"
The Communication Book : 44 Ideas for Better Conversations Every Day,"Mikael Krogerus, Roman Tschppeler",208,Penguin Books Ltd,2018-04-05,12.15,0.35,3.78,954,10,64,286,358,236,59704,9780241982280,English,"Society, Social, Sciences"
"My First Bob Books - Pre-Reading Skills Box Set Phonics, Ages 3 and Up, Pre-K (Reading Readiness)","Lynn Maslen Kertell, John R Maslen, Sue Hendra",48,Scholastic US,2008-08-01,18.32,0.68,4.1,178,8,5,34,45,86,56740,9780545019224,English,"Society, Social, Sciences"
"Overcoming Anxiety, 2nd Edition : A self-help guide using cognitive behavioural techniques",Helen Kennerley,416,"Little, Brown Book Group",2022-04-05,12.02,2.48,3.76,376,7,27,106,144,92,27143,9781849018784,English,"Society, Social, Sciences"
Using Picture Books to Teach Writing with the Traits: K-2 : An Annotated Bibliography of More Than 150 Mentor Texts with Teacher-Tested Lessons,"Ruth Culham, Raymond Coutu",112,Scholastic US,2008-05-01,16.89,3.11,4.38,32,0,0,5,10,17,52482,9780545025119,English,"Society, Social, Sciences"
The Little Book of Inner Peace,Ashley Davis Bush,96,Octopus Publishing Group,2017-04-04,7.63,1.87,4.01,137,1,6,30,54,46,5666,9781856753678,English,"Society, Social, Sciences"
The Waste Books,Georg Christoph Lichtenbe,264,"The New York Review of Books, Inc",2000-10-01,16.04,2.46,4.18,751,3,32,123,264,329,94437,9780940322509,English,"Society, Social, Sciences"
The Big Fat Activity Book for Pregnant People,"Jordan Reid, Erin Williams",180,Orion Publishing Co,2017-05-18,15.82,0.18,4.18,127,3,5,24,29,66,45238,9781409173892,English,"Society, Social, Sciences"
The Little Red Book,Anonymous,160,Hazelden Information & Educational Services,1996-07-01,13.46,0.54,4.36,393,8,9,49,96,231,79239,9780894860041,English,"Society, Social, Sciences"
The Black Books,"C. G. Jung, Martin Liebscher, John Peck, Sonu Shamdasani",1648,WW Norton & Co,2020-10-13,240.96,14.54,4.5,38,1,0,3,9,25,92428,9780393088649,English,"Society, Social, Sciences"
An Illustrated Book of Bad Arguments,"Ali Almossawi, Alejandro Giraldo",64,Scribe Publications,2014-12-04,16.68,1.82,3.8,4687,56,363,1317,1676,1275,16145,9781922247810,English,"Society, Social, Sciences"
Allen Carr's Easy Way to Stop Smoking : Read this book and you'll never smoke a cigarette again,Allen Carr,288,Penguin Books Ltd,2015-09-24,12.07,1.43,4.25,13368,443,652,1581,3107,7585,1087,9781405923316,English,"Society, Social, Sciences"
"Dungeons and Dragons Art and Arcana: Special Edition, Boxed Book and Ephemera Set : A Visual History","Michael Witwer, Kyle Newman",448,Ten Speed Press,2018-10-23,102.13,22.37,4.61,1648,6,12,77,433,1120,60136,9780399582752,English,"Society, Social, Sciences"
Student-Centered Leadership,V Robinson,192,John Wiley & Sons Inc,2011-08-26,24.64,0.16,4.18,82,0,1,16,32,33,56519,9780470874134,English,"Society, Social, Sciences"
The Art of Statistics : Learning from Data,David Spiegelhalter,448,Penguin Books Ltd,2020-05-27,12.89,0.61,4.17,3644,12,68,580,1596,1388,3019,9780241258767,English,"Society, Social, Sciences"
The Book of Five Rings,Miyamoto Musashi,108,Merchant Books,2012-12-31,8.39,1.61,4.01,44182,692,2470,9521,14722,16777,78225,9781603864947,English,"Society, Social, Sciences"
The Secret of the Golden Flower; A Chinese Book of Life,"Richard Wilhelm, Cary F Baynes, Dr C G Jung",176,Martino Fine Books,2014-11-17,15.41,0.59,4.14,1463,22,65,250,470,656,38216,9781614277293,English,"Society, Social, Sciences"
Three Books of Occult Philosophy,"Heinrich Cornelius Agrippa, Eric Purdue",864,Inner Traditions Bear and Company,2021-12-09,176.11,29.39,4.12,1489,30,80,269,419,691,219251,9781644114162,English,"Society, Social, Sciences"
How to Write a Lot : A Practical Guide to Productive Academic Writing,Paul J. Silvia,110,American Psychological Association,2018-09-25,17.08,3.42,4.07,4148,30,150,804,1700,1464,38116,9781433829734,English,"Society, Social, Sciences"
The Queer Art of Failure,Jack Halberstam,224,Duke University Press,2011-09-19,24.59,2.41,4.07,1938,29,85,331,765,728,42152,9780822350453,English,"Society, Social, Sciences"
Harry Potter Hogwarts Castle and Sticker Book : Lights Up!,Running Press,16,"Running Press,U.S.",2018-10-11,9.67,3.83,4.41,17,1,1,0,3,12,14528,9780762464401,English,"Society, Social, Sciences"
When God Was a Woman,Merlin Stone,265,HOUGHTON MIFFLIN,1978-05-04,16.50,3.50,3.95,5047,175,310,986,1688,1888,26199,9780156961585,English,"Society, Social, Sciences"
Reality Therapy : A New Approach to Psychiatry,William Glasser,192,HarperCollins Publishers Inc,2014-11-12,10.26,3.94,3.9,731,22,47,164,248,250,66823,9780060904142,English,"Society, Social, Sciences"
25 Read & Write Mini-Books : That Teach Word Families,Nancy Sanders,64,Scholastic Teaching Resources,2001-04-01,12.76,0.24,3.91,53,6,1,7,17,22,52662,9780439155878,English,"Society, Social, Sciences"
The Red Book,"C. G. Jung, Mark Kyburz, John Peck, Sonu Shamdasani",404,WW Norton & Co,2010-03-01,224.34,28.16,4.51,4754,72,126,358,966,3232,11401,9780393065671,English,"Society, Social, Sciences"
Books That Build Character : A Guide to Teaching Your Child Moral Values Through Stories,William Kilpatrick,336,SIMON & SCHUSTER,1994-11-01,19.12,2.68,4.07,195,2,5,35,89,64,300873,9780671884239,English,"Society, Social, Sciences"
2023 Guide to the Night Sky : A Month-by-Month Guide to Exploring the Skies Above Britain and Ireland,"Storm Dunlop, Wil Tirion, Royal Observatory Greenwich, Collins Astronomy, Collins Books",112,HarperCollins Publishers,2023-01-01,8.92,0.08,4.75,4,0,0,0,1,3,8179,9780008393540,English,"Society, Social, Sciences"
Honey for a Child's Heart : The Imaginative Use of Books in Family Life,Gladys Hunt,256,ZONDERVAN,2002-05-01,16.92,5.98,4.45,4177,21,60,367,1283,2446,36041,9780310242468,English,"Society, Social, Sciences"
Self-Knowledge,The School of Life,80,The School of Life Press,2018-11-06,11.76,0.74,4.04,1401,9,75,274,539,504,50678,9780995753501,English,"Society, Social, Sciences"
"Light on Life : The Yoga Journey to Wholeness, Inner Peace, and Ultimate Freedom","B.K.S. Iyengar, John J. Evans, Douglas Abrams",304,Rodale Press,2006-09-19,17.58,1.42,4.39,3310,18,73,351,1022,1846,19039,9781594865244,English,"Society, Social, Sciences"
The Book of Tea,Kakuzo Okakura,128,Penguin Books Ltd,2017-02-28,3.88,6.62,3.86,13097,248,853,3294,4790,3912,10890,9780241251355,English,"Society, Social, Sciences"
The Book of Imaginary Beings : (Penguin Classics Deluxe Edition),"Jorge Luis Borges, Andrew Hurley, Peter Sis",256,Penguin Putnam Inc,2006-09-26,17.30,2.70,4.07,8611,53,322,1814,3220,3202,63558,9780143039938,English,"Society, Social, Sciences"
Mindfulness-Based Cognitive Therapy for Depression,"Zindel V. Segal, Mark Williams, John Teasdale",471,Guilford Publications,2012-12-12,103.49,4.01,4.31,382,2,6,50,137,187,22199,9781462507504,English,"Society, Social, Sciences"
My Mouth Is a Volcano Activity and Idea Book,"Julia Cook, Carrie Hartman",24,National Center for Youth Issues,2009-12-01,9.82,2.18,4.45,62,0,3,7,11,41,9010,9781931636919,English,"Society, Social, Sciences"
March: Book One,"John Lewis, Andrew Aydin, Nate Powell",128,Top Shelf Productions,2016-10-17,15.21,0.79,4.34,52301,1134,1316,4664,16526,28661,41662,9781603093002,English,"Society, Social, Sciences"
"The Book of Ichigo Ichie : The Art of Making the Most of Every Moment, the Japanese Way","Francesc Miralles, Hector Garcia",208,Quercus Publishing,2020-06-23,14.72,3.78,3.92,4428,52,241,1086,1695,1354,12072,9781529401295,English,"Society, Social, Sciences"
The Four Agreements Companion Book : Using the Four Agreements to Master the Dream of Your Life,"Don Miguel Ruiz, Janet Mills",224,"Amber-Allen Publishing,U.S.",2000-10-16,12.91,1.59,4.24,4638,59,187,678,1358,2356,25501,9781878424488,English,"Society, Social, Sciences"
"The Man Who Loved Books Too Much : The True Story of a Thief, a Detective, and World of Literary Obsession",Allison Hoover Bartlett,288,Penguin Putnam Inc,2011-07-22,15.84,1.16,3.44,12506,394,1519,4697,4043,1853,148552,9781594484810,English,"Society, Social, Sciences"
Bloodlands : THE book to help you understand today's Eastern Europe,Timothy Snyder,544,Vintage Publishing,2011-09-01,13.27,0.23,4.36,13856,183,311,1384,4426,7552,7810,9780099551799,English,"Society, Social, Sciences"
The Philokalia Vol 1,"G.E.H. Palmer, The Rev. Kallistos Timothy Ware, Philip Sherrard",384,FABER & FABER,1984-04-01,20.40,1.10,4.48,1295,14,26,118,304,833,7426,9780571130139,English,"Society, Social, Sciences"
The Big Book of ACT Metaphors : A Practitioner's Guide to Experiential Exercises and Metaphors in Acceptance and Commitment Therapy,"Jill A. Stoddard, Niloofar Afari",272,New Harbinger Publications,2014-05-01,35.47,20.53,4.18,116,0,6,16,45,49,22857,9781608825295,English,"Society, Social, Sciences"
Maximum Achievement : Strategies and Skills that Will Unlock Your Hidden Powers to Succeed,Brian Tracy,352,Simon & Schuster,1995-06-05,15.27,0.23,4.12,5034,188,280,671,1493,2402,54858,9780684803319,English,"Society, Social, Sciences"
The Penguin Book of Norse Myths : Gods of the Vikings,Kevin Crossley-Holland,320,Penguin Books Ltd,2018-02-01,13.91,2.09,4.19,6209,36,136,1051,2382,2604,59579,9780241982075,English,"Society, Social, Sciences"
The Psychedelic Experience : A Manual Based on the Tibetan Book of the Dead,"Ralph Metzner, Richard Alpert, Timothy Leary, Daniel Pinchbeck",144,Penguin Books Ltd,2008-10-02,10.00,2.50,3.81,4955,165,409,1166,1673,1542,62925,9780141189635,English,"Society, Social, Sciences"
The Will to Power,Friedrich Nietzsche,608,Random House USA Inc,1968-08-12,17.36,2.64,4.06,9796,213,452,1844,3350,3937,59208,9780394704371,English,"Society, Social, Sciences"
Books do Furnish a Life : An electrifying celebration of science writing,Richard Dawkins,464,Transworld Publishers Ltd,2022-08-01,13.55,0.95,4,387,5,22,79,142,139,63374,9781529176490,English,"Society, Social, Sciences"
The Book of Tea,"Kakuzo Okakura, Christopher Benfey",112,Penguin Books Ltd,2019-07-17,8.92,2.58,3.86,13204,249,859,3321,4834,3941,64823,9780141191843,English,"Society, Social, Sciences"
What Is to Be Done? [Burning Questions of Our Movement],V I Lenin,178,Martino Fine Books,2013-09-11,11.51,1.19,4.01,2968,82,190,564,908,1224,60728,9781614274780,English,"Society, Social, Sciences"
Waldorf Kindergarten Snack Book,Lisa Hildreth,64,Anthroposophic Press Inc,2006-01-01,11.36,4.64,3.89,57,3,4,12,15,23,58269,9780880105637,English,"Society, Social, Sciences"
Ogilvy on Advertising,David Ogilvy,224,Random House USA Inc,1987-03-01,30.79,0.71,4.14,10214,185,364,1603,3731,4331,55811,9780394729039,English,"Society, Social, Sciences"
The Little Book of Currency Trading : How to Make Big Profits in the World of Forex,Kathy Lien,224,John Wiley & Sons Inc,2011-02-04,17.35,4.05,3.61,258,6,21,101,69,61,105009,9780470770351,English,"Society, Social, Sciences"
Harry Potter: The Monster Book of Monsters : It Roams and Chomps!,Donald Lemke,48,"Running Press,U.S.",2020-12-17,13.45,2.05,4,2,0,0,0,2,0,53106,9780762497171,English,"Society, Social, Sciences"
The Tibetan Book of the Dead : Liberation Through Understanding in the Between,Robert Thurman,304,Random House USA Inc,1994-01-01,16.62,3.88,4.06,943,11,40,203,313,376,54915,9780553370904,English,"Society, Social, Sciences"
"Cengage Advantage Books: Understanding Arguments, Concise Edition","Walter Sinnott-Armstrong, Robert Fogelin",352,"Cengage Learning, Inc",2014-01-01,52.80,4.20,4,38,0,3,6,17,12,315108,9781285197395,English,"Society, Social, Sciences"
This Is Shakespeare : How to Read the World's Greatest Playwright,Emma Smith,368,Penguin Books Ltd,2020-04-02,11.47,1.03,4.28,886,4,14,101,376,391,15776,9780241361634,English,"Society, Social, Sciences"
The Comfort Book : The instant No.1 Sunday Times Bestseller,Matt Haig,272,Canongate Books,2021-07-06,19.24,1.76,4.1,41581,505,1748,7591,14930,16807,6958,9781786898296,English,"Society, Social, Sciences"
"Body Respect : What Conventional Health Books Get Wrong, Leave Out, and Just Plain Fail to Understand about Weight","Linda Bacon, Lucy  Aphramor",232,BenBella Books,2014-09-02,11.26,0.73,4.21,1669,13,44,262,604,746,53837,9781940363196,English,"Society, Social, Sciences"
Structure Of Magic V1 : A Book About Language And Therapy,John Grinder,225,"Science & Behavior Books Inc.,U.S.",2005-09-13,20.17,1.33,4.07,929,24,36,175,310,384,20563,9780831400446,English,"Society, Social, Sciences"
Poor Economics : The Surprising Truth about Life on Less Than $1 a Day,"Abhijit V. Banerjee, Esther Duflo",320,Penguin Books Ltd,2012-03-29,12.57,0.93,4.28,19795,100,414,2358,7808,9115,54750,9780718193669,English,"Society, Social, Sciences"
Night,"Elie Wiesel, Marion Wiesel",144,"Hill & Wang Inc.,U.S.",2006-01-16,10.41,2.09,4.36,1148947,13476,27382,126320,345748,636021,1544,9780374500016,English,"Society, Social, Sciences"
Overcoming Bulimia Nervosa and Binge Eating 3rd Edition : A self-help guide using cognitive behavioural techniques,Prof Peter Cooper,256,"Little, Brown Book Group",2021-01-12,9.98,4.02,3.83,53,3,6,10,12,22,63734,9781849010757,English,"Society, Social, Sciences"
The Book on the Taboo Against Knowing Who You Are,Alan Watts,176,Profile Books Ltd,2009-05-05,8.68,2.82,4.22,20021,331,824,2725,6337,9804,4447,9780285638532,English,"Society, Social, Sciences"
The Book of Human Emotions : An Encyclopedia of Feeling from Anger to Wanderlust,Tiffany Watt Smith,320,Profile Books Ltd,2016-11-09,10.87,1.63,3.9,933,6,51,225,402,249,12876,9781781251300,English,"Society, Social, Sciences"
"The Gentle Sleep Book : Gentle, No-Tears, Sleep Solutions for Parents of Newborns to Five-Year-Olds : First edition",Sarah Ockwell-Smith,336,"Little, Brown Book Group",2021-01-19,15.74,2.76,3.93,1545,30,91,348,571,505,15759,9780349405209,English,"Society, Social, Sciences"
The Little Book Of Hindu Deities : From the Goddess of Wealth to the Sacred Cow,Sanjay Patel,128,Penguin Putnam Inc,2006-12-02,15.95,3.05,4.36,991,7,22,104,328,530,28420,9780452287754,English,"Society, Social, Sciences"
Easy and Engaging ESL Activities and Mini-books for Every Classroom,Kama Eilnhorn,64,Scholastic US,2001-06-01,12.68,0.32,3.44,36,2,4,13,10,7,88296,9780439153911,English,"Society, Social, Sciences"
Essentials of WISC-V Assessment,DP Flanagan,656,John Wiley & Sons Inc,2017-04-07,41.21,14.79,4.19,31,0,1,5,12,13,50669,9781118980873,English,"Society, Social, Sciences"
Little Book of Louis Vuitton : The Story of the Iconic Fashion House,Karen Homer,160,Welbeck Publishing Group,2021-09-07,16.98,1.52,4.09,93,0,2,17,45,29,10036,9781787397415,English,"Society, Social, Sciences"
Some of My Best Friends are Books : Guiding Gifted Readers (3rd Edition),Judith Wynn Halsted,596,Great Potential Press Inc,2009-09-01,27.61,2.89,3.92,254,3,17,52,107,75,121926,9780910707961,English,"Society, Social, Sciences"
"Sara, Book 2 : Solomon's Fine Featherless Friends","Esther Hicks, Jerry Hicks",256,Hay House Inc,2008-07-31,14.74,1.26,4.55,729,5,18,62,132,512,27392,9781401911591,English,"Society, Social, Sciences"
National Populism : The Revolt Against Liberal Democracy,"Roger Eatwell, Matthew Goodwin",384,Penguin Books Ltd,2020-10-20,12.37,1.13,3.84,1102,16,66,250,514,256,34793,9780241312001,English,"Society, Social, Sciences"
Overcoming Depression 3rd Edition : A self-help guide using cognitive behavioural techniques,Paul Gilbert,624,"Little, Brown Book Group",2021-03-02,16.03,1.47,3.89,431,8,30,103,149,141,15911,9781849010665,English,"Society, Social, Sciences"
"Overcoming Social Anxiety and Shyness, 2nd Edition : A self-help guide using cognitive behavioural techniques",Dr. Gillian Butler,400,"Little, Brown Book Group",2021-01-19,12.84,3.16,3.79,672,19,58,148,270,177,44134,9781472120434,English,"Society, Social, Sciences"
Business Adventures : Twelve Classic Tales from the World of Wall Street: The New York Times bestseller Bill Gates calls 'the best business book I've ever read',John Brooks,464,John Murray Press,2018-10-31,13.23,2.77,3.82,22440,1063,1734,5068,6965,7610,12689,9781473611528,English,"Society, Social, Sciences"
"Words that Sell, Revised and Expanded Edition",Richard Bayan,160,McGraw-Hill Education - Europe,2006-05-30,15.43,2.07,4.02,794,20,44,151,262,317,8344,9780071467858,English,"Society, Social, Sciences"
A Book Of Silence,"Granta, Sara Maitland",320,Granta Books,2009-08-03,10.88,1.62,3.77,1260,39,98,334,434,355,28297,9781847081513,English,"Society, Social, Sciences"
The Brain That Changes Itself : Stories of Personal Triumph from the Frontiers of Brain Science,Norman Doidge,448,Penguin Random House Australia,2008-01-23,17.93,0.57,4.2,35359,635,1131,5076,12272,16245,66196,9780143113102,English,"Society, Social, Sciences"
Economics: The User's Guide : A Pelican Introduction,Ha-Joon Chang,528,Penguin Books Ltd,2018-10-31,14.82,1.18,4.17,6806,49,194,978,2932,2653,6976,9780718197032,English,"Society, Social, Sciences"
The Body Remembers : The Psychophysiology of Trauma and Trauma Treatment,Babette Rothschild,208,WW Norton & Co,2011-05-12,31.61,0.99,4.29,1928,15,54,220,716,923,15821,9780393703276,English,"Society, Social, Sciences"
Beat Dyslexia: Bk. 1 : A Step-by-step Multi Sensory Literacy Programme,"Elizabeth Franks, Myra Nicholson, Celia Stone",96,LDA,2007-04-05,38.76,0.84,4,2,0,0,1,0,1,73587,9781855034174,English,"Society, Social, Sciences"
The Little Book Of Wisdom,Dalai Lama,160,Ebury Publishing,2000-07-06,4.97,0.53,4.24,2836,27,76,444,933,1356,4242,9780712605533,English,"Society, Social, Sciences"
"The LDN Book : How a Little-Known Generic Drug - Low Dose Naltrexone - Could Revolutionize Treatment for Autoimmune Diseases, Cancer, Autism, Depression, and More",Linda Elsegood,240,Chelsea Green Publishing Co,2016-03-08,22.72,4.78,4.15,118,2,7,13,45,51,36759,9781603586641,English,"Society, Social, Sciences"
Being Ecological,Timothy Morton,240,Penguin Books Ltd,2019-02-13,11.20,2.30,3.56,593,29,67,162,212,123,45995,9780241274231,English,"Society, Social, Sciences"
"One Piece, Vol. 94",Eiichiro Oda,208,"Viz Media, Subs. of Shogakukan Inc",2020-08-20,9.90,0.10,4.61,2162,11,16,143,457,1535,23125,9781974715374,English,"Society, Social, Sciences"
The Tibetan Book of the Dead : The Great Liberation Through Hearing In The Bardo,"Chgyam Trungpa, Francesca Fremantle",144,Shambhala Publications Inc,2000-10-10,14.62,5.88,3.89,5217,211,380,1080,1635,1911,62758,9781570627477,English,"Society, Social, Sciences"
"The Book of Beautiful Questions : The Powerful Questions That Will Help You Decide, Create, Connect, and Lead",Warren Berger,288,Bloomsbury Publishing USA,2019-12-12,15.01,3.49,4.13,724,7,22,134,268,293,60242,9781632869579,English,"Society, Social, Sciences"
The Little Book of Psychology : An Introduction to the Key Psychologists and Theories You Need to Know,"Emily Ralls, Caroline Riggs",128,Octopus Publishing Group,2022-04-05,7.37,1.63,4.02,817,10,20,177,349,261,10260,9781786858078,English,"Society, Social, Sciences"
Get Out of Your Mind and Into Your Life for Teens : A Guide to Living an Extraordinary Life,Joseph Ciarrochi,136,New Harbinger Publications,2012-09-06,15.08,3.42,3.87,149,3,13,31,56,46,8547,9781608821938,English,"Society, Social, Sciences"
Sandplay Therapy : A Step-by-Step Manual for Psychotherapists of Diverse Orientations,"Barbara Labovitz Boik, E. Anna Goodwin",304,WW Norton & Co,2000-01-26,37.64,1.16,4.11,28,0,1,6,10,11,167943,9780393703191,English,"Society, Social, Sciences"
Anti-Education,"Friederich Nietzsche, Damion Searls, Paul Reitter, Chad Wellmon",136,"The New York Review of Books, Inc",2015-12-15,10.85,1.65,3.79,543,9,47,139,204,144,154672,9781590178942,English,"Society, Social, Sciences"
"Three ""Whys"" of the Russian Revolution",Richard Pipes,96,Random House USA Inc,1997-06-01,12.08,2.92,3.57,264,11,27,83,86,57,178101,9780679776468,English,"Society, Social, Sciences"
The Emotionally Abused Woman : Overcoming Destructive Patterns and Reclaiming Yourself,Beverly Engel,256,Random House USA Inc,1992-02-01,14.32,3.18,4.08,430,11,20,85,121,193,165190,9780449906446,English,"Society, Social, Sciences"
"Innovation Book, The : How to Manage Ideas and Execution for Outstanding Results",Max McKeown,296,Pearson Education Limited,2014-09-15,29.28,13.22,3.65,52,1,4,13,28,6,342093,9781292011905,English,"Society, Social, Sciences"
The Constitution of the United States of America,Founding Fathers,36,"Applewood Books, U.S.",1995-08-01,9.98,1.02,4.52,26790,483,667,2372,4212,19056,178556,9781557091055,English,"Society, Social, Sciences"
The World War 2 Trivia Book : Interesting Stories and Random Facts from the Second World War,"Bill O'Neill, Dwayne Walker",174,LAK Publishing,2020-03-04,11.40,0.40,3.86,416,21,29,90,123,153,343306,9781648450129,English,"Society, Social, Sciences"
The Book of Balance and Harmony : A Taoist Handbook,Thomas Cleary,176,Shambhala Publications Inc,2003-11-11,21.71,4.79,4.19,58,0,1,10,24,23,326843,9781590300770,English,"Society, Social, Sciences"
Morphology of the Folktale : Second Edition,"V. Propp, Laurence Scott, Louis A. Wagner",184,University of Texas Press,1968-06-01,20.10,8.80,4.01,1773,11,79,402,673,608,141863,9780292783768,English,"Society, Social, Sciences"
Manager's Guide to Crisis Management,Jonathan Bernstein,192,McGraw-Hill Education - Europe,2011-12-16,18.49,3.01,3.62,32,1,3,9,13,6,194750,9780071769495,English,"Society, Social, Sciences"
ICT InteraCT for Key Stage 3 Pupil's Book 1,Bob Reeves,120,Hodder Education,2008-01-30,21.49,5.84,3,2,0,0,2,0,0,62299,9780340940976,English,"Society, Social, Sciences"
"The Bond Book, Third Edition: Everything Investors Need to Know About Treasuries, Municipals, GNMAs, Corporates, Zeros, Bond Funds, Money Market Funds, and More",Annette Thau,448,McGraw-Hill Education - Europe,2010-12-28,32.94,10.56,4.05,340,7,14,62,128,129,149504,9780071664707,English,"Society, Social, Sciences"
Abnormal Psychology : An Integrative Approach,"David Barlow, Stefan Hofmann, V. Durand",784,"Cengage Learning, Inc",2017-01-01,88.55,123.07,4.01,651,18,22,117,275,219,134299,9781305950443,English,"Society, Social, Sciences"
The Crying Book,Heather Christle,208,"Little, Brown Book Group",2021-02-04,8.43,3.07,3.84,2816,62,189,706,1045,814,45976,9781472154712,English,"Society, Social, Sciences"
"The Shadow Book of Ji Yun : The Chinese Classic of Weird True Tales, H",Yn Ji,338,Empress Wu Books,2021-06-05,23.44,2.26,4.35,68,1,0,11,18,38,23426,9781953124012,English,"Society, Social, Sciences"
In The Freud Archives,Janet Malcolm,176,"The New York Review of Books, Inc",2002-11-30,16.48,2.52,4.19,933,5,27,149,357,395,186197,9781590170274,English,"Society, Social, Sciences"
End of Molasses Classes,Ron Clark,352,SIMON & SCHUSTER,2012-04-17,19.52,0.48,4.18,1535,20,53,251,513,698,199934,9781451639742,English,"Society, Social, Sciences"
Welsh for Beginners with CD,"Angela Wilkes, John Shackell",48,Usborne Publishing Ltd,2001-08-31,13.67,1.33,3.91,46,1,3,13,11,18,174482,9780746046449,English,"Society, Social, Sciences"
