title,authors,number_of_pages,publisher,publication_date,price_in_euros,discount_in_euros,rating,number_of_votes_goodreads,number_of_votes_one_star,number_of_votes_two_stars,number_of_votes_three_stars,number_of_votes_four_stars,number_of_votes_five_stars,bestsellers_rank,isbn13,language,category
Overcoming Perfectionism 2nd Edition : A self-help guide using scientifically supported cognitive behavioural techniques,"Roz Shafran, Sarah Egan, Tracey Wade",448,"Little, Brown Book Group",2019-04-30,13.45,2.55,3.82,205,4,9,60,78,54,52494,9781472140562,English,"Society, Social, Sciences"
Publishing E-Books For Dummies,A Luke,320,John Wiley & Sons Inc,2012-09-30,20.42,6.48,4.22,162,1,6,26,52,77,364368,9781118342909,English,"Society, Social, Sciences"
The Critic : A tantalising cold-case murder mystery (The Enzo Files Book 2),Peter May,400,Quercus Publishing,2016-11-01,10.12,1.38,3.74,4359,60,264,1344,1783,908,33485,9781782062097,English,"Society, Social, Sciences"
The Interpretation of Fairy Tales,Marie-Louise von Franz,224,Shambhala Publications Inc,1996-07-09,18.76,7.74,4.14,1036,11,42,184,348,451,32646,9780877735267,English,"Society, Social, Sciences"
Scratch & Sniff Book of Weed,"Seth Matlins, Eve Epstein, Ann Pickard",22,Abrams,2017-04-18,16.64,0.86,4.49,41,0,1,2,14,24,98445,9781419724527,English,"Society, Social, Sciences"
Portable Magic : A History of Books and their Readers,Emma Smith,352,Penguin Books Ltd,2022-04-28,23.94,0.56,3.92,200,1,8,48,92,51,83186,9780241427262,English,"Society, Social, Sciences"
The Ladies' Book of Etiquette and Manual of Politeness,Florence Hartley,256,Hesperus Press Ltd,2015-02-01,15.24,0.26,3.56,408,16,52,124,121,95,90866,9781843915423,English,"Society, Social, Sciences"
The Little Book of Feminism,Harriet Dyer,96,Octopus Publishing Group,2016-09-28,7.04,0.46,3.99,576,7,10,136,253,170,110508,9781849538442,English,"Society, Social, Sciences"
The Mammoth Book of New CSI : Forensic science in over thirty real-life crime scene investigations,Nigel Cawthorne,464,"Little, Brown Book Group",2012-05-24,12.48,1.52,3.68,123,2,8,44,42,27,19717,9781780330020,English,"Society, Social, Sciences"
The Big Activity Book for Anxious People,"Jordan Reid, Erin Williams",160,Penguin Putnam Inc,2019-05-07,16.37,0.13,3.79,118,4,13,25,38,38,89219,9780525538066,English,"Society, Social, Sciences"
The Book of Legendary Lands,"Umberto Eco, Alastair McEwen",480,Quercus Publishing,2015-09-03,32.29,4.21,4.12,1339,10,29,269,507,524,95592,9780857052964,English,"Society, Social, Sciences"
Complete Musashi: The Book of Five Rings and Other Works : Definitive New Translations of the Writings of Miyamoto Musashi - Japan's Greatest Samurai!,"Musashi, Alexander Bennett",240,Tuttle Publishing,2021-03-02,14.20,0.30,4.35,26,0,1,3,8,14,20473,9784805316160,English,"Society, Social, Sciences"
HBR's 10 Must Reads Boxed Set with Bonus Emotional Intelligence (7 Books) (HBR's 10 Must Reads),"Harvard Business Review, Peter F. Drucker, Clayton M. Christensen, Daniel Goleman, Michael E. Porter",1617,Harvard Business Review Press,2017-04-04,109.65,6.34,5,2,0,0,0,0,2,191571,9781633693319,English,"Society, Social, Sciences"
When I Care About Others,Cornelia Spelman,24,Albert Whitman & Company,2004-03-01,8.69,0.31,4.01,126,2,5,32,38,49,51093,9780807588987,English,"Society, Social, Sciences"
AQA Biology A2 Student Book,"Glenn Toole, Susan Toole",328,Oxford University Press,2014-11-01,16.21,20.89,3.94,18,1,0,0,15,2,109441,9780748798131,English,"Society, Social, Sciences"
The Penguin Writer's Manual,"Martin Manser, Stephen Curtis",352,Penguin Books Ltd,2002-03-28,14.42,1.58,3.76,89,2,2,29,38,18,55779,9780140514896,English,"Society, Social, Sciences"
The Ancient Egyptian Books of the Afterlife,"Erik Hornung, David Lorton",216,Cornell University Press,1999-06-17,27.87,1.63,4.11,84,2,1,14,36,31,400424,9780801485152,English,"Society, Social, Sciences"
The Vegan Book of Permaculture,Graham Burnett,304,Permanent Publications,2015-01-15,20.24,0.26,4.26,46,0,4,3,16,23,26332,9781856232012,English,"Society, Social, Sciences"
Book Of Tells,Peter Collett,400,Transworld Publishers Ltd,2004-06-01,13.11,0.89,3.65,603,11,45,205,224,118,123867,9780553814590,English,"Society, Social, Sciences"
Do Design : Why Beauty is Key to Everything,Alan Moore,112,The Do Book Co,2016-05-10,9.68,2.82,3.63,63,3,5,20,19,16,59566,9781907974281,English,"Society, Social, Sciences"
The Human Planet : How We Created the Anthropocene,"Simon Lewis, Mark A. Maslin",480,Penguin Books Ltd,2018-06-07,12.93,0.57,4.27,544,1,8,64,243,228,73184,9780241280881,English,"Society, Social, Sciences"
The Art of War by Sun Tzu & The Book of Five Rings by Miyamoto Musashi,"Sun Tzu, Musashi",152,www.bnpublishing.com,2007-04-30,13.88,1.32,4.41,459,9,6,56,105,283,68887,9789562912501,English,"Society, Social, Sciences"
Without Feathers,Woody Allen,224,Random House USA Inc,1990-01-01,8.49,1.51,3.9,10015,258,550,2235,3836,3136,43650,9780345336972,English,"Society, Social, Sciences"
The Ultimate Girls' Body Book : Not-So-Silly Questions About Your Body,"Walt Larimore, MD, Amaryllis Sanchez Wohlever, MD",272,ZONDERVAN,2013-12-31,11.16,3.44,4.49,35,0,0,4,10,21,58934,9780310739814,English,"Society, Social, Sciences"
The Ladybird Book of Red Tape,"Jason Hazeley, Joel Morris",56,Penguin Books Ltd,2016-10-20,10.09,1.41,3.93,186,0,13,45,70,58,8370,9780718184391,English,"Society, Social, Sciences"
Mastering Your Hidden Self : A Guide to the Huna Way,Serge Kahili King,192,"Quest Books,U.S.",1985-04-01,15.30,0.20,3.9,516,22,36,101,170,187,49798,9780835605915,English,"Society, Social, Sciences"
"The Gentle Parenting Book : How to raise calmer, happier children from birth to seven",Sarah Ockwell-Smith,320,"Little, Brown Book Group",2021-06-01,15.40,3.10,4.09,458,3,21,86,169,179,57873,9780349408729,English,"Society, Social, Sciences"
"The Mastery of Love : A Practical Guide to the Art of Relationship, A Toltec Wisdom Book","Don Miguel Ruiz, Janet Mills",224,"Amber-Allen Publishing,U.S.",1999-05-01,14.14,0.36,4.26,47193,814,1780,6528,13314,24757,602,9781878424426,English,"Society, Social, Sciences"
100 Sight Word Mini-Books : Instant Fill-In Mini-Books That Teach 100 Essential Sight Words,"Lisa Cestnik, Jay Cestnik",112,Teaching Resources,2005-12-01,16.29,0.21,4.17,29,0,2,5,8,14,37639,9780439387804,English,"Society, Social, Sciences"
The Mammoth Book of the Kama Sutra,Maxim Jakubowski,512,"Little, Brown Book Group",2008-08-28,15.41,0.59,4.03,34,1,1,8,10,14,26630,9781845298227,English,"Society, Social, Sciences"
Spelunky : Boss Fight Books #11,Derek Yu,224,Boss Fight LLC,2016-03-29,13.38,3.12,4.43,1405,0,10,108,550,737,23449,9781940535111,English,"Society, Social, Sciences"
The Met Office Pocket Cloud Book,"Richard Hamblyn, The Met Office",128,David & Charles,2010-05-28,9.96,4.04,4.19,31,0,2,4,11,14,97586,9780715337615,English,"Society, Social, Sciences"
The Book of Contemplation : Islam and the Crusades,Usama ibn Munqidh,400,Penguin Books Ltd,2008-10-01,14.91,1.59,3.92,364,5,21,77,157,104,128596,9780140455137,English,"Society, Social, Sciences"
A Book Forged in Hell : Spinoza's Scandalous Treatise and the Birth of the Secular Age,Steven Nadler,304,Princeton University Press,2013-11-24,14.37,3.62,4,687,2,23,147,314,201,41752,9780691160184,English,"Society, Social, Sciences"
What We See When We Read,Peter Mendelsund,448,Random House USA Inc,2014-08-05,17.70,0.80,3.7,5265,146,482,1461,1904,1272,69489,9780804171632,English,"Society, Social, Sciences"
Structure Of Magic Vol 2 : A Book About Communication And Change,John Grinder,198,"Science & Behavior Books Inc.,U.S.",1989-11-01,19.42,2.08,4.06,378,7,16,70,140,145,31005,9780831400491,English,"Society, Social, Sciences"
The Book of the Cailleach : Stories of the Wise Woman Healer,Gearoid Crualaoich,320,Cork University Press,2006-12-30,31.97,6.53,4.09,23,0,1,5,8,9,9518,9781859184127,English,"Society, Social, Sciences"
The Complete Book of Tai Chi Chuan : A Comprehensive Guide to the Principles and Practice,Wong Kiew Kit,336,Tuttle Publishing,2002-11-15,19.58,0.92,3.98,187,3,12,44,54,74,103103,9780804834407,English,"Society, Social, Sciences"
The Book of Chuang Tzu,"Chuang Tzu, Martin Palmer",352,Penguin Books Ltd,2007-12-01,12.89,1.11,4.35,2503,21,65,324,703,1390,63176,9780140455373,English,"Society, Social, Sciences"
25 Easy Bilingual Nonfiction Mini-Books : Easy-To-Read Reproducible Mini-Books in English and Spanish That Build Vocabulary and Fluency--And Support the Social Studies and Science Topics You Teach,Judy Nayer,64,Teaching Resources,2005-12-01,12.69,0.31,4.25,12,0,1,1,4,6,119811,9780439705448,English,"Society, Social, Sciences"
The Weekend : A Sunday Times 'Best Books for Summer 2021',Charlotte Wood,288,Orion Publishing Co,2021-06-24,9.82,1.68,3.42,12036,453,1524,4294,4089,1676,43382,9781474612999,English,"Society, Social, Sciences"
Shadow and Evil in Fairy Tales,Marie-Louise von Franz,352,Shambhala Publications Inc,1995-03-01,25.12,7.88,4.3,721,2,30,90,229,370,46534,9780877739746,English,"Society, Social, Sciences"
The Book of Ho'oponopono : The Hawaiian Practice of Forgiveness and Healing,"Luc Bodin, Nathalie Bodin Lamboy, Jean Graciet",160,Inner Traditions Bear and Company,2016-04-21,13.64,0.86,3.97,276,8,20,53,87,108,36389,9781620555101,English,"Society, Social, Sciences"
The Little Book of Gratitude,Dr Dr Robert A Emmons A PhD,96,Octopus Publishing Group,2016-09-06,10.03,0.97,4.04,354,4,17,72,130,131,32711,9781856753654,English,"Society, Social, Sciences"
The Emerald Tablet of Hermes & The Kybalion : Two Classic Books on Hermetic Philosophy,"Hermes Trismegistus, The Three Initiates",126,Quick Time Press,2020-05-05,9.75,2.35,4.46,506,4,12,52,117,321,5282,9781946774804,English,"Society, Social, Sciences"
"The Disappointment Dragon : Learning to cope with disappointment (for all children and dragon tamers, including those with Asperger syndrome)","Kay Al-Ghani, Haitham Al-Ghani",64,Jessica Kingsley Publishers,2013-12-21,22.02,0.48,3.76,21,3,0,4,6,8,26015,9781849054324,English,"Society, Social, Sciences"
"Overcoming Low Self-Esteem, 2nd Edition : A self-help guide using cognitive behavioural techniques",Dr Melanie Fennell,432,"Little, Brown Book Group",2022-04-05,14.52,1.48,3.87,695,21,36,167,262,209,41373,9781472119292,English,"Society, Social, Sciences"
The Book of Human Emotions : An Encyclopedia of Feeling from Anger to Wanderlust,Tiffany Watt Smith,320,Profile Books Ltd,2016-11-09,10.87,1.63,3.9,933,6,51,225,402,249,12876,9781781251300,English,"Society, Social, Sciences"
Fear and Loathing in Las Vegas : A Savage Journey to the Heart of the American Dream,Hunter S. Thompson,224,Random House USA Inc,1998-05-12,14.53,3.47,4.07,330489,6795,16136,58062,114794,134702,56669,9780679785897,English,"Society, Social, Sciences"
Business Adventures : Twelve Classic Tales from the World of Wall Street: The New York Times bestseller Bill Gates calls 'the best business book I've ever read',John Brooks,464,John Murray Press,2018-10-31,13.23,2.77,3.82,22440,1063,1734,5068,6965,7610,12689,9781473611528,English,"Society, Social, Sciences"
The Little Book of Big Change : The No-Willpower Approach to Breaking Any Habit,Amy Johnson,200,New Harbinger Publications,2016-03-31,11.73,4.27,3.84,919,28,83,220,261,327,54092,9781626252301,English,"Society, Social, Sciences"
The Book of Boundaries : Set the limits that will set you free,Melissa Urban,368,Ebury Publishing,2022-10-20,18.98,2.02,4.35,815,4,16,84,296,415,31624,9781785044403,English,"Society, Social, Sciences"
Sefer Yetzira/the Book of Creation : The Book of Creation in Theory and Practice,Aryeh Kaplan,474,Red Wheel/Weiser,2005-02-17,37.07,5.43,4.32,1150,15,44,152,286,653,38032,9780877288558,English,"Society, Social, Sciences"
Trauma Stewardship: An Everyday Guide to Caring for Self While Caring for Others,"Laura van Dernoot Lipsky, Connie Burk",288,Berrett-Koehler,2009-05-04,21.26,1.24,4.34,4613,25,95,535,1579,2379,6146,9781576759448,English,"Society, Social, Sciences"
The Essential Kierkegaard,"Soren Kierkegaard, Howard V. Hong, Edna H. Hong",536,Princeton University Press,2000-06-19,37.99,2.01,4.19,1912,26,50,310,675,851,66381,9780691019406,English,"Society, Social, Sciences"
The Little Book Of Calm : The Two Million Copy Bestseller,Paul Wilson,160,Penguin Books Ltd,2016-07-28,5.84,0.66,3.92,470,7,34,118,140,171,57172,9780241257449,English,"Society, Social, Sciences"
The Megabook of Fluency,"Timothy V. Rasinski, Melissa Cheesman Smith",320,Scholastic US,2021-09-02,49.65,1.35,4.54,57,0,0,2,22,33,49318,9781338257014,English,"Society, Social, Sciences"
Creative Process in Gestalt Therapy,Joseph Zinker,304,Random House USA Inc,1978-07-12,17.43,2.07,4.14,155,1,9,23,57,65,22523,9780394725673,English,"Society, Social, Sciences"
Overcoming Obsessive Compulsive Disorder : A self-help guide using cognitive behavioural techniques,"David Veale, Rob Willson",480,"Little, Brown Book Group",2009-05-07,12.88,4.12,3.88,113,4,7,26,37,39,29646,9781849010726,English,"Society, Social, Sciences"
You Will be Able to Draw by the End of This Book,Jake Spicer,160,Octopus Publishing Group,2020-01-01,17.24,0.26,4.01,75,1,5,15,25,29,11078,9781781573716,English,"Society, Social, Sciences"
"Third Culture Kids : The Experience of Growing Up Among Worlds: The original, classic book on TCKs","David C. Pollock, Ruth E. Van Reken, Michael V. Pollock",480,John Murray Press,2017-11-30,22.07,2.93,4.11,1832,16,54,337,731,694,44221,9781473657663,English,"Society, Social, Sciences"
The Book of Qualities,Ruth J Gendler,112,HarperCollins Publishers Inc,1988-01-27,11.59,3.91,4.46,986,5,20,109,230,622,103387,9780060962524,English,"Society, Social, Sciences"
"The Little Book of Trumpisms : The Donald on Immigration, Global Warming, His Rivals, Mexicans and More","Seth Milstein, Bill Katovsky",120,HarperCollins Publishers,2016-05-09,5.88,0.62,3.12,91,5,23,29,24,10,18885,9781911042389,English,"Society, Social, Sciences"
Making the Modern World - Materials and Dematerialization,V Smil,242,John Wiley and Sons Ltd,2013-12-16,34.68,18.62,3.75,521,14,60,129,155,163,104004,9781119942535,English,"Society, Social, Sciences"
The Ladybird Book of The Quiet Night In,"Jason Hazeley, Joel Morris",56,Penguin Books Ltd,2018-06-01,9.80,5.70,3.51,105,3,13,36,33,20,79329,9780718188689,English,"Society, Social, Sciences"
The Tell-Tale Brain : A Neuroscientist's Quest for What Makes Us Human,V. S. Ramachandran,384,WW Norton & Co,2012-03-02,17.83,0.67,4.15,10181,139,368,1726,3517,4431,80417,9780393340624,English,"Society, Social, Sciences"
Notes On The Cinematograph,"Jonathan Griffin, Robert Bresson",128,"The New York Review of Books, Inc",2016-11-15,10.59,4.41,4.22,2670,26,89,386,930,1239,45379,9781681370248,English,"Society, Social, Sciences"
Reading in the Wild - The Book Whisperer's Keys to Cultivating Lifelong Reading Habits,D Miller,304,John Wiley & Sons Inc,2013-12-20,18.31,1.39,4.47,5287,17,82,466,1564,3158,50952,9780470900307,English,"Society, Social, Sciences"
A Book of Life,Peter Kingsley,258,CATAFALQUE PRESS,2021-09-01,25.74,5.46,4.42,45,0,1,8,7,29,72599,9781999638450,English,"Society, Social, Sciences"
Furiously Happy : A Funny Book About Horrible Things,Jenny Lawson,352,Pan Macmillan,2016-06-16,10.69,2.81,3.89,153591,6666,11471,29982,48814,56658,12468,9781447238348,English,"Society, Social, Sciences"
The Dalai Lama's Book of Love and Compassion,His Holiness the Dalai Lama,128,HarperCollins Publishers,2002-02-01,6.83,0.67,4.04,118,0,3,30,44,41,57776,9780007122875,English,"Society, Social, Sciences"
The A-Z of Therapeutic Parenting : Strategies and Solutions,Sarah Naish,344,Jessica Kingsley Publishers,2018-04-17,24.11,1.89,4.45,207,1,1,21,65,119,30498,9781785923760,English,"Society, Social, Sciences"
Introvert'S Way : Living a Quiet Life in a Noisy World,Sophia Dembling,208,Penguin Putnam Inc,2012-12-04,15.17,1.83,3.67,4450,108,469,1303,1490,1080,38349,9780399537691,English,"Society, Social, Sciences"
The Book of Five Rings,"Miyamoto Musashi, William Scott Wilson, Shiro Tsujimura",160,Shambhala Publications Inc,2018-06-06,19.45,1.05,4.01,44097,692,2460,9494,14696,16755,13617,9781590309841,English,"Society, Social, Sciences"
When I Feel Angry,Cornelia Spelman,24,Albert Whitman & Company,2004-03-01,8.93,0.07,4.03,557,6,29,130,170,222,53096,9780807588970,English,"Society, Social, Sciences"
Modern Man in Search of a Soul,"C. G. Jung, W.S. Dell, Cary F. Baynes",252,Elsevier Australia,1955-08-04,13.21,3.79,4.2,10866,142,347,1687,3751,4939,3087,9780156612067,English,"Society, Social, Sciences"
"Preliminary Studies for the ""The Philosophical Investigations"" - Generally Known as The Blue and Brown Books",Wittgenstein,210,John Wiley and Sons Ltd,2002-12-18,25.52,14.68,4.12,2377,36,98,436,772,1035,169757,9780631146605,English,"Society, Social, Sciences"
The Black Books,"C. G. Jung, Martin Liebscher, John Peck, Sonu Shamdasani",1648,WW Norton & Co,2020-10-13,240.96,14.54,4.5,38,1,0,3,9,25,92428,9780393088649,English,"Society, Social, Sciences"
"Sara, Book 1 : Sara Learns the Secret about the Law of Attraction","Esther Hicks, Jerry Hicks, Caroline Garrett",192,Hay House Inc,2007-07-27,11.75,3.25,4.42,1536,23,47,158,344,964,46271,9781401911584,English,"Society, Social, Sciences"
The First Ten Books,"Confucius, D.C. Lau",80,Penguin Books Ltd,2005-08-25,6.12,1.38,3.43,235,7,25,105,56,42,76467,9780141023809,English,"Society, Social, Sciences"
Phenomenology of Spirit,"G. W. F. Hegel, A. V. Miller, J. N. Findlay",630,Oxford University Press Inc,1979-06-14,23.02,6.98,3.95,17339,676,1200,3412,4999,7052,16471,9780198245971,English,"Society, Social, Sciences"
The Dalai Lama's Book of Wisdom,His Holiness the Dalai Lama,128,HarperCollins Publishers,2000-04-01,7.30,1.70,4.24,2841,28,76,444,936,1357,52941,9780722539552,English,"Society, Social, Sciences"
The Complete Book of Five Rings,"Miyamoto Musashi, Kenji Tokitsu",288,Shambhala Publications Inc,2010-05-11,18.79,2.71,4,44841,700,2531,9714,14917,16979,38142,9781590307977,English,"Society, Social, Sciences"
Books that Changed the World : The 50 Most Influential Books in Human History,Andrew Taylor,336,Quercus Publishing,2016-06-14,11.14,2.36,3.5,357,2,38,145,122,50,171486,9781782069423,English,"Society, Social, Sciences"
"The Complete Book of Pilates for Men : The Lifetime Plan for Strength, Power & Peak Performance",Daniel Lyon,352,HarperCollins Publishers Inc,2011-06-24,26.93,1.47,3.82,113,4,6,26,47,30,36515,9780060820770,English,"Society, Social, Sciences"
"Unnatural Causes : 'An absolutely brilliant book. I really recommend it, I don't often say that'  Jeremy Vine, BBC Radio 2",Dr Richard Shepherd,464,Penguin Books Ltd,2019-09-24,13.78,0.22,4.33,31532,156,581,3539,11574,15682,549,9781405923538,English,"Society, Social, Sciences"
The Penis Book : A Doctor's Complete Guide to the Penis - From Size to Function and Everything in Between,Aaron Spitz,304,Potter/Ten Speed/Harmony/Rodale,2018-02-20,16.53,0.97,4.05,398,4,11,81,169,133,76094,9781635650297,English,"Society, Social, Sciences"
The Ladybird Book of the Mid-Life Crisis,"Jason Hazeley, Joel Morris",56,Penguin Books Ltd,2015-10-29,9.30,0.70,3.89,639,14,41,142,246,196,54767,9780718183530,English,"Society, Social, Sciences"
The Mammoth Book of Celtic Myths and Legends,Peter Ellis,640,"Little, Brown Book Group",2022-05-10,14.16,1.84,4.1,2873,31,85,610,1000,1147,9499,9781841192482,English,"Society, Social, Sciences"
Ancient Secret of the Fountain of Youth Book 2,Peter Kelder,336,Ebury Publishing,2012-10-04,15.52,2.98,3.87,221,4,19,52,73,73,79579,9780753540077,English,"Society, Social, Sciences"
Book of Longing,Leonard Cohen,240,Penguin Books Ltd,2007-10-01,11.97,1.53,4.01,9627,139,501,1934,3599,3454,64226,9780141027562,English,"Society, Social, Sciences"
The Book of Moods : How I Turned My Worst Emotions Into My Best Life,"Lauren Martin, Barrie Kreinik",288,Grand Central Publishing,2020-12-08,24.47,3.53,3.84,2762,63,214,689,943,853,122436,9781538733622,English,"Society, Social, Sciences"
The Tibetan Book Of Living And Dying : A Spiritual Classic from One of the Foremost Interpreters of Tibetan Buddhism to the West,Sogyal Rinpoche,464,Ebury Publishing,2008-02-07,16.73,1.77,4.21,27828,496,1032,4143,8640,13517,5215,9781846041051,English,"Society, Social, Sciences"
The Book of Five Rings : A Classic Text on the Japanese Way of the Sword,"Miyamoto Musashi, Thomas Cleary",192,Shambhala Publications Inc,2005-01-11,8.81,2.19,4,44882,700,2534,9724,14932,16992,1466,9781590302484,English,"Society, Social, Sciences"
The People and the Books : 18 Classics of Jewish Literature,Adam Kirsch,432,WW Norton & Co,2016-11-11,25.34,7.16,4.21,163,2,3,23,65,70,364863,9780393241761,English,"Society, Social, Sciences"
How to Read a Book,"Mortimer J. Adler, Charles Van Doren",426,Simon & Schuster,2008-06-16,14.54,5.96,3.98,22534,591,1382,4390,7715,8456,2887,9780671212094,English,"Society, Social, Sciences"
The Dyscalculia Resource Book : Games and Puzzles for ages 7 to 14,Ronit Bird,272,SAGE Publications Ltd,2017-06-21,39.25,15.55,4.33,3,0,0,0,2,1,43837,9781473975002,English,"Society, Social, Sciences"
"Critical Thinking & Logic Mastery - 3 Books In 1 : How To Make Smarter Decisions, Conquer Logical Fallacies And Sharpen Your Thinking",Thinknetic,452,M & M Limitless Online Inc.,2022-01-03,29.36,5.24,3.29,14,0,3,6,3,2,312508,9781646963867,English,"Society, Social, Sciences"
No Worries! Mindful Kids : An activity book for children who sometimes feel anxious or stressed,"Lily Murray, Dr. Sharie Coombes, Katie Abey",96,Bonnier Books Ltd,2017-07-27,12.09,0.41,4.42,64,1,0,9,15,39,6091,9781787410879,English,"Society, Social, Sciences"
"Story of the World, Vol. 2 Audiobook : History for the Classical Child: The Middle Ages","Jim Weiss, Susan Wise Bauer",9,Peace Hill Press,2007-09-25,38.93,12.77,4.33,2514,23,41,290,882,1278,91335,9781933339122,English,"Society, Social, Sciences"
The Definitive Book of Body Language : How to read others' attitudes by their gestures,"Allan Pease, Barbara Pease",416,Orion Publishing Co,2017-05-11,11.43,2.07,3.96,25766,571,1371,5467,9474,8883,7244,9781409168508,English,"Society, Social, Sciences"
The One Thing : The Surprisingly Simple Truth Behind Extraordinary Results: Achieve your goals with one of the world's bestselling success books,"Gary Keller, Jay Papasan",240,John Murray Press,2016-05-10,9.67,3.83,4.13,58757,1227,2687,9379,19486,25978,80,9781848549258,English,"Society, Social, Sciences"
The Four Agreements : A Practical Guide to Personal Freedom (A Toltec Wisdom Book),"Don Miguel Ruiz, Janet Mills, Nicholas Wilton",160,"Amber-Allen Publishing,U.S.",1997-11-07,12.46,1.54,4.18,318447,7270,15474,47812,90621,157270,49,9781878424310,English,"Society, Social, Sciences"
The Intelligent Investor : The Definitive Book on Value Investing,Benjamin Graham,640,HarperCollins Publishers Inc,2003-10-23,21.59,3.41,4.25,115390,2556,3806,14993,35307,58728,235,9780060555665,English,"Society, Social, Sciences"
"Body Respect : What Conventional Health Books Get Wrong, Leave Out, and Just Plain Fail to Understand about Weight","Linda Bacon, Lucy  Aphramor",232,BenBella Books,2014-09-02,11.26,0.73,4.21,1669,13,44,262,604,746,53837,9781940363196,English,"Society, Social, Sciences"
The Ladies' Book of Etiquette and Manual of Politeness,Florence Hartley,256,Hesperus Press Ltd,2015-02-01,15.24,0.26,3.56,408,16,52,124,121,95,90866,9781843915423,English,"Society, Social, Sciences"
Little Black Book,Otegha Uwagba,160,HarperCollins Publishers,2019-07-23,8.01,0.99,3.56,2708,57,260,989,920,482,51629,9780008318987,English,"Society, Social, Sciences"
The Stanford Mathematics Problem Book : With Hints and Solutions,"George Polya, Jeremy Kilpatrick",80,Dover Publications Inc.,2009-03-27,7.36,2.64,4.07,84,1,7,10,33,33,13983,9780486469249,English,"Society, Social, Sciences"
The Ladybird Book of The Big Night Out,"Jason Hazeley, Joel Morris",56,Penguin Books Ltd,2018-06-01,9.31,5.69,3.5,88,3,12,31,22,20,90343,9780718188672,English,"Society, Social, Sciences"
"Overcoming Anger and Irritability, 2nd Edition : A self-help guide using cognitive behavioural techniques",Dr William Davies,400,"Little, Brown Book Group",2020-12-29,13.02,2.98,3.6,241,13,23,74,69,62,41369,9781472120229,English,"Society, Social, Sciences"
The Psychedelic Experience : A Manual Based on the Tibetan Book of the Dead,"Ralph Metzner, Richard Alpert, Timothy Leary, Daniel Pinchbeck",144,Penguin Books Ltd,2008-10-02,10.00,2.50,3.81,4955,165,409,1166,1673,1542,62925,9780141189635,English,"Society, Social, Sciences"
"Summary and Analysis of Thinking, Fast and Slow : Based on the Book by Daniel Kahneman",Worth Books,64,OPEN ROAD MEDIA,2017-05-09,8.55,2.44,3.82,22,1,0,7,8,6,63418,9781504046756,English,"Society, Social, Sciences"
The Ultimate Book of Heroic Failures,Stephen Pile,304,Faber & Faber,2012-10-04,12.14,1.86,3.82,306,8,20,72,124,82,65466,9780571277315,English,"Society, Social, Sciences"
"Darkly Dreaming Dexter : DEXTER NEW BLOOD, the major new TV thriller on Sky Atlantic (Book One)",Jeff Lindsay,288,Orion Publishing Co,2005-07-27,10.45,2.05,3.9,201963,6418,12932,44991,68022,69600,51483,9780752865744,English,"Society, Social, Sciences"
The Puberty Book : The classic puberty book for girls and boys aged 9-14,"Wendy Darvill, Kelsey Powell",208,Gill,2018-07-27,10.83,1.17,3.69,64,3,7,12,27,15,59855,9780717183265,English,"Society, Social, Sciences"
The Tibetan Book of the Dead : First Complete Translation,"Gyurme Dorje, Graham Coleman, Thupten Jinpa",592,Penguin Putnam Inc,2006-01-19,42.17,2.83,4.17,9395,203,385,1548,2731,4528,57264,9780670858866,English,"Society, Social, Sciences"
How to Find Love,The School of Life,80,The School of Life Press,2018-12-04,11.76,0.74,4.13,863,7,21,159,346,330,50694,9780995573697,English,"Society, Social, Sciences"
