title,authors,number_of_pages,publisher,publication_date,price_in_euros,discount_in_euros,rating,number_of_votes_goodreads,number_of_votes_one_star,number_of_votes_two_stars,number_of_votes_three_stars,number_of_votes_four_stars,number_of_votes_five_stars,bestsellers_rank,isbn13,language,category
Singer Sewing Book,Mary Picken,264,Read Books,2010-07-27,38.36,7.74,4.33,24,0,1,1,11,11,1120357,9781445514673,English,"Technology, Engineering"
"Capturing Sunlight, Book 1 : Skills & Ideas for Intensive Grazing, Sustainable Pastures, Healthy Soils, & Grassfed Livestock",Woody Lane,334,Lane Livestock Services,2020-01-20,25.22,4.88,4.57,7,0,0,1,1,5,1011296,9780983323822,English,"Technology, Engineering"
Newnes Radio and RF Engineering Pocket Book,"Steve Winder, Joseph Carr",344,Elsevier Science & Technology,2002-09-24,36.96,1.99,4,1,0,0,0,1,0,998756,9780750656085,English,"Technology, Engineering"
Green Up! : An A-Z of Environmentally Friendly Home Improvements,Will Anderson,144,Green Books,2007-10-04,8.81,2.84,3.6,5,0,1,1,2,1,740016,9781903998946,English,"Technology, Engineering"
Protection of Electronic Circuits,R Standler,464,Dover Publications Inc.,2003-03-28,31.15,1.35,4.29,7,0,0,1,3,3,760530,9780486425528,English,"Technology, Engineering"
"Food Microbiology - An Introduction, Fourth Edition",TJ Montville,624,American Society for Microbiology,2017-04-12,97.54,7.46,4,7,0,1,1,2,3,1363606,9781555819385,English,"Technology, Engineering"
"iPad Project Book, The","Michael Cohen, Dennis Cohen, Lisa Spangenberg",240,Pearson Education (US),2010-11-01,21.32,1.10,3.12,17,2,3,6,3,3,1810262,9780321714756,English,"Technology, Engineering"
Mechanical Vibration Practice and Noise Control,V. Ramamurti,430,Alpha Science International Ltd,2012-11-30,47.79,1.71,4.33,3,0,0,1,0,2,1961896,9781842657522,English,"Technology, Engineering"
Venetian Ships and Shipbuilders of the Renaissance,Frederic Chapin Lane,296,Johns Hopkins University Press,1992-10-27,30.20,13.60,4.11,9,0,1,2,1,5,1255906,9780801845147,English,"Technology, Engineering"
Alternative Energy Systems and Applications 2e,BK Hodge,460,John Wiley and Sons Ltd,2017-05-08,71.42,7.58,3.31,13,2,1,2,7,1,1899568,9781119109211,English,"Technology, Engineering"
Hop Production: Volume 16,V. Rybacek,258,Elsevier Science & Technology,1991-03-01,51.91,3.04,4,1,0,0,0,1,0,1664044,9780444987709,English,"Technology, Engineering"
"Water-Centric Sustainable Communities - Planning, Retrofitting and Constructing the Next Urban Environments",V Novotny,624,John Wiley & Sons Inc,2010-10-27,122.30,2.10,3,3,0,1,1,1,0,1668453,9780470476086,English,"Technology, Engineering"
The Book On Pekingese (A Vintage Dog Books Breed Classic),Dorothy Slater,128,Read Books,2007-04-03,21.75,10.45,4,1,0,0,0,1,0,9781406795622,9781406795622,English,"Technology, Engineering"
The Man Who Talks with the Flowers : The Intimate Life Story of Dr. George Washington Carver,Glenn Clark,40,Wilder Publications,2011-09-01,10.73,1.07,4.58,156,1,2,9,38,106,1203904,9781617204180,English,"Technology, Engineering"
Vogue's Book of Smart Dressmaking,Anon,66,Read Books,2011-04-15,21.67,10.53,4,1,0,0,0,1,0,2167008,9781447401117,English,"Technology, Engineering"
Foundations of Electrodynamics,Parry Moon,320,Dover Publications Inc.,2013-08-30,20.17,0.83,3.5,2,0,0,1,1,0,1666442,9780486497037,English,"Technology, Engineering"
The Last Beekeeper : Vespling Book 1,Jared Gulian,448,WaysOut Press,2021-09-30,23.59,0.31,4.09,162,2,12,30,44,74,1102042,9780473570927,English,"Technology, Engineering"
Regulating Safety of Traditional and Ethnic Foods,"V. Prakash, Olga Martin-Belloso, Larry Keener, Sian Bethan Astley, Susanne Braun, Helena McMahon, Huub Lelieveld",536,Elsevier Science Publishing Co Inc,2015-12-11,102.01,4.39,4,4,0,1,0,1,2,9780128006054,9780128006054,English,"Technology, Engineering"
"Image, Video & 3D Data Registration - Medical, Satllite & Video Processing Applications with Quality Metrics",V Argyriou,256,John Wiley & Sons Inc,2015-08-21,80.62,7.58,5,1,0,0,0,0,1,9781118702468,9781118702468,English,"Technology, Engineering"
"Electricity from Sunlight - Photovoltaic-Systems Integration and Sustainability, Second Edition",V Fthenakis,360,John Wiley & Sons Inc,2018-04-09,80.74,0.96,5,1,0,0,0,0,1,9781118963807,9781118963807,English,"Technology, Engineering"
Handbook of Nonwovens,S. J. Russell,544,Elsevier Science & Technology,2006-12-22,200.60,44.40,3.5,2,0,1,0,0,1,1761873,9781855736030,English,"Technology, Engineering"
War and the Transformation of Global Politics,V. Jabri,230,Palgrave Macmillan,2007-03-20,91.38,29.12,2.8,5,0,2,2,1,0,9780230006577,9780230006577,English,"Technology, Engineering"
Pular Art Deco Lighting: Shades of the Past,Herb Millman,176,Schiffer Publishing Ltd,2007-07-01,53.86,0.14,3.5,4,0,0,2,2,0,1862224,9780764320439,English,"Technology, Engineering"
Theory of Superconductivity,J. Robert Schrieffer,352,Taylor & Francis Inc,1971-01-22,69.52,1.48,4.5,2,0,0,0,1,1,1668480,9780738201207,English,"Technology, Engineering"
Driving Spaces - A Cultural-Historical Geography of England's M1 Motorway,P Merriman,320,John Wiley and Sons Ltd,2007-12-04,31.10,21.20,4,1,0,0,0,1,0,1711622,9781405130721,English,"Technology, Engineering"
The Ninth Metal : The Comet Cycle Book 1,Benjamin Percy,304,Hodder & Stoughton,2022-01-13,9.73,2.77,3.71,1672,28,137,460,706,341,1271974,9781473690080,English,"Technology, Engineering"
All New Bathroom Ideas that Work,David Schiff,192,Taunton Press Inc,2018-11-07,24.10,2.40,3.2,10,0,1,7,1,1,2637576,9781631868788,English,"Technology, Engineering"
"Fundamentals of III-V Devices - HBTs, MESFETs, and HFETs/HEMTs",W Liu,520,John Wiley & Sons Inc,1999-04-23,170.84,62.86,3.2,5,1,1,0,2,1,2416526,9780471297000,English,"Technology, Engineering"
"Audel Carpenter's and Builder's Layout, Foundation and Framing 7e V 3",MR Miller,320,John Wiley & Sons Inc,2004-11-12,34.83,9.17,5,1,0,0,0,0,1,2459386,9780764571121,English,"Technology, Engineering"
Pushing the Envelope : The Career of Fighter Ace and Test Pilot Marion Carl,"Maj Gen Marion E. Carl USMC (Ret.), Barrett Tillman",152,Naval Institute Press,2014-03-15,24.99,1.51,4.38,16,0,0,2,6,8,2644460,9781591148661,English,"Technology, Engineering"
Amelia,"Donald M. Goldstein, Katherine V. Dillon",352,Potomac Books Inc,2007-09-30,10.90,0.10,3.72,57,2,2,18,23,12,1364437,9781597970952,English,"Technology, Engineering"
"The New York Times Second Book of Science Questions and Answers : 225 New, Unusual, Intriguing, and Just Plain Bizarre Inquiries Into Everyday Scientific Mysteries",C. Claiborne Ray,240,Bantam Doubleday Dell Publishing Group Inc,2003-04-08,12.46,1.54,3.42,12,0,0,7,5,0,2403822,9780385722582,English,"Technology, Engineering"
Newnes Digital Logic IC Pocket Book: Volume 3,R M MARSTON,256,Elsevier Science & Technology,1996-10-17,37.26,2.69,2.67,3,1,0,1,1,0,2074731,9780750630184,English,"Technology, Engineering"
The Book : The Life Story of a Technology,Nicole Howard,192,ABC-CLIO,2005-09-30,53.10,5.30,3.5,119,3,10,50,36,20,9780313330285,9780313330285,English,"Technology, Engineering"
Practical Machinery Vibration Analysis and Predictive Maintenance,"Cornelius Scheffer, Paresh Girdhar",272,Elsevier Science & Technology,2004-09-09,53.76,5.19,3.4,5,0,2,0,2,1,1653475,9780750662758,English,"Technology, Engineering"
Coloss Bee Book Vol I : Standard Methods for Apis mellifera Research,"Vincent Dietemann, James D Ellis, Peter Neumann",640,International Bee Research Association,2017-12-14,117.52,75.48,5,1,0,0,0,0,1,3152209,9780860982838,English,"Technology, Engineering"
Coloss Bee Book Vol II : Standard Methods for Apis mellifera Pest and Pathogen Research,"Vincent Dietemann, James D Ellis, Peter Neumann",354,International Bee Research Association,2017-12-15,84.88,48.42,5,1,0,0,0,0,1,3152867,9780860982821,English,"Technology, Engineering"
Victorian Pencils: Tools to Jewels,Deb Crosby,224,Schiffer Publishing Ltd,1998-09-01,63.88,0.62,4,3,0,0,1,1,1,1675654,9780764304132,English,"Technology, Engineering"
Atlas of Fantastic Infrastructures : An Intimate Look at Media Architecture,"Mihye An, Ludger Hovestadt, Vera Bühlmann",392,Birkhäuser,2016-04-26,54.57,5.38,3,1,0,0,1,0,0,1982603,9783035606287,English,"Technology, Engineering"
Illustrated Manual of U.S. Portable Flamethrowers,Charles S. Hobson,160,Schiffer Publishing Ltd,2010-08-19,49.23,3.77,3.75,4,0,0,1,3,0,1679812,9780764335259,English,"Technology, Engineering"
MRI Techniques,V Perrin,232,ISTE Ltd and John Wiley & Sons Inc,2013-10-14,124.14,16.96,2,1,0,1,0,0,0,9781848215030,9781848215030,English,"Technology, Engineering"
Waterproof and Water Repellent Textiles and Clothing,John T. Williams,586,Elsevier Science & Technology,2017-11-15,167.59,47.41,4,3,0,1,0,0,2,1645353,9780081012123,English,"Technology, Engineering"
Finite Element Method in Machine Design,V. Ramamurti,452,Alpha Science International Ltd,2012-01-31,57.88,5.62,4.6,5,0,0,0,2,3,3705161,9781842657478,English,"Technology, Engineering"
Macro-Engineering : A Challenge for the Future,"V. Badescu, R.B. Cathcart, R.D. Schuiling",318,Springer-Verlag New York Inc.,2006-10-15,168.15,24.44,3.67,3,0,0,2,0,1,9781402037399,9781402037399,English,"Technology, Engineering"
Bionanotechnology : Proteins to Nanodevices,"V. Renugopalakrishnan, Randy V. Lewis",296,Springer,2010-10-19,184.27,35.71,5,1,0,0,0,0,1,9789048170784,9789048170784,English,"Technology, Engineering"
Waterproof and Water Repellent Textiles and Clothing,John T. Williams,586,Elsevier Science & Technology,2017-11-15,167.59,47.41,4,3,0,1,0,0,2,1645353,9780081012123,English,"Technology, Engineering"
Emerald Architecture: Case Studies in Green Building (GreenSource),Greensource Magazine,176,McGraw-Hill Education - Europe,2008-06-16,57.48,7.52,2.5,2,1,0,0,1,0,2367651,9780071544115,English,"Technology, Engineering"
Reeds Vol 11: Engineering Drawing,H.G. Beck,176,Bloomsbury Publishing PLC,2019-05-21,56.13,21.37,5,1,0,0,0,0,1,2161302,9781472969859,English,"Technology, Engineering"
"Fundamentals of III-V Devices - HBTs, MESFETs, and HFETs/HEMTs",W Liu,520,John Wiley & Sons Inc,1999-04-23,170.84,62.86,3.2,5,1,1,0,2,1,2416526,9780471297000,English,"Technology, Engineering"
"Healthy Land, Healthy Pasture, Healthy Horses : The Equicentral System Series Book 2","Jane Myers, Stuart Myers",262,Equiculture Publishing,2016-01-01,33.53,38.87,4.8,5,0,0,0,1,4,935234,9780994156181,English,"Technology, Engineering"
Macchi MC.200/MC.202/MC.205/ V Glares of War,Nicola Malizia,256,IBN,2006-06-15,52.92,7.18,5,1,0,0,0,0,1,2327684,9788875650308,English,"Technology, Engineering"
The Book Of The Goat - Containing Full Particulars Of The Various Breeds Of Goats And Their Profitable Management,"H.S., Holmes Pegler",376,Read Books,2008-11-30,39.09,7.31,4,2,0,0,0,2,0,2568397,9781443737593,English,"Technology, Engineering"
Modern Drying Technology - Computational Tools at Different Scales V 1,E Tsotsas,359,Wiley-VCH Verlag GmbH,2007-11-09,187.92,26.78,5,1,0,0,0,0,1,2765141,9783527315567,English,"Technology, Engineering"
The Prehistory and History of Ceramic Kilns V VII,PM Rice,262,American Ceramic Society,2006-03-15,121.75,46.05,4,1,0,0,0,1,0,2637483,9781574980264,English,"Technology, Engineering"
Yamaha XZ550 Vision V-Twins (82 - 85),Haynes Publishing,176,Haynes Manuals Inc,1988-09-01,38.34,5.16,4,1,0,0,0,1,0,2701737,9781850107613,English,"Technology, Engineering"
Dynamics of Polymeric Liquids 2e V 1,RB Bird,672,John Wiley & Sons Inc,1987-06-23,272.72,91.18,4.38,8,0,0,1,3,4,2070861,9780471802457,English,"Technology, Engineering"
How to Build Max-Performance Pontiac V-8s,Rocky Rotella,146,Cartech,2012-10-15,25.23,2.27,5,3,0,0,0,0,3,2219820,9781613254745,English,"Technology, Engineering"
Don'T Drink the Water (without Reading This Book) : Essential Guide to Our Contaminated Drinking Water and What You Can Do About it,Lono Kahuna Kupua A'o,112,"Kali Press,U.S.",2003-06-10,11.51,1.49,3.8,5,0,0,2,2,1,2497718,9780962888298,English,"Technology, Engineering"
History of the British Cavalry Vol.3 1872-1898,"George Charles Henry Victor Paget,Marquess of Anglesey",520,Pen & Sword Books Ltd,1997-03-01,45.73,28.77,4,2,0,0,0,2,0,2394152,9780436273278,English,"Technology, Engineering"
Horse Property Planning and Development : The Equicentral System Series Book 3,"Jane Myers, Stuart Myers",278,Equiculture Publishing,2016-01-01,33.85,39.75,4,1,0,0,0,1,0,1063666,9780994156198,English,"Technology, Engineering"
71 Famous Scientists : Who Spent Their Lives for Our Better Tomorrow,V&S Publishers Editorial board,160,V & S Publishers,2015-10-05,29.36,0.64,3.67,3,0,1,0,1,1,2743970,9789350571743,English,"Technology, Engineering"
Matchbox Toys: The Tyco Years 1993-1994,Charlie Mack,144,Schiffer Publishing Ltd,1997-01-06,19.80,4.20,3.25,4,1,1,0,0,2,1007571,9780887408656,English,"Technology, Engineering"
Analysis On Manifolds,James R. Munkres,380,Taylor & Francis Ltd,2019-06-13,127.05,10.45,4.04,47,0,2,10,19,16,2046358,9780367091156,English,"Technology, Engineering"
Gas Well Deliquification,"James F. Lea, Henry V. Nickens",608,Elsevier Science & Technology,2008-05-15,57.70,12.66,4,2,0,0,1,0,1,1097444,9780750682800,English,"Technology, Engineering"
"What Makes Up the Universe? Stars, Planets, Solar Systems and Galaxies Astronomy Guide Book Grade 3 Children's Astronomy & Space Books",Baby Professor,76,Baby Professor,2019-08-01,24.72,5.68,2,1,0,1,0,0,0,3551482,9781541975460,English,"Technology, Engineering"
Principles of Neural Information Theory : Computational Neuroscience and Metabolic Efficiency,James V Stone,214,Tutorial Introductions,2018-05-26,70.34,15.46,4.15,13,0,0,3,5,5,2500872,9780993367960,English,"Technology, Engineering"
Northr's Yf-17 Cobra: a Pictorial History,Don Logan,64,Schiffer Publishing Ltd,1997-01-08,20.84,0.16,3,1,0,0,1,0,0,1548301,9780887409103,English,"Technology, Engineering"
Artificial Superintelligence : A Futuristic Approach,Roman V. Yampolskiy,227,Apple Academic Press Inc.,2015-06-19,42.61,4.89,3.67,15,2,0,4,4,5,2179881,9781482234435,English,"Technology, Engineering"
A Cameo from the Past : The Prehistory and Early History of the Kruger National Park,U. de V. Pienaar,767,Protea Boekhuis,2013-04-14,77.34,2.16,5,2,0,0,0,0,2,2238258,9781869191955,English,"Technology, Engineering"
Are We There Yet? All About the Planet Mercury! Space for Kids - Children's Aeronautics & Space Book,Baby Professor,42,Baby Professor,2017-02-15,12.68,3.62,2,1,0,1,0,0,0,1957453,9781683269281,English,"Technology, Engineering"
Reliability Centered Maintenance-Reengineered : Practical Optimization of the RCM Process with RCM-R (R),"James V. Reyes-Picknell, Jesus R. Sifonte",349,Taylor & Francis Inc,2017-04-14,55.79,2.21,5,1,0,0,0,0,1,2171529,9781498785174,English,"Technology, Engineering"
The Unfamiliar Garden : The Comet Cycle Book 2,Benjamin Percy,224,Hodder & Stoughton,2022-07-09,8.95,2.45,3.8,657,9,41,180,268,159,1332897,9781473690158,English,"Technology, Engineering"
The Message of the Atoms : Essays on Wolfgang Pauli and the Unspeakable,Kalervo V. Laurikainen,206,Springer-Verlag Berlin and Heidelberg GmbH & Co. KG,2011-09-18,74.47,11.08,4,2,0,0,0,2,0,2783661,9783642644573,English,"Technology, Engineering"
Plastics End Use Applications,Donald V. Rosato,119,Springer-Verlag New York Inc.,2011-08-04,66.21,7.29,5,1,0,0,0,0,1,2567668,9781461402442,English,"Technology, Engineering"
Are We There Yet? All About the Planet Neptune! Space for Kids - Children's Aeronautics & Space Book,Baby Professor,42,Baby Professor,2017-02-15,12.68,3.62,2,1,0,1,0,0,0,1957452,9781683269274,English,"Technology, Engineering"
Are We There Yet? All About the Planet Uranus! Space for Kids - Children's Aeronautics & Space Book,Baby Professor,42,Baby Professor,2017-02-15,12.68,3.42,2,1,0,1,0,0,0,1957778,9781683269267,English,"Technology, Engineering"
Camouflage Uniforms of Eurean and NATO Armies: 1945 to the Present,J.F. Borsarello,120,Schiffer Publishing Ltd,2004-09-13,30.75,1.25,4.67,3,0,0,0,1,2,1428529,9780764310188,English,"Technology, Engineering"
Are We There Yet? All About the Planet Venus! Space for Kids - Children's Aeronautics & Space Book,Baby Professor,42,Baby Professor,2017-02-15,12.68,3.42,4,1,0,0,0,1,0,1754473,9781683269298,English,"Technology, Engineering"
Our Solar System : Astronomy Books For Kids - Intergalactic Kids Book Edition,Baby Professor,42,Baby Professor,2016-04-01,20.34,7.16,5,1,0,0,0,0,1,2663383,9781683056492,English,"Technology, Engineering"
Foundations of Electrodynamics,Parry Moon,320,Dover Publications Inc.,2013-08-30,20.17,0.83,3.5,2,0,0,1,1,0,1666442,9780486497037,English,"Technology, Engineering"
Fundamentals of Hydro- and Aeromechanics,"Ludwig Prandtl, O.G. Tietjens, L. Rosenhead",270,Dover Publications Inc.,2011-12-08,23.08,2.92,2.75,4,0,2,1,1,0,1666455,9780486603742,English,"Technology, Engineering"
The U.S. Naval Institute on NAVAL STRATEGY,Thomas J. Cutler,212,Naval Institute Press,2015-12-30,11.90,17.40,4.67,3,0,0,0,1,2,1871439,9780870211133,English,"Technology, Engineering"
Global Silk Industry : A Complete Source Book,"Rajat Datta, Mahesh Nanavaty",428,Universal Publishers,2005-02-28,34.56,2.84,4.5,2,0,0,0,1,1,2206128,9781581124934,English,"Technology, Engineering"
"Introduction to Matrices, Sets and Groups for Science Students",Geoffrey Stephenson,164,Dover Publications Inc.,2016-01-14,12.42,1.58,3.88,8,0,0,3,3,2,1854988,9780486650777,English,"Technology, Engineering"
"The TAB Battery Book: An In-Depth Guide to Construction, Design, and Use",Michael Root,272,McGraw-Hill Education - Europe,2011-01-16,40.20,7.30,4,5,0,0,0,5,0,1823513,9780071739900,English,"Technology, Engineering"
Better NOT Bigger : How to Take Control of Urban Growth and Improve your Community,Eben V. Fodor,192,New Society Publishers,2007-06-01,21.83,0.16,3.45,20,2,2,6,5,5,2726052,9781897408032,English,"Technology, Engineering"
Reeds Vol 9: Steam Engineering Knowledge for Marine Engineers,Thomas D. Morton,304,Bloomsbury Publishing PLC,2019-06-25,53.90,5.10,4,5,0,1,1,0,3,1920497,9781472968814,English,"Technology, Engineering"
Mysticism and Religious Traditions,Steven T. Katz,284,Oxford University Press Inc,1984-03-15,23.05,2.95,3.67,9,1,0,1,6,1,1833215,9780195033144,English,"Technology, Engineering"
Rehabilitation of Pipelines Using Fiber-reinforced Polymer (FRP) Composites,V M Karbhari,314,Elsevier Science & Technology,2015-05-22,161.15,71.75,4,1,0,0,0,1,0,2461895,9780857096845,English,"Technology, Engineering"
Tanks 1914-1918 the Log-book of a Pioneer 2004,Albert G. Stern,360,Naval & Military Press Ltd,2005-02-28,23.40,5.30,4,1,0,0,0,1,0,2705102,9781843429449,English,"Technology, Engineering"
"Nuclear Rocket : Making Our Planet Green, Peaceful And Prosperous",James Dewar,216,Collector's Guide Publishing,2009-09-24,20.68,0.42,3.67,6,0,0,2,4,0,1748125,9781894959995,English,"Technology, Engineering"
Around the World in 84 Days : The Authorized Biography of Skylab Astronaut Jerry Carr,David J Shayler,272,Collector's Guide Publishing,2008-09-22,22.92,8.58,3.5,4,0,0,2,2,0,1760290,9781894959407,English,"Technology, Engineering"
Getting Off the Planet : Training Astronauts,"Mary Jane Chambers, Dr Randall Chambers",120,Collector's Guide Publishing,2006-01-30,16.99,2.11,2.67,3,1,0,1,1,0,1949967,9781894959209,English,"Technology, Engineering"
Vehicle Accident Analysis and Reconstruction Methods,"Raymond M. Brach, R. Matthew Brach",375,SAE International,2011-05-30,161.88,22.72,4,1,0,0,0,1,0,1859636,9780768034370,English,"Technology, Engineering"
"Dyes in History and Archaeology: Vol. 18 : Papers Presented at the 18th Meeting, Brussels, 1999",Jo Kirby,116,Archetype Publications Ltd,2007-02-06,67.72,1.76,4,1,0,0,0,1,0,2231757,9781873132333,English,"Technology, Engineering"
The Book of the Feet - A History of Boots and Shoes,J S Hall,234,White Press,2017-04-21,24.92,1.88,4.5,2,0,0,0,1,1,2164709,9781473338067,English,"Technology, Engineering"
Reeds Vol 11: Engineering Drawing,H.G. Beck,176,Bloomsbury Publishing PLC,2019-05-21,56.13,21.37,5,1,0,0,0,0,1,2161302,9781472969859,English,"Technology, Engineering"
"Healthy Land, Healthy Pasture, Healthy Horses : The Equicentral System Series Book 2","Jane Myers, Stuart Myers",262,Equiculture Publishing,2016-01-01,33.53,38.87,4.8,5,0,0,0,1,4,935234,9780994156181,English,"Technology, Engineering"
Newnes Data Communications Pocket Book,"Steve Winder, Mike Tooley",256,ELSEVIER SCIENCE & TECHNOLOGY,2002-05-08,35.86,4.09,4,1,0,0,0,1,0,2085841,9780750652971,English,"Technology, Engineering"
Better NOT Bigger : How to Take Control of Urban Growth and Improve your Community,Eben V. Fodor,192,New Society Publishers,2007-06-01,21.83,0.16,3.45,20,2,2,6,5,5,2726052,9781897408032,English,"Technology, Engineering"
Carbohydrates: The Essential Molecules of Life,"Robert V. Stick, Spencer Williams",496,Elsevier Science & Technology,2008-12-02,76.43,3.52,3,1,0,0,1,0,0,2027366,9780240521183,English,"Technology, Engineering"
Rehabilitation of Pipelines Using Fiber-reinforced Polymer (FRP) Composites,V M Karbhari,314,Elsevier Science & Technology,2015-05-22,161.15,71.75,4,1,0,0,0,1,0,2461895,9780857096845,English,"Technology, Engineering"
"Official History of the Second World War the War at Sea 1939-45: Volume III Part I the Offensive 1st June 1943-31 May 1944: v. III,Pt. I",S. W. Roskill,512,Naval & Military Press Ltd,2005-02-28,46.50,12.50,3.92,25,1,2,5,7,10,1213324,9781843428053,English,"Technology, Engineering"
A History and Description of the Collie or Sheepdog in His British Varieties (A Vintage Dog Books Breed Classic),Rawdon Lee,180,Read Books,2006-02-08,31.53,15.27,5,1,0,0,0,0,1,9781846640872,9781846640872,English,"Technology, Engineering"
Vogue's Book of Smart Dressmaking,Anon,66,Read Books,2011-04-15,21.67,10.53,4,1,0,0,0,1,0,2167008,9781447401117,English,"Technology, Engineering"
"How To Make Doll Clothes - A Book For Daughters, Mothers And Grandmothers",Emily Dow,98,READ BOOKS,2010-07-27,33.99,7.51,4,1,0,0,0,1,0,1916863,9781445514666,English,"Technology, Engineering"
"Climate Change Book : A Brief History of Climate Change, Climate Science, Climate Hysteria, Climate Denial, Climate Debate, and Reasons for Hope",University Press,68,Independently Published,2021-05-02,11.49,0.54,3.13,15,4,0,4,4,3,1380015,9798747600744,English,"Technology, Engineering"
Book of Five Rings,Musashi Miyamoto,108,www.bnpublishing.com,2009-05-11,16.82,3.48,4.01,44182,692,2470,9521,14722,16777,2217488,9781607961192,English,"Technology, Engineering"
ASM HB v. 8 : Mechanical Testing and Evaluation,"Howard Kuhn, Diana Medlin",998,ASM International,2000-10-30,366.23,10.57,4,2,0,0,1,0,1,2102256,9780871703897,English,"Technology, Engineering"
Are We There Yet? All About the Planet Saturn! Space for Kids - Children's Aeronautics & Space Book,Baby Professor,42,Baby Professor,2017-02-15,12.68,3.52,5,7,0,0,0,0,7,1592343,9781683269250,English,"Technology, Engineering"
American Hand Book of the Daguerreotype (Illustrated Edition) (Dodo Press),S D Humphrey,140,Dodo Press,2009-01-31,11.06,0.93,4,1,0,0,0,1,0,1874858,9781409925873,English,"Technology, Engineering"
The Shrimp Book II,Victoria Alday-Sanz,500,5M Books Ltd,2022-05-31,236.98,7.52,3.5,2,0,1,0,0,1,2687585,9781789181043,English,"Technology, Engineering"
Dodge Caravan/Voyager/Town & Country (84 - 95) (Chilton),"Chilton Automotive Books, The Nichols/Chilton, Chilton, Chilton Book Company",320,Haynes Manuals Inc,2001-06-19,32.26,5.74,5,1,0,0,0,0,1,9780801987960,9780801987960,English,"Technology, Engineering"
A History and Description of the Collie or Sheepdog in His British Varieties (A Vintage Dog Books Breed Classic),Rawdon Lee,180,Read Books,2006-02-07,22.68,15.12,5,1,0,0,0,0,1,3738839,9781846640865,English,"Technology, Engineering"
FIDIC Silver Book 2019 : A companion to the 2017 EPC/Turnkey Contract,Jakob Sorensen,240,ICE Publishing,2019-03-25,80.32,0.68,4.5,2,0,0,0,1,1,2088393,9780727764362,English,"Technology, Engineering"
"Knife Making Book for Beginners : A Bladesmithing User Guide to Forging Knives Plus Tips, Tools and Techniques to Get You Started",Luke Wade,136,C.U Publishing LLC,2021-02-02,19.10,3.50,4,1,0,0,0,1,0,2755041,9781952597626,English,"Technology, Engineering"
FIDIC Silver Book 2019 : A companion to the 2017 EPC/Turnkey Contract,Jakob Sorensen,240,ICE Publishing,2019-03-25,80.32,0.68,4.5,2,0,0,0,1,1,2088393,9780727764362,English,"Technology, Engineering"
"Knife Making Book for Beginners : A Bladesmithing User Guide to Forging Knives Plus Tips, Tools and Techniques to Get You Started",Luke Wade,136,C.U Publishing LLC,2021-02-02,19.10,3.50,4,1,0,0,0,1,0,2755041,9781952597626,English,"Technology, Engineering"
How are Planets Named? Planets in the Solar System Science Grade 4 Children's Astronomy & Space Books,Baby Professor,84,Baby Professor,2019-11-22,15.36,8.14,5,1,0,0,0,0,1,9781541949294,9781541949294,English,"Technology, Engineering"
Spot Tests in Organic Analysis,"F. Feigl, V. Anger",804,Elsevier Science & Technology,1989-05-01,64.04,185.96,5,1,0,0,0,0,1,2396507,9780444402097,English,"Technology, Engineering"
The Sporting Bull Terrier (Vintage Dog Books Breed Classic - American Pit Bull Terrier),Eugene Glass,108,Read Books,2005-08-02,38.57,7.73,5,1,0,0,0,0,1,9781905124794,9781905124794,English,"Technology, Engineering"
Can Humans Live in Mars? Astronomy Book for Kids Grade 4 Children's Astronomy & Space Books,Baby Professor,72,Baby Professor,2019-08-01,23.78,5.52,5,1,0,0,0,0,1,9781541975576,9781541975576,English,"Technology, Engineering"
Can Humans Live in Mars? Astronomy Book for Kids Grade 4 Children's Astronomy & Space Books,Baby Professor,72,Baby Professor,2019-11-22,15.03,5.87,5,1,0,0,0,0,1,9781541953321,9781541953321,English,"Technology, Engineering"
Coffee with Barbie Doll,"Sandra ""Johnsie"" Bryan",160,Schiffer Publishing Ltd,1998-07-01,20.80,0.20,4,4,0,0,1,2,1,1255500,9780764304125,English,"Technology, Engineering"
